title,author,date,link,pdf_link,query,search_engine,nr_found,cite_count,doiAssessment of the alcohol consumption among outdoor bar drinkers in Nigeria by qualitative methods,"Victor O. Lasebikan,    Olatunde Ayinde,    Mayokun Odunleye",2018,https://link.springer.com/article/10.1186/s12889-018-5250-y,https://link.springer.com/content/pdf/10.1186%2Fs12889-018-5250-y.pdf,,,1,No cite count available,https://doi.org/10.1186/s12889-018-5250-y
Ecosystem Services,"Patricia Balvanera,    Sandra Quijas…",2017,https://link.springer.com/chapter/10.1007/978-3-319-27288-7_3,https://link.springer.com/content/pdf/10.1007%2F978-3-319-27288-7_3.pdf,,,1,3,https://doi.org/10.1007/978-3-319-27288-7_3
Transcript profiling of cytokinin action in Arabidopsis roots and shoots discovers largely similar but also organ-specific responses,"Wolfram G Brenner,    Thomas Schmülling",2012,https://link.springer.com/article/10.1186/1471-2229-12-112,https://link.springer.com/content/pdf/10.1186%2F1471-2229-12-112.pdf,,,1,32,https://doi.org/10.1186/1471-2229-12-112
Abstracts from the 3rd Conference on Aneuploidy and Cancer: Clinical and Experimental Aspects,"Athel Cornish-Bowden,    Athel Cornish-Bowden,    David Rasnick…",2017,https://link.springer.com/article/10.1186/s13039-017-0320-x,https://link.springer.com/content/pdf/10.1186%2Fs13039-017-0320-x.pdf,,,1,No cite count available,https://doi.org/10.1186/s13039-017-0320-x
How Transnational are Migrants in Switzerland? An Analysis of the Migration-Mobility-Transnationality Nexus,Eric Crettaz…,2019,https://link.springer.com/chapter/10.1007/978-3-030-05671-1_11,https://link.springer.com/content/pdf/10.1007%2F978-3-030-05671-1_11.pdf,,,1,No cite count available,https://doi.org/10.1007/978-3-030-05671-1_11
Globalization and the German industrial production model,Gary Herrigel,2015,https://link.springer.com/article/10.1007/s12651-014-0170-5,https://link.springer.com/content/pdf/10.1007%2Fs12651-014-0170-5.pdf,,,1,7,https://doi.org/10.1007/s12651-014-0170-5
A New Replicator: A theoretical framework for analysing replication,"István Zachar,    Eörs Szathmáry",2010,https://link.springer.com/article/10.1186/1741-7007-8-21,https://link.springer.com/content/pdf/10.1186%2F1741-7007-8-21.pdf,,,1,20,https://doi.org/10.1186/1741-7007-8-21
Affinity proteomic profiling of plasma for proteins associated to area-based mammographic breast density,"Sanna Byström,    Martin Eklund,    Mun-Gwan Hong,    Claudia Fredolini…",2018,https://link.springer.com/article/10.1186/s13058-018-0940-z,https://link.springer.com/content/pdf/10.1186%2Fs13058-018-0940-z.pdf,,,1,2,https://doi.org/10.1186/s13058-018-0940-z
Tregs: A Therapeutic Target for the Treatment of Portal Fibrosis?,"Yuhua Xue,    George Michalopoulos",2015,https://link.springer.com/article/10.1007/s10620-015-3687-8,https://link.springer.com/content/pdf/10.1007%2Fs10620-015-3687-8.pdf,,,1,2,https://doi.org/10.1007/s10620-015-3687-8
Back to the tubule: microtubule dynamics in Parkinson’s disease,"Laura Pellegrini,    Andrea Wetzel,    Simone Grannó…",2017,https://link.springer.com/article/10.1007/s00018-016-2351-6,https://link.springer.com/content/pdf/10.1007%2Fs00018-016-2351-6.pdf,,,1,14,https://doi.org/10.1007/s00018-016-2351-6
Detecting Hidden Storage Side Channel Vulnerabilities in Networked Applications,"Felix C. Freiling,    Sebastian Schinzel",2011,https://link.springer.com/chapter/10.1007/978-3-642-21424-0_4,https://link.springer.com/content/pdf/10.1007%2F978-3-642-21424-0_4.pdf,,,1,4,https://doi.org/10.1007/978-3-642-21424-0_4
The effect of hydration state and energy balance on innate immunity of a desert reptile,"Karla T Moeller,    Michael W Butler,    Dale F DeNardo",2013,https://link.springer.com/article/10.1186/1742-9994-10-23,https://link.springer.com/content/pdf/10.1186%2F1742-9994-10-23.pdf,,,1,19,https://doi.org/10.1186/1742-9994-10-23
"Invasive colon cancer, but not non-invasive adenomas induce a gradient effect of Wnt pathway receptor frizzled 1 (Fz1) expression in the tumor microenvironment","Kestutis Planutis,    Marina Planutiene,    Anthony V Nguyen…",2013,https://link.springer.com/article/10.1186/1479-5876-11-50,https://link.springer.com/content/pdf/10.1186%2F1479-5876-11-50.pdf,,,1,6,https://doi.org/10.1186/1479-5876-11-50
Comparative neuroanatomy suggests repeated reduction of neuroarchitectural complexity in Annelida,"Carsten M Heuer,    Carsten HG Müller,    Christiane Todt,    Rudi Loesel",2010,https://link.springer.com/article/10.1186/1742-9994-7-13,https://link.springer.com/content/pdf/10.1186%2F1742-9994-7-13.pdf,,,1,32,https://doi.org/10.1186/1742-9994-7-13
Caregiving in ALS – a mixed methods approach to the study of Burden,"Miriam Galvin,    Bernie Corr,    Caoifa Madden,    Iain Mays…",2016,https://link.springer.com/article/10.1186/s12904-016-0153-0,https://link.springer.com/content/pdf/10.1186%2Fs12904-016-0153-0.pdf,,,1,13,https://doi.org/10.1186/s12904-016-0153-0
Programmatic assessment of competency-based workplace learning: when theory meets practice,"Harold GJ Bok,    Pim W Teunissen,    Robert P Favier,    Nancy J Rietbroek…",2013,https://link.springer.com/article/10.1186/1472-6920-13-123,https://link.springer.com/content/pdf/10.1186%2F1472-6920-13-123.pdf,,,1,54,https://doi.org/10.1186/1472-6920-13-123
The peritoneal “soil” for a cancerous “seed”: a comprehensive review of the pathogenesis of intraperitoneal cancer metastases,"Justyna Mikuła-Pietrasik,    Paweł Uruski…",2018,https://link.springer.com/article/10.1007/s00018-017-2663-1,https://link.springer.com/content/pdf/10.1007%2Fs00018-017-2663-1.pdf,,,1,6,https://doi.org/10.1007/s00018-017-2663-1
Central nervous system drug development: An integrative biomarker approach toward individualized medicine,"B. Gomez-Mancilla,    E. Marrer,    J. Kehren,    A. Kinnunen,    G. Imbert,    R. Hillebrand…",2005,https://link.springer.com/article/10.1602/neurorx.2.4.683,https://link.springer.com/content/pdf/10.1602%2Fneurorx.2.4.683.pdf,,,1,19,https://doi.org/10.1602/neurorx.2.4.683
Replacing monocultures with mixed-species stands: Ecosystem service implications of two production forest alternatives in Sweden,"Adam Felton,    Urban Nilsson,    Johan Sonesson,    Annika M. Felton,    Jean-Michel Roberge…",2016,https://link.springer.com/article/10.1007/s13280-015-0749-2,https://link.springer.com/content/pdf/10.1007%2Fs13280-015-0749-2.pdf,,,1,44,https://doi.org/10.1007/s13280-015-0749-2
Maintenance of Cross-Sector Partnerships: The Role of Frames in Sustained Collaboration,"Elizabeth J. Klitsie,    Shahzad Ansari,    Henk W. Volberda",2018,https://link.springer.com/article/10.1007/s10551-018-3859-5,https://link.springer.com/content/pdf/10.1007%2Fs10551-018-3859-5.pdf,,,1,1,https://doi.org/10.1007/s10551-018-3859-5
"Rapid Task-Models Development Using Sub-models, Sub-routines and Generic Components","Peter Forbrig,    Célia Martinie,    Philippe Palanque…",2014,https://link.springer.com/chapter/10.1007/978-3-662-44811-3_9,https://link.springer.com/content/pdf/10.1007%2F978-3-662-44811-3_9.pdf,,,1,9,https://doi.org/10.1007/978-3-662-44811-3_9
Semantic communication in birds: evidence from field research over the past two decades,Toshitaka N. Suzuki,2016,https://link.springer.com/article/10.1007/s11284-016-1339-x,https://link.springer.com/content/pdf/10.1007%2Fs11284-016-1339-x.pdf,,,1,20,https://doi.org/10.1007/s11284-016-1339-x
The evolution of consumption and its welfare effects,Ulrich Witt,2017,https://link.springer.com/article/10.1007/s00191-016-0459-3,https://link.springer.com/content/pdf/10.1007%2Fs00191-016-0459-3.pdf,,,1,9,https://doi.org/10.1007/s00191-016-0459-3
"Increased BDNF methylation in saliva, but not blood, of patients with borderline personality disorder","Mara Thomas,    Nora Knoblich,    Annalena Wallisch,    Katarzyna Glowacz…",2018,https://link.springer.com/article/10.1186/s13148-018-0544-6,https://link.springer.com/content/pdf/10.1186%2Fs13148-018-0544-6.pdf,,,1,No cite count available,https://doi.org/10.1186/s13148-018-0544-6
The emerging role of lysine methyltransferase SETD8 in human diseases,"Ciro Milite,    Alessandra Feoli,    Monica Viviano,    Donatella Rescigno…",2016,https://link.springer.com/article/10.1186/s13148-016-0268-4,https://link.springer.com/content/pdf/10.1186%2Fs13148-016-0268-4.pdf,,,1,13,https://doi.org/10.1186/s13148-016-0268-4
Systematic prediction of DNA shape changes due to CpG methylation explains epigenetic effects on protein–DNA binding,"Satyanarayan Rao,    Tsu-Pei Chiu,    Judith F. Kribelbauer…",2018,https://link.springer.com/article/10.1186/s13072-018-0174-4,https://link.springer.com/content/pdf/10.1186%2Fs13072-018-0174-4.pdf,,,1,4,https://doi.org/10.1186/s13072-018-0174-4
Q&A: Friends (but sometimes foes) within: the complex evolutionary ecology of symbioses between host and microbes,"Nicole Gerardo,    Gregory Hurst",2017,https://link.springer.com/article/10.1186/s12915-017-0455-6,https://link.springer.com/content/pdf/10.1186%2Fs12915-017-0455-6.pdf,,,1,3,https://doi.org/10.1186/s12915-017-0455-6
The role of tenascin-C in tissue injury and tumorigenesis,"Kim S. Midwood,    Gertraud Orend",2009,https://link.springer.com/article/10.1007/s12079-009-0075-1,https://link.springer.com/content/pdf/10.1007%2Fs12079-009-0075-1.pdf,,,1,181,https://doi.org/10.1007/s12079-009-0075-1
Ecological impacts of non-native Pacific oysters (Crassostrea gigas) and management measures for protected areas in Europe,"Roger J. H. Herbert,    John Humphreys,    Clare. J. Davies…",2016,https://link.springer.com/article/10.1007/s10531-016-1209-4,https://link.springer.com/content/pdf/10.1007%2Fs10531-016-1209-4.pdf,,,1,19,https://doi.org/10.1007/s10531-016-1209-4
Mixed Parentage: Negotiating Identity in Denmark,"Helene Bang Appel,    Rashmi Singla",2016,https://link.springer.com/chapter/10.1007/978-3-319-44610-3_8,https://link.springer.com/content/pdf/10.1007%2F978-3-319-44610-3_8.pdf,,,1,No cite count available,https://doi.org/10.1007/978-3-319-44610-3_8
Progression and Verification of Situation Calculus Agents with Bounded Beliefs,"Giuseppe De Giacomo,    Yves Lespérance,    Fabio Patrizi,    Stavros Vassos",2016,https://link.springer.com/article/10.1007/s11225-015-9626-z,https://link.springer.com/content/pdf/10.1007%2Fs11225-015-9626-z.pdf,,,1,No cite count available,https://doi.org/10.1007/s11225-015-9626-z
A model of heritage content to support the design and analysis of video games for history education,"Laurence Hanes,    Robert Stone",2018,https://link.springer.com/article/10.1007/s40692-018-0120-2,https://link.springer.com/content/pdf/10.1007%2Fs40692-018-0120-2.pdf,,,1,No cite count available,https://doi.org/10.1007/s40692-018-0120-2
Conflict in the boardroom: a participant observation study of supervisory board dynamics,"Eelke M. Heemskerk,    Klaas Heemskerk…",2017,https://link.springer.com/article/10.1007/s10997-015-9339-8,https://link.springer.com/content/pdf/10.1007%2Fs10997-015-9339-8.pdf,,,1,3,https://doi.org/10.1007/s10997-015-9339-8
"Cell cycle, oncogenic and tumor suppressor pathways regulate numerous long and macro non-protein-coding RNAs","Jörg Hackermüller,    Kristin Reiche,    Christian Otto,    Nadine Hösler…",2014,https://link.springer.com/article/10.1186/gb-2014-15-3-r48,https://link.springer.com/content/pdf/10.1186%2Fgb-2014-15-3-r48.pdf,,,1,20,https://doi.org/10.1186/gb-2014-15-3-r48
Cell-matrix interactions in dermal repair and scarring,"Beate Eckes,    Roswitha Nischt,    Thomas Krieg",2010,https://link.springer.com/article/10.1186/1755-1536-3-4,https://link.springer.com/content/pdf/10.1186%2F1755-1536-3-4.pdf,,,1,84,https://doi.org/10.1186/1755-1536-3-4
Enabling Young Professionals to Learn from Errors - the Role of a Supportive Learning Climate in Crossing Help Network Boundaries,"Therese Grohnert,    Roger H. G. Meuwissen,    Wim H. Gijselaers",2018,https://link.springer.com/article/10.1007/s12186-018-9206-2,https://link.springer.com/content/pdf/10.1007%2Fs12186-018-9206-2.pdf,,,1,No cite count available,https://doi.org/10.1007/s12186-018-9206-2
Testing the effectiveness of two natural selection simulations in the context of a large-enrollment undergraduate laboratory class,"Denise S. Pope,    Caleb M. Rounds,    Jody Clarke-Midura",2017,https://link.springer.com/article/10.1186/s12052-017-0067-1,https://link.springer.com/content/pdf/10.1186%2Fs12052-017-0067-1.pdf,,,1,1,https://doi.org/10.1186/s12052-017-0067-1
Exploring drivers and challenges in implementation of health promotion in community mental health services: a qualitative multi-site case study using Normalization Process Theory,"Viola Burau,    Kathrine Carstensen,    Mia Fredens…",2018,https://link.springer.com/article/10.1186/s12913-018-2850-2,https://link.springer.com/content/pdf/10.1186%2Fs12913-018-2850-2.pdf,,,1,2,https://doi.org/10.1186/s12913-018-2850-2
Tests of the separate retrieval of item and associative information using a frequency-judgment task,"William E. Hockley,    Carolina Cristi",1996,https://link.springer.com/article/10.3758/BF03201103,https://link.springer.com/content/pdf/10.3758%2FBF03201103.pdf,,,1,1,https://doi.org/10.3758/BF03201103
Posttranscriptional Regulation of Oral Bacterial Adaptive Responses,"Justin Merritt,    Zhiyun Chen,    Nan Liu,    Jens Kreth",2014,https://link.springer.com/article/10.1007/s40496-013-0005-4,https://link.springer.com/content/pdf/10.1007%2Fs40496-013-0005-4.pdf,,,1,5,https://doi.org/10.1007/s40496-013-0005-4
Size matters: predation of fish eggs and larvae by native and invasive amphipods,"N. G. Taylor,    A. M. Dunn",2017,https://link.springer.com/article/10.1007/s10530-016-1265-4,https://link.springer.com/content/pdf/10.1007%2Fs10530-016-1265-4.pdf,,,1,2,https://doi.org/10.1007/s10530-016-1265-4
Consumers’ intention to use health recommendation systems to receive personalized nutrition advice,"Sonja Wendel,    Benedict GC Dellaert,    Amber Ronteltap…",2013,https://link.springer.com/article/10.1186/1472-6963-13-126,https://link.springer.com/content/pdf/10.1186%2F1472-6963-13-126.pdf,,,1,11,https://doi.org/10.1186/1472-6963-13-126
Laws of biology: why so few?,"Pawan K. Dhar,    Alessandro Giuliani",2010,https://link.springer.com/article/10.1007/s11693-009-9049-0,https://link.springer.com/content/pdf/10.1007%2Fs11693-009-9049-0.pdf,,,1,15,https://doi.org/10.1007/s11693-009-9049-0
Animal models and conserved processes,"Ray Greek,    Mark J Rice",2012,https://link.springer.com/article/10.1186/1742-4682-9-40,https://link.springer.com/content/pdf/10.1186%2F1742-4682-9-40.pdf,,,1,18,https://doi.org/10.1186/1742-4682-9-40
Transcriptome and proteome quantification of a tumor model provides novel insights into post‐transcriptional gene regulation,"Christoph Jüschke,    Ilse Dohnal,    Peter Pichler,    Heike Harzer,    Remco Swart…",2013,https://link.springer.com/article/10.1186/gb-2013-14-11-r133,https://link.springer.com/content/pdf/10.1186%2Fgb-2013-14-11-r133.pdf,,,1,22,https://doi.org/10.1186/gb-2013-14-11-r133
Rural Transformation Index: Measuring Rural–Urban Disparities,"Li Wang,    Qutub Uddin Khan,    Dian Zhang",2013,https://link.springer.com/chapter/10.1007/978-94-007-5937-4_12,https://link.springer.com/content/pdf/10.1007%2F978-94-007-5937-4_12.pdf,,,1,1,https://doi.org/10.1007/978-94-007-5937-4_12
Predation by avian insectivores on caterpillars is linked to leaf damage on oak (Quercus robur),"Bengt Gunnarsson,    Jonas Wallin,    Jenny Klingberg",2018,https://link.springer.com/article/10.1007/s00442-018-4234-z,https://link.springer.com/content/pdf/10.1007%2Fs00442-018-4234-z.pdf,,,1,No cite count available,https://doi.org/10.1007/s00442-018-4234-z
Uncoupled responses of Smad4-deficient cancer cells to TNFα result in secretion of monomeric laminin-γ2,"Dirk Zboralski,    Bettina Warscheid,    Susanne Klein-Scory,    M. Bassel Malas…",2010,https://link.springer.com/article/10.1186/1476-4598-9-65,https://link.springer.com/content/pdf/10.1186%2F1476-4598-9-65.pdf,,,1,6,https://doi.org/10.1186/1476-4598-9-65
Response-time analysis for fixed-priority systems with a write-back cache,"Robert I. Davis,    Sebastian Altmeyer,    Jan Reineke",2018,https://link.springer.com/article/10.1007/s11241-018-9305-z,https://link.springer.com/content/pdf/10.1007%2Fs11241-018-9305-z.pdf,,,1,No cite count available,https://doi.org/10.1007/s11241-018-9305-z
Sigma-2: Multiple sequence alignment of non-coding DNA via an evolutionary model,"Gayathri Jayaraman,    Rahul Siddharthan",2010,https://link.springer.com/article/10.1186/1471-2105-11-464,https://link.springer.com/content/pdf/10.1186%2F1471-2105-11-464.pdf,,,1,2,https://doi.org/10.1186/1471-2105-11-464
"Morphological and ecophysiological root and leaf traits in ectomycorrhizal, arbuscular-mycorrhizal and non-mycorrhizal Alnus incana seedlings","Jouni Kilpeläinen,    Aitor Barbero-López,    Bartosz Adamczyk,    Pedro J. Aphalo…",2019,https://link.springer.com/article/10.1007/s11104-018-03922-w,https://link.springer.com/content/pdf/10.1007%2Fs11104-018-03922-w.pdf,,,1,No cite count available,https://doi.org/10.1007/s11104-018-03922-w
“A manager in the minds of doctors:” a comparison of new modes of control in European hospitals,"Ellen Kuhlmann,    Viola Burau,    Tiago Correia…",2013,https://link.springer.com/article/10.1186/1472-6963-13-246,https://link.springer.com/content/pdf/10.1186%2F1472-6963-13-246.pdf,,,1,26,https://doi.org/10.1186/1472-6963-13-246
Migration and the Multi-Dimensional Well-Being of Elderly Persons in Georgia,"Jennifer Waidler,    Michaella Vanore,    Franziska Gassmann…",2018,https://link.springer.com/article/10.1007/s12062-017-9176-4,https://link.springer.com/content/pdf/10.1007%2Fs12062-017-9176-4.pdf,,,1,No cite count available,https://doi.org/10.1007/s12062-017-9176-4
"The influence of contextual factors on healthcare quality improvement initiatives: what works, for whom and in what setting? Protocol for a realist review","Emma Coles,    Mary Wells,    Margaret Maxwell,    Fiona M. Harris…",2017,https://link.springer.com/article/10.1186/s13643-017-0566-8,https://link.springer.com/content/pdf/10.1186%2Fs13643-017-0566-8.pdf,,,1,6,https://doi.org/10.1186/s13643-017-0566-8
Using green infrastructure to improve urban air quality (GI4AQ),"C. Nick Hewitt,    Kirsti Ashworth,    A. Rob MacKenzie",2019,https://link.springer.com/article/10.1007/s13280-019-01164-3,https://link.springer.com/content/pdf/10.1007%2Fs13280-019-01164-3.pdf,,,1,No cite count available,https://doi.org/10.1007/s13280-019-01164-3
Educating the Developing Mind: Towards an Overarching Paradigm,"Andreas Demetriou,    George Spanoudis,    Antigoni Mouyi",2011,https://link.springer.com/article/10.1007/s10648-011-9178-3,https://link.springer.com/content/pdf/10.1007%2Fs10648-011-9178-3.pdf,,,1,36,https://doi.org/10.1007/s10648-011-9178-3
The location problem in social ontology,Frank Hindriks,2013,https://link.springer.com/article/10.1007/s11229-011-0036-0,https://link.springer.com/content/pdf/10.1007%2Fs11229-011-0036-0.pdf,,,1,13,https://doi.org/10.1007/s11229-011-0036-0
"Team Dynamics Theory: Nomological network among cohesion, team mental models, coordination, and collective efficacy",Edson Filho,2019,https://link.springer.com/article/10.1007/s11332-018-0519-1,https://link.springer.com/content/pdf/10.1007%2Fs11332-018-0519-1.pdf,,,1,No cite count available,https://doi.org/10.1007/s11332-018-0519-1
A kinetic-based sigmoidal model for the polymerase chain reaction and its application to high-capacity absolute quantitative real-time PCR,"Robert G Rutledge,    Don Stewart",2008,https://link.springer.com/article/10.1186/1472-6750-8-47,https://link.springer.com/content/pdf/10.1186%2F1472-6750-8-47.pdf,,,1,114,https://doi.org/10.1186/1472-6750-8-47
"Implementation of a stepped-wedge cluster randomized design in routine public health practice: design and application for a tuberculosis (TB) household contact study in a high burden area of Lima, Peru","Lena Shah,    Marlene Rojas,    Oscar Mori,    Carlos Zamudio,    Jay S. Kaufman…",2015,https://link.springer.com/article/10.1186/s12889-015-1883-2,https://link.springer.com/content/pdf/10.1186%2Fs12889-015-1883-2.pdf,,,1,1,https://doi.org/10.1186/s12889-015-1883-2
Frames and Ambivalence in Context: An Analysis of Hands-On Experts’ Perception of the Welfare of Animals in Traveling Circuses in The Netherlands,"Hanneke J. Nijland,    Noelle M. C. Aarts…",2013,https://link.springer.com/article/10.1007/s10806-010-9252-8,https://link.springer.com/content/pdf/10.1007%2Fs10806-010-9252-8.pdf,,,1,3,https://doi.org/10.1007/s10806-010-9252-8
PdumBase: a transcriptome database and research tool for Platynereis dumerilii and early development of other metazoans,"Hsien-Chao Chou,    Natalia Acevedo-Luna,    Julie A. Kuhlman…",2018,https://link.springer.com/article/10.1186/s12864-018-4987-0,https://link.springer.com/content/pdf/10.1186%2Fs12864-018-4987-0.pdf,,,1,No cite count available,https://doi.org/10.1186/s12864-018-4987-0
Designing cultural multilevel selection research for sustainability science,"Michelle A. Kline,    Timothy M. Waring,    Jonathan Salerno",2018,https://link.springer.com/article/10.1007/s11625-017-0509-2,https://link.springer.com/content/pdf/10.1007%2Fs11625-017-0509-2.pdf,,,1,2,https://doi.org/10.1007/s11625-017-0509-2
γδT cells but not αβT cells contribute to sepsis-induced white matter injury and motor abnormalities in mice,"Xiaoli Zhang,    Eridan Rocha-Ferreira,    Tao Li,    Regina Vontell…",2017,https://link.springer.com/article/10.1186/s12974-017-1029-9,https://link.springer.com/content/pdf/10.1186%2Fs12974-017-1029-9.pdf,,,1,4,https://doi.org/10.1186/s12974-017-1029-9
Ethical requirements for reconfigurable sensor technology: a challenge for value sensitive design,"Francien Dechesne,    Martijn Warnier…",2013,https://link.springer.com/article/10.1007/s10676-013-9326-1,https://link.springer.com/content/pdf/10.1007%2Fs10676-013-9326-1.pdf,,,1,8,https://doi.org/10.1007/s10676-013-9326-1
Transgenerational loss and recovery of early learning ability in foraging predatory mites,"Marliza B. Reichert,    Inga C. Christiansen…",2017,https://link.springer.com/article/10.1007/s10493-017-0122-1,https://link.springer.com/content/pdf/10.1007%2Fs10493-017-0122-1.pdf,,,1,2,https://doi.org/10.1007/s10493-017-0122-1
"
In vitro stability of therapeutically relevant, internally truncated dystrophins","Jackie L McCourt,    Katrina K Rhett,    Michele A Jaeger,    Joseph J Belanto…",2015,https://link.springer.com/article/10.1186/s13395-015-0040-z,https://link.springer.com/content/pdf/10.1186%2Fs13395-015-0040-z.pdf,,,1,5,https://doi.org/10.1186/s13395-015-0040-z
Microvascular bioengineering: a focus on pericytes,"Huaning Zhao,    John C. Chappell",2019,https://link.springer.com/article/10.1186/s13036-019-0158-3,https://link.springer.com/content/pdf/10.1186%2Fs13036-019-0158-3.pdf,,,1,No cite count available,https://doi.org/10.1186/s13036-019-0158-3
The pros and cons of applying the movement ecology paradigm for studying animal dispersal,"Michel Baguette,    Virginie M Stevens,    Jean Clobert",2014,https://link.springer.com/article/10.1186/s40462-014-0013-6,https://link.springer.com/content/pdf/10.1186%2Fs40462-014-0013-6.pdf,,,1,11,https://doi.org/10.1186/s40462-014-0013-6
Growing up HIV-positive in Uganda: “psychological immunodeficiency”? A qualitative study,"Birthe Loa Knizek,    James Mugisha,    Joseph Osafo,    Eugene Kinyanda",2017,https://link.springer.com/article/10.1186/s40359-017-0199-7,https://link.springer.com/content/pdf/10.1186%2Fs40359-017-0199-7.pdf,,,1,No cite count available,https://doi.org/10.1186/s40359-017-0199-7
On Subject Variations in Achievement Motivations: A Study in Business Subjects,"Dirk T. Tempelaar,    Sybrand Schim van der Loeff…",2011,https://link.springer.com/article/10.1007/s11162-010-9199-7,https://link.springer.com/content/pdf/10.1007%2Fs11162-010-9199-7.pdf,,,1,7,https://doi.org/10.1007/s11162-010-9199-7
Identification of Biologically Relevant Compounds in Aboveground and Belowground Induced Volatile Blends,"Nicole M. van Dam,    Bao-Li Qiu,    Cornelis A. Hordijk…",2010,https://link.springer.com/article/10.1007/s10886-010-9844-9,https://link.springer.com/content/pdf/10.1007%2Fs10886-010-9844-9.pdf,,,1,37,https://doi.org/10.1007/s10886-010-9844-9
Serotonin1A receptor deletion does not interact with maternal separation-induced increases in startle reactivity and prepulse inhibition deficits,"Lucianne Groenink,    Elisabeth Y. Bijlsma,    Meg J. V. van Bogaert…",2011,https://link.springer.com/article/10.1007/s00213-010-1998-1,https://link.springer.com/content/pdf/10.1007%2Fs00213-010-1998-1.pdf,,,1,8,https://doi.org/10.1007/s00213-010-1998-1
Patient involvement in patient safety: Protocol for developing an intervention using patient reports of organisational safety and patient incident reporting,"Jane K Ward,    Rosemary RC McEachan,    Rebecca Lawton…",2011,https://link.springer.com/article/10.1186/1472-6963-11-130,https://link.springer.com/content/pdf/10.1186%2F1472-6963-11-130.pdf,,,1,19,https://doi.org/10.1186/1472-6963-11-130
"
Drosophila melanogaster positive transcriptional elongation factors regulate metabolic and sex-biased expression in adults","Haiwang Yang,    Denis Basquin,    Daniel Pauli,    Brian Oliver",2017,https://link.springer.com/article/10.1186/s12864-017-3755-x,https://link.springer.com/content/pdf/10.1186%2Fs12864-017-3755-x.pdf,,,1,1,https://doi.org/10.1186/s12864-017-3755-x
