title,author,date,link,pdf_link,query,search_engine,nr_found,cite_count,doi
Context sensitive storage management,"DC Fisk - US Patent 7,020,758, 2006 - Google Patents",2006,https://patents.google.com/patent/US7020758B2/en,https://patentimages.storage.googleapis.com/68/ed/58/71bf012f064f4d/US10247261.pdf,,,1,165,No DOI available
Context-aware multimedia computing in the intelligent hospital,"S Mitchell, MD Spiteri, J Bates… - Proceedings of the 9th …, 2000 - dl.acm.org",2000,https://dl.acm.org/citation.cfm?id=566730,http://www.cl.cam.ac.uk/research/dtg/lce-pub/public/files/SIGOPS-EW2000.pdf,,,1,91,No DOI available
"A user-centric, resource-aware, context-sensitive, multi-device application framework for ubiquitous computing environments","M Roman, RH Campbell - University of Illinois at Urbana-Champaign …, 2002 - academia.edu",2002,http://www.academia.edu/download/36555463/AppFrameworkTR.pdf,http://www.academia.edu/download/36555463/AppFrameworkTR.pdf,,,1,36,No DOI available
Towards context-sensitive service aspects,"T Rho, M Schmatz, AB Cremers - Work. on Object Technology for Ambient …, 2006 - Citeseer",2006,http://citeseerx.ist.psu.edu/viewdoc/download?doi=10.1.1.453.9762&rep=rep1&type=pdf,http://citeseerx.ist.psu.edu/viewdoc/download?doi=10.1.1.453.9762&rep=rep1&type=pdf,,,1,22,No DOI available
WebMake: Integrating distributed software development in a structure-enhanced Web,"M Baentsch, G Molter, P Sturm - Computer Networks and ISDN Systems, 1995 - Elsevier",1995,https://www.sciencedirect.com/science/article/pii/0169755295000194,No PDF available,,,1,38,No DOI available
Gaia: a middleware platform for active spaces,"M Román, C Hess, R Cerqueira… - … Mobile Computing and …, 2002 - dl.acm.org",2002,https://dl.acm.org/citation.cfm?id=643558,https://www.researchgate.net/profile/Renato_Cerqueira/publication/220411303_Gaia_A_middleware_platform_for_active_spaces/links/0fcfd505b38889bbd6000000/Gaia-A-middleware-platform-for-active-spaces.pdf,,,1,210,No DOI available
Scouting context-sensitive components,"JO Pfaffmann, KP Zauner - Proceedings Third NASA/DoD …, 2001 - ieeexplore.ieee.org",2001,https://ieeexplore.ieee.org/abstract/document/937942/,https://ieeexplore.ieee.org/iel5/7467/20301/00937942.pdf,,,1,24,No DOI available
Towards a context management framework for MobiLife,"P Floréen, M Przybilski, P Nurmi, J Koolwaaij… - Proc. 14th IST Mobile & …, 2005 - koolwaaij.nl",2005,http://www.koolwaaij.nl/research/Pub/koolwaaij.2005.2.pdf,http://www.koolwaaij.nl/research/Pub/koolwaaij.2005.2.pdf,,,1,76,No DOI available
"Middleware: Context management in heterogeneous, evolving ubiquitous environments","RCA da Rocha, M Endler - IEEE Distributed Systems Online, 2006 - computer.org",2006,https://www.computer.org/csdl/mags/ds/2006/04/o4001-abs.html,https://www.computer.org/csdl/mags/ds/2006/04/o4001.pdf,,,1,64,No DOI available
A middleware infrastructure for active spaces,"M Román, C Hess, R Cerqueira… - IEEE pervasive …, 2002 - academia.edu",2002,http://www.academia.edu/download/30659833/IEEE.PvC.Gaia.pdf,http://www.academia.edu/download/30659833/IEEE.PvC.Gaia.pdf,,,1,1668,No DOI available
Pervasive computing: a paradigm for the 21st century,"D Saha, A Mukherjee - Computer, 2003 - ieeexplore.ieee.org",2003,https://ieeexplore.ieee.org/abstract/document/1185214/,https://ieeexplore.ieee.org/iel5/2/26595/01185214.pdf,,,1,913,No DOI available
Mode 2 society and the emergence of context-sensitive science,"M Gibbons - Science and public policy, 2000 - academic.oup.com",2000,https://academic.oup.com/spp/article-abstract/27/3/159/1650494,https://academic.oup.com/spp/article-pdf/27/3/159/4648934/27-3-159.pdf,,,1,338,No DOI available
Solar: An open platform for context-aware mobile applications,"G Chen, D Kotz - 2005 - apps.dtic.mil",2005,https://apps.dtic.mil/docs/citations/ADA440088,https://apps.dtic.mil/dtic/tr/fulltext/u2/a440088.pdf,,,1,122,No DOI available
User interface framework for integrating user interface elements of independent software components,"T Vachuska, R Hagarty, J Hummer - US Patent App. 10/113,431, 2003 - Google Patents",2003,https://patents.google.com/patent/US20030184584A1/en,https://patentimages.storage.googleapis.com/9c/0c/00/c3b725c30e5074/US10113431.pdf,,,1,76,No DOI available
Software reuse research: Status and future,"WB Frakes, K Kang - IEEE transactions on Software …, 2005 - ieeexplore.ieee.org",2005,https://ieeexplore.ieee.org/abstract/document/1492369/,https://ieeexplore.ieee.org/iel5/32/32074/01492369.pdf,,,1,805,No DOI available
Universal dock for context sensitive computing device,"AA Hassan, Y Gupta, R Rao, BR Anders - US Patent 9,542,203, 2017 - Google Patents",2017,https://patents.google.com/patent/US9542203B2/en,No PDF available,,,1,24,No DOI available
Dynamic configuration of context-sensitive personal sites and membership channels,"J Ramer, C Lacson, T Corddry - US Patent App. 10/086,592, 2002 - Google Patents",2002,https://patents.google.com/patent/US20020174201A1/en,https://patentimages.storage.googleapis.com/41/65/63/f9a96c639adbb9/US10086592.pdf,,,1,167,No DOI available
A hybrid recommender system for context-aware recommendations of mobile applications,"W Woerndl, C Schueller… - 2007 IEEE 23rd …, 2007 - ieeexplore.ieee.org",2007,https://ieeexplore.ieee.org/abstract/document/4401078/,https://ieeexplore.ieee.org/iel5/4400942/4400943/04401078.pdf,,,1,160,No DOI available
System and method for multi-modal context-sensitive applications in home network environment,"DH Kim, SH Ahn, JY Kwak, ER Lee, JY Kim… - US Patent …, 2009 - Google Patents",2009,https://patents.google.com/patent/US7584280B2/en,No PDF available,,,1,63,No DOI available
Configuration diagram with context sensitive connectivity,"JL Kodosky, D Shah, SW Rogers - US Patent 7,594,220, 2009 - Google Patents",2009,https://patents.google.com/patent/US7594220B2/en,https://patentimages.storage.googleapis.com/pdfs/US7594220.pdf,,,1,75,No DOI available
A new approach to distributed context-aware computing,"P Swoboda, J Plaice, A Ferscha, H Hoertner, G Kotsis - 2004 - plaice.web.cse.unsw.edu.au",2004,http://plaice.web.cse.unsw.edu.au/~plaice/archive/JAP/P-Pervasive04-intense.pdf,http://plaice.web.cse.unsw.edu.au/~plaice/archive/JAP/P-Pervasive04-intense.pdf,,,1,12,No DOI available
Application mobility in active spaces,"M Roman, H Ho, RH Campbell - 1st international conference on …, 2002 - gaia.cs.illinois.edu",2002,http://gaia.cs.illinois.edu/papers/mum2002.pdf,http://gaia.cs.illinois.edu/papers/mum2002.pdf,,,1,52,No DOI available
Ubiroad: Semantic middleware for context-aware smart road environments,"V Terziyan, O Kaykova… - 2010 Fifth International …, 2010 - ieeexplore.ieee.org",2010,https://ieeexplore.ieee.org/abstract/document/5476731/,https://ieeexplore.ieee.org/iel5/5476375/5476480/05476731.pdf,,,1,60,No DOI available
"ORBWork: A CORBA-based fully distributed, scalable and dynamic workflow enactment service for METEOR","KJ Kochut, AP Sheth, JA Miller - Large Scale Distributed …, 1999 - cobweb.cs.uga.edu",1999,http://cobweb.cs.uga.edu/~jam/papers/zLSDISpapers/KSM98.pdf,http://cobweb.cs.uga.edu/~jam/papers/zLSDISpapers/KSM98.pdf,,,1,47,No DOI available
Context-aware authentication for the internet of things,"K Habib, W Leister - Elev. Int. Conf. Auton. Auton. Syst. fined, 2015 - researchgate.net",2015,https://www.researchgate.net/profile/Wolfgang_Leister/publication/277587823_Context-Aware_Authentication_for_the_Internet_of_Things/links/556dd23b08aefcb861db791f.pdf,https://www.researchgate.net/profile/Wolfgang_Leister/publication/277587823_Context-Aware_Authentication_for_the_Internet_of_Things/links/556dd23b08aefcb861db791f.pdf,,,1,16,No DOI available
Home automation control using context sensitive menus,"D Burton, M Ward - US Patent 9,824,578, 2017 - Google Patents",2017,https://patents.google.com/patent/US9824578B2/en,https://patentimages.storage.googleapis.com/d8/4b/84/275582f7834fb7/US20160063854A1.pdf,,,1,44,No DOI available
Deployment of Component-based Applications on Top of a Context-aware Middleware.,"D Ayed, N Belhanafi, C Taconet… - IASTED Conf. on …, 2005 - pdfs.semanticscholar.org",2005,https://pdfs.semanticscholar.org/e4fe/d877c21aaf15feb31911ca0f3dc2c3aa0191.pdf,https://pdfs.semanticscholar.org/e4fe/d877c21aaf15feb31911ca0f3dc2c3aa0191.pdf,,,1,11,No DOI available
Meta-programming grey-box connectors,"U Aßmann, T Genßler, H Bar - Proceedings 33rd International …, 2000 - ieeexplore.ieee.org",2000,https://ieeexplore.ieee.org/abstract/document/848770/,No PDF available,,,1,30,No DOI available
A Framework for Distributed Activity Recognition in Ubiquitous Systems.,"P Nurmi, M Przybilski, G Lindén, P Floréen - IC-AI, 2005 - pdfs.semanticscholar.org",2005,https://pdfs.semanticscholar.org/e5ba/6b1909a7633af7c872bc7d9a95cafb1ca3b7.pdf,https://pdfs.semanticscholar.org/e5ba/6b1909a7633af7c872bc7d9a95cafb1ca3b7.pdf,,,1,20,No DOI available
System and method for auto-tab completion of context sensitive remote managed objects in a traffic director environment,"A Gupta, P Chandrasekharan, N Sidde - US Patent 9,311,155, 2016 - Google Patents",2016,https://patents.google.com/patent/US9311155B2/en,No PDF available,,,1,39,No DOI available
Adaptation of Web services to the context based on workflow: Approach for self-adaptation of service-oriented architectures to the context,"F Felhi, J Akaichi - arXiv preprint arXiv:1211.4867, 2012 - arxiv.org",1211,https://arxiv.org/abs/1211.4867,https://arxiv.org/pdf/1211.4867,,,1,13,No DOI available
Information system security curricula development,"E Crowley - … On Information Technology Education: Proceedings of …, 2003 - geocities.ws",2003,http://www.geocities.ws/crowleye3919/pdf/Security_CITC.pdf,http://www.geocities.ws/crowleye3919/pdf/Security_CITC.pdf,,,1,105,No DOI available
Context sensitive interactive systems design: A framework for representation of contexts,"K Sato - Proceedings of the 10th International Conference on …, 2003 - researchgate.net",2003,https://www.researchgate.net/profile/Keiichi_Sato/publication/228691368_Context_Sensitive_Interactive_Systems_Design_A_Framework_for_Representation_of_contexts/links/5631559108ae0530378d2d0f.pdf,https://www.researchgate.net/profile/Keiichi_Sato/publication/228691368_Context_Sensitive_Interactive_Systems_Design_A_Framework_for_Representation_of_contexts/links/5631559108ae0530378d2d0f.pdf,,,1,20,No DOI available
Distributed context reasoning for proactive systems,"M Przybilski - Proc. of the Workshop on Context …, 2005 - pdfs.semanticscholar.org",2005,https://pdfs.semanticscholar.org/44a7/46a960fd6d2ad21dd7cbc1784dd79884828a.pdf#page=53,https://pdfs.semanticscholar.org/44a7/46a960fd6d2ad21dd7cbc1784dd79884828a.pdf#page=53,,,1,5,No DOI available
Using Components in Workflow Activities,"S Schreyjak - Business Object Design and Implementation II, 1998 - Springer",1998,https://link.springer.com/chapter/10.1007/978-1-4471-1286-0_14,https://pdfs.semanticscholar.org/4eea/2d379669a87d9605ce2aeb0bf531c91bd5f3.pdf,,,1,10,No DOI available
A pro-active middleware platform for mobile environments.,"D Conan, C Taconet, D Ayed… - IASTED Conf. on …, 2004 - researchgate.net",2004,https://www.researchgate.net/profile/Guy_Bernard/publication/220901511_A_pro-active_middleware_platform_for_mobile_environments/links/09e4150bdd26e882b4000000.pdf,https://www.researchgate.net/profile/Guy_Bernard/publication/220901511_A_pro-active_middleware_platform_for_mobile_environments/links/09e4150bdd26e882b4000000.pdf,,,1,13,No DOI available
A user context approach for adaptive and distributed GIS,"M Petit, C Ray, C Claramunt - The European Information Society, 2007 - Springer",2007,https://link.springer.com/chapter/10.1007/978-3-540-72385-1_7,http://www.aromate.org/papers/AGILE'07.pdf,,,1,21,No DOI available
A survey of context data distribution for mobile ubiquitous systems,"P Bellavista, A Corradi, M Fanelli… - ACM computing surveys …, 2012 - dl.acm.org",2012,https://dl.acm.org/citation.cfm?id=2333119,https://www.researchgate.net/profile/Luca_Foschini2/publication/230627476_A_Survey_of_Context_Data_Distribution_for_Mobile_Ubiquitous_Systems/links/09e415022735550c90000000.pdf,,,1,305,No DOI available
The Turing O-Machine and the DIME Network Architecture: Injecting the Architectural Resiliency into Distributed Computing.,"R Mikkilineni, A Comparini, G Morana - Turing-100, 2012 - Citeseer",2012,http://citeseerx.ist.psu.edu/viewdoc/download?doi=10.1.1.353.7518&rep=rep1&type=pdf,http://citeseerx.ist.psu.edu/viewdoc/download?doi=10.1.1.353.7518&rep=rep1&type=pdf,,,1,32,No DOI available
Method and system for information broadcasting,"DA Baudino, JL Perdomo - US Patent App. 11/467,086, 2008 - Google Patents",2008,https://patents.google.com/patent/US20080052407A1/en,No PDF available,,,1,55,No DOI available
Dynamics in action: Intentional behavior as a complex system,"A Juarrero - Emergence, 2000 - Taylor & Francis",2000,https://www.tandfonline.com/doi/pdf/10.1207/S15327000EM0202_03,http://intersci.ss.uci.edu/wiki/pub/Juarrero(2000)Dynmcs_Action(ECO).pdf,,,1,957,No DOI available
A runtime architecture-based approach for the dynamic evolution of distributed component-based systems,"Y Zhou - Companion of the 30th international conference on …, 2008 - dl.acm.org",2008,https://dl.acm.org/citation.cfm?id=1370217,No PDF available,,,1,8,No DOI available
System and method for context sensitive mobile data and software update,"R O'farrell, M Kirstein - US Patent App. 10/820,567, 2004 - Google Patents",2004,https://patents.google.com/patent/US20040224674A1/en,No PDF available,,,1,104,No DOI available
Devising context sensitive approaches to change: the example of Glaxo Wellcome,"VH Hailey, J Balogun - Long Range Planning, 2002 - Elsevier",2002,https://www.sciencedirect.com/science/article/pii/S0024630102000353,http://itmporgchange.pbworks.com/f/Balogun.pdf,,,1,103,No DOI available
"Method and apparatus to configure, provision and control a set-top terminal","RS Grzeczkowski - US Patent 6,687,486, 2004 - Google Patents",2004,https://patents.google.com/patent/US6687486B2/en,https://patentimages.storage.googleapis.com/38/cc/13/e07d5c024360a3/US10062784.pdf,,,1,66,No DOI available
ScudWare: A semantic and adaptive middleware platform for smart vehicle space,"Z Wu, Q Wu, H Cheng, G Pan… - IEEE Transactions on …, 2007 - ieeexplore.ieee.org",2007,https://ieeexplore.ieee.org/abstract/document/4114351/,https://ieeexplore.ieee.org/iel5/6979/4114329/04114351.pdf,,,1,58,No DOI available
Client—server system with central application management allowing an administrator to configure end user applications by executing them in the context of users and …,"KF Hayes Jr - US Patent 6,205,476, 2001 - Google Patents",2001,https://patents.google.com/patent/US6205476B1/en,No PDF available,,,1,86,No DOI available
Context sensitive collaboration environment,"GD Pelton, LL Bobbitt, WH Morrison IV - US Patent App. 12/041,218, 2009 - Google Patents",2009,https://patents.google.com/patent/US20090222742A1/en,No PDF available,,,1,73,No DOI available
"Design of warehousing and distribution systems: an object model of facilities, functions and information","T Govindaraj, EE Blanco, DA Bodner… - … on systems, man …, 2000 - ieeexplore.ieee.org",2000,https://ieeexplore.ieee.org/abstract/document/885998/,https://ieeexplore.ieee.org/iel5/7099/19153/00885998.pdf,,,1,36,No DOI available
A context sensitive public display for adaptive multi-user information visualization,"AH Morales-Aranda… - … Conference on Autonomic …, 2007 - ieeexplore.ieee.org",2007,https://ieeexplore.ieee.org/abstract/document/4437940/,https://ieeexplore.ieee.org/iel5/4437870/4437871/04437940.pdf,,,1,8,No DOI available
Modeling software architectures and styles with graph grammars and constraint solving,"D Hirsch, P Inverardi, U Montanari - Working Conference on Software …, 1999 - Springer",1999,https://link.springer.com/chapter/10.1007/978-0-387-35563-4_8,https://link.springer.com/content/pdf/10.1007/978-0-387-35563-4_8.pdf,,,1,71,No DOI available
Method and apparatus for providing user specific web-based help in a distributed system environment,"PA Huboi, S Sharma, LC Chan, J Epplett - US Patent 6,799,198, 2004 - Google Patents",2004,https://patents.google.com/patent/US6799198B1/en,No PDF available,,,1,93,No DOI available
Behavior-based access control for distributed healthcare environment,"MH Yarmand, K Sartipi… - 2008 21st IEEE …, 2008 - ieeexplore.ieee.org",2008,https://ieeexplore.ieee.org/abstract/document/4561969/,https://ieeexplore.ieee.org/iel5/4561933/4561934/04561969.pdf,,,1,16,No DOI available
Context-sensitive call control using constraints and rules,"D Lesaint, D Mehta, B O'Sullivan, L Quesada… - … on Principles and …, 2010 - Springer",2010,https://link.springer.com/chapter/10.1007/978-3-642-15396-9_46,http://citeseerx.ist.psu.edu/viewdoc/download?doi=10.1.1.225.3023&rep=rep1&type=pdf,,,1,4,No DOI available
"Efficient, context-sensitive detection of real-world semantic attacks","MD Bond, V Srivastava, KS McKinley… - Proceedings of the 5th …, 2010 - dl.acm.org",2010,https://dl.acm.org/citation.cfm?id=1814218,http://www.cs.utexas.edu/~mckinley/papers/pecan-plas-2010.pdf,,,1,13,No DOI available
Fast and efficient context-aware services,"D Raz, AT Juhola, J Serrat-Fernandez, A Galis - 2006 - books.google.com",2006,https://books.google.de/books?hl=de&lr=&id=1dLtRPRLDGsC&oi=fnd&pg=PR1&dq=context-sensitive+AND+distributed+composition+AND+reconfig*&ots=vp7Xtr4i3k&sig=4cFN2sMVFDNQZulxFly-7PISOto,No PDF available,,,1,71,No DOI available
Composite templates for cloth modeling and sketching,"H Chen, ZJ Xu, ZQ Liu, SC Zhu - 2006 IEEE Computer Society …, 2006 - ieeexplore.ieee.org",2006,https://ieeexplore.ieee.org/abstract/document/1640853/,https://ieeexplore.ieee.org/iel5/10924/34373/01640853.pdf,,,1,140,No DOI available
A Design Space for Context-Sensitive User Interfaces.,"J Vanderdonckt, D Grolaux, P Van Roy, Q Limbourg… - IASSE, 2005 - researchgate.net",2005,https://www.researchgate.net/profile/Benoit_Macq/publication/220828766_A_Design_Space_for_Context-Sensitive_User_Interfaces/links/09e4150b205f11e191000000.pdf,https://www.researchgate.net/profile/Benoit_Macq/publication/220828766_A_Design_Space_for_Context-Sensitive_User_Interfaces/links/09e4150b205f11e191000000.pdf,,,1,39,No DOI available
Beyond prototypes: Challenges in deploying ubiquitous systems,"N Davies, HW Gellersen - IEEE Pervasive computing, 2002 - ieeexplore.ieee.org",2002,https://ieeexplore.ieee.org/abstract/document/993142/,https://ieeexplore.ieee.org/iel5/7756/21413/00993142.pdf,,,1,334,No DOI available
Context-sensitive pagination as a function of table sort order,"AD Munter - US Patent 8,326,835, 2012 - Google Patents",2012,https://patents.google.com/patent/US8326835B1/en,https://patentimages.storage.googleapis.com/80/3b/b2/cc1b758aa1d158/US8326835.pdf,,,1,12,No DOI available
An XML-based implementation of manufacturing route sheet documents for context-sensitive and web-based process planning,"CJ Hu, ZZ Li, L Zheng, N Li, PH Wen - International Journal of …, 2008 - Taylor & Francis",2008,https://www.tandfonline.com/doi/abs/10.1080/09511920701370738,https://www.tandfonline.com/doi/full/10.1080/09511920701370738,,,1,14,No DOI available
Dynamic distribution and layouting of model-based user interfaces in smart environments,"D Roscher, G Lehmann, V Schwartze… - … -Driven Development of …, 2011 - Springer",2011,https://link.springer.com/chapter/10.1007/978-3-642-14562-9_9,No PDF available,,,1,18,No DOI available
Word matching with context sensitive character to sound correlating,"R Gandhi, C Liao - US Patent App. 11/318,826, 2007 - Google Patents",2007,https://patents.google.com/patent/US20070150279A1/en,No PDF available,,,1,55,No DOI available
Scalable processing of context information with COSMOS,"D Conan, R Rouvoy, L Seinturier - … International Conference on Distributed …, 2007 - Springer",2007,https://link.springer.com/chapter/10.1007/978-3-540-72883-2_16,https://link.springer.com/content/pdf/10.1007/978-3-540-72883-2_16.pdf,,,1,136,No DOI available
Method and apparatus for efficient and flexible surveillance visualization with context sensitive privacy preserving and power lens data mining,"L Liu, KC Lee, J Yu, HT Ozdemir… - US Patent App. 11 …, 2008 - Google Patents",2008,https://patents.google.com/patent/US20080198159A1/en,No PDF available,,,1,69,No DOI available
Information distribution method and system,"CP Hahn, PV Gissel - US Patent 7,243,156, 2007 - Google Patents",2007,https://patents.google.com/patent/US7243156B2/en,No PDF available,,,1,33,No DOI available
Context-aware computing [Guest Editors' Intro.],"GD Abowd, M Ebling, G Hung, H Lei… - IEEE Pervasive …, 2002 - ieeexplore.ieee.org",2002,https://ieeexplore.ieee.org/abstract/document/1037718/,https://ieeexplore.ieee.org/iel5/7756/22254/01037718.pdf,,,1,121,No DOI available
Turning Web 2.0 social software into versatile collaborative learning solutions,"D Gillet, S El Helou, CM Yu… - … conference on advances …, 2008 - ieeexplore.ieee.org",2008,https://ieeexplore.ieee.org/abstract/document/4455977/,https://ieeexplore.ieee.org/iel5/4455942/4455943/04455977.pdf,,,1,82,No DOI available
Association of multiple objects in a table cell with visual components,"R Hagarty - US Patent App. 10/286,666, 2004 - Google Patents",2004,https://patents.google.com/patent/US20040085367A1/en,No PDF available,,,1,23,No DOI available
Context awareness in mobile computing environments,"CB Anagnostopoulos, A Tsounis… - Wireless Personal …, 2007 - Springer",2007,https://link.springer.com/article/10.1007/s11277-006-9187-6,https://link.springer.com/content/pdf/10.1007/s11277-006-9187-6.pdf,,,1,126,No DOI available
User-centered context-aware mobile applications―The next generation of personal mobile computing,"D Zhang, B Adipat, Y Mowafi - Communications of the Association …, 2009 - aisel.aisnet.org",2009,https://aisel.aisnet.org/cgi/viewcontent.cgi?article=3399&context=cais,https://pdfs.semanticscholar.org/cf71/da6b2513e95cfa36cea75e49507b0c6800fd.pdf,,,1,44,No DOI available
Practical context-sensitive CFI,"V Van der Veen, D Andriesse, E Göktaş… - Proceedings of the …, 2015 - dl.acm.org",2015,https://dl.acm.org/citation.cfm?id=2813673,https://www.vvdveen.com/publications/PathArmor.pdf,,,1,108,No DOI available
A trust-based context-aware access control model for web-services,"R Bhatti, E Bertino, A Ghafoor - Distributed and Parallel Databases, 2005 - Springer",2005,https://link.springer.com/article/10.1007/s10619-005-1075-7,https://link.springer.com/content/pdf/10.1007/s10619-005-1075-7.pdf,,,1,263,No DOI available
Configuring devices using context histories,"J Helander - US Patent 7,680,906, 2010 - Google Patents",2010,https://patents.google.com/patent/US7680906B2/en,https://patentimages.storage.googleapis.com/e4/2a/19/d4b65880b38553/US7680906.pdf,,,1,22,No DOI available
Facilitating context-awareness in composite mashup applications,"S Pietschmann, C Radeck, K Meißner - Proceedings of the 3rd …, 2011 - researchgate.net",2011,https://www.researchgate.net/profile/Klaus_Meissner/publication/230629687_Facilitating_Context-Awareness_in_Composite_Mashup_Applications/links/53ed03570cf2981ada11672d.pdf,https://www.researchgate.net/profile/Klaus_Meissner/publication/230629687_Facilitating_Context-Awareness_in_Composite_Mashup_Applications/links/53ed03570cf2981ada11672d.pdf,,,1,6,No DOI available
System and Method for Context Sensitive Mobile Data and Software Update,"R O'farrell, MD Kirstein - US Patent App. 12/796,277, 2010 - Google Patents",2010,https://patents.google.com/patent/US20100251230A1/en,No PDF available,,,1,55,No DOI available
System and method for integrating network services,"R Sullivan, D Vrsalovic, M Aganagic - US Patent App. 09/895,999, 2003 - Google Patents",2003,https://patents.google.com/patent/US20030005090A1/en,No PDF available,,,1,46,No DOI available
Designing context awareness middleware architecture for personal healthcare information system,"M Sain, HJ Lee, WY Chung - 2010 The 12th International …, 2010 - ieeexplore.ieee.org",2010,https://ieeexplore.ieee.org/abstract/document/5440347/,https://ieeexplore.ieee.org/iel5/5433809/5440109/05440347.pdf,,,1,9,No DOI available
Service-Oriented Computing Imperatives in Ad Hoc Wireless Settings,"R Sen, R Handorean, GC Roman… - Service-oriented software …, 2005 - igi-global.com",2005,https://www.igi-global.com/chapter/service-oriented-computing-imperatives-hoc/28958,https://openscholarship.wustl.edu/cgi/viewcontent.cgi?article=2024&context=cse_research,,,1,23,No DOI available
Architecture framework for software test tool,"S Chang-Ai, L Chao, J Mao-Zhong… - … on Technology of Object …, 2000 - ieeexplore.ieee.org",2000,https://ieeexplore.ieee.org/abstract/document/885896/,https://ieeexplore.ieee.org/iel5/7108/19142/00885896.pdf,,,1,12,No DOI available
AmbieAgents: a scalable infrastructure for mobile and context-aware information services,"TC Lech, LWM Wienhofen - Proceedings of the fourth international joint …, 2005 - dl.acm.org",2005,https://dl.acm.org/citation.cfm?id=1082568,https://sophia.javeriana.edu.co/~acarrillo/Personalizacion/Articulos/p625-lech.pdf,,,1,102,No DOI available
A ubiquitous context-sensitive multimodal multimedia computing system and its machine learning-based reconfiguration at the architectural level,"MD Hina, A Ramdane-Cherif… - … Symposium on Multimedia …, 2005 - ieeexplore.ieee.org",2005,https://ieeexplore.ieee.org/abstract/document/1565886/,https://ieeexplore.ieee.org/iel5/10471/33218/01565886.pdf,,,1,8,No DOI available
