title,author,date,link,pdf_link,query,search_engine,nr_found,cite_count,doiAmbitrust? Immutable and Context Aware Trust Fusion,"JM Seigneur - Technical Report, 2006 - Citeseer",2006,http://citeseerx.ist.psu.edu/viewdoc/download?doi=10.1.1.93.1530&rep=rep1&type=pdf,http://citeseerx.ist.psu.edu/viewdoc/download?doi=10.1.1.93.1530&rep=rep1&type=pdf,,,1,6,No DOI available
Smart objects as building blocks for the internet of things,"G Kortuem, F Kawsar, V Sundramoorthy… - IEEE Internet …, 2009 - usir.salford.ac.uk",2009,http://usir.salford.ac.uk/id/eprint/2735,http://usir.salford.ac.uk/2735/1/w1iot.pdf,,,1,1327,No DOI available
Providing context-aware personalization through cross-context reasoning of user modeling data,"S Berkovsky, L Aroyo, D Heckmann… - … on Decentralized and …, 2007 - academia.edu",2007,http://www.academia.edu/download/30820724/ubideum2007.pdf#page=7,http://www.academia.edu/download/30820724/ubideum2007.pdf#page=7,,,1,17,No DOI available
A study on issues in context-aware systems based on a survey and service scenarios,"S Lee, S Park, S Lee - 2009 10th ACIS International …, 2009 - ieeexplore.ieee.org",2009,https://ieeexplore.ieee.org/abstract/document/5286703/,No PDF available,,,1,18,No DOI available
A layered e-maintenance architecture powered by smart wireless monitoring components,"P Pistofidis, C Emmanouilidis… - 2012 IEEE …, 2012 - ieeexplore.ieee.org",2012,https://ieeexplore.ieee.org/abstract/document/6209969/,https://ieeexplore.ieee.org/iel5/6198915/6209899/06209969.pdf,,,1,25,No DOI available
Precision: Privacy enhanced context-aware information fusion in ubiquitous healthcare,"G Pallapa, N Roy, S Das - Proceedings of the 1st International Workshop …, 2007 - dl.acm.org",2007,https://dl.acm.org/citation.cfm?id=1270351,https://ieeexplore.ieee.org/iel5/4273309/4273310/04273321.pdf,,,1,13,No DOI available
Toward social paradigms for mobile context-aware computing in smart cities: Position paper,"R Kamberov, V Santos, C Granell - 2016 11th Iberian …, 2016 - ieeexplore.ieee.org",2016,https://ieeexplore.ieee.org/abstract/document/7521453/,https://ieeexplore.ieee.org/iel7/7511893/7521364/07521453.pdf,,,1,4,No DOI available
Mobile querying of online semantic web data for context-aware applications,"W Van Woensel, S Casteleyn, E Paret… - IEEE Internet …, 2011 - ieeexplore.ieee.org",2011,https://ieeexplore.ieee.org/abstract/document/5999639/,https://ieeexplore.ieee.org/iel5/4236/5226613/05999639.pdf,,,1,11,No DOI available
Blockchain based distributed control system for edge computing,"A Stanciu - 2017 21st International Conference on Control …, 2017 - ieeexplore.ieee.org",2017,https://ieeexplore.ieee.org/abstract/document/7968630/,https://ieeexplore.ieee.org/iel7/7963998/7968527/07968630.pdf,,,1,42,No DOI available
Toward service aggregation for edge computing,"J Abdelaziz, M Adda, H Mcheick - Procedia Computer Science, 2016 - Elsevier",2016,https://www.sciencedirect.com/science/article/pii/S1877050916318154,https://www.sciencedirect.com/science/article/pii/S1877050916318154/pdf?md5=6e942450bdc15e5fa34dc7f459149c71&isDTMRedir=Y&pid=1-s2.0-S1877050916318154-main.pdf,,,1,5,No DOI available
Context aware lightweight energy efficient framework,"D Sathan, A Meetoo… - International Journal of …, 2009 - sclab.yonsei.ac.kr",2009,http://sclab.yonsei.ac.kr/courses/11mobile/11mobile.files/paper/14.pdf,http://sclab.yonsei.ac.kr/courses/11mobile/11mobile.files/paper/14.pdf,,,1,7,No DOI available
Context-aware emergent behaviour in a MAS for information exchange,"A Olaru, C Gratie, AM Florea - Scalable Computing: Practice and …, 2010 - scpe.org",2010,https://scpe.org/index.php/scpe/article/view/637,https://scpe.org/index.php/scpe/article/view/637/260,,,1,14,No DOI available
Context-aware security policy for the service discovery,"S Trabelsi, L Gomez, Y Roudier - 21st International Conference …, 2007 - ieeexplore.ieee.org",2007,https://ieeexplore.ieee.org/abstract/document/4221104/,https://ieeexplore.ieee.org/iel5/4221005/4221006/04221104.pdf,,,1,20,No DOI available
Context-aware exception handling in mobile agent systems: the MoCA case,"K Damasceno, N Cacho, A Garcia… - Proceedings of the …, 2006 - dl.acm.org",2006,https://dl.acm.org/citation.cfm?id=1138071,http://citeseerx.ist.psu.edu/viewdoc/download?doi=10.1.1.64.4579&rep=rep1&type=pdf,,,1,26,No DOI available
Context-sensitive authorization for asynchronous communications,"V Hourdin, JY Tigli, S Lavirotte, G Rey… - … Conference for Internet …, 2009 - ieeexplore.ieee.org",2009,https://ieeexplore.ieee.org/abstract/document/5402550/,https://hal.archives-ouvertes.fr/docs/00/47/68/82/PDF/hourdin-tigli-etal_2009.pdf,,,1,2,No DOI available
Decentralized information flow verification framework for the service chain composition in mobile computing environments,"N Xi, J Ma, C Sun, T Zhang - 2013 IEEE 20th International …, 2013 - ieeexplore.ieee.org",2013,https://ieeexplore.ieee.org/abstract/document/6649625/,https://ieeexplore.ieee.org/iel7/6596022/6649542/06649625.pdf,,,1,7,No DOI available
Matching context aware software testing design techniques to ISO/IEC/IEEE 29119,"S Matalonga, F Rodrigues, GH Travassos - International Conference on …, 2015 - Springer",2015,https://link.springer.com/chapter/10.1007/978-3-319-19860-6_4,https://www.researchgate.net/profile/Santiago_Matalonga/publication/278551551_Matching_context_aware_software_testing_design_techniques_to_ISOIECIEEE_29119/links/5581531f08ae47061e5f68ff/Matching-context-aware-software-testing-design-techniques-to-ISO-IEC-IEEE-29119.pdf,,,1,6,No DOI available
A generic approach for on-the-fly adding of context-aware features to existing websites,"W Van Woensel, S Casteleyn, O De Troyer - Proceedings of the 22nd …, 2011 - dl.acm.org",2011,https://dl.acm.org/citation.cfm?id=1995987,http://citeseerx.ist.psu.edu/viewdoc/download?doi=10.1.1.848.5722&rep=rep1&type=pdf,,,1,13,No DOI available
A GRID Approach to Providing Multimodal Context-Sensitive Social Service to Mobile Users,"M Magaldi, R Russo, L Bevilacqua, S Pierno… - … Conferences"" On the …, 2008 - Springer",2008,https://link.springer.com/chapter/10.1007/978-3-540-88875-8_76,No PDF available,,,1,1,No DOI available
Employing Context Information and Semantics to Advance Responsiveness in Service Composition,"C Jacob, H Pfeffer, S Steglich - Context-Aware Mobile and …, 2009 - igi-global.com",2009,https://www.igi-global.com/chapter/context-aware-mobile-ubiquitous-computing/7120,No PDF available,,,1,1,No DOI available
Privacy-aware web services selection and composition,"T Li, T He - 2014 International Conference on Service Sciences, 2014 - ieeexplore.ieee.org",2014,https://ieeexplore.ieee.org/abstract/document/7312306/,https://ieeexplore.ieee.org/iel7/7309520/7311971/07312306.pdf,,,1,3,No DOI available
