title,author,date,link,pdf_link,query,search_engine,nr_found,cite_count,doi
Context inference of users' social relationships and distributed policy management,"A Devlic, R Reichle, M Wagner… - 2009 IEEE …, 2009 - ieeexplore.ieee.org",2009,https://ieeexplore.ieee.org/abstract/document/4912890/,https://www.researchgate.net/profile/Michael_Wagner10/publication/224441312_Context_inference_of_users%27_social_relationships_and_distributed_policy_management/links/09e4150b66141d20ce000000.pdf,,,1,20,No DOI available
Connector colouring I: Synchronisation and context dependency,"D Clarke, D Costa, F Arbab - Electronic Notes in Theoretical Computer …, 2006 - Elsevier",2006,https://www.sciencedirect.com/science/article/pii/S1571066106001812,https://www.sciencedirect.com/science/article/pii/S1571066106001812/pdf?md5=af74e5aece1fdf4ba28673dd399e5514&pid=1-s2.0-S1571066106001812-main.pdf,,,1,17,No DOI available
Design and engineering process integration through a multiple view intermediate modeller in a distributed object-oriented system environment,"T De Martino, B Falcidieno, S Haßinger - Computer-Aided Design, 1998 - Elsevier",1998,https://www.sciencedirect.com/science/article/pii/S0010448597000961,No PDF available,,,1,181,No DOI available
Fuzzy logic in autonomous robotics: behavior coordination,"A Safiotti - Proceedings of 6th International Fuzzy Systems …, 1997 - ieeexplore.ieee.org",1997,https://ieeexplore.ieee.org/abstract/document/616430/,No PDF available,,,1,193,No DOI available
Extended framework for modeling choice behavior,"M Ben-Akiva, D McFadden, T Gärling, D Gopinath… - Marketing letters, 1999 - Springer",1999,https://link.springer.com/article/10.1023/A:1008046730291,https://link.springer.com/content/pdf/10.1023/A:1008046730291.pdf,,,1,315,No DOI available
Social context–induced song variation affects female behavior and gene expression,"SC Woolley, AJ Doupe - PLoS biology, 2008 - journals.plos.org",2008,https://journals.plos.org/plosbiology/article?id=10.1371/journal.pbio.0060062,https://journals.plos.org/plosbiology/article?id=10.1371/journal.pbio.0060062,,,1,213,No DOI available
"The insect mushroom body, an experience-dependent recoding device","R Menzel - Journal of Physiology-Paris, 2014 - Elsevier",2014,https://www.sciencedirect.com/science/article/pii/S092842571400031X,No PDF available,,,1,62,No DOI available
Songs of the city: noise-dependent spectral plasticity in the acoustic phenotype of urban birds,"H Slabbekoorn - Animal Behaviour, 2013 - Elsevier",2013,https://www.sciencedirect.com/science/article/pii/S0003347213000493,No PDF available,,,1,160,No DOI available
"A dynamic systems perspective on social cognition, problematic behaviour, and intervention in adolescence","A Lichtwarck-Aschoff, P van Geert - European Journal of …, 2004 - Taylor & Francis",2004,https://www.tandfonline.com/doi/abs/10.1080/17405620444000157,No PDF available,,,1,19,No DOI available
Modeling and processing information for context-aware computing: A survey,"C Hoareau, I Satoh - New Generation Computing, 2009 - Springer",2009,https://link.springer.com/article/10.1007/s00354-009-0060-5,https://link.springer.com/content/pdf/10.1007/s00354-009-0060-5.pdf,,,1,71,No DOI available
Context‐dependent effects of freshwater mussels on stream benthic communities,"DE Spooner, CC Vaughn - Freshwater Biology, 2006 - Wiley Online Library",2006,https://onlinelibrary.wiley.com/doi/abs/10.1111/j.1365-2427.2006.01547.x,https://onlinelibrary.wiley.com/doi/full/10.1111/j.1365-2427.2006.01547.x,,,1,195,No DOI available
Adaptive behavior in autonomous agents,"T Ziemke - Presence, 1998 - MIT Press",1998,https://www.mitpressjournals.org/doi/abs/10.1162/105474698565947,https://pdfs.semanticscholar.org/8942/1acd291cad262b89308da719593d7c0a0b61.pdf,,,1,99,No DOI available
Authoring context-dependent cross-device user interfaces based on trigger/action rules,"G Ghiani, M Manca, F Paternò - … of the 14th International Conference on …, 2015 - dl.acm.org",2015,https://dl.acm.org/citation.cfm?id=2836073,http://citeseerx.ist.psu.edu/viewdoc/download?doi=10.1.1.723.9086&rep=rep1&type=pdf,,,1,20,No DOI available
The influences of landscape structure on butterfly distribution and movement: a review,"J Dover, J Settele - Journal of Insect conservation, 2009 - Springer",2009,https://link.springer.com/article/10.1007/s10841-008-9135-8,https://link.springer.com/article/10.1007/s10841-008-9135-8,,,1,221,No DOI available
Adaptive context oriented component-based application middleware (coca-middleware),"B Magableh, S Barrett - International Conference on Ubiquitous …, 2011 - Springer",2011,https://link.springer.com/chapter/10.1007/978-3-642-23641-9_13,https://www.researchgate.net/profile/Hung_Yi_Teng/publication/221601133_A_Context-Aware_Seamless_Handover_Mechanism_for_Mass_Rapid_Transit_System/links/564aa86208ae127ff986b880/A-Context-Aware-Seamless-Handover-Mechanism-for-Mass-Rapid-Transit-System.pdf#page=152,,,1,7,No DOI available
"Population structure, spatial distribution and life‐history traits of blacktip reef sharks Carcharhinus melanopterus","J Mourier, SC Mills, S Planes - Journal of Fish Biology, 2013 - Wiley Online Library",2013,https://onlinelibrary.wiley.com/doi/abs/10.1111/jfb.12039,https://onlinelibrary.wiley.com/doi/pdf/10.1111/jfb.12039,,,1,37,No DOI available
The vertebrate social behavior network: evolutionary themes and variations,"JL Goodson - Hormones and behavior, 2005 - Elsevier",2005,https://www.sciencedirect.com/science/article/pii/S0018506X0500036X,https://www.ncbi.nlm.nih.gov/pmc/articles/PMC2570781/,,,1,502,No DOI available
Composition of agarose substrate affects behavioral output of Drosophila larvae,"AA Apostolopoulou, F Hersperger, L Mazija… - Frontiers in behavioral …, 2014 - frontiersin.org",2014,https://www.frontiersin.org/articles/10.3389/fnbeh.2014.00011,https://www.frontiersin.org/articles/10.3389/fnbeh.2014.00011,,,1,15,No DOI available
"Prisma: Towards quality, aspect oriented and dynamic software architectures","J Pérez, I Ramos, J Jaén, P Letelier… - … Conference on Quality …, 2003 - ieeexplore.ieee.org",2003,https://ieeexplore.ieee.org/abstract/document/1319086/,https://ieeexplore.ieee.org/iel5/9215/29226/01319086.pdf,,,1,87,No DOI available
Multi-unit recordings reveal context-dependent modulation of synchrony in odor-specific neural ensembles,"TA Christensen, VM Pawlowski, H Lei… - Nature …, 2000 - nature.com",2000,https://www.nature.com/articles/nn0900_927,http://www.academia.edu/download/35240571/MultiUnitRecordingsRevealContextDependentModulationOfSynchronyInOdorSpecificNeuralEnsembles.pdf,,,1,145,No DOI available
Neuroeconomics: Decision making and the brain,"PW Glimcher, E Fehr - 2013 - books.google.com",2013,https://books.google.de/books?hl=de&lr=&id=qToTAAAAQBAJ&oi=fnd&pg=PP1&dq=context-dependent+AND+distributed+composition+AND+behaviour&ots=t8AqvE2Zgi&sig=ewzgv0rKYCDlgK_-ltV8MtSqJqA,https://u.osu.edu/ratcliffmckoon/files/2018/07/glimcher-chapter-1gtu9o2.pdf,,,1,971,No DOI available
Regulation of behavioral responses by corticotropin-releasing factor,"CA Lowry, FL Moore - General and comparative endocrinology, 2006 - Elsevier",2006,https://www.sciencedirect.com/science/article/pii/S0016648005003813,No PDF available,,,1,147,No DOI available
Interpatch movement and edge effects: the role of behavioral responses to the landscape matrix,"K J. Haynes, J T. Cronin - Oikos, 2006 - Wiley Online Library",2006,https://onlinelibrary.wiley.com/doi/abs/10.1111/j.0030-1299.2006.13977.x,https://onlinelibrary.wiley.com/doi/full/10.1111/j.0030-1299.2006.13977.x,,,1,137,No DOI available
Lesions of an avian basal ganglia circuit prevent context-dependent changes to song variability,"MH Kao, MS Brainard - Journal of neurophysiology, 2006 - physiology.org",2006,https://www.physiology.org/doi/abs/10.1152/jn.01138.2005,https://pdfs.semanticscholar.org/e7ba/e0b3c031f0abe94e02162e766d4f8d067e00.pdf,,,1,205,No DOI available
