title,author,date,link,pdf_link,query,search_engine,nr_found,cite_count,doi
Context-dependent associations in linear distributed memories,"E Mizraji - Bulletin of mathematical biology, 1989 - Elsevier",1989,https://www.sciencedirect.com/science/article/pii/S0092824089800679,https://link.springer.com/content/pdf/10.1007/BF02458441.pdf,,,1,41,No DOI available
The context-dependent role model,"J Vallejos, P Ebraert, B Desmet, T Van Cutsem… - … on Distributed …, 2007 - Springer",2007,https://link.springer.com/chapter/10.1007/978-3-540-72883-2_1,https://link.springer.com/content/pdf/10.1007/978-3-540-72883-2_1.pdf,,,1,19,No DOI available
Automata for context-dependent connectors,"M Bonsangue, D Clarke, A Silva - International Conference on …, 2009 - Springer",2009,https://link.springer.com/chapter/10.1007/978-3-642-02053-7_10,https://repositorium.sdum.uminho.pt/bitstream/1822/37969/1/1738.pdf,,,1,47,No DOI available
"Distributed Applications and Interoperable Systems: 7th IFIP WG 6.1 International Conference, DAIS 2007, Paphos, Cyprus, June 6-8, 2007, Proccedings","J Indulska, K Raymond - 2007 - books.google.com",2007,https://books.google.de/books?hl=de&lr=&id=CAg0vDWS1PcC&oi=fnd&pg=PP2&dq=context-dependent+AND+distributed+composition+AND+behaviour&ots=A1f37dro2d&sig=PQLAn6Oe9GgISiqgBqxU27Q85RU,No PDF available,,,1,48,No DOI available
"The influence of social behaviour, dispersal and landscape fragmentation on population structure in a sedentary bird","PG Cale - Biological Conservation, 2003 - Elsevier",2003,https://www.sciencedirect.com/science/article/pii/S0006320702001520,No PDF available,,,1,80,No DOI available
Scale‐dependent effects of landscape context on three pollinator guilds,"I Steffan-Dewenter, U Münzenberg, C Bürger… - Ecology, 2002 - Wiley Online Library",2002,https://esajournals.onlinelibrary.wiley.com/doi/abs/10.1890/0012-9658(2002)083%5B1421:SDEOLC%5D2.0.CO%3B2,https://esajournals.onlinelibrary.wiley.com/doi/full/10.1890/0012-9658(2002)083%5B1421:SDEOLC%5D2.0.CO2,,,1,1049,No DOI available
Towards aspect-oriented programming for context-aware systems: A comparative study,"F Dantas, T Batista, N Cacho - … of the 1st International Workshop on …, 2007 - dl.acm.org",2007,https://dl.acm.org/citation.cfm?id=1270345,https://ieeexplore.ieee.org/iel5/4273309/4273310/04273315.pdf,,,1,19,No DOI available
Context-oriented programming,"R Hirschfeld, P Costanza… - Journal of Object …, 2008 - boris.unibe.ch",2008,https://boris.unibe.ch/id/eprint/37163,https://boris.unibe.ch/37163/1/article4.pdf,,,1,564,No DOI available
"Distributed representations, simple recurrent networks, and grammatical structure","JL Elman - Machine learning, 1991 - Springer",1991,https://link.springer.com/article/10.1007/BF00114844,https://link.springer.com/content/pdf/10.1007/BF00114844.pdf,,,1,1470,No DOI available
Context‐dependent variability in the components of fish escape response: integrating locomotor performance and behavior,"P Domenici - Journal of Experimental Zoology Part A …, 2010 - Wiley Online Library",2010,https://onlinelibrary.wiley.com/doi/abs/10.1002/jez.580,https://onlinelibrary.wiley.com/doi/pdf/10.1002/jez.580,,,1,91,No DOI available
Finding structure in time,"JL Elman - Cognitive science, 1990 - Wiley Online Library",1990,https://rmets.onlinelibrary.wiley.com/doi/pdf/10.1207/s15516709cog1402_1,https://rmets.onlinelibrary.wiley.com/doi/pdf/10.1207/s15516709cog1402_1,,,1,10060,No DOI available
Context-dependent group size choice in fish,"DJ Hoare, ID Couzin, JGJ Godin, J Krause - Animal Behaviour, 2004 - Elsevier",2004,https://www.sciencedirect.com/science/article/pii/S0003347203003580,http://www.princeton.edu/~icouzin/Animal%20behaviour.pdf,,,1,320,No DOI available
G/sup en/oM: a tool for the specification and the implementation of operating modules in a distributed robot architecture,"S Fleury, M Herrb, R Chatila - Proceedings of the 1997 IEEE …, 1997 - ieeexplore.ieee.org",1997,https://ieeexplore.ieee.org/abstract/document/655108/,http://citeseerx.ist.psu.edu/viewdoc/download?doi=10.1.1.56.6368&rep=rep1&type=pdf,,,1,266,No DOI available
Context-dependent interaction leads to emergent search behavior in social aggregates,"C Torney, Z Neufeld, ID Couzin - Proceedings of the …, 2009 - National Acad Sciences",2009,https://www.pnas.org/content/106/52/22055.short,https://www.pnas.org/content/pnas/106/52/22055.full.pdf,,,1,96,No DOI available
Scalable context-dependent analysis of emergency egress models,"M Massink, D Latella, A Bracciali, MD Harrison… - Formal Aspects of …, 2012 - Springer",2012,https://link.springer.com/article/10.1007/s00165-011-0188-1,https://link.springer.com/content/pdf/10.1007/s00165-011-0188-1.pdf,,,1,30,No DOI available
Middleware for distributed context-aware systems,"K Henricksen, J Indulska, T McFadden… - … Conferences"" On the …, 2005 - Springer",2005,https://link.springer.com/chapter/10.1007/11575771_53,https://www.researchgate.net/profile/Sasitharan_Balasubramaniam/publication/220831096_Middleware_for_Distributed_Context-Aware_Systems/links/00b49532839f98cd72000000/Middleware-for-Distributed-Context-Aware-Systems.pdf,,,1,270,No DOI available
Hypoxia-based habitat compression in the Neuse River Estuary: context-dependent shifts in behavioral avoidance thresholds,"LA Eby, LB Crowder - Canadian Journal of Fisheries and …, 2002 - NRC Research Press",2002,https://www.nrcresearchpress.com/doi/abs/10.1139/f02-067,"http://scholar.google.de/scholar?output=instlink&nossl=1&q=info:-AfFVpNa864J:scholar.google.com/&hl=de&as_sdt=0,5&scillfp=15895112449271132376&oi=lle",,,1,273,No DOI available
Connector colouring I: Synchronisation and context dependency,"D Clarke, D Costa, F Arbab - Science of Computer Programming, 2007 - Elsevier",2007,https://www.sciencedirect.com/science/article/pii/S0167642307000366,https://www.sciencedirect.com/science/article/pii/S0167642307000366/pdf?md5=8011a67c59604d3db322f0a2445d3b41&isDTMRedir=Y&pid=1-s2.0-S0167642307000366-main.pdf&_valck=1,,,1,101,No DOI available
Building a world model with structure-sensitive sparse binary distributed representations,"DA Rachkovskij, EM Kussul, TN Baidyk - Biologically Inspired Cognitive …, 2013 - Elsevier",2013,https://www.sciencedirect.com/science/article/pii/S2212683X12000552,http://www.academia.edu/download/43802927/Building_a_world_model_with_structure-se20160316-11824-9grbe6.pdf,,,1,41,No DOI available
Deficits in auditory and visual context-dependent processing in schizophrenia: defining the pattern,"DC Javitt, AM Shelley, G Silipo… - Archives of general …, 2000 - jamanetwork.com",2000,https://jamanetwork.com/journals/jamapsychiatry/article-abstract/481682,https://jamanetwork.com/journals/archneurpsyc/fullarticle/481682,,,1,230,No DOI available
Dynamics in action: Intentional behavior as a complex system,"A Juarrero - Emergence, 2000 - Taylor & Francis",2000,https://www.tandfonline.com/doi/pdf/10.1207/S15327000EM0202_03,http://intersci.ss.uci.edu/wiki/pub/Juarrero(2000)Dynmcs_Action(ECO).pdf,,,1,957,No DOI available
Behavioural reaction norms: animal personality meets individual plasticity,"NJ Dingemanse, AJN Kazem, D Réale… - Trends in ecology & …, 2010 - Elsevier",2010,https://www.sciencedirect.com/science/article/pii/S0169534709002432,No PDF available,,,1,869,No DOI available
Normalization is a general neural mechanism for context-dependent decision making,"K Louie, MW Khaw… - Proceedings of the …, 2013 - National Acad Sciences",2013,https://www.pnas.org/content/110/15/6139.short,https://www.pnas.org/content/pnas/110/15/6139.full.pdf,,,1,142,No DOI available
Shark personalities? Repeatability of social network traits in a widely distributed predatory fish,"DMP Jacoby, LN Fear, DW Sims, DP Croft - Behavioral Ecology and …, 2014 - Springer",2014,https://link.springer.com/article/10.1007/s00265-014-1805-9,https://link.springer.com/article/10.1007/s00265-014-1805-9,,,1,51,No DOI available
Habitat selection behaviour links local and regional scales in aquatic systems,"WJ Resetarits Jr - Ecology Letters, 2005 - Wiley Online Library",2005,https://onlinelibrary.wiley.com/doi/abs/10.1111/j.1461-0248.2005.00747.x,https://onlinelibrary.wiley.com/doi/full/10.1111/j.1461-0248.2005.00747.x,,,1,140,No DOI available
Synchronous coordination of distributed omponents,J Proença - 2011 - openaccess.leidenuniv.nl,2011,https://openaccess.leidenuniv.nl/handle/1887/17624,https://openaccess.leidenuniv.nl/bitstream/handle/1887/17624/thesis-colour[1].pdf?sequence=5,,,1,41,No DOI available
Context sensitivity and balancing in Indian organizational behaviour,"J BP Sinha RN Kanungo - International journal of psychology, 1997 - Taylor & Francis",1997,https://www.tandfonline.com/doi/abs/10.1080/002075997400890,https://onlinelibrary.wiley.com/doi/pdf/10.1080/002075997400890,,,1,177,No DOI available
Supporting context-aware mobile applications: an infrastructure approach,"MJ van Sinderen, AT van Halteren… - IEEE …, 2006 - ieeexplore.ieee.org",2006,https://ieeexplore.ieee.org/abstract/document/1705985/,https://ieeexplore.ieee.org/iel5/35/36012/01705985.pdf,,,1,129,No DOI available
"Individual movement behavior, matrix heterogeneity, and the dynamics of spatially structured populations","E Revilla, T Wiegand - … of the National Academy of Sciences, 2008 - National Acad Sciences",2008,https://www.pnas.org/content/105/49/19120.short,https://www.pnas.org/content/pnas/105/49/19120.full.pdf,,,1,152,No DOI available
Engineering mobile agent applications via context-dependent coordination,"G Cabri, L Leonardi… - IEEE Transactions on …, 2002 - ieeexplore.ieee.org",2002,https://ieeexplore.ieee.org/abstract/document/1049403/,https://ieeexplore.ieee.org/iel5/32/22485/01049403.pdf,,,1,119,No DOI available
Multitasking in the olfactory system: context-dependent responses to odors reveal dual GABA-regulated coding mechanisms in single olfactory projection neurons,"TA Christensen, BR Waldrop… - Journal of …, 1998 - Soc Neuroscience",1998,http://www.jneurosci.org/content/18/15/5999.short,http://www.jneurosci.org/content/jneuro/18/15/5999.full.pdf,,,1,141,No DOI available
Context-aware service engineering: A survey,"GM Kapitsaki, GN Prezerakos, ND Tselikas… - Journal of Systems and …, 2009 - Elsevier",2009,https://www.sciencedirect.com/science/article/pii/S0164121209000430,http://www.academia.edu/download/30690729/J3.pdf,,,1,121,No DOI available
Predictable component architectures using dependent finite state machines,"HW Schmidt, BJ Krämer, I Poernomo… - … Workshop on Radical …, 2002 - Springer",2002,https://link.springer.com/chapter/10.1007/978-3-540-24626-8_22,http://www.academia.edu/download/39964865/Predictable_Component_Architectures_Usin20151113-1152-l0veie.pdf,,,1,36,No DOI available
Distributed Representations,"JL Elman - Connectionism: Theory and practice, 1992 - books.google.com",1992,https://books.google.de/books?hl=de&lr=&id=aEtnDAAAQBAJ&oi=fnd&pg=PA138&dq=context-dependent+AND+distributed+composition+AND+behaviour&ots=26EQHJr-Lw&sig=i2upzdgGTZbIuZsMRvnI5yttz74,No PDF available,,,1,74,No DOI available
Context-dependent computation by recurrent dynamics in prefrontal cortex,"V Mante, D Sussillo, KV Shenoy, WT Newsome - nature, 2013 - nature.com",2013,https://www.nature.com/articles/nature12742,https://www.ncbi.nlm.nih.gov/pmc/articles/PMC4121670/,,,1,541,No DOI available
Context oriented software development,"B Magableh, S Barrett - Journal of Emerging …, 2012 - pdfs.semanticscholar.org",2012,https://pdfs.semanticscholar.org/266f/11b438ea5abae374a88efc81421126d64a1a.pdf,https://pdfs.semanticscholar.org/266f/11b438ea5abae374a88efc81421126d64a1a.pdf,,,1,8,No DOI available
Integrating context-and stage-dependent effects in studies of frugivorous seed dispersal: an example from south-east Kenya,"V Lehouck, D Bonte, T Spanhove… - Dispersal ecology and …, 2012 - books.google.com",2012,https://books.google.de/books?hl=de&lr=&id=wC9qnr4dH5AC&oi=fnd&pg=PA50&dq=context-dependent+AND+distributed+composition+AND+behaviour&ots=o3vM7TavJc&sig=EDFVIhvBmHMKcKSrv1ZjGyZ-p3w,No PDF available,,,1,5,No DOI available
Dynamic and decentralized service composition,"T Cottenier, T Elrad - … web information systems and technologies. INSTICC …, 2005 - Citeseer",2005,http://citeseerx.ist.psu.edu/viewdoc/download?doi=10.1.1.457.6471&rep=rep1&type=pdf,http://citeseerx.ist.psu.edu/viewdoc/download?doi=10.1.1.457.6471&rep=rep1&type=pdf,,,1,23,No DOI available
Model-driven development of context-aware services,"JPA Almeida, ME Iacob, H Jonkers… - … Conference on Distributed …, 2006 - Springer",2006,https://link.springer.com/chapter/10.1007/11773887_17,https://link.springer.com/content/pdf/10.1007/11773887_17.pdf,,,1,35,No DOI available
Modeling traveler choice behavior using the concepts of relative utility and relative interest,"J Zhang, H Timmermans, A Borgers, D Wang - … Research Part B …, 2004 - Elsevier",2004,https://www.sciencedirect.com/science/article/pii/S0191261503000092,No PDF available,,,1,95,No DOI available
Context dependence in foraging behaviour of Achillea millefolium,"JD Karst, PR Belter, JA Bennett, JF Cahill - Oecologia, 2012 - Springer",2012,https://link.springer.com/article/10.1007/s00442-012-2358-0,https://link.springer.com/article/10.1007/s00442-012-2358-0,,,1,10,No DOI available
Binding and normalization of binary sparse distributed representations by context-dependent thinning,"DA Rachkovskij, EM Kussul - Neural Computation, 2001 - MIT Press",2001,https://www.mitpressjournals.org/doi/abs/10.1162/089976601300014592,http://cogprints.org/1240/1/cdt-1sp.pdf,,,1,119,No DOI available
A model of context-dependent component connectors,"M Bonsangue, D Clarke, A Silva - Science of Computer Programming, 2012 - Elsevier",2012,https://www.sciencedirect.com/science/article/pii/S0167642311000189,https://www.sciencedirect.com/science/article/pii/S0167642311000189/pdf?md5=d7d68be1cc971f0baa0c1d75bf6abe86&pid=1-s2.0-S0167642311000189-main.pdf&_valck=1,,,1,18,No DOI available
Distribution of orexin receptor mRNA in the rat brain,"P Trivedi, H Yu, DJ MacNeil, LHT Van der Ploeg… - FEBS …, 1998 - Wiley Online Library",1998,https://febs.onlinelibrary.wiley.com/doi/abs/10.1016/S0014-5793(98)01266-6,https://febs.onlinelibrary.wiley.com/doi/full/10.1016/S0014-5793(98)01266-6,,,1,915,No DOI available
Decoupled execution of synchronous coordination models via behavioural automata,"J Proença, D Clarke, E De Vink, F Arbab - arXiv preprint arXiv:1108.0232, 2011 - arxiv.org",1108,https://arxiv.org/abs/1108.0232,https://arxiv.org/pdf/1108.0232,,,1,18,No DOI available
Putting gender into context: An interactive model of gender-related behavior.,"K Deaux, B Major - Psychological review, 1987 - psycnet.apa.org",1987,https://psycnet.apa.org/record/1987-34377-001,https://pdfs.semanticscholar.org/edc1/81eaba471bdf8bb83e968b6a5352b76f21b0.pdf,,,1,1581,No DOI available
Repeatability: its role in evolutionary studies of mating behavior,"CRB Boake - Evolutionary Ecology, 1989 - Springer",1989,https://link.springer.com/article/10.1007/BF02270919,https://link.springer.com/content/pdf/10.1007/BF02270919.pdf,,,1,470,No DOI available
Context-dependent reorganization of spatial and movement representations by simultaneously recorded hippocampal and striatal neurons during performance of …,"O Yeshenko, A Guazzelli, SJY Mizumori - Behavioral neuroscience, 2004 - psycnet.apa.org",2004,https://psycnet.apa.org/record/2004-16908-009,https://www.researchgate.net/profile/Sheri_Mizumori/publication/8408790_Context-Dependent_Reorganization_of_Spatial_and_Movement_Representations_by_Simultaneously_Recorded_Hippocampal_and_Striatal_Neurons_During_Performance_of_Allocentric_and_Egocentric_Tasks/links/00463530e1421334a5000000/Context-Dependent-Reorganization-of-Spatial-and-Movement-Representations-by-Simultaneously-Recorded-Hippocampal-and-Striatal-Neurons-During-Performance-of-Allocentric-and-Egocentric-Tasks.pdf,,,1,75,No DOI available
Psychological heterogeneity in AD/HD—a dual pathway model of behaviour and cognition,"EJS Sonuga-Barke - Behavioural brain research, 2002 - Elsevier",2002,https://www.sciencedirect.com/science/article/pii/S0166432801004326,"http://scholar.google.de/scholar?output=instlink&nossl=1&q=info:mrxSfpwhHPcJ:scholar.google.com/&hl=de&as_sdt=0,5&scillfp=7082305983978663517&oi=lle",,,1,953,No DOI available
Ecological implications of behavioural syndromes,"A Sih, J Cote, M Evans, S Fogarty, J Pruitt - Ecology letters, 2012 - Wiley Online Library",2012,https://onlinelibrary.wiley.com/doi/abs/10.1111/j.1461-0248.2011.01731.x,https://onlinelibrary.wiley.com/doi/full/10.1111/j.1461-0248.2011.01731.x,,,1,549,No DOI available
VR-RoBoser: real-time adaptive sonification of virtual environments based on avatar behavior,"SL Groux, J Manzolli, PFMJ Verschure - Proceedings of the 7th …, 2007 - dl.acm.org",2007,https://dl.acm.org/citation.cfm?id=1279822,http://citeseerx.ist.psu.edu/viewdoc/download?doi=10.1.1.135.3330&rep=rep1&type=pdf,,,1,14,No DOI available
Measuring landscape connectivity: the challenge of behavioral landscape ecology,"M Bélisle - Ecology, 2005 - Wiley Online Library",2005,https://esajournals.onlinelibrary.wiley.com/doi/abs/10.1890/04-0923,https://esajournals.onlinelibrary.wiley.com/doi/full/10.1890/04-0923,,,1,461,No DOI available
Representation and structure in connectionist models,JL Elman - 1989 - apps.dtic.mil,1989,https://apps.dtic.mil/docs/citations/ADA259504,https://apps.dtic.mil/dtic/tr/fulltext/u2/a259504.pdf,,,1,228,No DOI available
Deep-level composition variables as predictors of team performance: a meta-analysis.,"ST Bell - Journal of applied psychology, 2007 - psycnet.apa.org",2007,https://psycnet.apa.org/doiLanding?doi=10.1037/0021-9010.92.3.595,https://www.researchgate.net/profile/Suzanne_Bell3/publication/6345949_Deep-Level_Composition_Variables_as_Predictors_of_Team_Performance/links/00b7d5256c6ed6931b000000/Deep-Level-Composition-Variables-as-Predictors-of-Team-Performance.pdf,,,1,977,No DOI available
Dynamics of text generation with realistic Zipf's distribution,"D Zanette, M Montemurro - Journal of quantitative Linguistics, 2005 - Taylor & Francis",2005,https://www.tandfonline.com/doi/abs/10.1080/09296170500055293,https://arxiv.org/pdf/cond-mat/0212496,,,1,105,No DOI available
Food limitation leads to behavioral diversification and dietary specialization in sea otters,"MT Tinker, G Bentall, JA Estes - Proceedings of the …, 2008 - National Acad Sciences",2008,https://www.pnas.org/content/105/2/560.short,https://www.pnas.org/content/pnas/105/2/560.full.pdf,,,1,293,No DOI available
Striatal dopamine modulates basal ganglia output and regulates social context-dependent behavioral variability through D1 receptors,"A Leblois, BJ Wendel, DJ Perkel - Journal of Neuroscience, 2010 - Soc Neuroscience",2010,http://www.jneurosci.org/content/30/16/5730.short,http://www.jneurosci.org/content/jneuro/30/16/5730.full.pdf,,,1,105,No DOI available
Context-dependent discrimination and the evolution of mimicry,"ØH Holen, RA Johnstone - The American Naturalist, 2006 - journals.uchicago.edu",2006,https://www.journals.uchicago.edu/doi/abs/10.1086/499567,https://www.jstor.org/stable/pdf/10.1086/499567.pdf,,,1,35,No DOI available
On the development of social behaviour in immature males of a feral horse population (Equus przewalskii f. caballus),"R Hoffmann - Zeitschrift fˇr SÈugetierkunde, 1985 - paardenwelzijnscheck.nl",1985,https://www.paardenwelzijnscheck.nl/app/webroot/files/ckeditor_files/files/Gezondheid%20en%20gedrag/Hoffmann%20(1985)%20On%20the%20development%20of%20social%20behaviour%20in%20immature%20males%20of%20a%20feral%20horse%20population.pdf,https://www.paardenwelzijnscheck.nl/app/webroot/files/ckeditor_files/files/Gezondheid%20en%20gedrag/Hoffmann%20(1985)%20On%20the%20development%20of%20social%20behaviour%20in%20immature%20males%20of%20a%20feral%20horse%20population.pdf,,,1,23,No DOI available
Autocrine loops with positive feedback enable context-dependent cell signaling,"SY Shvartsman, MP Hagan, A Yacoub… - American Journal of …, 2002 - physiology.org",2002,https://www.physiology.org/doi/abs/10.1152/ajpcell.00260.2001,https://pdfs.semanticscholar.org/f06f/2bbf8b1f57ff15712e12490c690ad9aa5ee7.pdf,,,1,140,No DOI available
Dissociable components of rule-guided behavior depend on distinct medial and prefrontal regions,"MJ Buckley, FA Mansouri, H Hoda, M Mahboubi… - …, 2009 - science.sciencemag.org",2009,http://science.sciencemag.org/content/325/5936/52.short,https://www.jstor.org/stable/pdf/20536549.pdf,,,1,230,No DOI available
Behaviour-based modelling of hexapod locomotion: linking biology and technical application,"V Dürr, J Schmitz, H Cruse - Arthropod structure & development, 2004 - Elsevier",2004,https://www.sciencedirect.com/science/article/pii/S1467803904000301,http://citeseerx.ist.psu.edu/viewdoc/download?doi=10.1.1.72.9312&rep=rep1&type=pdf,,,1,175,No DOI available
Dispersal ecology and evolution,"J Clobert, M Baguette, TG Benton, JM Bullock - 2012 - books.google.com",2012,https://books.google.de/books?hl=de&lr=&id=s3EVDAAAQBAJ&oi=fnd&pg=PP1&dq=context-dependent+AND+distributed+composition+AND+behaviour&ots=LKoEFB0XKp&sig=ali-WJjBwOCVR_hUA2WVGrmQHY8,No PDF available,,,1,416,No DOI available
Vector-based models of semantic composition,"J Mitchell, M Lapata - proceedings of ACL-08: HLT, 2008 - aclweb.org",2008,https://www.aclweb.org/anthology/P08-1028,https://www.aclweb.org/anthology/P08-1028,,,1,578,No DOI available
The structural basis for mapping behavior onto the ventral striatum and its subdivisions,"GE Meredith, BA Baldo, ME Andrezjewski… - Brain Structure and …, 2008 - Springer",2008,https://link.springer.com/article/10.1007/s00429-008-0175-3,https://link.springer.com/article/10.1007/s00429-008-0175-3,,,1,166,No DOI available
Structure of social networks in a passerine bird: consequences for sexual selection and the evolution of mating strategies,"KP Oh, AV Badyaev - The American Naturalist, 2010 - journals.uchicago.edu",2010,https://www.journals.uchicago.edu/doi/abs/10.1086/655216,https://www.journals.uchicago.edu/doi/pdf/10.1086/655216?version=meter+at+null&module=meter-Links&pgtype=article&contentId=&mediaId=&referrer=&priority=true&action=click&contentCollection=meter-links-click,,,1,146,No DOI available
Architectural primitives for distribution and mobility,"A Lopes, JL Fiadeiro, M Wermelinger - 2002 - oro.open.ac.uk",2002,http://oro.open.ac.uk/1169/,http://oro.open.ac.uk/1169/1/lopes02fse.pdf,,,1,61,No DOI available
Distributed information systems tailorability: A component approach,"D Theotokis, GD Kapos, C Vassilakis… - … Trends of Distributed …, 1999 - ieeexplore.ieee.org",1999,https://ieeexplore.ieee.org/abstract/document/818790/,https://ieeexplore.ieee.org/iel5/6627/17681/00818790.pdf,,,1,8,No DOI available
Personality and social context,"MM Webster, AJW Ward - Biological Reviews, 2011 - Wiley Online Library",2011,https://zslpublications.onlinelibrary.wiley.com/doi/pdf/10.1111/j.1469-185X.2010.00169.x,https://zslpublications.onlinelibrary.wiley.com/doi/pdf/10.1111/j.1469-185X.2010.00169.x,,,1,190,No DOI available
A theoretical proposal for the relationship between context and disease,"KL Frohlich, E Corin, L Potvin - Sociology of health & illness, 2001 - Wiley Online Library",2001,https://onlinelibrary.wiley.com/doi/abs/10.1111/1467-9566.00275,https://onlinelibrary.wiley.com/doi/pdf/10.1111/1467-9566.00275,,,1,429,No DOI available
"The Disgust Scale: item analysis, factor structure, and suggestions for refinement.","BO Olatunji, NL Williams, DF Tolin… - Psychological …, 2007 - psycnet.apa.org",2007,https://psycnet.apa.org/record/2007-12847-003,http://www.psy.vanderbilt.edu/faculty/olatunoo/pdf/281.pdf,,,1,558,No DOI available
Distributed processing and temporal codes in neuronal networks,"W Singer - Cognitive neurodynamics, 2009 - Springer",2009,https://link.springer.com/article/10.1007/s11571-009-9087-z,https://link.springer.com/article/10.1007/s11571-009-9087-z,,,1,136,No DOI available
The behavioural ecology of personality: consistent individual differences from an adaptive perspective,"SRX Dall, AI Houston, JM McNamara - Ecology letters, 2004 - Wiley Online Library",2004,https://onlinelibrary.wiley.com/doi/abs/10.1111/j.1461-0248.2004.00618.x,https://onlinelibrary.wiley.com/doi/full/10.1111/j.1461-0248.2004.00618.x,,,1,956,No DOI available
Model-driven composition of context-aware web services using ContextUML and aspects,"GN Prezerakos, ND Tselikas… - … Conference on Web …, 2007 - ieeexplore.ieee.org",2007,https://ieeexplore.ieee.org/abstract/document/4279615/,https://ieeexplore.ieee.org/iel5/4279552/4279553/04279615.pdf,,,1,52,No DOI available
Behavioral dopamine signals,"W Schultz - Trends in neurosciences, 2007 - Elsevier",2007,https://www.sciencedirect.com/science/article/pii/S0166223607000689,http://citeseerx.ist.psu.edu/viewdoc/download?doi=10.1.1.697.7200&rep=rep1&type=pdf,,,1,951,No DOI available
Pcoms: A component model for building context-dependent applications,"B Magableh, S Barrett - 2009 Computation World: Future …, 2009 - ieeexplore.ieee.org",2009,https://ieeexplore.ieee.org/abstract/document/5359553/,https://www.researchgate.net/profile/Basel_Magableh/publication/232640151_PCOMs_A_Component_Model_for_Building_Context-Dependent_Applications/links/0912f5089a20354b9c000000/PCOMs-A-Component-Model-for-Building-Context-Dependent-Applications.pdf,,,1,11,No DOI available
