title,author,date,link,pdf_link,query,search_engine,nr_found,cite_count,doi
The Kung Fu Hero in the Digital Age: Stephen Chow's 'Glocal'Strategies,"VPY Lee - Hong Kong Cinema Since 1997, 2009 - Springer",1997,https://link.springer.com/chapter/10.1057/9780230245433_6,No PDF available,,,1,No cite count available,No DOI available
"NEW FRONTIERS OF TRANSLATION IN THE 21st CENTURY (THE GLOBE, THE MARKET, THE FIELD). In Honor of the Life and Work of Michael Henry Heim","RS Valentino - The Slavic and East European Journal, 2013 - JSTOR",2013,https://www.jstor.org/stable/24642405,https://www.jstor.org/stable/pdf/24642405.pdf,,,1,No cite count available,No DOI available
Concept-context-design: A creative model for the development of interactivity,"A Kerne - Proceedings of the 4th conference on Creativity & …, 2002 - dl.acm.org",2002,https://dl.acm.org/citation.cfm?id=581739,https://www.researchgate.net/profile/Andruid_Kerne/publication/221629418_Concept-context-design_a_creative_model_for_the_development_of_interactivity/links/02bfe5110223975185000000/Concept-context-design-a-creative-model-for-the-development-of-interactivity.pdf,,,1,24,No DOI available
"Introduction: Gendering development, developing gender: The politics of contemporary gendered analysis of development","P Motzafi-Haller, S Abu-Rabia-Queder - Hagar, 2009 - search.proquest.com",2009,http://search.proquest.com/openview/c56dd0ed0a277ad2bbecbc595563d7a5/1?pq-origsite=gscholar&cbl=38320,No PDF available,,,1,No cite count available,No DOI available
Contextualizing culturally relevant science and mathematics teaching for indigenous learning,"E Abrams, PC Taylor, CJ Guo - International Journal of Science and …, 2013 - Springer",2013,https://link.springer.com/article/10.1007/s10763-012-9388-2,https://link.springer.com/content/pdf/10.1007/s10763-012-9388-2.pdf,,,1,37,No DOI available
Problem solving was never this easy: Transformational change through appreciative inquiry,"M Faure - Performance improvement, 2006 - Wiley Online Library",2006,https://onlinelibrary.wiley.com/doi/abs/10.1002/pfi.4930450917,https://onlinelibrary.wiley.com/doi/pdf/10.1002/pfi.4930450917,,,1,51,No DOI available
Skyscraper geography,"D McNeill - Progress in human geography, 2005 - journals.sagepub.com",2005,https://journals.sagepub.com/doi/abs/10.1191/0309132505ph527oa,https://journals.sagepub.com/doi/pdf/10.1191/0309132505ph527oa,,,1,126,No DOI available
,"Y Daniel - … of the Association of Graduate Dance …, 1983 - Association of Graduate Dance …",1983,javascript:void(0),No PDF available,,,1,No cite count available,No DOI available
"Diplomacy, democracy and impossible ideas","E Barritt - EU Climate Diplomacy, 2018 - taylorfrancis.com",2018,https://www.taylorfrancis.com/books/e/9781351599771/chapters/10.4324/9781315104980-15,No PDF available,,,1,1,No DOI available
A de novo substitution in BCL11B leads to loss of interaction with transcriptional complexes and craniosynostosis,"JAC Goos, WK Vogel, H Mlcochova… - Human Molecular …, 2019 - academic.oup.com",2019,https://academic.oup.com/hmg/advance-article-abstract/doi/10.1093/hmg/ddz072/5427034,https://academic.oup.com/hmg/advance-article-pdf/doi/10.1093/hmg/ddz072/28270376/ddz072.pdf,,,1,No cite count available,No DOI available
Learning from krumping: Collective agency in dance performance cultures,"YB Kafai, KA Peppler - Proceedings of the 8th international conference …, 2008 - dl.acm.org",2008,https://dl.acm.org/citation.cfm?id=1599864,No PDF available,,,1,2,No DOI available
Cultural Knowledge and Conceptions of the Knowledge Society,"B Opie - A Paper presented at the, 2001 - Citeseer",2001,http://citeseerx.ist.psu.edu/viewdoc/download?doi=10.1.1.203.2174&rep=rep1&type=pdf,http://citeseerx.ist.psu.edu/viewdoc/download?doi=10.1.1.203.2174&rep=rep1&type=pdf,,,1,2,No DOI available
Contemporary epistemological research in education: Reconciliation and reconceptualization of the field,"T Niessen, T Abma, G Widdershoven… - Theory & …, 2008 - journals.sagepub.com",2008,https://journals.sagepub.com/doi/abs/10.1177/0959354307086921,https://journals.sagepub.com/doi/pdf/10.1177/0959354307086921,,,1,47,No DOI available
Exploring the transformative potential of collaborative art projects in South African Higher Education,"K Perold, E Costandius - South African Journal of Higher Education, 2015 - journals.co.za",2015,https://journals.co.za/content/high/29/6/EJC191480,No PDF available,,,1,No cite count available,No DOI available
Exploring the transformative potential of collaborative art projects on the Stellenbosch University campus,"E Costandius, K Perold - 2015 - scholar.sun.ac.za",2015,http://scholar.sun.ac.za/handle/10019.1/104321,https://scholar.sun.ac.za/bitstream/handle/10019.1/104321/costandius_exploring_2015.pdf?sequence=1&isAllowed=y,,,1,No cite count available,No DOI available
"Supervision, documentation and other aspects of praxis","R Nelson - Practice as Research in the Arts, 2013 - Springer",2013,https://link.springer.com/chapter/10.1057/9781137282910_4,No PDF available,,,1,2,No DOI available
Dialogical nursing ethics: the quality of freedom restrictions,"TA Abma, GAM Widdershoven, BJM Frederiks… - Nursing …, 2008 - journals.sagepub.com",2008,https://journals.sagepub.com/doi/abs/10.1177/0969733008095387,https://journals.sagepub.com/doi/pdf/10.1177/0969733008095387,,,1,15,No DOI available
Communication Studies as critical: CDA and poststructuralism §,"T Cross - Fukuoka University Review of Literature and …, 2004 - fukuoka-u.repo.nii.ac.jp",2004,https://fukuoka-u.repo.nii.ac.jp/?action=repository_action_common_download&item_id=763&item_no=1&attribute_id=22&file_no=1,https://fukuoka-u.repo.nii.ac.jp/?action=repository_action_common_download&item_id=763&item_no=1&attribute_id=22&file_no=1,,,1,No cite count available,No DOI available
IMAGINE RRI. A card-based method for reflecting on responsibility in life science research,"U Felt, M Fochler, L Sigl - Journal of Responsible Innovation, 2018 - Taylor & Francis",2018,https://www.tandfonline.com/doi/abs/10.1080/23299460.2018.1457402,https://www.tandfonline.com/doi/full/10.1080/23299460.2018.1457402,,,1,3,No DOI available
1 Linked Data Beyond Libraries,"P Di Maio - Linked Data and User Interaction, 2015 - books.google.com",2015,https://books.google.de/books?hl=de&lr=&id=hG3yCQAAQBAJ&oi=fnd&pg=PA3&dq=context-specific+AND+choreography+AND+sensitiv&ots=Js-vyRwJXk&sig=Bki2un2FKS0fpzUImqTBoJ2K750,No PDF available,,,1,2,No DOI available
Interrogating ourselves: Reflections on arts-based health research,"MJ Hodgins, KM Boydell - … /Forum: Qualitative Social …, 2013 - qualitative-research.net",2013,http://www.qualitative-research.net/index.php/fqs/article/view/2018,http://www.qualitative-research.net/index.php/fqs/article/download/2018/3609,,,1,24,No DOI available
Dialogue in dance studies research,"A Dils, JF Crosby - Dance research journal, 2001 - cambridge.org",2001,https://www.cambridge.org/core/journals/dance-research-journal/article/dialogue-in-dance-studies-research/F7F06DDB6C0A1E444AAE00B9FAF8E58C,https://www.jstor.org/stable/pdf/1478857.pdf,,,1,9,No DOI available
DETERMINATION OF SOCIAL SKILLS SPECIFIC TO DANCESPORT DANCERS,A Armas - LASE JOURNAL OF SPORT SCIENCE is a Scientific … - journal.lspa.lv,No year available,http://journal.lspa.lv/files/2017_1/LASE_2017_1.pdf#page=21,http://journal.lspa.lv/files/2017_1/LASE_2017_1.pdf#page=21,,,1,No cite count available,No DOI available
