title,author,date,link,pdf_link,query,search_engine,nr_found,cite_count,doi
K-Trek: a peer-to-peer approach to distribute knowledge in large environments,"P Busetta, P Bouquet, G Adami, M Bonifacio… - … Workshop on Agents …, 2003 - Springer",2003,https://link.springer.com/chapter/10.1007/978-3-540-25840-7_18,http://eprints.biblio.unitn.it/archive/00000427/01/033.pdf,,,1,9,No DOI available
"System and methods for automatically selecting, mapping and designating components for digital cable service distribution systems","R Booth - US Patent App. 09/932,289, 2002 - Google Patents",2002,https://patents.google.com/patent/US20020032908A1/en,No PDF available,,,1,17,No DOI available
An energy-efficient object discovery protocol for context-sensitive middleware for ubiquitous computing,"SS Yau, F Karim - … Transactions on Parallel and Distributed …, 2003 - ieeexplore.ieee.org",2003,https://ieeexplore.ieee.org/abstract/document/1247669/,https://ieeexplore.ieee.org/iel5/71/27943/01247669.pdf,,,1,21,No DOI available
Dynamic contextual service ranking,"A Bottaro, RS Hall - International Conference on Software Composition, 2007 - Springer",2007,https://link.springer.com/chapter/10.1007/978-3-540-77351-1_10,http://www.academia.edu/download/4419836/software_composition__6_conf.__sc_2007_lncs4829__springer__2007__isbn_9783540773504__289s__csln_.pdf#page=137,,,1,24,No DOI available
Energy efficiency improvement through context sensitive self-learning of machine availability,"JL Bittencourt, R Bonefeld, S Scholze… - 2011 9th IEEE …, 2011 - ieeexplore.ieee.org",2011,https://ieeexplore.ieee.org/abstract/document/6034843/,https://ieeexplore.ieee.org/iel5/6029399/6034824/06034843.pdf,,,1,16,No DOI available
Explicit namespaces,"F Achermann, O Nierstrasz - Joint Modular Languages Conference, 2000 - Springer",2000,https://link.springer.com/chapter/10.1007/10722581_8,https://pdfs.semanticscholar.org/d98f/9e34e265f2667014012f460ca40a6a8a173b.pdf,,,1,41,No DOI available
Context-sensitive caching,"GA Cuomo, BK Martin, DF Ferguson, DC Shupp… - US Patent …, 2008 - Google Patents",2008,https://patents.google.com/patent/US7334087B2/en,No PDF available,,,1,19,No DOI available
A dynamic platform for run-time adaptation,"H Pham, JM Paluska, U Saif, C Stawarz… - Pervasive and Mobile …, 2009 - Elsevier",2009,https://www.sciencedirect.com/science/article/pii/S1574119209000698,https://dspace.mit.edu/openaccess-disseminate/1721.1/62019,,,1,16,No DOI available
Client-server system with central application management allowing an administrator to configure user and group contexts during application configuration without …,"KF Hayes Jr - US Patent 6,237,092, 2001 - Google Patents",2001,https://patents.google.com/patent/US6237092B1/en,No PDF available,,,1,153,No DOI available
A middleware-based application framework for active space applications,"M Roman, RH Campbell - Proceedings of the ACM/IFIP/USENIX 2003 …, 2003 - dl.acm.org",2003,https://dl.acm.org/citation.cfm?id=1515945,https://link.springer.com/content/pdf/10.1007/3-540-44892-6_22.pdf,,,1,58,No DOI available
A universal self-organization mechanism for role-based Organic Computing systems,"F Nafz, F Ortmeier, H Seebach, JP Steghöfer… - … on Autonomic and …, 2009 - Springer",2009,https://link.springer.com/chapter/10.1007/978-3-642-02704-8_3,https://www.researchgate.net/profile/Frank_Ortmeier/publication/221108310_A_Universal_Self-Organization_Mechanism_for_Role-Based_Organic_Computing_Systems/links/0deec5193612dc7e8e000000.pdf,,,1,28,No DOI available
Tool supported test frameworks in TTCN-3,"I Schieferdecker, T Vassiliou-Gioles - Electronic Notes in Theoretical …, 2003 - Elsevier",2003,https://www.sciencedirect.com/science/article/pii/S1571066104808223,https://www.sciencedirect.com/science/article/pii/S1571066104808223/pdf?md5=19764bf555410ba875ed57fb83f023b6&isDTMRedir=Y&pid=1-s2.0-S1571066104808223-main.pdf&_valck=1,,,1,7,No DOI available
The design of a novel autonomic management methodology and architecture for next generation and future internet systems,"S van der Meer, J Strassner… - 2009 Sixth IEEE …, 2009 - ieeexplore.ieee.org",2009,https://ieeexplore.ieee.org/abstract/document/4839200/,https://ieeexplore.ieee.org/iel5/4839190/4839191/04839200.pdf,,,1,8,No DOI available
"Security, privacy and trust in Internet of Things: The road ahead","S Sicari, A Rizzardi, LA Grieco, A Coen-Porisini - Computer networks, 2015 - Elsevier",2015,https://www.sciencedirect.com/science/article/pii/S1389128614003971,http://tarjomefa.com/wp-content/uploads/2016/07/5009-English.pdf,,,1,800,No DOI available
Kinetic systems in architecture: New approach for environmental control systems and context-sensitive buildings,"N Ramzy, H Fayed - Sustainable Cities and Society, 2011 - Elsevier",2011,https://www.sciencedirect.com/science/article/pii/S2210670711000394,http://www.academia.edu/download/49094220/j.scs.2011.07.00420160924-14390-1et3cc0.pdf,,,1,22,No DOI available
Reconfiguration of software architecture styles with name mobility,"D Hirsch, P Inverardi, U Montanari - International Conference on …, 2000 - Springer",2000,https://link.springer.com/chapter/10.1007/3-540-45263-X_10,No PDF available,,,1,47,No DOI available
Context-sensitive delta inference for identifying workload-dependent performance bottlenecks,"X Xiao, S Han, D Zhang, T Xie - … of the 2013 International Symposium on …, 2013 - dl.acm.org",2013,https://dl.acm.org/citation.cfm?id=2483784,https://www.microsoft.com/en-us/research/wp-content/uploads/2016/07/issta13_delta_infer.pdf,,,1,53,No DOI available
Scalable service deployment on software-defined networks,"J Rubio-Loyola, A Galis, A Astorga… - IEEE …, 2011 - ieeexplore.ieee.org",2011,https://ieeexplore.ieee.org/abstract/document/6094010/,https://ieeexplore.ieee.org/iel5/35/6093994/06094010.pdf,,,1,68,No DOI available
