title,author,date,link,pdf_link,query,search_engine,nr_found,cite_count,doi
Towards context-aware multimedia processing through semantic web services,"S Dietze, JB Domingue - Proceedings of the 7th European Conference …, 2009 - dl.acm.org",2009,https://dl.acm.org/citation.cfm?id=1542107,http://www.academia.edu/download/31008881/towards_context_aware_composition_of_web_services.pdf,,,1,6,No DOI available
Situation-aware IoT service coordination using the event-driven SOA paradigm,"B Cheng, D Zhu, S Zhao, J Chen - IEEE Transactions on …, 2016 - ieeexplore.ieee.org",2016,https://ieeexplore.ieee.org/abstract/document/7442148/,https://ieeexplore.ieee.org/iel7/4275028/5699970/07442148.pdf,,,1,50,No DOI available
supporting interoperability and Context-awareness in e-learning through situation-driven learning Processes,"S Dietze, A Gugliotta, J Domingue - International Journal of Distance …, 2009 - igi-global.com",2009,https://www.igi-global.com/article/international-journal-distance-education-technologies/3912,https://www.igi-global.com/viewtitle.aspx?titleid=3912,,,1,12,No DOI available
SquirrelJoin: network-aware distributed join processing with lazy partitioning,"L Rupprecht, W Culhane, P Pietzuch - Proceedings of the VLDB …, 2017 - dl.acm.org",2017,https://dl.acm.org/citation.cfm?id=3137636,https://pdfs.semanticscholar.org/6ed9/31956400fd24bb50198978723a3a2888660c.pdf,,,1,6,No DOI available
Pure Edge Computing Platform for the Future Internet,"M D'Angelo, M Caporuscio - Federation of International Conferences on …, 2016 - Springer",2016,https://link.springer.com/chapter/10.1007/978-3-319-50230-4_36,https://www.researchgate.net/profile/Mauro_Caporuscio/publication/308792578_Pure_Edge_Computing_Platform_for_the_Future_Internet/links/5b2a28ff0f7e9b1d009bd50e/Pure-Edge-Computing-Platform-for-the-Future-Internet.pdf,,,1,3,No DOI available
Service-based computing on manets: Enabling dynamic interoperability of first responders,"J Kopena, E Sultanik, G Naik, I Howley… - IEEE Intelligent …, 2005 - ieeexplore.ieee.org",2005,https://ieeexplore.ieee.org/abstract/document/1511996/,https://ieeexplore.ieee.org/iel5/9670/32373/01511996.pdf,,,1,28,No DOI available
Privacy in Web Service Transactions: A Tale of More than a Decade of Work,"L Bahri, B Carminati, E Ferrari - IEEE Transactions on Services …, 2018 - ieeexplore.ieee.org",2018,https://ieeexplore.ieee.org/abstract/document/7937912/,https://ieeexplore.ieee.org/iel7/4629386/4629387/07937912.pdf,,,1,3,No DOI available
"On the integration of trust with negotiation, argumentation and semantics","P Bonatti, E Oliveira, J Sabater-Mir… - The Knowledge …, 2014 - cambridge.org",2014,https://www.cambridge.org/core/journals/knowledge-engineering-review/article/on-the-integration-of-trust-with-negotiation-argumentation-and-semantics/4251479AAE967556879D64E879B825DF,https://www.cambridge.org/core/services/aop-cambridge-core/content/view/4251479AAE967556879D64E879B825DF/S0269888913000064a.pdf/on-the-integration-of-trust-with-negotiation-argumentation-and-semantics.pdf,,,1,15,No DOI available
Cloud enterprise architecture,P Raj - 2012 - taylorfrancis.com,2012,https://www.taylorfrancis.com/books/9781466502338,http://www.ittoday.info/Articles/Cloud_Enterprise_Architecture.pdf,,,1,19,No DOI available
Network-Centric Service-Oriented Enterprises,"WY Chang - Network-Centric Service-Oriented Enterprise, 2007 - Springer",2007,https://link.springer.com/chapter/10.1007/978-1-4020-6456-2_10,No PDF available,,,1,4,No DOI available
Emerging Directions in Embedded and Ubiquitous Computing,"XZOS LuYan, ESJZS YiMu, DCLD Kim, YSJCZ Xu - Springer",No year available,https://link.springer.com/content/pdf/10.1007/11807964.pdf,No PDF available,,,1,No cite count available,No DOI available
"Emerging Directions in Embedded and Ubiquitous Computing: EUC 2006 Workshops: NCUS, SecUbiq, USN, TRUST, ESO, and MSA, Seoul, Korea, August 1 …","X Zhou, O Sokolsky, L Yan, ES Jung, Z Shao, Y Mu… - 2006 - books.google.com",2006,https://books.google.de/books?hl=de&lr=&id=-zdsCQAAQBAJ&oi=fnd&pg=PA1&dq=situation-aware+AND+choreography+AND+sensitiv&ots=iQ1u3__hYu&sig=iPe2jhO_95lReGS2lxLUav7kT1c,No PDF available,,,1,No cite count available,No DOI available
"Some open questions for the integration of trust with negotiation, argumentation and semantics","P Bonatti, E Oliveira, J Sabater-Mir, C Sierra, F Toni - 2010 - agreement-technologies.eu",2010,http://www.agreement-technologies.eu/wp-content/plugins/fresh-page/files_flutter/1285596012Someopenquestionsfortheintegration-Bonattietal.pdf,http://www.agreement-technologies.eu/wp-content/plugins/fresh-page/files_flutter/1285596012Someopenquestionsfortheintegration-Bonattietal.pdf,,,1,No cite count available,No DOI available
Towards the agility of collaborative workflows through an event driven approach–Application to crisis management,"AM Barthe-Delanoë, A Montarnal, S Truptil… - International journal of …, 2018 - Elsevier",2018,https://www.sciencedirect.com/science/article/pii/S2212420918302309,https://hal-mines-albi.archives-ouvertes.fr/hal-01724575/document,,,1,3,No DOI available
Lightweight Service Mashup Middleware With REST Style Architecture for IoT Applications,"B Cheng, S Zhao, J Qian, Z Zhai… - IEEE Transactions on …, 2018 - ieeexplore.ieee.org",2018,https://ieeexplore.ieee.org/abstract/document/8340176/,https://ieeexplore.ieee.org/iel7/4275028/5699970/08340176.pdf,,,1,2,No DOI available
Guide to secure web services,"A Singhal, T Winograd, K Scarfone - NIST Special Publication, 2007 - govinfo.gov",2007,https://www.govinfo.gov/content/pkg/GOVPUB-C13-3026b188380c98f88e763eb79b1c2af1/pdf/GOVPUB-C13-3026b188380c98f88e763eb79b1c2af1.pdf,https://www.govinfo.gov/content/pkg/GOVPUB-C13-3026b188380c98f88e763eb79b1c2af1/pdf/GOVPUB-C13-3026b188380c98f88e763eb79b1c2af1.pdf,,,1,83,No DOI available
Adaptive touch panel synchronization,"MO Johansson, M Midholt, OTN Moliner… - US Patent …, 2016 - Google Patents",2016,https://patents.google.com/patent/US9354744B2/en,No PDF available,,,1,9,No DOI available
Interface cultures: artistic aspects of interaction,"C Sommerer, L Mignonneau, D King - 2015 - books.google.com",2015,https://books.google.de/books?hl=de&lr=&id=edFKCgAAQBAJ&oi=fnd&pg=PP1&dq=situation-aware+AND+choreography+AND+sensitiv&ots=broceThFmV&sig=AupxH56sU2K_cRNmDs0kMnhMAlU,No PDF available,,,1,18,No DOI available
Method and system for role based situation aware software,"JE Boyer, EE Kelley, E Lane - US Patent 8,805,774, 2014 - Google Patents",2014,https://patents.google.com/patent/US8805774B2/en,No PDF available,,,1,23,No DOI available
Method and system for context aware collaborative tagging,"JE Boyer, EE Kelley, E Lane - US Patent App. 12/046,914, 2009 - Google Patents",2009,https://patents.google.com/patent/US20090235167A1/en,No PDF available,,,1,113,No DOI available
Enriching the 'integration as a service paradigm'for the cloud era,"P Raj - Cloud computing–principles and paradigms. Wiley …, 2011 - Wiley Online Library",2011,https://onlinelibrary.wiley.com/doi/pdf/10.1002/9780470940105#page=76,No PDF available,,,1,12,No DOI available
NESSI Strategic Research Agenda,C DRAFT - nessi-europe.org,No year available,http://www.nessi-europe.org/files/ResearchPapers/NESSI_SRA_VOL_2.pdf,http://www.nessi-europe.org/files/ResearchPapers/NESSI_SRA_VOL_2.pdf,,,1,No cite count available,No DOI available
"Specification, development, and verification of CASCADAS autonomic computing and networking toolkit","A Manzalini, N Brgulja, R Minerva… - Formal and practical …, 2012 - igi-global.com",2012,https://www.igi-global.com/chapter/formal-practical-aspects-autonomic-computing/60444,No PDF available,,,1,4,No DOI available
"Advanced system and method for dynamically discovering, provisioning and accessing host services on wireless data communication devices","HA Little, CA Dunk, H Hind, GP Mousseau… - US Patent …, 2014 - Google Patents",2014,https://patents.google.com/patent/US8700096B2/en,No PDF available,,,1,6,No DOI available
Detection of false data injection attacks in smart grid cyber-physical systems,B Li - 2019 - dr.ntu.edu.sg,2019,https://dr.ntu.edu.sg/handle/10220/47640,https://dr.ntu.edu.sg/bitstream/handle/10220/47640/PhD-Thesis-LiBeibei-Final-New-Format-Softcopy.pdf?sequence=2,,,1,No cite count available,No DOI available
Visualization and animation for situation awareness in the battlefield,YJ Kim - 2000 - cs.purdue.edu,2000,http://www.cs.purdue.edu/homes/cmh/distribution/Theses/KimThesis.pdf,http://www.cs.purdue.edu/homes/cmh/distribution/Theses/KimThesis.pdf,,,1,2,No DOI available
Sources of embodied creativity: Interactivity and ideation in contact improvisation,"M Kimmel, D Hristova, K Kussmaul - Behavioral Sciences, 2018 - mdpi.com",2018,https://www.mdpi.com/2076-328X/8/6/52,https://www.mdpi.com/2076-328X/8/6/52/pdf,,,1,6,No DOI available
Modeling context-aware systems using TOSCA,M Martín Sanchez - 2017 - elib.uni-stuttgart.de,2017,http://elib.uni-stuttgart.de/handle/11682/9303,http://elib.uni-stuttgart.de/bitstream/11682/9303/1/master_thesis_final.pdf,,,1,No cite count available,No DOI available
A reference architecture for healthcare supportive home systems from a systems-of-systems perspective,LMG Rodriguez - 2018 - tel.archives-ouvertes.fr,2018,https://tel.archives-ouvertes.fr/tel-02089352/,https://tel.archives-ouvertes.fr/tel-02089352/document,,,1,No cite count available,No DOI available
the German Research Training Groups in Computer Science,"A Babari, C Carapelle - lat.inf.tu-dresden.de",No year available,https://lat.inf.tu-dresden.de/quantla/images/documents/RTGs_joint_workshop_proceedings_2015.pdf,https://lat.inf.tu-dresden.de/quantla/images/documents/RTGs_joint_workshop_proceedings_2015.pdf,,,1,No cite count available,No DOI available
""" He Says You're Going To Play the Giant"": Ethnographic Perspectives on a Cambodian Arts Class in Philadelphia. Philadelphia Folklore Project Working Papers# 8.",W Westerman - 1994 - ERIC,1994,https://eric.ed.gov/?id=ED402237,https://files.eric.ed.gov/fulltext/ED402237.pdf,,,1,1,No DOI available
Context-aware and secure workflow systems,H Alotaibi - 2012 - dora.dmu.ac.uk,2012,https://dora.dmu.ac.uk/handle/2086/8052,https://dora.dmu.ac.uk/bitstream/handle/2086/8052/e-thesis%20submission%20%5B%20Hind%20Mobtel%20Alotaibi%20%5D.pdf?sequence=1,,,1,2,No DOI available
Twelve practical and useful questions about driving simulation,"JK Caird, WJ Horrey - Handbook of driving simulation for …, 2011 - books.google.com",2011,https://books.google.de/books?hl=de&lr=&id=lnTA8sT8gkEC&oi=fnd&pg=SA5-PA1&dq=situation-aware+AND+choreography+AND+sensitiv&ots=GVruVW9FwU&sig=oncKMjcEfP7_mxb_CP66Uw3Dv34,No PDF available,,,1,61,No DOI available
"Frank Sinatra, my father",N Sinatra - 1986 - books.google.com,1986,https://books.google.de/books?hl=de&lr=&id=9EiE2i6i-PUC&oi=fnd&pg=PR8&dq=situation-aware+AND+choreography+AND+sensitiv&ots=CAza534nDN&sig=HDYhBsF2ab1KCHlsYuNjsMTv2FI,No PDF available,,,1,27,No DOI available
Surprised by Laughter: The Comic World of CS Lewis,T Lindvall - 2012 - books.google.com,2012,https://books.google.de/books?hl=de&lr=&id=lIfy6yfULIYC&oi=fnd&pg=PT1&dq=situation-aware+AND+choreography+AND+sensitiv&ots=XDEkigVUqw&sig=CsuaIRA7UPr06bYUc3KnajuQHkk,No PDF available,,,1,14,No DOI available
Situation Recognition from Multi-Resolution Event Streams,S Pongpaichet - 2016 - escholarship.org,2016,https://escholarship.org/uc/item/9x37b5gd,https://cloudfront.escholarship.org/dist/prd/content/qt9x37b5gd/qt9x37b5gd.pdf,,,1,No cite count available,No DOI available
Stories of modern technology failures and cognitive engineering successes,"F Durso, NJ Cooke - 2007 - content.taylorfrancis.com",2007,https://content.taylorfrancis.com/books/download?dac=C2007-0-03994-6&isbn=9781410618481&format=googlePreviewPdf,No PDF available,,,1,51,No DOI available
Coordination infrastructure in collaborative systems,"WK Edwards - Unpublished doctoral dissertation. Georgia Institute of …, 1995 - Citeseer",1995,http://citeseerx.ist.psu.edu/viewdoc/download?doi=10.1.1.7.4473&rep=rep1&type=pdf,http://citeseerx.ist.psu.edu/viewdoc/download?doi=10.1.1.7.4473&rep=rep1&type=pdf,,,1,46,No DOI available
Personalised wearable cardiac sensor services for pervasive self-care,A Krupaviciute - 2011 - tel.archives-ouvertes.fr,2011,https://tel.archives-ouvertes.fr/tel-00708340/,https://tel.archives-ouvertes.fr/tel-00708340/file/these.pdf,,,1,1,No DOI available
Architecture de référence pour les systèmes d'e-santé à domicile dans la perspective de systèmes-de-systèmes,"G Rodriguez, L Maria - 2018 - theses.fr",2018,https://www.theses.fr/2018LORIS493,https://www.theses.fr/2018LORIS493.pdf,,,1,No cite count available,No DOI available
Holographic video capture and telepresence system,"GD Smits - US Patent App. 15/804,909, 2018 - Google Patents",2018,https://patents.google.com/patent/US20180063484A1/en,No PDF available,,,1,No cite count available,No DOI available
Holographic video capture and telepresence system,"GD Smits - US Patent App. 16/140,485, 2019 - Google Patents",2019,https://patents.google.com/patent/US20190028674A1/en,No PDF available,,,1,No cite count available,No DOI available
On social and technical aspects of managing mobile Ad-hoc communities,B Klein - 2011 - othes.univie.ac.at,2011,http://othes.univie.ac.at/17816/,http://othes.univie.ac.at/17816/1/2011-10-13_0308798.pdf,,,1,No cite count available,No DOI available
PhD Thesis Proposal: Human-Machine Collaborative Optimization via Apprenticeship Scheduling,MC Gombolay - 2015 - dspace.mit.edu,2015,https://dspace.mit.edu/handle/1721.1/97689,https://dspace.mit.edu/bitstream/handle/1721.1/97689/MIT-CSAIL-TR-2015-025.pdfsequence=1,,,1,No cite count available,No DOI available
Future cloud systems design: challenges and research directions,"A Taherkordi, F Zahid, Y Verginadis, G Horn - IEEE Access, 2018 - ieeexplore.ieee.org",2018,https://ieeexplore.ieee.org/abstract/document/8543679/,https://ieeexplore.ieee.org/iel7/6287639/6514899/08543679.pdf,,,1,3,No DOI available
