title,author,date,link,pdf_link,query,search_engine,nr_found,cite_count,doi
A comprehensive approach for situation-awareness based on sensing and reasoning about context,"T Springer, P Wustmann, I Braun, W Dargie… - International Conference …, 2008 - Springer",2008,https://link.springer.com/chapter/10.1007/978-3-540-69293-5_13,https://www.researchgate.net/profile/Iris_Braun/publication/221601200_A_Comprehensive_Approach_for_Situation-Awareness_Based_on_Sensing_and_Reasoning_about_Context/links/0fcfd5096c91322c03000000.pdf,,,1,20,No DOI available
Enhancing situation-aware systems through imprecise reasoning,"C Anagnostopoulos… - IEEE Transactions on …, 2008 - ieeexplore.ieee.org",2008,https://ieeexplore.ieee.org/abstract/document/4459331/,https://ieeexplore.ieee.org/iel5/7755/4358975/04459331.pdf,,,1,46,No DOI available
Enriching a situation awareness framework for IoT with knowledge base and reasoning components,"N Kolbe, A Zaslavsky, S Kubler, J Robert… - … Conference on Modeling …, 2017 - Springer",2017,https://link.springer.com/chapter/10.1007/978-3-319-57837-8_4,https://orbilu.uni.lu/bitstream/10993/31792/1/Kolbe_SituationAwarenessFramework_Context-17.pdf,,,1,3,No DOI available
Toward a general software infrastructure for ubiquitous computing,"CA Costa, AC Yamin, CFR Geyer - … systems. Los Alamitos. Vol. 7, n. 1 …, 2008 - lume.ufrgs.br",2008,https://www.lume.ufrgs.br/bitstream/handle/10183/27606/000624999.pdf?sequence=1,https://www.lume.ufrgs.br/bitstream/handle/10183/27606/000624999.pdf?sequence=1,,,1,187,No DOI available
QoS and situation aware ontology framework for dynamic web services composition,"M Wu, C Jin, C Yu, H Yan, J Ying - 2008 12th International …, 2008 - ieeexplore.ieee.org",2008,https://ieeexplore.ieee.org/abstract/document/4537027/,https://ieeexplore.ieee.org/iel5/4530852/4536938/04537027.pdf,,,1,8,No DOI available
A component-based distributed control system for assembly automation,"SM Lee, R Harrison, AA West - 2nd IEEE International …, 2004 - ieeexplore.ieee.org",2004,https://ieeexplore.ieee.org/abstract/document/1417298/,https://ieeexplore.ieee.org/iel5/9715/30671/01417298.pdf,,,1,34,No DOI available
Situation-aware adaptation to optimise energy consumption in intelligent buildings using coloured petri nets,"PJI Kaneshiro, PD Haghighi… - 2014 9th IEEE Conference …, 2014 - ieeexplore.ieee.org",2014,https://ieeexplore.ieee.org/abstract/document/6931164/,https://ieeexplore.ieee.org/iel7/6917161/6931119/06931164.pdf,,,1,4,No DOI available
On distributed run-time software evolution driven by stakeholders of smart home development,"CK Chang, K Oyama, H Jaygarl… - … Symposium on Universal …, 2008 - ieeexplore.ieee.org",2008,https://ieeexplore.ieee.org/abstract/document/4724442/,https://ieeexplore.ieee.org/iel5/4724419/4724420/04724442.pdf,,,1,8,No DOI available
Conceptual situation spaces for semantic situation-driven processes,"S Dietze, A Gugliotta, J Domingue - European Semantic Web Conference, 2008 - Springer",2008,https://link.springer.com/chapter/10.1007/978-3-540-68234-9_44,https://link.springer.com/content/pdf/10.1007/978-3-540-68234-9_44.pdf,,,1,24,No DOI available
Context-aware business application service co-ordination in mobile computing environments,"H Helin, M Klusch, A Lopes, A Fernández… - AAMAS05 workshop on …, 2005 - Citeseer",2005,http://citeseerx.ist.psu.edu/viewdoc/download?doi=10.1.1.385.9581&rep=rep1&type=pdf,http://citeseerx.ist.psu.edu/viewdoc/download?doi=10.1.1.385.9581&rep=rep1&type=pdf,,,1,18,No DOI available
Automated agent synthesis for situation awareness in service-based systems,"SS Yau, H Gong, D Huang, W Gao… - … Computer Software and …, 2006 - ieeexplore.ieee.org",2006,https://ieeexplore.ieee.org/abstract/document/4020113/,https://ieeexplore.ieee.org/iel5/4020030/4020031/04020113.pdf,,,1,13,No DOI available
Situation-aware composition of low-level traffic handling functions,"M Smirnov, T Zseby, R Roth - Conference on Modell. ing …, 2006 - researchgate.net",2006,https://www.researchgate.net/profile/Rudolf_Roth2/publication/228977905_Situation-aware_Composition_of_Low-level_Traffic_Handling_Functions/links/544f649f0cf2bca5ce90ef70.pdf,https://www.researchgate.net/profile/Rudolf_Roth2/publication/228977905_Situation-aware_Composition_of_Low-level_Traffic_Handling_Functions/links/544f649f0cf2bca5ce90ef70.pdf,,,1,4,No DOI available
Cognitive techniques: three types of network awareness,"JM Smith - Cognitive Radio Technology, 2009 - books.google.com",2009,https://books.google.de/books?hl=de&lr=&id=81q5AMSAMzgC&oi=fnd&pg=PA289&dq=situation-aware+AND+distributed+composition+AND+adapt*&ots=vjOmJQT0gT&sig=4XuOMxBz30vqcfmElMDHmCtlJmM,No PDF available,,,1,12,No DOI available
Situation modeling and smart context retrieval with semantic web technology and conflict resolution,"D Heckmann - International Workshop on Modeling and Retrieval of …, 2005 - Springer",2005,https://link.springer.com/chapter/10.1007/11740674_3,http://w5.cs.uni-saarland.de/publication/file/180/Heckmann06.LNCS3496.pdf,,,1,31,No DOI available
Autonomic communication services: a new challenge for software agents,"R Quitadamo, F Zambonelli - Autonomous Agents and Multi-Agent …, 2008 - Springer",2008,https://link.springer.com/article/10.1007/s10458-008-9054-9,https://link.springer.com/content/pdf/10.1007/s10458-008-9054-9.pdf,,,1,37,No DOI available
Self-aware computing systems: related concepts and research areas,"J Cámara, KL Bellman, JO Kephart, M Autili… - Self-Aware Computing …, 2017 - Springer",2017,https://link.springer.com/chapter/10.1007/978-3-319-47474-8_2,No PDF available,,,1,7,No DOI available
Integration of smart components for building your personal mobile guide,"R Malaka, R Porzel, A Zipf… - Proceedings of AIMS …, 2000 - geog.uni-heidelberg.de",2000,https://www.geog.uni-heidelberg.de/md/chemgeo/geog/gis/integration_of_smart_components.pdf,https://www.geog.uni-heidelberg.de/md/chemgeo/geog/gis/integration_of_smart_components.pdf,,,1,17,No DOI available
Situation-aware adaptive recommendation to assist mobile users in a campus environment,"A Bouzeghoub, KN Do, LK Wives - … International Conference on …, 2009 - ieeexplore.ieee.org",2009,https://ieeexplore.ieee.org/abstract/document/5076240/,https://ieeexplore.ieee.org/iel5/5076161/5076162/05076240.pdf,,,1,35,No DOI available
Contextual adaptation of learning resources,"A Bouzeghoub, K Do, C Lecocq - IADIS International Conference …, 2007 - researchgate.net",2007,https://www.researchgate.net/profile/Claire_Lecocq/publication/266883620_CONTEXTUAL_ADAPTATION_OF_LEARNING_RESOURCES/links/544649040cf22b3c14de191a.pdf,https://www.researchgate.net/profile/Claire_Lecocq/publication/266883620_CONTEXTUAL_ADAPTATION_OF_LEARNING_RESOURCES/links/544649040cf22b3c14de191a.pdf,,,1,12,No DOI available
Enabling decision-making for situation-aware adaptations of interactive systems,"C Märtin, C Herdin - Proceedings of 10th Forum Media Technology …, 2017 - ceur-ws.org",2017,http://ceur-ws.org/Vol-2009/fmt-proceedings-2017-paper6.pdf,http://ceur-ws.org/Vol-2009/fmt-proceedings-2017-paper6.pdf,,,1,2,No DOI available
Towards self-organizing knowledge networks for smart world infrastructures,"M Baumgarten, N Bicocchi, KJ Curran… - … on Systems Science …, 2006 - uir.ulster.ac.uk",2006,http://uir.ulster.ac.uk/11618/,http://uir.ulster.ac.uk/11618/1/Towards_Self-Organizing_Knowledge_Networks_for_Smart_World_Infrastructures.pdf,,,1,22,No DOI available
A context provisioning framework to support pervasive and ubiquitous applications,"M Knappmeyer, N Baker, S Liaquat… - European Conference on …, 2009 - Springer",2009,https://link.springer.com/chapter/10.1007/978-3-642-04471-7_8,http://www.academia.edu/download/39640446/A_Context_Provisioning_Framework_to_Supp20151103-4654-7w7yv4.pdf,,,1,41,No DOI available
