title,author,date,link,pdf_link,query,search_engine,nr_found,cite_count,doi
Next-generation applications in healthcare digital libraries using semantic service composition and coordination,"T Möller, H Schuldt, A Gerber… - Health informatics …, 2006 - journals.sagepub.com",2006,https://journals.sagepub.com/doi/abs/10.1177/1460458206063802,https://journals.sagepub.com/doi/pdf/10.1177/1460458206063802,,,1,6,No DOI available
A roadmap towards sustainable self-aware service systems,"S Dustdar, C Dorn, F Li, L Baresi, G Cabri… - Proceedings of the …, 2010 - dl.acm.org",2010,https://dl.acm.org/citation.cfm?id=1808986,https://dsg.tuwien.ac.at/staff/fei/papers/SEAMS-Chiristoph.pdf,,,1,31,No DOI available
Context-aware middleware solutions for anytime and anywhere emergency assistance to elderly people,"D Bottazzi, A Corradi… - IEEE Communications …, 2006 - ieeexplore.ieee.org",2006,https://ieeexplore.ieee.org/abstract/document/1632653/,https://ieeexplore.ieee.org/iel5/35/34236/01632653.pdf,,,1,104,No DOI available
Context-based dynamics of trust,"WX Sun, FM Liu, XY Liu - 2010 2nd International Conference …, 2010 - ieeexplore.ieee.org",2010,https://ieeexplore.ieee.org/abstract/document/5497630/,https://ieeexplore.ieee.org/iel5/5487607/5497281/05497630.pdf,,,1,No cite count available,No DOI available
"Organic vs. conventional agriculture: knowledge, power and innovation in the food chain","K Morgan, J Murdoch - Geoforum, 2000 - Elsevier",2000,https://www.sciencedirect.com/science/article/pii/S0016718599000299,https://www.researchgate.net/profile/Md_Zahangir_Hossain3/post/Can_any_one_share_some_literature_comparing_organic_agriculture_with_conventional_agriculture/attachment/59d6554279197b80779ac81f/AS%3A525049639981056%401502192997090/download/morgan2000.pdf,,,1,479,No DOI available
Event-driven scientific workflow execution,"Z Zhao, A Paschke - International Conference on Business Process …, 2012 - Springer",2012,https://link.springer.com/chapter/10.1007/978-3-642-36285-9_42,No PDF available,,,1,8,No DOI available
"COASTmed: software architectures for delivering customizable, policy-based differential web services","A Baquero - Companion Proceedings of the 36th International …, 2014 - dl.acm.org",2014,https://dl.acm.org/citation.cfm?id=2591083,No PDF available,,,1,No cite count available,No DOI available
Drawing lessons for policy-making,"RB Saltman, K Vrangbæk - Decentralization in health care …, 2007 - books.google.com",2007,https://books.google.de/books?hl=de&lr=&id=21DiozeH9wYC&oi=fnd&pg=PA77&dq=context-dependent+AND+decentralized+composition&ots=SXak8RtN2q&sig=vZdMBnl3nQ4cnnVB7cVXB_hf4Y8,http://dess.fmp.ueh.edu.ht/pdf/colloque2012_Saltman_Bankauskaite_Vrangback_decentralisation_in_healthcare.pdf#page=102,,,1,12,No DOI available
Smart Semantic Middleware for the Internet of Things.,"A Katasonov, O Kaykova, O Khriyenko… - Icinco …, 2008 - pdfs.semanticscholar.org",2008,https://pdfs.semanticscholar.org/4665/130fd1236d7cf5636b188ca7adcc4fd8d631.pdf,https://pdfs.semanticscholar.org/4665/130fd1236d7cf5636b188ca7adcc4fd8d631.pdf,,,1,212,No DOI available
"Decentralization, devolution and development: Reflections on the water reform process in Zimbabwe","B Derman, A Ferguson, F Gonese - BASIS CRSP Workshop on Water …, 2000 - crsps.net",2000,http://crsps.net/wp-content/downloads/BASIS/Inventoried%2010.19/13-2000-7-594.pdf,http://crsps.net/wp-content/downloads/BASIS/Inventoried%2010.19/13-2000-7-594.pdf,,,1,25,No DOI available
PINCET-Process integration of collaborative enterprises,"R Eshuis, H Ludwig - 15th IEEE International Workshops on …, 2006 - ieeexplore.ieee.org",2006,https://ieeexplore.ieee.org/abstract/document/4092214/,https://ieeexplore.ieee.org/iel5/4092163/4092164/04092214.pdf,,,1,1,No DOI available
Aspect-oriented context modeling for embedded systems,"T Kishi, N Noda - Early Aspects: Aspect-Oriented Requirements …, 2004 - trese.cs.utwente.nl",2004,http://trese.cs.utwente.nl/workshops/early-aspects-2004/Papers/WorkshopReport-EarlyAspects2004.pdf#page=68,http://trese.cs.utwente.nl/workshops/early-aspects-2004/Papers/WorkshopReport-EarlyAspects2004.pdf#page=68,,,1,21,No DOI available
DBGlobe: a service-oriented P2P system for global computing,"E Pitoura, S Abiteboul, D Pfoser, G Samaras… - ACM Sigmod …, 2003 - dl.acm.org",2003,https://dl.acm.org/citation.cfm?id=945737,http://cs.uoi.gr/~pitoura/distribution/sr03.pdf,,,1,78,No DOI available
Context-sensitive trust computing in distributed environments,"Y Ding, F Liu, B Tang - Knowledge-Based Systems, 2012 - Elsevier",2012,https://www.sciencedirect.com/science/article/pii/S0950705111002723,http://or.nsfc.gov.cn/bitstream/00001903-5/112633/1/1000003873447.pdf,,,1,17,No DOI available
The Aurora architecture for developing network-centric applications by dynamic composition of services,"M Marazakis, D Papadakis, C Nikolaou - 1997 - Citeseer",1997,http://citeseerx.ist.psu.edu/viewdoc/download?doi=10.1.1.40.6680&rep=rep1&type=pdf,http://citeseerx.ist.psu.edu/viewdoc/download?doi=10.1.1.40.6680&rep=rep1&type=pdf,,,1,35,No DOI available
Updating a Context-Aware Service Directory for M-services,"C Doulkeridis, M Vazirgiannis - Context, 2004 - researchgate.net",2004,https://www.researchgate.net/profile/Michalis_Vazirgiannis/publication/238446023_Updating_a_Context-Aware_Service_Directory_for_M-Services/links/56b89ce108ae44bb330d3554.pdf,https://www.researchgate.net/profile/Michalis_Vazirgiannis/publication/238446023_Updating_a_Context-Aware_Service_Directory_for_M-Services/links/56b89ce108ae44bb330d3554.pdf,,,1,4,No DOI available
On the challenges of self-adaptation in systems of systems,"D Weyns, J Andersson - Proceedings of the First International Workshop …, 2013 - dl.acm.org",2013,https://dl.acm.org/citation.cfm?id=2489860,https://www.researchgate.net/profile/Danny_Weyns/publication/262331526_On_the_challenges_of_self-Adaptation_in_systems_of_systems/links/5451fbd30cf285a067c6aff2/On-the-challenges-of-self-Adaptation-in-systems-of-systems.pdf,,,1,16,No DOI available
A qualitative model for the simulation of traffic behaviours in a multi-lane environment,"C Claramunt, B Jiang - Journal of Geographical Sciences, 2001 - Springer",2001,https://link.springer.com/article/10.1007/BF02837442,https://link.springer.com/content/pdf/10.1007/BF02837442.pdf,,,1,14,No DOI available
Dependence relations among autonomous agents,"C Castelfranchi, M Miceli, A Cesta - decentralized AI, 1992 - academia.edu",1992,http://www.academia.edu/download/32832475/MAAMAW-91-Book-Final.pdf,http://www.academia.edu/download/32832475/MAAMAW-91-Book-Final.pdf,,,1,261,No DOI available
Modeling enterprise capabilities with i*: reasoning on alternatives,"MH Danesh, E Yu - International Conference on Advanced Information …, 2014 - Springer",2014,https://link.springer.com/chapter/10.1007/978-3-319-07869-4_10,No PDF available,,,1,29,No DOI available
Programmable coordination infrastructures for mobility,"F Zambonelli, G Cabri, L Leonardi - … and Mobility–a Workshop co-located …, 2001 - Citeseer",2001,http://citeseerx.ist.psu.edu/viewdoc/download?doi=10.1.1.23.4755&rep=rep1&type=pdf,http://citeseerx.ist.psu.edu/viewdoc/download?doi=10.1.1.23.4755&rep=rep1&type=pdf,,,1,2,No DOI available
"Small cities, neoliberal governance and sustainable development in the global south: A conceptual framework and research agenda","R Véron - Sustainability, 2010 - mdpi.com",2010,https://www.mdpi.com/2071-1050/2/9/2833,https://www.mdpi.com/2071-1050/2/9/2833/pdf,,,1,36,No DOI available
