title,author,date,link,pdf_link,query,search_engine,nr_found,cite_count,doi
Scalable service deployment on software-defined networks,"J Rubio-Loyola, A Galis, A Astorga… - IEEE …, 2011 - ieeexplore.ieee.org",2011,https://ieeexplore.ieee.org/abstract/document/6094010/,https://ieeexplore.ieee.org/iel5/35/6093994/06094010.pdf,,,1,68,No DOI available
Exploring service-oriented system engineering challenges: a systematic literature review,"Q Gu, P Lago - Service Oriented Computing and Applications, 2009 - Springer",2009,https://link.springer.com/article/10.1007/s11761-009-0046-7,https://link.springer.com/content/pdf/10.1007/s11761-009-0046-7.pdf,,,1,80,No DOI available
Towards self-configuration and management of e-service provisioning in dynamic value constellations,"J Gordijn, H Weigand, M Reichert… - Proceedings of the 2008 …, 2008 - dl.acm.org",2008,https://dl.acm.org/citation.cfm?id=1363823,http://dbis.eprints.uni-ulm.de/186/1/sac2008GordijnWeigandReichertWieringaFinal.pdf,,,1,10,No DOI available
A semantic web framework for interleaving policy reasoning and external service discovery,"J Rao, N Sadeh - International Workshop on Rules and Rule Markup …, 2005 - Springer",2005,https://link.springer.com/chapter/10.1007/11580072_6,http://www.escm.cs.cmu.edu/files/ruleml2005.pdf,,,1,5,No DOI available
Web service computing: Overview and directions,"B Benatallah, O Perrin, FA Rabhi, C Godart - Handbook of nature-inspired …, 2006 - Springer",2006,https://link.springer.com/content/pdf/10.1007/0-387-27705-6_17.pdf,No PDF available,,,1,6,No DOI available
"A Knowledge-oriented, Context-sensitive Architectural Framework for Service Deployment in Marginalized Rural Communities",MP Thinyane - 2009 - core.ac.uk,2009,https://core.ac.uk/download/pdf/145055496.pdf,https://core.ac.uk/download/pdf/145055496.pdf,,,1,3,No DOI available
Computational service economies: design and applications,"NR Jennings, A Rogers - Intelligent Distributed Computing III, 2009 - Springer",2009,https://link.springer.com/chapter/10.1007/978-3-642-03214-1_1,https://core.ac.uk/download/pdf/22879243.pdf,,,1,1,No DOI available
Solar: Building a context fusion network for pervasive computing,G Chen - 2004 - ists.dartmouth.edu,2004,http://www.ists.dartmouth.edu/library/279.pdf,http://www.ists.dartmouth.edu/library/279.pdf,,,1,53,No DOI available
Utilizing role-based models for on-demand composition of smart service systems,"M Wutzler, T Springer, A Schill - … to the first International Conference on …, 2017 - dl.acm.org",2017,https://dl.acm.org/citation.cfm?id=3079390,No PDF available,,,1,2,No DOI available
Context-awareness,"B Gonçalves, P Costa, LM Botelho - … : Intelligent Service Coordination in the …, 2008 - Springer",2008,https://link.springer.com/chapter/10.1007/978-3-7643-8575-0_5,https://pdfs.semanticscholar.org/39ea/6a1a008008d78020b92a4ae13582c01cd01a.pdf,,,1,4,No DOI available
Run-time and atomic weaving of distributed aspects,"E Truyen, W Joosen - … on Aspect-Oriented Software Development II, 2006 - Springer",2006,https://link.springer.com/chapter/10.1007/11922827_6,https://pdfs.semanticscholar.org/e6ac/8d74401787adf0508353590196a9803bae46.pdf,,,1,15,No DOI available
Supporting context awareness in ubiquitous service environments,"M Jonsson - Licentiate Thesis, 2003 - Citeseer",2003,http://citeseerx.ist.psu.edu/viewdoc/download?doi=10.1.1.526.6975&rep=rep1&type=pdf,http://citeseerx.ist.psu.edu/viewdoc/download?doi=10.1.1.526.6975&rep=rep1&type=pdf,,,1,5,No DOI available
Self-integrating organic control systems: from crayfish to smart homes,"A Diaconescu, P Mata, K Bellman - ARCS Workshop 2018 …, 2018 - ieeexplore.ieee.org",2018,https://ieeexplore.ieee.org/abstract/document/8385429/,https://ieeexplore.ieee.org/iel7/8385231/8385232/08385429.pdf,,,1,4,No DOI available
Method and Apparatus for Checking Aggregated Web Services,"J Hjelm, TG Kanter, M Lidstrom - US Patent App. 12/863,925, 2011 - Google Patents",2011,https://patents.google.com/patent/US20110023131A1/en,No PDF available,,,1,9,No DOI available
Adaptive Context Dissemination in Heterogeneous Environments,"D Balakrishnan, A Nayak - IEEE Transactions on Mobile …, 2014 - ieeexplore.ieee.org",2014,https://ieeexplore.ieee.org/abstract/document/6636312/,https://ieeexplore.ieee.org/iel7/7755/6824285/06636312.pdf,,,1,4,No DOI available
"The who, what, and why of site-based management","JL David - Educational Leadership, 1995 - sbruzzese.org",1995,http://sbruzzese.org/edem628/readings/1_site_based_management.pdf,http://sbruzzese.org/edem628/readings/1_site_based_management.pdf,,,1,191,No DOI available
INDICES: exploiting edge resources for performance-aware cloud-hosted services,"S Shekhar, AD Chhokra… - 2017 IEEE 1st …, 2017 - ieeexplore.ieee.org",2017,https://ieeexplore.ieee.org/abstract/document/8014362/,https://ieeexplore.ieee.org/iel7/8014314/8014305/08014362.pdf,,,1,27,No DOI available
Context-sensitive authorization for asynchronous communications,"V Hourdin, JY Tigli, S Lavirotte, G Rey… - … Conference for Internet …, 2009 - ieeexplore.ieee.org",2009,https://ieeexplore.ieee.org/abstract/document/5402550/,https://hal.archives-ouvertes.fr/docs/00/47/68/82/PDF/hourdin-tigli-etal_2009.pdf,,,1,2,No DOI available
Trust-Based Service Management for Service-Oriented Mobile Ad Hoc Networks and Its Application to Service Composition and Task Assignment with Multi-Objective …,Y Wang - 2016 - vtechworks.lib.vt.edu,2016,https://vtechworks.lib.vt.edu/handle/10919/70965,https://vtechworks.lib.vt.edu/bitstream/handle/10919/70965/Wang_Y_D_2016.pdf?sequence=1&isAllowed=y,,,1,3,No DOI available
Web-based user interface for SOA systems enhanced by ontology,"M Kopel, J Sobecki - Multimedia and Internet Systems: theory and practice, 2013 - Springer",2013,https://link.springer.com/chapter/10.1007/978-3-642-32335-5_23,No PDF available,,,1,3,No DOI available
Ubiquitous computing in prospect: A bibliographic study,"TT Chen, M Lee - 2008 International Symposium on Ubiquitous …, 2008 - ieeexplore.ieee.org",2008,https://ieeexplore.ieee.org/abstract/document/4656517/,https://ieeexplore.ieee.org/iel5/4656495/4656496/04656517.pdf,,,1,11,No DOI available
Middleware services framework for on-premises and cloud deployment,"AK Nori, D Shukla, Y Christensen… - US Patent …, 2016 - Google Patents",2016,https://patents.google.com/patent/US9336060B2/en,No PDF available,,,1,141,No DOI available
Designing survivable services from independent components with basic functionality,"A Dittrich, J Kowal, M Malek - International Workshop on Dependable …, 2008 - citemaster.net",2008,http://www.citemaster.net/get/4517f5c6-39a4-11e4-814e-00163e009cc7/2008%20Designing%20Survivable%20Services%20from%20Independent%20Components%20with%20Basic%20Functionality.pdf,http://www.citemaster.net/get/4517f5c6-39a4-11e4-814e-00163e009cc7/2008%20Designing%20Survivable%20Services%20from%20Independent%20Components%20with%20Basic%20Functionality.pdf,,,1,1,No DOI available
