title,author,date,link,pdf_link,query,search_engine,nr_found,cite_count,doi
Optimism as a Way of Life: Case Studies on Three Young Girls,R Chawla - Youth and Positivism - researchgate.net,No year available,https://www.researchgate.net/profile/Dr_Vikas_Madhukar/publication/303524726_Youth_and_Positivism/links/5746d5ed08ae9ace8425c7a9/Youth-and-Positivism.pdf#page=127,https://www.researchgate.net/profile/Dr_Vikas_Madhukar/publication/303524726_Youth_and_Positivism/links/5746d5ed08ae9ace8425c7a9/Youth-and-Positivism.pdf#page=127,,,1,No cite count available,No DOI available
A reference architecture for healthcare supportive home systems from a systems-of-systems perspective,LMG Rodriguez - 2018 - tel.archives-ouvertes.fr,2018,https://tel.archives-ouvertes.fr/tel-02089352/,https://tel.archives-ouvertes.fr/tel-02089352/document,,,1,No cite count available,No DOI available
Guide to secure web services,"A Singhal, T Winograd, K Scarfone - NIST Special Publication, 2007 - govinfo.gov",2007,https://www.govinfo.gov/content/pkg/GOVPUB-C13-3026b188380c98f88e763eb79b1c2af1/pdf/GOVPUB-C13-3026b188380c98f88e763eb79b1c2af1.pdf,https://www.govinfo.gov/content/pkg/GOVPUB-C13-3026b188380c98f88e763eb79b1c2af1/pdf/GOVPUB-C13-3026b188380c98f88e763eb79b1c2af1.pdf,,,1,83,No DOI available
Sources of embodied creativity: Interactivity and ideation in contact improvisation,"M Kimmel, D Hristova, K Kussmaul - Behavioral Sciences, 2018 - mdpi.com",2018,https://www.mdpi.com/2076-328X/8/6/52,https://www.mdpi.com/2076-328X/8/6/52/pdf,,,1,6,No DOI available
Semantic Web Service matchmakers: state of the art and challenges,"H Dong, FK Hussain, E Chang - Concurrency and Computation …, 2013 - Wiley Online Library",2013,https://onlinelibrary.wiley.com/doi/abs/10.1002/cpe.2886,https://onlinelibrary.wiley.com/doi/pdf/10.1002/cpe.2886,,,1,45,No DOI available
Kompetente Organisation oder wie man das Leben von 007 rettet,"T Klatetzki - Soziologie der Kompetenz, 2010 - Springer",2010,https://link.springer.com/chapter/10.1007/978-3-531-91951-5_12,No PDF available,,,1,6,No DOI available
The extension of semantic formalization of service workflow specification language,"W Viriyasitavat, L Da Xu, Z Bi - IEEE Transactions on Industrial …, 2019 - ieeexplore.ieee.org",2019,https://ieeexplore.ieee.org/abstract/document/8294213/,https://ieeexplore.ieee.org/iel7/9424/4389054/08294213.pdf,,,1,4,No DOI available
Interface cultures: artistic aspects of interaction,"C Sommerer, L Mignonneau, D King - 2015 - books.google.com",2015,https://books.google.de/books?hl=de&lr=&id=edFKCgAAQBAJ&oi=fnd&pg=PP1&dq=situation-aware+AND+choreography&ots=broceSiymX&sig=n_AbiYefegYA4eIpFqdDsN1sZII,No PDF available,,,1,18,No DOI available
A framework for dynamically adaptable augmented reality systems,T Reicher - 2004 - mediatum.ub.tum.de,2004,https://mediatum.ub.tum.de/601755,https://mediatum.ub.tum.de/doc/601755/file.pdf,,,1,19,No DOI available
Special Aspects of Usability,"A Hang, D Buschek, A De Luca, A Hösl, S Löhmann… - Citeseer",No year available,http://citeseerx.ist.psu.edu/viewdoc/download?doi=10.1.1.709.8334&rep=rep1&type=pdf,http://citeseerx.ist.psu.edu/viewdoc/download?doi=10.1.1.709.8334&rep=rep1&type=pdf,,,1,No cite count available,No DOI available
Putney for game-audio,"R Climent, M Pilkington - Skyler and Bliss Original Citation Adkins, Monty and … - core.ac.uk",No year available,https://core.ac.uk/download/pdf/30733117.pdf#page=355,https://core.ac.uk/download/pdf/30733117.pdf#page=355,,,1,No cite count available,No DOI available
Adaptive touch panel synchronization,"MO Johansson, M Midholt, OTN Moliner… - US Patent …, 2016 - Google Patents",2016,https://patents.google.com/patent/US9354744B2/en,No PDF available,,,1,9,No DOI available
Les Applications Long-Life dédiées à l'utilisation dans les smart,R Karchoud - 2017 - theses.fr,2017,https://www.theses.fr/2017PAUU3037,https://www.theses.fr/2017PAUU3037.pdf,,,1,No cite count available,No DOI available
Detection of false data injection attacks in smart grid cyber-physical systems,B Li - 2019 - dr.ntu.edu.sg,2019,https://dr.ntu.edu.sg/handle/10220/47640,https://dr.ntu.edu.sg/bitstream/handle/10220/47640/PhD-Thesis-LiBeibei-Final-New-Format-Softcopy.pdf?sequence=2,,,1,No cite count available,No DOI available
NESSI Strategic Research Agenda,C DRAFT - nessi-europe.org,No year available,http://www.nessi-europe.org/files/ResearchPapers/NESSI_SRA_VOL_2.pdf,http://www.nessi-europe.org/files/ResearchPapers/NESSI_SRA_VOL_2.pdf,,,1,No cite count available,No DOI available
System and method for managing community assets,"SR Carrier, HS Chapman, JR Hind - US Patent App. 12/036,925, 2009 - Google Patents",2009,https://patents.google.com/patent/US20090216581A1/en,No PDF available,,,1,12,No DOI available
Integrating different profiles to form a process,"A Dogac, Y Kabak, T Namli, GBL Erturkmen - US Patent 8,321,237, 2012 - Google Patents",2012,https://patents.google.com/patent/US8321237B2/en,https://patentimages.storage.googleapis.com/43/23/18/27b6316856f35d/US8321237.pdf,,,1,7,No DOI available
Future cloud systems design: challenges and research directions,"A Taherkordi, F Zahid, Y Verginadis, G Horn - IEEE Access, 2018 - ieeexplore.ieee.org",2018,https://ieeexplore.ieee.org/abstract/document/8543679/,https://ieeexplore.ieee.org/iel7/6287639/6514899/08543679.pdf,,,1,3,No DOI available
Architecture de référence pour les systèmes d'e-santé à domicile dans la perspective de systèmes-de-systèmes,"G Rodriguez, L Maria - 2018 - theses.fr",2018,https://www.theses.fr/2018LORIS493,https://www.theses.fr/2018LORIS493.pdf,,,1,No cite count available,No DOI available
"Advanced system and method for dynamically discovering, provisioning and accessing host services on wireless data communication devices","HA Little, CA Dunk, H Hind, GP Mousseau… - US Patent …, 2014 - Google Patents",2014,https://patents.google.com/patent/US8700096B2/en,No PDF available,,,1,6,No DOI available
Model Engineering Recent Papers,B Thalheim - Citeseer,No year available,http://citeseerx.ist.psu.edu/viewdoc/download?doi=10.1.1.467.6192&rep=rep1&type=pdf,http://citeseerx.ist.psu.edu/viewdoc/download?doi=10.1.1.467.6192&rep=rep1&type=pdf,,,1,No cite count available,No DOI available
Enabling the Vehicle Economy Using a Blockchain-Based Value Transaction Layer Protocol for Vehicular Ad-Hoc Networks,"B Leiding, WV Vorobev - URL: https://uploads-ssl. webflow …, 2018 - uploads-ssl.webflow.com",2018,https://uploads-ssl.webflow.com/5a4ea18a81f55a00010bdf45/5b69e53263e2a6076124ecbe_Chorus-Mobility-WP--v1.0.1.pdf,https://uploads-ssl.webflow.com/5a4ea18a81f55a00010bdf45/5b69e53263e2a6076124ecbe_Chorus-Mobility-WP--v1.0.1.pdf,,,1,2,No DOI available
Personalised wearable cardiac sensor services for pervasive self-care,A Krupaviciute - 2011 - tel.archives-ouvertes.fr,2011,https://tel.archives-ouvertes.fr/tel-00708340/,https://tel.archives-ouvertes.fr/tel-00708340/file/these.pdf,,,1,1,No DOI available
Establishment of security federations,"B Thurm, J Hu - US Patent 8,104,069, 2012 - Google Patents",2012,https://patents.google.com/patent/US8104069B2/en,https://patentimages.storage.googleapis.com/33/3a/11/e3d31a186bfa18/US8104069.pdf,,,1,15,No DOI available
"Applications, Tools and Techniques on the Road to Exascale Computing",K De Bosschere - 2012 - books.google.com,2012,https://books.google.de/books?hl=de&lr=&id=9QmL0yNnmIgC&oi=fnd&pg=PR1&dq=situation-aware+AND+choreography&ots=pvLTO1m9rC&sig=VPi6F5GWwZhL3tvtI7CzV8w9-8g,https://biblio.ugent.be/publication/2107216/file/2154137.pdf,,,1,10,No DOI available
"System and method for providing educational related social/geo/promo link promotional data sets for end user display of interactive ad links, promotions and sale of …","S Heath - US Patent App. 13/439,761, 2013 - Google Patents",2013,https://patents.google.com/patent/US20130073387A1/en,No PDF available,,,1,180,No DOI available
