title,author,date,link,pdf_link,query,search_engine,nr_found,cite_count,doi
Tracking Visitors in a Museum,"R Brunelli, O Lanz, A Santuari, F Tobia - PEACH-Intelligent Interfaces for …, 2007 - Springer",2007,https://link.springer.com/content/pdf/10.1007/3-540-68755-6_10.pdf,https://www.researchgate.net/profile/Oswald_Lanz/publication/226908565_Tracking_Visitors_in_a_Museum/links/557a965208aeacff2003de48/Tracking-Visitors-in-a-Museum.pdf,,,1,5,No DOI available
"Spatial fit, from panacea to practice: implementing the EU Water Framework Directive","T Moss - Ecology and Society, 2012 - ecologyandsociety.org",2012,https://www.ecologyandsociety.org/vol17/iss3/art2,https://www.ecologyandsociety.org/vol17/iss3/art2,,,1,116,No DOI available
Model-driven service development for a-posteriori application integration,"T Haase - IEEE International Conference on e-Business …, 2007 - ieeexplore.ieee.org",2007,https://ieeexplore.ieee.org/abstract/document/4402162/,https://ieeexplore.ieee.org/iel5/4402048/4402049/04402162.pdf,,,1,8,No DOI available
Coordination of distributed proactive smart resources.,"O Khriyenko - Parallel and Distributed Computing and …, 2007 - pdfs.semanticscholar.org",2007,https://pdfs.semanticscholar.org/a3bc/0dc967a960288bff2b59ae1b78fca8bcc18a.pdf,https://pdfs.semanticscholar.org/a3bc/0dc967a960288bff2b59ae1b78fca8bcc18a.pdf,,,1,1,No DOI available
Toward a model of computational attention based on expressive behavior: applications to cultural heritage scenarios,"D Glowinski, M Mancas, G Volpe, PJ Maes - eNTERFACE'09, 2009 - biblio.ugent.be",2009,https://biblio.ugent.be/publication/905865,https://biblio.ugent.be/publication/905865/file/905895,,,1,3,No DOI available
Transition Strategies for Increasing Self-awareness in Existing Types of Computing Systems,"M Autili, KL Bellman, A Diaconescu, L Esterle… - Self-Aware Computing …, 2017 - Springer",2017,https://link.springer.com/chapter/10.1007/978-3-319-47474-8_10,No PDF available,,,1,2,No DOI available
supporting interoperability and Context-awareness in e-learning through situation-driven learning Processes,"S Dietze, A Gugliotta, J Domingue - International Journal of Distance …, 2009 - igi-global.com",2009,https://www.igi-global.com/article/international-journal-distance-education-technologies/3912,https://www.igi-global.com/viewtitle.aspx?titleid=3912,,,1,12,No DOI available
Self-configuration in manets: Different perspectives,"J Wang, RV Prasad, I Niemegeers - International Workshop on Self …, 2007 - Springer",2007,https://link.springer.com/chapter/10.1007/978-3-540-74917-2_18,No PDF available,,,1,7,No DOI available
Applying Program Visualization Techniques to Aid Parallel and Distributed Program Development (Work In Progress) Technical Report GIT-GVU-91-08,"WF Appelbe, JT Stasko, E Kraemer - 1993 - pdfs.semanticscholar.org",1993,https://pdfs.semanticscholar.org/35f3/430034eaafce354556f9128a4f18199866bb.pdf,https://pdfs.semanticscholar.org/35f3/430034eaafce354556f9128a4f18199866bb.pdf,,,1,1,No DOI available
"Identity, personhood, and religion in Caribbean context",AH Khan - 1997 - cielonaranja.com,1997,http://www.cielonaranja.com/khan.pdf,http://www.cielonaranja.com/khan.pdf,,,1,2,No DOI available
How to access organizational informality: Using movement improvisation to address embodied organizational knowledge,"R Wetzel, N Van Renterghem - Organizational Aesthetics, 2015 - digitalcommons.wpi.edu",2015,http://digitalcommons.wpi.edu/cgi/viewcontent.cgi?article=1094&context=oa,http://digitalcommons.wpi.edu/cgi/viewcontent.cgi?article=1094&context=oa,,,1,2,No DOI available
Molecular computing with artificial neurons,"M Conrad, KP Zauner - … of the Korea Information Science Society, 2000 - eprints.soton.ac.uk",2000,https://eprints.soton.ac.uk/259141/,https://eprints.soton.ac.uk/259141/1/ConradM00MolCompArtfNeuro.pdf,,,1,12,No DOI available
An E-Service SOA Model for Virtual Service Enterprises,"C Zirpins, W Emmerich - Working Conference on Virtual Enterprises, 2008 - Springer",2008,https://link.springer.com/chapter/10.1007/978-0-387-84837-2_50,https://link.springer.com/content/pdf/10.1007/978-0-387-84837-2_50.pdf,,,1,1,No DOI available
Organising water: The hidden role of intermediary work,"T Moss, W Medd, S Guy, S Marvin - Water Alternatives, 2009 - water-alternatives.org",2009,http://www.water-alternatives.org/index.php/allabs/35-a2-1-2/file,http://www.water-alternatives.org/index.php/allabs/35-a2-1-2/file,,,1,86,No DOI available
Empathic interaction with a virtual guide,"MY Lim, R Aylett, CM Jones - Proceeding of the Joint Symposium on …, 2005 - academia.edu",2005,http://www.academia.edu/download/30796101/10_Virt_Final.pdf#page=135,http://www.academia.edu/download/30796101/10_Virt_Final.pdf#page=135,,,1,11,No DOI available
The AmI-Solertis system: creating user experiences in smart environments,"A Leonidis, D Arampatzis… - 2017 IEEE 13th …, 2017 - ieeexplore.ieee.org",2017,https://ieeexplore.ieee.org/abstract/document/8115850/,No PDF available,,,1,8,No DOI available
Lightweight dynamic service conversation controller,"M Lemon, H Kuno, A Karp - US Patent App. 09/862,612, 2002 - Google Patents",2002,https://patents.google.com/patent/US20020188666A1/en,No PDF available,,,1,15,No DOI available
Managing complex augmented reality models,"D Schmalstieg, G Schall, D Wagner… - IEEE Computer …, 2007 - ieeexplore.ieee.org",2007,https://ieeexplore.ieee.org/abstract/document/4267946/,https://ieeexplore.ieee.org/iel5/38/4267933/04267946.pdf,,,1,51,No DOI available
UbiRoad: Semantic Middleware for Cooperative Traffic Systems and Services,"V Terziyan, O Kaykova, D Zhovtobryukh - … Systems Volume 3, Number 3 & …, 2010 - Citeseer",2010,http://citeseerx.ist.psu.edu/viewdoc/download?doi=10.1.1.641.7853&rep=rep1&type=pdf#page=132,http://citeseerx.ist.psu.edu/viewdoc/download?doi=10.1.1.641.7853&rep=rep1&type=pdf#page=132,,,1,3,No DOI available
Evaluation of qos based web-service selection techniques for service composition,"M Sathya, M Swarnamugi, P Dhavachelvan… - … Journal of Software …, 2010 - cscjournals.org",2010,http://www.cscjournals.org/download/issuearchive/IJSE/Volume1/IJSE_V1_I5.pdf#page=7,http://www.cscjournals.org/download/issuearchive/IJSE/Volume1/IJSE_V1_I5.pdf#page=7,,,1,71,No DOI available
Towards adaptive decision support systems: A service-oriented approach,"D Yu, S Zheng - Advances in Information Sciences and …, 2011 - pdfs.semanticscholar.org",2011,https://pdfs.semanticscholar.org/1646/fe4ac3a208765a2f3adcb9091d5c9f20ea79.pdf,https://pdfs.semanticscholar.org/1646/fe4ac3a208765a2f3adcb9091d5c9f20ea79.pdf,,,1,8,No DOI available
Personal contextual awareness through visual focus,"LT Cheng, J Robinson - IEEE Intelligent systems, 2001 - ieeexplore.ieee.org",2001,https://ieeexplore.ieee.org/abstract/document/940021/,https://ieeexplore.ieee.org/iel5/5254/20350/00940021.pdf,,,1,13,No DOI available
Context Slicing the Chemical Aether,"H Mills, H Fu, S Peppe, G Hughes, G Smith, TR Payne - academia.edu",No year available,http://www.academia.edu/download/38252088/htsw03-frey.pdf,http://www.academia.edu/download/38252088/htsw03-frey.pdf,,,1,No cite count available,No DOI available
Subject-Oriented Business Process Management,"W Schmidt, A Fleischmann, O Gilbert - HMD–Praxis der …, 2009 - Springer",2009,https://link.springer.com/content/pdf/10.1007/978-3-642-23135-3.pdf,https://link.springer.com/content/pdf/10.1007/978-3-642-23135-3.pdf,,,1,5,No DOI available
