title,author,date,link,pdf_link
Rayleigh fading compensation for QAM in land mobile radio communications,"S Sampei, T Sunaga - … Transactions on Vehicular Technology, 1993 - ieeexplore.ieee.org",1993,https://ieeexplore.ieee.org/abstract/document/211451/,https://ieeexplore.ieee.org/iel1/25/5514/00211451.pdf
Tcot-a timeout-based mobile transaction commitment protocol,"V Kumar, N Prabhu, MH Dunham… - IEEE Transactions on …, 2002 - ieeexplore.ieee.org",2002,https://ieeexplore.ieee.org/abstract/document/1039846/,https://ieeexplore.ieee.org/iel5/12/22294/01039846.pdf
A transaction model for mobile computing,"SK Madria, B Bhargava - Database Engineering and …, 1998 - ieeexplore.ieee.org",1998,https://ieeexplore.ieee.org/abstract/document/694363/,https://ieeexplore.ieee.org/iel4/5670/15179/00694363.pdf
XML-based representation of mobile process calculi,"LG Meredith - US Patent 6,516,322, 2003 - Google Patents",2003,https://patents.google.com/patent/US6516322B1/en,No PDF available
Mobile data and transaction management,"SK Madria, M Mohania, SS Bhowmick, B Bhargava - Information Sciences, 2002 - Elsevier",2002,https://www.sciencedirect.com/science/article/pii/S0020025502001780,http://eprint.iitd.ac.in/bitstream/2074/1040/1/madriamob2002.pdf
Conducting an online payment transaction using an NFC enabled mobile communication device,"M Fisher - US Patent 8,352,323, 2013 - Google Patents",2013,https://patents.google.com/patent/US8352323B2/en,No PDF available
Understanding dynamics between initial trust and usage intentions of mobile banking,"G Kim, BS Shin, HG Lee - Information Systems Journal, 2009 - Wiley Online Library",2009,https://onlinelibrary.wiley.com/doi/abs/10.1111/j.1365-2575.2007.00269.x,https://onlinelibrary.wiley.com/doi/pdf/10.1111/j.1365-2575.2007.00269.x
Method and system providing advertisement using tone of ringing sounds of mobile phone and commerical transaction service in association with the same,"D Kim - US Patent App. 10/220,859, 2003 - Google Patents",2003,https://patents.google.com/patent/US20030050837A1/en,No PDF available
Supporting QoS-aware transactions in a system on mobile devices (SyD),"W Xie, SB Navathe, SK Prasad - … Systems Workshops, 2003 …, 2003 - ieeexplore.ieee.org",2003,https://ieeexplore.ieee.org/abstract/document/1203602/,http://citeseerx.ist.psu.edu/viewdoc/download?doi=10.1.1.58.9168&rep=rep1&type=pdf
A transaction model to improve data availability in mobile computing,"SK Madria, B Bhargava - Distributed and Parallel Databases, 2001 - Springer",2001,https://link.springer.com/article/10.1023/A:1019232412740,https://link.springer.com/content/pdf/10.1023/A:1019232412740.pdf
Nested commits for mobile calculi: extending Join,"R Bruni, H Melgratti, U Montanari - Exploring New Frontiers of Theoretical …, 2004 - Springer",2004,https://link.springer.com/chapter/10.1007/1-4020-8141-3_43,https://link.springer.com/content/pdf/10.1007/1-4020-8141-3_43.pdf
Method of distributing information via mobile devices and enabling its use at a point of transaction,"V Bemmel, R Van Tuyl, N Nguyen - US Patent App. 11/873,133, 2008 - Google Patents",2008,https://patents.google.com/patent/US20080097851A1/en,No PDF available
Authentication for a commercial transaction using a mobile module,"BE Johnson, C Webster-Lam - US Patent 8,996,423, 2015 - Google Patents",2015,https://patents.google.com/patent/US8996423B2/en,No PDF available
Transaction management for m-commerce at a mobile terminal,"J Veijalainen, V Terziyan, H Tirri - Electronic Commerce Research and …, 2006 - Elsevier",2006,https://www.sciencedirect.com/science/article/pii/S1567422306000135,https://www.computer.org/csdl/proceedings/hicss/2003/1874/03/187430089a.pdf
System and method for facilitating electronic financial transactions using a mobile telecommunication device,"G Leung, R Lee, K Cheng, P Chui, A Mitchell… - US Patent …, 2008 - Google Patents",2008,https://patents.google.com/patent/US7379920B2/en,No PDF available
Single tap transactions using an NFC enabled mobile device,"M Fisher - US Patent 8,332,272, 2012 - Google Patents",2012,https://patents.google.com/patent/US8332272B2/en,No PDF available
Presentation of sponsored content based on mobile transaction event,"J Ramer, A Soroca, D Doughty - US Patent 7,702,318, 2010 - Google Patents",2010,https://patents.google.com/patent/US7702318B2/en,No PDF available
Mobile telephone transaction systems and methods,"DJ Pharris - US Patent App. 12/412,235, 2009 - Google Patents",2009,https://patents.google.com/patent/US20090281904A1/en,No PDF available
Modeling and compensation of the dynamic interaction of a mobile manipulator,"Y Yamamoto, X Yun - Robotics and Automation, 1994 …, 1994 - ieeexplore.ieee.org",1994,https://ieeexplore.ieee.org/abstract/document/350960/,https://pdfs.semanticscholar.org/c3f8/95ac8a58164de18e90b5a62157122f0061e7.pdf
Consumer transaction-based marketing of goods and services,"L Napier, S Graham - US Patent App. 10/607,677, 2004 - Google Patents",2004,https://patents.google.com/patent/US20040199422A1/en,No PDF available
Mobile transaction system and method,"K Adam, S Blit, A Eckstein, B Inbal - US Patent App. 10/030,763, 2002 - Google Patents",2002,https://patents.google.com/patent/US20020181710A1/en,No PDF available
Mobile phone with electronic transaction card,"SG Narendra, P Tadepalli, TN Spitzer - US Patent 7,828,214, 2010 - Google Patents",2010,https://patents.google.com/patent/US7828214B2/en,No PDF available
Sensor fusion for mobile robot dead-reckoning with a precision-calibrated fiber optic gyroscope,"H Chung, L Ojeda, J Borenstein - Robotics and Automation …, 2001 - ieeexplore.ieee.org",2001,https://ieeexplore.ieee.org/abstract/document/933174/,https://ieeexplore.ieee.org/iel5/7423/20185/00933174.pdf
Transaction server configured to authorize payment transactions using mobile telephone devices,"DJ Pharris - US Patent App. 12/412,193, 2009 - Google Patents",2009,https://patents.google.com/patent/US20090254479A1/en,No PDF available
Presentation of sponsored content on mobile device based on transaction event,"J Ramer, A Soroca, D Doughty - US Patent 8,270,955, 2012 - Google Patents",2012,https://patents.google.com/patent/US8270955B2/en,No PDF available
Ghosting payment account data in a mobile telephone payment transaction system,"J Pharris - US Patent 8,301,500, 2012 - Google Patents",2012,https://patents.google.com/patent/US8301500B2/en,No PDF available
The influence of information sensitivity compensation on privacy concern and behavioral intention,"S Yang, K Wang - ACM SIGMIS Database: the DATABASE for Advances …, 2009 - dl.acm.org",2009,https://dl.acm.org/citation.cfm?id=1496937,"http://scholar.google.de/scholar?output=instlink&nossl=1&q=info:_KVONkddhPcJ:scholar.google.com/&hl=de&as_sdt=0,5&scillfp=830571615334447313&oi=lle"
An Approach to Optimistic Commit and Transparent Compensation for E-Service Transactions.,"J Ouyang, A Sahai, V Machiraju - ISCA PDCS, 2001 - fog.hpl.external.hp.com",2001,https://fog.hpl.external.hp.com/techreports/2001/HPL-2001-34.pdf,https://fog.hpl.external.hp.com/techreports/2001/HPL-2001-34.pdf
Compensation framework for long running transactions,"SR Thatte, LG Meredith, M Levy, BK Mehta… - US Patent …, 2005 - Google Patents",2005,https://patents.google.com/patent/US6918053B1/en,https://patentimages.storage.googleapis.com/ae/31/9f/dbb83caddbe430/US10086032.pdf
Design and implementation of model-predictive control with friction compensation on an omnidirectional mobile robot,"AGS Conceição, CET Dórea, L Martinez… - … /ASME Transactions …, 2014 - ieeexplore.ieee.org",2014,https://ieeexplore.ieee.org/abstract/document/6461945/,https://ieeexplore.ieee.org/iel5/3516/6746080/06461945.pdf
Compensation framework for long running transactions,"SR Thatte, LG Meredith, M Levy, BK Mehta… - US Patent …, 2008 - Google Patents",2008,https://patents.google.com/patent/US7380166B2/en,https://patentimages.storage.googleapis.com/e8/ec/be/01e4fc8ad6a472/US7380166.pdf
"System, Method, and Computer-Readable Medium for Mobile Payment Authentication and Authorization","H Choe, Y Choe, M Park - US Patent App. 11/855,856, 2008 - Google Patents",2008,https://patents.google.com/patent/US20080103984A1/en,No PDF available
Mobile device with transaction card in add-on slot,"SG Narendra, TN Spitzer, P Tadepalli - US Patent 7,954,715, 2011 - Google Patents",2011,https://patents.google.com/patent/US7954715B2/en,No PDF available
Reduced-complexity baseband compensation of joint Tx/Rx I/Q imbalance in mobile MIMO-OFDM,"B Narasimhan, S Narayanan, H Minn… - IEEE Transactions on …, 2010 - ieeexplore.ieee.org",2010,https://ieeexplore.ieee.org/abstract/document/5463226/,https://ieeexplore.ieee.org/iel5/7693/5463204/05463226.pdf
Mobile barcode generation and payment,"CA Wong, EI Shie, JM Aronoff, RCP Lin… - US Patent App. 12 …, 2010 - Google Patents",2010,https://patents.google.com/patent/US20100138344A1/en,No PDF available
Doppler compensation and code acquisition techniques for LEO satellite mobile radio communications,"GJR Povey, J Talvitie - 1996 - IET",1996,http://digital-library.theiet.org/content/conferences/10.1049/cp_19960398,No PDF available
Digital image stabilization by adaptive block motion vectors filtering,"F Vella, A Castorina, M Mancuso… - IEEE Transactions on …, 2002 - ieeexplore.ieee.org",2002,https://ieeexplore.ieee.org/abstract/document/1037077/,https://ieeexplore.ieee.org/iel5/30/22240/01037077.pdf
On the expressive power of primitives for compensation handling,"I Lanese, C Vaz, C Ferreira - European Symposium on Programming, 2010 - Springer",2010,https://link.springer.com/chapter/10.1007/978-3-642-11957-6_20,https://link.springer.com/content/pdf/10.1007/978-3-642-11957-6_20.pdf
Time-variant Doppler frequency estimation and compensation for mobile OFDM systems,"J Cai, Z Li, Y Hao, J Cai - … transactions on consumer electronics, 2006 - ieeexplore.ieee.org",2006,https://ieeexplore.ieee.org/abstract/document/1649647/,https://ieeexplore.ieee.org/iel5/30/34592/01649647.pdf
Trajectory tracking for a mobile robot with skid-slip compensation in the vector-field-orientation control system,"M Michałek, P Dutkiewicz, M Kiełczewski… - International Journal of …, 2009 - degruyter.com",2009,https://www.degruyter.com/view/j/amcs.2009.19.issue-4/v10006-009-0043-1/v10006-009-0043-1.xml,https://www.degruyter.com/downloadpdf/j/amcs.2009.19.issue-4/v10006-009-0043-1/v10006-009-0043-1.xml
Method and system of effecting a financial transaction,"G Simonds - US Patent App. 09/932,667, 2002 - Google Patents",2002,https://patents.google.com/patent/US20020023027A1/en,No PDF available
A transaction coordination mechanism and its compensation technology in grid environment,"F Tang, M Li, J Cao - Journal of Computer Research and …, 2003 - en.cnki.com.cn",2003,http://en.cnki.com.cn/Article_en/CJFDTotal-JFYZ200312024.htm,No PDF available
Characteristics of CMA adaptive array for selective fading compensation in digital land mobile radio communications,"T Ohgane - IEICE Trans. Commun., 1990 - ci.nii.ac.jp",1990,https://ci.nii.ac.jp/naid/10011085623/,No PDF available
System and method for on the spot purchasing by scanning barcodes from screens with a mobile device,"A Muni - US Patent 7,387,250, 2008 - Google Patents",2008,https://patents.google.com/patent/US7387250B2/en,No PDF available
H∞ compensation of external vibration impact on servo performance of hard disk drives in mobile applications,"C Du, SS Ge, FL Lewis - … Journal of Adaptive Control and Signal …, 2008 - Wiley Online Library",2008,https://onlinelibrary.wiley.com/doi/abs/10.1002/acs.990,https://onlinelibrary.wiley.com/doi/pdf/10.1002/acs.990
Mobile advertising and compensation-verification system,"G Walwer - US Patent 8,712,630, 2014 - Google Patents",2014,https://patents.google.com/patent/US8712630B2/en,No PDF available
Mobile phone payment processing methods and systems,"K Laracey - US Patent 8,380,177, 2013 - Google Patents",2013,https://patents.google.com/patent/US8380177B2/en,No PDF available
Method and system for providing biometric authentication at a point-of-sale via a mobile device,"V Bemmel, S Mian - US Patent 7,512,567, 2009 - Google Patents",2009,https://patents.google.com/patent/US7512567B2/en,No PDF available
Accurate mobile robot dead-reckoning with a precision-calibrated fiber-optic gyroscope,"H Chung, L Ojeda, J Borenstein - IEEE Transactions on …, 2001 - ieeexplore.ieee.org",2001,https://ieeexplore.ieee.org/abstract/document/917085/,https://ieeexplore.ieee.org/iel5/70/19812/00917085.pdf
Backlight power reduction using efficient image compensation for mobile devices,"TH Kim, KS Choi, SJ Ko - IEEE Transactions on Consumer …, 2010 - ieeexplore.ieee.org",2010,https://ieeexplore.ieee.org/abstract/document/5606354/,https://ieeexplore.ieee.org/iel5/30/5606236/05606354.pdf
Motion control of mobile manipulator based on neural networks and error compensation,"CY Lee, IK Jeong, I Lee, JJ Lee - Robotics and Automation …, 2004 - ieeexplore.ieee.org",2004,https://ieeexplore.ieee.org/abstract/document/1302447/,https://ieeexplore.ieee.org/iel5/9126/28923/01302447.pdf
Mobile shopping method and application,"A Muller - US Patent App. 11/059,204, 2006 - Google Patents",2006,https://patents.google.com/patent/US20060106674A1/en,No PDF available
"Method and apparatus for acquiring, maintaining, and using information to be communicated in bar code form with a mobile communications device","VT Gobburu, K Narayanan, N Challa… - US Patent …, 2004 - Google Patents",2004,https://patents.google.com/patent/US6736322B2/en,No PDF available
GPS-based tracking control for a car-like wheeled mobile robot with skidding and slipping,"CB Low, D Wang - IEEE/ASME transactions on mechatronics, 2008 - ieeexplore.ieee.org",2008,https://ieeexplore.ieee.org/abstract/document/4598867/,https://ieeexplore.ieee.org/iel5/3516/4598871/04598867.pdf
Method and system for analyzing advertisements delivered to a mobile unit,"GR Hendrey, HA Tanaka, PJ Koopman Jr - US Patent 6,647,269, 2003 - Google Patents",2003,https://patents.google.com/patent/US6647269B2/en,No PDF available
Indoor intelligent mobile robot localization using fuzzy compensation and Kalman filter to fuse the data of gyroscope and magnetometer,"HY Chung, CC Hou, YS Chen - IEEE Transactions on Industrial …, 2015 - ieeexplore.ieee.org",2015,https://ieeexplore.ieee.org/abstract/document/7069245/,https://ieeexplore.ieee.org/iel7/41/7247793/07069245.pdf
Smart-antenna systems for mobile communication networks. Part 1. Overview and antenna design,"S Bellofiore, CA Balanis, J Foutz… - IEEE Antennas and …, 2002 - ieeexplore.ieee.org",2002,https://ieeexplore.ieee.org/abstract/document/1039395/,https://ieeexplore.ieee.org/iel5/74/22101/01039395.pdf
Methods and systems for receiving compensation for using mobile payment services,"TTG Zhou, DTX Zhou, AHB Zhou - US Patent App. 13/661,207, 2013 - Google Patents",2013,https://patents.google.com/patent/US20130043305A1/en,No PDF available
Mobile commerce infrastructure systems and methods,"B Friedman - US Patent 8,548,908, 2013 - Google Patents",2013,https://patents.google.com/patent/US8548908B2/en,No PDF available
"Wireless telephony for collecting tolls, conducting financial transactions, and authorizing other activities","PH Morrill Jr - US Patent 5,991,749, 1999 - Google Patents",1999,https://patents.google.com/patent/US5991749A/en,No PDF available
"Method for using applications in a mobile station, a mobile station and a system for effecting payments","P Heinonen, M Terho, MJ Marttila… - US Patent 5,887,266, 1999 - Google Patents",1999,https://patents.google.com/patent/US5887266A/en,No PDF available
Transaction compensation in web services,"T Strandenæs, R Karlsen - Norsk Informatikkonferanse, 2002 - heim.ifi.uio.no",2002,http://heim.ifi.uio.no/~nik/2002/Strandenas.pdf,http://heim.ifi.uio.no/~nik/2002/Strandenas.pdf
Mobile payment management,"D Wentker, E Wong, G Shenker, D Deibert - US Patent 8,923,827, 2014 - Google Patents",2014,https://patents.google.com/patent/US8923827B2/en,No PDF available
Methods and systems for accurately representing corporate financial results in light of equity-based compensation and contingent transactions,"J Jameson - US Patent App. 11/000,489, 2005 - Google Patents",2005,https://patents.google.com/patent/US20050125318A1/en,http://patentimages.storage.googleapis.com/pdfs/US20050125318.pdf
Mobile phone ATM processing methods and systems,"K Laracey - US Patent 8,632,000, 2014 - Google Patents",2014,https://patents.google.com/patent/US8632000B2/en,No PDF available
Adaptive compensation for imbalance and offset losses in direct conversion transceivers,"JK Cavers, MW Liao - … transactions on vehicular technology, 1993 - ieeexplore.ieee.org",1993,https://ieeexplore.ieee.org/abstract/document/260752/,https://ieeexplore.ieee.org/iel1/25/6590/00260752.pdf
Predictive control of an omnidirectional mobile robot with friction compensation,"AGS Conceicao, CET Dorea… - Robotics Symposium and …, 2010 - ieeexplore.ieee.org",2010,https://ieeexplore.ieee.org/abstract/document/5702177/,No PDF available
Effect of the dynamic interaction on coordinated control of mobile manipulators,"Y Yamamoto, X Yun - IEEE Transactions on Robotics and …, 1996 - ieeexplore.ieee.org",1996,https://ieeexplore.ieee.org/abstract/document/538986/,https://ieeexplore.ieee.org/iel4/70/11632/00538986.pdf
Mobile money for financial inclusion,"K Donovan - Information and Communications for …, 2012 - elibrary.worldbank.org",2012,https://elibrary.worldbank.org/doi/pdf/10.1596/978-0-8213-8991-1#page=81,http://www-wds.worldbank.org/external/default/WDSContentServer/WDSP/IB/2012/08/30/000386194_20120830022053/additional/585559324_201406191042051.pdf
Doppler compensation for mobile OFDM systems with multiple receive antennas,"S Serbetli - Communications and Vehicular Technology in the …, 2012 - ieeexplore.ieee.org",2012,https://ieeexplore.ieee.org/abstract/document/6399402/,https://ieeexplore.ieee.org/iel5/6384627/6399383/06399402.pdf
Mobile account authentication service,"BH Dominguez, TJ Manessis, JT Roth… - US Patent …, 2010 - Google Patents",2010,https://patents.google.com/patent/US7707120B2/en,No PDF available
Compensation techniques for virtual credit transactions,"E Jung, R Levien, M Malamud… - US Patent App. 11 …, 2006 - Google Patents",2006,https://patents.google.com/patent/US20060195376A1/en,No PDF available
Understanding changes in consumer payment habits-do mobile payments and electronic invoices attract consumers?,"T Dahlberg, A Oorni - … , 2007. HICSS 2007. 40th Annual Hawaii …, 2007 - ieeexplore.ieee.org",2007,https://ieeexplore.ieee.org/abstract/document/4076473/,https://www.computer.org/csdl/proceedings/hicss/2007/2755/00/27550050b.pdf
A calculus for long-running transactions,"L Bocchi, C Laneve, G Zavattaro - … on Formal Methods for Open Object …, 2003 - Springer",2003,https://link.springer.com/chapter/10.1007/978-3-540-39958-2_9,https://link.springer.com/content/pdf/10.1007/978-3-540-39958-2_9.pdf
Systems and methods for providing anonymous financial transactions,"R Otto, M Murrell, S Mugford, M Rowen… - US Patent App. 09 …, 2001 - Google Patents",2001,https://patents.google.com/patent/US20010029496A1/en,No PDF available
Stored value transaction system including an integrated database server,"M Blandina, R Berry, M Belczynski - US Patent 7,216,091, 2007 - Google Patents",2007,https://patents.google.com/patent/US7216091B1/en,No PDF available
Contract Compensation in Nonmarket Transactions,"JP Tomain - U. Pitt. L. Rev., 1984 - HeinOnline",1984,https://heinonline.org/hol-cgi-bin/get_pdf.cgi?handle=hein.journals/upitt46&section=36,http://scholarship.law.uc.edu/cgi/viewcontent.cgi?article=1246&context=fac_pubs
Enhanced performance of RoF link for cellular mobile systems using postdistortion compensation,"CH Lee, V Postoyalko, T O'Farrell - Personal, Indoor and Mobile …, 2004 - ieeexplore.ieee.org",2004,https://ieeexplore.ieee.org/abstract/document/1368825/,No PDF available
Compensation of finger effect on a mobile terminal antenna by antenna selection,"R Valkonen, S Myllymäki, A Huttunen… - Electromagnetics in …, 2010 - ieeexplore.ieee.org",2010,https://ieeexplore.ieee.org/abstract/document/5648879/,No PDF available
Measurement and correction of systematic odometry errors in mobile robots,"J Borenstein, L Feng - IEEE Transactions on robotics and …, 1996 - ieeexplore.ieee.org",1996,https://ieeexplore.ieee.org/abstract/document/544770/,https://ieeexplore.ieee.org/iel4/70/11940/00544770.pdf
Internet eco system for transacting information and transactional data for compensation,"A Hadi - US Patent App. 12/317,759, 2009 - Google Patents",2009,https://patents.google.com/patent/US20090177529A1/en,No PDF available
"Method for using applications in a mobile station, a mobile station, and a system for effecting payments","P Heinonen, M Terho, M Marttila, M Rautiola - US Patent 6,418,326, 2002 - Google Patents",2002,https://patents.google.com/patent/US6418326B1/en,No PDF available
A modeling approach and reference models for the analysis of mobile payment use cases,"K Pousttchi - Electronic Commerce Research and Applications, 2008 - Elsevier",2008,https://www.sciencedirect.com/science/article/pii/S1567422307000427,No PDF available
"Verification system for facilitating transactions via communication networks, and associated method","D Bunce - US Patent App. 10/325,408, 2004 - Google Patents",2004,https://patents.google.com/patent/US20040122685A1/en,No PDF available
Adaptive compensation method using the prediction algorithm for the Doppler frequency shift in the LEO mobile satellite communication system,"MH You, SP Lee, Y Han - ETRI journal, 2000 - Wiley Online Library",2000,https://onlinelibrary.wiley.com/doi/abs/10.4218/etrij.00.0100.0404,https://onlinelibrary.wiley.com/doi/pdf/10.4218/etrij.00.0100.0404
Mobile commerce systems and methods,"SE Arthur, CL Toomer, S Owen… - US Patent 8,566,239, 2013 - Google Patents",2013,https://patents.google.com/patent/US8566239B2/en,No PDF available
Flexible docking mechanism with error-compensation capability for auto recharging system of mobile robot,"S Roh, JH Park, YH Lee, YK Song, KW Yang… - International Journal of …, 2008 - ijcas.org",2008,http://www.ijcas.org/admin/paper/files/ijcas_v6_n5_pp.731-739.pdf,http://www.ijcas.org/admin/paper/files/ijcas_v6_n5_pp.731-739.pdf
Costs and Compensation Paid in Aviation Accident Litigation,"JS Kakalik, EM King, M Traynor, PA Ebener, L Picus - 1988 - rand.org",1988,https://www.rand.org/pubs/reports/R3421.html,No PDF available
"Method for using applications in a mobile station, a mobile station, and a system for effecting payments","P Heinonen, M Terho, MJ Marttila… - US Patent 6,078,806, 2000 - Google Patents",2000,https://patents.google.com/patent/US6078806A/en,No PDF available
Wireless computer wallet for physical point of sale (POS) transactions,"Y Labrou, JR Agre - US Patent 7,784,684, 2010 - Google Patents",2010,https://patents.google.com/patent/US7784684B2/en,No PDF available
Regulatory takings: When should compensation be paid?,"TJ Miceli, K Segerson - The Journal of Legal Studies, 1994 - journals.uchicago.edu",1994,https://www.journals.uchicago.edu/doi/pdfplus/10.1086/467944,https://www.amherst.edu/media/view/121559/original/MiceliSegerson.pdf
… communications device with separate In-phase (I) and Quadrature (Q) phase power amplification and power amplifier pre-distortion and IQ balance compensation,"L Zhu, G Mankaruse, M Corrigan… - US Patent …, 2012 - Google Patents",2012,https://patents.google.com/patent/US8223885B2/en,No PDF available
Visual navigation for mobile robots: A survey,"F Bonin-Font, A Ortiz, G Oliver - Journal of intelligent and robotic …, 2008 - dl.acm.org",2008,https://dl.acm.org/citation.cfm?id=1452818,https://link.springer.com/content/pdf/10.1007/s10846-008-9235-4.pdf
System and method for re-distributing and transferring mobile gift cards,"DJ Hurst - US Patent 8,589,267, 2013 - Google Patents",2013,https://patents.google.com/patent/US8589267B2/en,No PDF available
System and method for performing flexible workflow process compensation in a distributed workflow management system,"JW Davis, W Du, MC Shan - US Patent 5,870,545, 1999 - Google Patents",1999,https://patents.google.com/patent/US5870545A/en,No PDF available
Dynamic modeling and adaptive dynamic compensation for unicycle-like mobile robots,"FN Martins, M Sarcinelli-Filho… - … Robotics, 2009. ICAR …, 2009 - ieeexplore.ieee.org",2009,https://ieeexplore.ieee.org/abstract/document/5174791/,No PDF available
Fault-tolerant system and method of managing transaction failures in hierarchies,"Q Chen, U Dayal - US Patent 5,940,839, 1999 - Google Patents",1999,https://patents.google.com/patent/US5940839A/en,No PDF available
Method and apparatus for processing orders from customers in a mobile environment,"AD Hall, WB Crabtree Jr, FA Volk - US Patent 6,026,375, 2000 - Google Patents",2000,https://patents.google.com/patent/US6026375A/en,No PDF available
Authenticated electronic coupon issuing and redemption,"CC Palmer, ER Palmer, SW Smith - US Patent 6,505,773, 2003 - Google Patents",2003,https://patents.google.com/patent/US6505773B1/en,No PDF available
"An operational semantics for StAC, a language for modelling long-running business transactions","M Butler, C Ferreira - … Conference on Coordination Languages and Models, 2004 - Springer",2004,https://link.springer.com/chapter/10.1007/978-3-540-24634-3_9,https://eprints.soton.ac.uk/259626/1/paper_semantics.pdf
