title,author,date,link,pdf_link,query,search_engine,nr_found,cite_count,doi
After the cosmopolitan?: Multicultural cities and the future of racism,M Keith - 2005 - taylorfrancis.com,2005,https://www.taylorfrancis.com/books/9781134294534,https://www.researchgate.net/profile/Ivo_De_Sousa/post/Research_demonstrating_the_role_of_self-deception_in_racism_and_the_prevalence_of_racism/attachment/59d61f7379197b807797de47/AS%3A284757997965312%401444903005293/download/RACISM.+After_the_Cosmopolitan.pdf,,,1,496,No DOI available
Security in pervasive applications: a survey,"C Bodei, P Degano, L Galletta, G Mezzetti… - European Journal of Law …, 2013 - ejlt.org",2013,http://ejlt.org/article/view/276,http://ejlt.org/article/view/276/387,,,1,2,No DOI available
From Text to Dance: Andrée Howard's The Sailor's Return,"S Jones - Dance Research, 2008 - euppublishing.com",2008,https://www.euppublishing.com/doi/pdf/10.3366/E0264287508000030,https://www.jstor.org/stable/pdf/40263984.pdf,,,1,2,No DOI available
Conceptual alignment: How brains achieve mutual understanding,"A Stolk, L Verhagen, I Toni - Trends in cognitive sciences, 2016 - Elsevier",2016,https://www.sciencedirect.com/science/article/pii/S1364661315002867,https://langev.com/pdf/5448cb71ce69a6bae921077b641d257f6f8e702a.pdf,,,1,28,No DOI available
How to create a WSMO-based semantic service without knowing WSML,"G Agre, I Dilov - International Conference on Web Information Systems …, 2007 - Springer",2007,https://link.springer.com/chapter/10.1007/978-3-540-77010-7_22,http://www.academia.edu/download/8820873/INFRAWEBS%20Designer%20-%20Hf-SDDM-07.pdf,,,1,5,No DOI available
A Hybrid Architecture for Highly Adaptive and Automated e-Business Platforms,"B Schmid, C Schroth, T Janner - IEEE International Conference …, 2007 - ieeexplore.ieee.org",2007,https://ieeexplore.ieee.org/abstract/document/4278692/,https://ieeexplore.ieee.org/iel5/4278609/4278610/04278692.pdf,,,1,4,No DOI available
Human MMS21/NSE2 is a SUMO ligase required for DNA repair,"PR Potts, H Yu - Molecular and cellular biology, 2005 - Am Soc Microbiol",2005,https://mcb.asm.org/content/25/16/7021.short,https://mcb.asm.org/content/mcb/25/16/7021.full.pdf,,,1,225,No DOI available
"Towards methodological approaches to meet the challenges of human, social, cultural, and behavioral (HSCB) modeling","A Tolk, W Huiskamp, H Schaub… - Proceedings of the …, 2010 - ieeexplore.ieee.org",2010,https://ieeexplore.ieee.org/abstract/document/5679100/,https://ieeexplore.ieee.org/iel5/5672636/5678856/05679100.pdf,,,1,16,No DOI available
"Head, heart, hand: Embodying Maori language through song","R Trinick, H Dale - Australian Journal of Music Education, 2015 - search.informit.com.au",2015,https://search.informit.com.au/documentSummarydn=992135317564187res=IELHSS,No PDF available,,,1,6,No DOI available
An entirely specific type I A-kinase anchoring protein that can sequester two molecules of protein kinase A at mitochondria,"CK Means, B Lygren, LK Langeberg… - Proceedings of the …, 2011 - National Acad Sciences",2011,https://www.pnas.org/content/108/48/E1227.short,https://www.pnas.org/content/pnas/108/48/E1227.full.pdf,,,1,109,No DOI available
Neuronal activity modifies the DNA methylation landscape in the adult brain,"JU Guo, DK Ma, H Mo, MP Ball, MH Jang… - Nature …, 2011 - nature.com",2011,https://www.nature.com/neuro/journal/v14/n10/abs/nn.2900.html,https://www.ncbi.nlm.nih.gov/pmc/articles/PMC3183401/,,,1,457,No DOI available
A Study on Proprioception and Peripheral Vision in Synesthesia and Immersion,"M Boucher - Leonardo, 2017 - MIT Press",2017,https://www.mitpressjournals.org/doi/abs/10.1162/LEON_a_01008,"http://scholar.google.de/scholar?output=instlink&nossl=1&q=info:uvwElHwlrdUJ:scholar.google.com/&hl=de&as_sdt=0,5&scillfp=9607769350719065674&oi=lle",,,1,No cite count available,No DOI available
New tricks for an old fox: impact of TGFβ on the DNA damage response and genomic stability,"MH Barcellos-Hoff, FA Cucinotta - Sci. Signal., 2014 - stke.sciencemag.org",2014,http://stke.sciencemag.org/content/7/341/re5.abstract,https://www.researchgate.net/profile/Mary_Barcellos-Hoff/publication/267756791_New_tricks_for_an_old_fox_Impact_of_TGF_on_the_DNA_damage_response_and_genomic_stability/links/5485a1760cf2437065c9e9dc.pdf,,,1,37,No DOI available
Evolution of Development,"K Richardson - The Evolution of Intelligent Systems, 2010 - Springer",2010,https://link.springer.com/chapter/10.1057/9780230299245_5,No PDF available,,,1,No cite count available,No DOI available
Curious methods,"K Lutsky, S Burkholder - Places Journal, 2017 - placesjournal.org",2017,https://placesjournal.org/article/curious-methods/,https://placesjournal.org/article/curious-methods/,,,1,1,No DOI available
Policy-rich multi-agent support for e-Health applications,"L Braubach, W Lamersdorf, Z Milosevic… - Challenges of Expanding …, 2005 - Springer",2005,https://link.springer.com/chapter/10.1007/0-387-29773-1_16,https://link.springer.com/content/pdf/10.1007/0-387-29773-1_16.pdf,,,1,2,No DOI available
A review of observational gait assessment in clinical practice,"B Toro, C Nester, P Farren - Physiotherapy theory and practice, 2003 - Taylor & Francis",2003,https://www.tandfonline.com/doi/abs/10.1080/09593980307964,https://www.tandfonline.com/doi/pdf/10.1080/09593980307964,,,1,105,No DOI available
Geometric control of tissue morphogenesis,"CM Nelson - Biochimica et Biophysica Acta (BBA)-Molecular Cell …, 2009 - Elsevier",2009,https://www.sciencedirect.com/science/article/pii/S0167488908004370,https://www.sciencedirect.com/science/article/pii/S0167488908004370,,,1,68,No DOI available
Cell cycle checkpoints and their impact on anticancer therapeutic strategies,"A Eastman - Journal of cellular biochemistry, 2004 - Wiley Online Library",2004,https://onlinelibrary.wiley.com/doi/abs/10.1002/jcb.10699,https://onlinelibrary.wiley.com/doi/full/10.1002/jcb.10699,,,1,181,No DOI available
Embodied artistic inquiry,"LW Hervey - Dance/movement therapists in action: A working …, 2012 - books.google.com",2012,https://books.google.de/books?hl=de&lr=&id=SMpyDwAAQBAJ&oi=fnd&pg=PA200&dq=context-dependent+AND+choreography+AND+sensitiv&ots=zheE3m4d61&sig=gj1Msb4ObMJRtx2C-36v8RVFlYE,No PDF available,,,1,16,No DOI available
Matter of transformation: Designing an alternative tomorrow inspired by phenomenology,"C Hummels, P Lévy - interactions, 2013 - researchgate.net",2013,https://www.researchgate.net/profile/Pierre_Levy6/publication/262156218_Matter_of_transformation_designing_an_alternative_tomorrow_inspired_by_phenomenology/links/54db1cb30cf261ce15cf2e08/Matter-of-transformation-designing-an-alternative-tomorrow-inspired-by-phenomenology.pdf,https://www.researchgate.net/profile/Pierre_Levy6/publication/262156218_Matter_of_transformation_designing_an_alternative_tomorrow_inspired_by_phenomenology/links/54db1cb30cf261ce15cf2e08/Matter-of-transformation-designing-an-alternative-tomorrow-inspired-by-phenomenology.pdf,,,1,19,No DOI available
Circadian clock: time for novel anticancer strategies?,"L Ercolani, A Ferrari, C De Mei, C Parodi… - Pharmacological …, 2015 - Elsevier",2015,https://www.sciencedirect.com/science/article/pii/S1043661815001760,"http://scholar.google.de/scholar?output=instlink&nossl=1&q=info:ivXGIOK4pUAJ:scholar.google.com/&hl=de&as_sdt=0,5&scillfp=9267411348799822591&oi=lle",,,1,12,No DOI available
How healthy is your 'community of practice'?,"R Lynch - Probation journal, 2004 - journals.sagepub.com",2004,https://journals.sagepub.com/doi/abs/10.1177/0264550504041377,https://journals.sagepub.com/doi/pdf/10.1177/0264550504041377,,,1,5,No DOI available
