title,author,date,link,pdf_link,query,search_engine,nr_found,cite_count,doi
"Security, privacy and trust in Internet of Things: The road ahead","S Sicari, A Rizzardi, LA Grieco, A Coen-Porisini - Computer networks, 2015 - Elsevier",2015,https://www.sciencedirect.com/science/article/pii/S1389128614003971,http://tarjomefa.com/wp-content/uploads/2016/07/5009-English.pdf,,,1,800,No DOI available
An Adaptive Architecture for Context-Aware Interaction in Pervasive Applications,"A Colman, M Tran, J Han - Workshop on Security and Privacy Issues …, 2007 - academia.edu",2007,http://www.academia.edu/download/30913381/10.1.1.182.1884.pdf#page=237,http://www.academia.edu/download/30913381/10.1.1.182.1884.pdf#page=237,,,1,4,No DOI available
Towards seamless service mobility for mobile devices communicating within wireless grids,"B Rashid, M El-Darieby - 2007 Canadian Conference on …, 2007 - ieeexplore.ieee.org",2007,https://ieeexplore.ieee.org/abstract/document/4232788/,https://ieeexplore.ieee.org/iel5/4232658/4232659/04232788.pdf,,,1,6,No DOI available
Towards adaptive decision support systems: A service-oriented approach,"D Yu, S Zheng - … in Information Sciences and Service …, 2011 - pdfs.semanticscholar.org",2011,https://pdfs.semanticscholar.org/1646/fe4ac3a208765a2f3adcb9091d5c9f20ea79.pdf,https://pdfs.semanticscholar.org/1646/fe4ac3a208765a2f3adcb9091d5c9f20ea79.pdf,,,1,8,No DOI available
Computer and Information Sciences: Proceedings of the 25th International Symposium on Computer and Information Sciences,"E Gelenbe, R Lent, G Sakellari, A Sacan, H Toroslu… - 2010 - books.google.com",2010,https://books.google.de/books?hl=de&lr=&id=cfp7WA8JVGoC&oi=fnd&pg=PR3&dq=context-sensitive+AND+decentralized+service+composition+AND+adapt*&ots=sx_WjUTsx_&sig=QUWJq4beSrVJN_zBcayXA2N-95M,https://www.researchgate.net/profile/Yoav_Freund/publication/2798688_Data_Filtering_and_Distribution_Modeling_Algorithms_for_Machine_Learning/links/00b4952a73d517a3f4000000/Data-Filtering-and-Distribution-Modeling-Algorithms-for-Machine-Learning.pdf,,,1,59,No DOI available
"A Knowledge-oriented, Context-sensitive Architectural Framework for Service Deployment in Marginalized Rural Communities",MP Thinyane - 2009 - core.ac.uk,2009,https://core.ac.uk/download/pdf/145055496.pdf,https://core.ac.uk/download/pdf/145055496.pdf,,,1,3,No DOI available
Context as a Resource: A Service-Oriented Approach for Context-Awareness,D Romero - 2011 - tel.archives-ouvertes.fr,2011,https://tel.archives-ouvertes.fr/tel-00608838/,https://tel.archives-ouvertes.fr/tel-00608838/file/Thesis.pdf,,,1,6,No DOI available
Assisting mobile web users: client-side injection of context-sensitive cues into websites,"S Casteleyn, W Van Woensel, O De Troyer - … Applications & Services, 2010 - dl.acm.org",2010,https://dl.acm.org/citation.cfm?id=1967555,https://www.researchgate.net/profile/Olga_Troyer/publication/221237670_Assisting_mobile_Web_users_Client-side_injection_of_context-sensitive_cues_into_websites/links/0fcfd51128c04cd828000000.pdf,,,1,7,No DOI available
Context-sensitive authorization for asynchronous communications,"V Hourdin, JY Tigli, S Lavirotte, G Rey… - … Conference for Internet …, 2009 - ieeexplore.ieee.org",2009,https://ieeexplore.ieee.org/abstract/document/5402550/,https://hal.archives-ouvertes.fr/docs/00/47/68/82/PDF/hourdin-tigli-etal_2009.pdf,,,1,2,No DOI available
Engineering insights from an anthropocentric cyber-physical system: A case study for an assembly station,"BC Pirvu, CB Zamfirescu, D Gorecky - Mechatronics, 2016 - Elsevier",2016,https://www.sciencedirect.com/science/article/pii/S095741581500152X,"http://scholar.google.de/scholar?output=instlink&nossl=1&q=info:bZWH5RIJxnEJ:scholar.google.com/&hl=de&as_sdt=0,5&scillfp=14759706850374140811&oi=lle",,,1,45,No DOI available
A survey on wireless grids and clouds,"G Li, H Sun, H Gao, H Yu, Y Cai - 2009 Eighth International …, 2009 - ieeexplore.ieee.org",2009,https://ieeexplore.ieee.org/abstract/document/5279593/,https://ieeexplore.ieee.org/iel5/5279485/5279486/05279593.pdf,,,1,46,No DOI available
Cloud-based decision support systems and availability context: the probability of successful decision outcomes,"S Russell, V Yoon, G Forgionne - Information Systems and e-Business …, 2010 - Springer",2010,https://link.springer.com/article/10.1007/s10257-010-0126-4,https://link.springer.com/article/10.1007/s10257-010-0126-4,,,1,26,No DOI available
Adaptive Context Dissemination in Heterogeneous Environments,"D Balakrishnan, A Nayak - IEEE Transactions on Mobile …, 2014 - ieeexplore.ieee.org",2014,https://ieeexplore.ieee.org/abstract/document/6636312/,https://ieeexplore.ieee.org/iel7/7755/6824285/06636312.pdf,,,1,4,No DOI available
Scalable service deployment on software-defined networks,"J Rubio-Loyola, A Galis, A Astorga… - IEEE …, 2011 - ieeexplore.ieee.org",2011,https://ieeexplore.ieee.org/abstract/document/6094010/,https://ieeexplore.ieee.org/iel5/35/6093994/06094010.pdf,,,1,68,No DOI available
Self-integrating organic control systems: from crayfish to smart homes,"A Diaconescu, P Mata, K Bellman - ARCS Workshop 2018 …, 2018 - ieeexplore.ieee.org",2018,https://ieeexplore.ieee.org/abstract/document/8385429/,https://ieeexplore.ieee.org/iel7/8385231/8385232/08385429.pdf,,,1,4,No DOI available
Integrating studierstube and dwarf,"M Bauer, O Hilliges, A MacWilliams, C Sandor… - 2003 - campar.in.tum.de",2003,http://campar.in.tum.de/pub/dwarf2003integrating/dwarf2003integrating.pdf,http://campar.in.tum.de/pub/dwarf2003integrating/dwarf2003integrating.pdf,,,1,22,No DOI available
Development of situation-aware application software for ubiquitous computing environments,"SS Yau, Y Wang, F Karim - Proceedings 26th Annual …, 2002 - ieeexplore.ieee.org",2002,https://ieeexplore.ieee.org/abstract/document/1044557/,https://ieeexplore.ieee.org/iel5/8094/22390/01044557.pdf,,,1,126,No DOI available
Survey on concern separation in service integration,"T Cerny, MJ Donahoo - International Conference on Current Trends in …, 2016 - Springer",2016,https://link.springer.com/chapter/10.1007/978-3-662-49192-8_42,https://pdfs.semanticscholar.org/774b/993bc29af108f7369654620a7d998b5ef93f.pdf,,,1,5,No DOI available
Composing adaptive software systems in decentralized infrastructures,"M Wutzler - Proceedings of on MobiSys 2016 PhD Forum, 2016 - dl.acm.org",2016,https://dl.acm.org/citation.cfm?id=2933325,No PDF available,,,1,2,No DOI available
Context-sensitive optimisation of the key performance indicators for FMS,"MK Uddin, J Puttonen… - International Journal of …, 2015 - Taylor & Francis",2015,https://www.tandfonline.com/doi/abs/10.1080/0951192X.2014.941403,https://www.tandfonline.com/doi/full/10.1080/0951192X.2014.941403,,,1,3,No DOI available
Utilizing role-based models for on-demand composition of smart service systems,"M Wutzler, T Springer, A Schill - … to the first International Conference on …, 2017 - dl.acm.org",2017,https://dl.acm.org/citation.cfm?id=3079390,No PDF available,,,1,2,No DOI available
Improving the quality of private sector delivery of public health services: challenges and strategies,"R Brugha, A Zwi - Health policy and planning, 1998 - academic.oup.com",1998,https://academic.oup.com/heapol/article-abstract/13/2/107/693569,https://academic.oup.com/heapol/article-pdf/13/2/107/6749346/13-2-107.pdf,,,1,351,No DOI available
