title,author,date,link,pdf_link,query,search_engine,nr_found,cite_count,doiAutomatically composing reusable software components for mobile devices,"Jules White,    Douglas C. Schmidt,    Egon Wuchner…",2008,https://link.springer.com/article/10.1007/BF03192550,https://link.springer.com/content/pdf/10.1007%2FBF03192550.pdf,,,1,8,https://doi.org/10.1007/BF03192550
Evolution as ≪Reflections on the Design≫,Walter Cazzola,2014,https://link.springer.com/chapter/10.1007/978-3-319-08915-7_10,No PDF available,,,1,1,https://doi.org/10.1007/978-3-319-08915-7_10
European Integration,Gülay Çağlar,2005,https://link.springer.com/chapter/10.1007/1-4020-3064-9_9,No PDF available,,,1,No cite count available,https://doi.org/10.1007/1-4020-3064-9_9
Sustainable Industrial Processes by Embedded Real-Time Quality Prediction,"Marco Stolpe,    Hendrik Blom,    Katharina Morik",2016,https://link.springer.com/chapter/10.1007/978-3-319-31858-5_10,No PDF available,,,1,1,https://doi.org/10.1007/978-3-319-31858-5_10
Self-regulatory information sharing in participatory social sensing,"Evangelos Pournaras,    Jovan Nikolic,    Pablo Velásquez,    Marcello Trovati…",2016,https://link.springer.com/article/10.1140/epjds/s13688-016-0074-4,https://link.springer.com/content/pdf/10.1140%2Fepjds%2Fs13688-016-0074-4.pdf,,,1,10,https://doi.org/10.1140/epjds/s13688-016-0074-4
CPS-Based Manufacturing with Semantic Object Memories and Service Orchestration for Industrie 4.0 Applications,"Jens Haupert,    Xenia Klinge,    Anselm Blocher",2017,https://link.springer.com/chapter/10.1007/978-3-319-42559-7_8,No PDF available,,,1,No cite count available,https://doi.org/10.1007/978-3-319-42559-7_8
Fractionated Software for Networked Cyber-Physical Systems: Research Directions and Long-Term Vision,"Mark-Oliver Stehr,    Carolyn Talcott…",2011,https://link.springer.com/chapter/10.1007/978-3-642-24933-4_7,No PDF available,,,1,10,https://doi.org/10.1007/978-3-642-24933-4_7
Wind Power Landscapes in France: Landscape and Energy Decentralization,"Olivier Labussière,    Alain Nadaï",2015,https://link.springer.com/chapter/10.1007/978-94-017-9843-3_5,No PDF available,,,1,2,https://doi.org/10.1007/978-94-017-9843-3_5
Evaluation of Engineering Approaches in the Secure Software Development Life Cycle,"Marianne Busch,    Nora Koch,    Martin Wirsing",2014,https://link.springer.com/chapter/10.1007/978-3-319-07452-8_10,No PDF available,,,1,2,https://doi.org/10.1007/978-3-319-07452-8_10
Semantic Middleware Architectures for IoT Healthcare Applications,"Rita Zgheib,    Emmanuel Conchon,    Rémi Bastide",2019,https://link.springer.com/chapter/10.1007/978-3-030-10752-9_11,https://link.springer.com/content/pdf/10.1007%2F978-3-030-10752-9_11.pdf,,,1,No cite count available,https://doi.org/10.1007/978-3-030-10752-9_11
The Use of Adaptive Semantic Hypermedia for Ubiquitous Collaboration Systems,"Patricia Seefelder de Assis,    Daniel Schwabe",2008,https://link.springer.com/chapter/10.1007/978-3-540-88479-8_39,No PDF available,,,1,No cite count available,https://doi.org/10.1007/978-3-540-88479-8_39
Hermeneutic Institutionalism: Towards a New Synthesis,Andreas Glaeser,2014,https://link.springer.com/article/10.1007/s11133-014-9272-1,No PDF available,,,1,5,https://doi.org/10.1007/s11133-014-9272-1
"The evolution of the electronics industry on Batam Island (Riau Islands Province, Indonesia): an evolutionary trajectory contributing to regional resilience?","Leo van Grunsven,    Francis E. Hutchinson",2017,https://link.springer.com/article/10.1007/s10708-015-9692-9,https://link.springer.com/content/pdf/10.1007%2Fs10708-015-9692-9.pdf,,,1,1,https://doi.org/10.1007/s10708-015-9692-9
Policy-Driven Tailoring of Sensor Networks,"Nelson Matthys,    Christophe Huygens,    Danny Hughes,    Jó Ueyama…",2011,https://link.springer.com/chapter/10.1007/978-3-642-23583-2_2,No PDF available,,,1,1,https://doi.org/10.1007/978-3-642-23583-2_2
"Historical legacies, institutional change, and policy leadership: the case of Alexandre Millerand and the French factory inspectorate",Frieda Fuchs,2010,https://link.springer.com/article/10.1007/s11186-009-9094-4,No PDF available,,,1,1,https://doi.org/10.1007/s11186-009-9094-4
Pervasive Computing: Enabling Technologies and Challenges,"Mohan Kumar,    Sajal K Das",2006,https://link.springer.com/chapter/10.1007/0-387-27705-6_19,No PDF available,,,1,1,https://doi.org/10.1007/0-387-27705-6_19
Ma Thinking and Innovation in Global High Tech Companies: The Lessons of Business Model Innovation in Apple and Cisco Systems,"Mitsuru Kodama,    Takehiko Yasuda…",2017,https://link.springer.com/chapter/10.1057/978-1-137-59194-4_3,No PDF available,,,1,No cite count available,https://doi.org/10.1057/978-1-137-59194-4_3
Measuring Industry Dynamics: Towards a Comprehensive Concept,"Stefan Hauschild,    Dodo zu Knyphausen-Aufseß,    Martin Rahmel",2011,https://link.springer.com/article/10.1007/BF03396827,No PDF available,,,1,4,https://doi.org/10.1007/BF03396827
Support Context-Adaptation in the Constrained Application Protocol (CoAP),"Yuji Dong,    Kaiyu Wan,    Yong Yue,    Xin Huang",2019,https://link.springer.com/chapter/10.1007/978-3-030-17642-6_25,No PDF available,,,1,No cite count available,https://doi.org/10.1007/978-3-030-17642-6_25
Managing Green Business Model Transformations – A Framework for Management Practice,Axel Sommer,2012,https://link.springer.com/chapter/10.1007/978-3-642-28848-7_9,No PDF available,,,1,No cite count available,https://doi.org/10.1007/978-3-642-28848-7_9
Modularization – Enabler for Shop Floor Involvement in Improvement and Development,"Bjørnar Henriksen,    Lars Skjelstad…",2013,https://link.springer.com/chapter/10.1007/978-3-642-40352-1_32,https://link.springer.com/content/pdf/10.1007%2F978-3-642-40352-1_32.pdf,,,1,No cite count available,https://doi.org/10.1007/978-3-642-40352-1_32
Ubiquitous Working Environments,Carl Gustaf Jansson,2010,https://link.springer.com/chapter/10.1007/978-1-84800-098-8_7,No PDF available,,,1,No cite count available,https://doi.org/10.1007/978-1-84800-098-8_7
"REDD Policy Impacts on Indigenous Property Rights Regimes on Palawan Island, the Philippines","Wolfram Dressler,    Melanie McDermott,    Will Smith,    Juan Pulhin",2012,https://link.springer.com/article/10.1007/s10745-012-9527-y,No PDF available,,,1,8,https://doi.org/10.1007/s10745-012-9527-y
Methods of Analysis,"Wolfgang Kröger,    Enrico Zio",2011,https://link.springer.com/chapter/10.1007/978-0-85729-655-9_6,No PDF available,,,1,1,https://doi.org/10.1007/978-0-85729-655-9_6
Federating Policy-Driven Autonomous Systems: Interaction Specification and Management Patterns,"Alberto Schaeffer-Filho,    Emil Lupu…",2015,https://link.springer.com/article/10.1007/s10922-014-9317-5,No PDF available,,,1,4,https://doi.org/10.1007/s10922-014-9317-5
The Cognitive Factory,"M. F. Zaeh,    M. Beetz,    K. Shea,    G. Reinhart…",2009,https://link.springer.com/chapter/10.1007/978-1-84882-067-8_20,No PDF available,,,1,25,https://doi.org/10.1007/978-1-84882-067-8_20
Automatic resource allocation in a distributed camera network,"Deepak R. Karuppiah,    Roderic A. Grupen,    Zhigang Zhu…",2010,https://link.springer.com/article/10.1007/s00138-008-0182-7,No PDF available,,,1,8,https://doi.org/10.1007/s00138-008-0182-7
"The Marks of the Arts Lab: Comics, Performance, and the Counterculture",Maggie Gray,2017,https://link.springer.com/chapter/10.1007/978-3-319-66508-5_2,No PDF available,,,1,No cite count available,https://doi.org/10.1007/978-3-319-66508-5_2
Review and Designs of Federated Management in Future Internet Architectures,"Martín Serrano,    Steven Davy,    Martin Johnsson,    Willie Donnelly…",2011,https://link.springer.com/chapter/10.1007/978-3-642-20898-0_4,https://link.springer.com/content/pdf/10.1007%2F978-3-642-20898-0_4.pdf,,,1,4,https://doi.org/10.1007/978-3-642-20898-0_4
Algorithms and Framework for Comparison of Bee-Intelligence Based Peer-to-Peer Lookup,"Vesna Šešum-Čavić,    Eva Kühn",2013,https://link.springer.com/chapter/10.1007/978-3-642-38703-6_48,No PDF available,,,1,1,https://doi.org/10.1007/978-3-642-38703-6_48
Japan’s Economic Growth: Past and Present,"Takanobu Nakajima,    Masao Nakamura…",2001,https://link.springer.com/chapter/10.1057/9780230512283_2,No PDF available,,,1,1,https://doi.org/10.1057/9780230512283_2
Literature review,Theo Fowinkel,2014,https://link.springer.com/chapter/10.1007/978-3-658-05982-8_2,No PDF available,,,1,No cite count available,https://doi.org/10.1007/978-3-658-05982-8_2
Civil Society’s Claims to Political Representation in Brazil,Peter P. Houtzager…,2010,https://link.springer.com/article/10.1007/s12116-009-9059-7,No PDF available,,,1,No cite count available,https://doi.org/10.1007/s12116-009-9059-7
Empirical Part,Richard K. Lenz,2010,https://link.springer.com/chapter/10.1007/978-3-8349-8600-9_3,No PDF available,,,1,No cite count available,https://doi.org/10.1007/978-3-8349-8600-9_3
A Lightweight Service Placement Approach for Community Network Micro-Clouds,"Mennan Selimi,    Llorenç Cerdà-Alabern,    Felix Freitag…",2019,https://link.springer.com/article/10.1007/s10723-018-9437-3,https://link.springer.com/content/pdf/10.1007%2Fs10723-018-9437-3.pdf,,,1,No cite count available,https://doi.org/10.1007/s10723-018-9437-3
Conquering Complexity via Seamless Integration of Design-Time and Run-Time Verification,"Antonio Filieri,    Carlo Ghezzi,    Raffaela Mirandola…",2012,https://link.springer.com/chapter/10.1007/978-1-4471-2297-5_12,No PDF available,,,1,2,https://doi.org/10.1007/978-1-4471-2297-5_12
Encyclopedia A–Z,Bruce F. Murphy,2001,https://link.springer.com/chapter/10.1057/9780230107359_1,No PDF available,,,1,No cite count available,https://doi.org/10.1057/9780230107359_1
Testbeds for WSNs,Hossam Mahmoud Ahmad Fahmy,2016,https://link.springer.com/chapter/10.1007/978-981-10-0412-4_5,No PDF available,,,1,No cite count available,https://doi.org/10.1007/978-981-10-0412-4_5
Swarm-Based Computational Development,"Sebastian von Mammen,    David Phillips,    Timothy Davison…",2012,https://link.springer.com/chapter/10.1007/978-3-642-33902-8_18,No PDF available,,,1,No cite count available,https://doi.org/10.1007/978-3-642-33902-8_18
A software architecture centric engineering approach for Internetware,"Hong Mei,    Gang Huang,    Haiyan Zhao…",2006,https://link.springer.com/article/10.1007/s11432-006-2027-1,No PDF available,,,1,21,https://doi.org/10.1007/s11432-006-2027-1
Agent-based Cloud service composition,"J. Octavio Gutierrez-Garcia,    Kwang Mong Sim",2013,https://link.springer.com/article/10.1007/s10489-012-0380-x,No PDF available,,,1,53,https://doi.org/10.1007/s10489-012-0380-x
A Reflective Middleware to Support Peer-to-Peer Overlay Adaptation,"Gareth Tyson,    Paul Grace,    Andreas Mauthe…",2009,https://link.springer.com/chapter/10.1007/978-3-642-02164-0_3,https://link.springer.com/content/pdf/10.1007%2F978-3-642-02164-0_3.pdf,,,1,No cite count available,https://doi.org/10.1007/978-3-642-02164-0_3
Middleware for enterprise scale data stream management using utility-driven self-adaptive information flows,"Vibhore Kumar,    Brian F. Cooper,    Zhongtang Cai,    Greg Eisenhauer…",2007,https://link.springer.com/article/10.1007/s10586-007-0040-9,No PDF available,,,1,5,https://doi.org/10.1007/s10586-007-0040-9
Real-world Service Interaction with Enterprise Systems in Dynamic Manufacturing Environments,"S. Karnouskos,    D. Savio,    P. Spiess…",2010,https://link.springer.com/chapter/10.1007/978-1-84996-119-6_14,No PDF available,,,1,23,https://doi.org/10.1007/978-1-84996-119-6_14
Interaction-Driven Self-adaptation of Service Ensembles,"Christoph Dorn,    Schahram Dustdar",2010,https://link.springer.com/chapter/10.1007/978-3-642-13094-6_31,https://link.springer.com/content/pdf/10.1007%2F978-3-642-13094-6_31.pdf,,,1,3,https://doi.org/10.1007/978-3-642-13094-6_31
Conventional Workflow Technology for Scientific Simulation,"Katharina Görlach,    Mirko Sonntag,    Dimka Karastoyanova,    Frank Leymann…",2011,https://link.springer.com/chapter/10.1007/978-0-85729-439-5_12,No PDF available,,,1,16,https://doi.org/10.1007/978-0-85729-439-5_12
Business Process Data Analysis,"Seyed-Mehdi-Reza Beheshti,    Boualem Benatallah,    Sherif Sakr…",2016,https://link.springer.com/chapter/10.1007/978-3-319-25037-3_5,No PDF available,,,1,1,https://doi.org/10.1007/978-3-319-25037-3_5
Making Sense of Monitoring Data to Support Managed Next-Generation Services: A Report on DANMS 2012,"John Keeney,    Joan Serrat-Fernández",2012,https://link.springer.com/article/10.1007/s10922-012-9252-2,No PDF available,,,1,No cite count available,https://doi.org/10.1007/s10922-012-9252-2
Ethics in Practice,Fiona Bannon,2018,https://link.springer.com/chapter/10.1007/978-3-319-91731-3_6,No PDF available,,,1,No cite count available,https://doi.org/10.1007/978-3-319-91731-3_6
Ubiquitous Computing,Dietmar P. F. Möller,2016,https://link.springer.com/chapter/10.1007/978-3-319-25178-3_5,No PDF available,,,1,No cite count available,https://doi.org/10.1007/978-3-319-25178-3_5
Literature review of Industry 4.0 and related technologies,"Ercan Oztemel,    Samet Gursev",2018,https://link.springer.com/article/10.1007/s10845-018-1433-8,No PDF available,,,1,2,https://doi.org/10.1007/s10845-018-1433-8
Scientific Proceedings (Abstracts) 25th German Cancer Congress,No author available,2002,https://link.springer.com/article/10.1007/BF01480868,No PDF available,,,1,No cite count available,https://doi.org/10.1007/BF01480868
Towards the Development of Large-Scale Data Warehouse Application Frameworks,"Duong Thi Anh Hoang,    Hieu Tran…",2012,https://link.springer.com/chapter/10.1007/978-3-642-28827-2_7,https://link.springer.com/content/pdf/10.1007%2F978-3-642-28827-2_7.pdf,,,1,No cite count available,https://doi.org/10.1007/978-3-642-28827-2_7
A mobile-agent-based approach to software coordination in the HOOPE system,"Xiaoxing Ma,    Jian Lü,    Xianping Tao…",2002,https://link.springer.com/article/10.1360/02yf9019,No PDF available,,,1,No cite count available,https://doi.org/10.1360/02yf9019
Expert Groups in the Field of Eurocracy,Cécile Robert,2013,https://link.springer.com/chapter/10.1057/9781137294708_7,No PDF available,,,1,No cite count available,https://doi.org/10.1057/9781137294708_7
Sound conflict management and resolution for virtual-enterprise collaborations,"Nanjangud C. Narendra,    Alex Norta…",2016,https://link.springer.com/article/10.1007/s11761-015-0183-0,No PDF available,,,1,1,https://doi.org/10.1007/s11761-015-0183-0
Interoperability in Smart Automation of Cyber Physical Systems,"Daniel Schilberg,    Max Hoffmann,    Sebastian Schmitz…",2017,https://link.springer.com/chapter/10.1007/978-3-319-42559-7_10,No PDF available,,,1,No cite count available,https://doi.org/10.1007/978-3-319-42559-7_10
High-Level Internet of Things Applications Development Using Wireless Sensor Networks,"Zhenyu Song,    Mihai T. Lazarescu,    Riccardo Tomasi,    Luciano Lavagno…",2014,https://link.springer.com/chapter/10.1007/978-3-319-04223-7_4,No PDF available,,,1,8,https://doi.org/10.1007/978-3-319-04223-7_4
A common approach to intelligent energy and mobility services in a smart city environment,"Marco Lützenberger,    Nils Masuch…",2015,https://link.springer.com/article/10.1007/s12652-015-0263-1,No PDF available,,,1,4,https://doi.org/10.1007/s12652-015-0263-1
Software Enabled Future Internet – Challenges in Orchestrating the Future Internet,"Alex Galis,    Javier Rubio-Loyola,    Stuart Clayman…",2013,https://link.springer.com/chapter/10.1007/978-3-319-04277-0_18,No PDF available,,,1,4,https://doi.org/10.1007/978-3-319-04277-0_18
"ENACT: Development, Operation, and Quality Assurance of Trustworthy Smart IoT Systems","Nicolas Ferry,    Arnor Solberg,    Hui Song…",2019,https://link.springer.com/chapter/10.1007/978-3-030-06019-0_9,No PDF available,,,1,No cite count available,https://doi.org/10.1007/978-3-030-06019-0_9
Beyond Interoperability in the Systems,Aleksander Lodwich…,2017,https://link.springer.com/chapter/10.1007/978-3-319-51905-0_8,No PDF available,,,1,No cite count available,https://doi.org/10.1007/978-3-319-51905-0_8
A Heuristic for Constrained Set Partitioning in the Light of Heterogeneous Objectives,"Gerrit Anders,    Florian Siefert,    Wolfgang Reif",2015,https://link.springer.com/chapter/10.1007/978-3-319-27947-3_12,No PDF available,,,1,2,https://doi.org/10.1007/978-3-319-27947-3_12
Models@run.time: a guided tour of the state of the art and research challenges,"Nelly Bencomo,    Sebastian Götz,    Hui Song",2019,https://link.springer.com/article/10.1007/s10270-018-00712-x,No PDF available,,,1,No cite count available,https://doi.org/10.1007/s10270-018-00712-x
Self-organization and multiagent systems: II. Applications and the development technology,V. I. Gorodetskii,2012,https://link.springer.com/article/10.1134/S1064230712020062,No PDF available,,,1,5,https://doi.org/10.1134/S1064230712020062
Cognitive forwarding control in wireless ad-hoc networks with slow fading channels,"Vesal Hakami,    Mehdi Dehghan",2015,https://link.springer.com/article/10.1007/s11276-015-0919-y,No PDF available,,,1,No cite count available,https://doi.org/10.1007/s11276-015-0919-y
Introduction – Transcultural Turbulences: Towards a Multi-sited Reading of Image Flows,"Christiane Brosius,    Roland Wenzlhuemer",2011,https://link.springer.com/chapter/10.1007/978-3-642-18393-5_1,No PDF available,,,1,No cite count available,https://doi.org/10.1007/978-3-642-18393-5_1
Cloud cover: monitoring large-scale clouds with Varanus,"Jonathan Stuart Ward,    Adam Barker",2015,https://link.springer.com/article/10.1186/s13677-015-0041-9,https://link.springer.com/content/pdf/10.1186%2Fs13677-015-0041-9.pdf,,,1,3,https://doi.org/10.1186/s13677-015-0041-9
Architectural Requirements for Cloud Computing Systems: An Enterprise Cloud Approach,"Bhaskar Prasad Rimal,    Admela Jukan,    Dimitrios Katsaros…",2011,https://link.springer.com/article/10.1007/s10723-010-9171-y,No PDF available,,,1,149,https://doi.org/10.1007/s10723-010-9171-y
Individualised Production,…,2012,https://link.springer.com/chapter/10.1007/978-3-642-21067-9_3,No PDF available,,,1,5,https://doi.org/10.1007/978-3-642-21067-9_3
Adaptive middleware for autonomic systems,"Steve Neely,    Simon Dobson,    Paddy Nixon",2006,https://link.springer.com/article/10.1007/BF03219883,No PDF available,,,1,3,https://doi.org/10.1007/BF03219883
Case Studies in the Service Industry Sector,No author available,2006,https://link.springer.com/chapter/10.1007/3-7908-1703-1_4,No PDF available,,,1,No cite count available,https://doi.org/10.1007/3-7908-1703-1_4
Aspects of Architecture and Urbanism in the Reconstruction of Disaster: Comparison of L’ Aquila (Italy) with Kolontar/Devecser (Hungary) and Corbeni (Romania) in the Context of Participative Reconstruction,Maria Bostenaru Dan,2014,https://link.springer.com/chapter/10.1007/978-94-007-7981-5_14,No PDF available,,,1,1,https://doi.org/10.1007/978-94-007-7981-5_14
From Angry Youth to Anxious Parents: The Mediated Politics of Everyday Life,Bingchun Meng,2018,https://link.springer.com/chapter/10.1057/978-1-137-46214-5_5,No PDF available,,,1,No cite count available,https://doi.org/10.1057/978-1-137-46214-5_5
Recommendation Systems: Bridging Technical Aspects with Marketing Implications,"Vafopoulos Michalis,    Oikonomou Michael",2013,https://link.springer.com/chapter/10.1007/978-3-642-28977-4_5,No PDF available,,,1,No cite count available,https://doi.org/10.1007/978-3-642-28977-4_5
A formalized framework for mobile cloud computing,"Michele Amoretti,    Alessandro Grazioli…",2015,https://link.springer.com/article/10.1007/s11761-014-0169-3,No PDF available,,,1,2,https://doi.org/10.1007/s11761-014-0169-3
B,"Douglas M. Considine P.E.,    Glenn D. Considine",1995,https://link.springer.com/chapter/10.1007/978-1-4757-6918-0_2,No PDF available,,,1,No cite count available,https://doi.org/10.1007/978-1-4757-6918-0_2
Green Urbanism: Holistic Pathways to the Rejuvenation of Mature Housing Estates in Singapore,Steffen Lehmann,2011,https://link.springer.com/chapter/10.1007/978-94-007-0383-4_8,No PDF available,,,1,2,https://doi.org/10.1007/978-94-007-0383-4_8
Experiences in building a mOSAIC of clouds,"Dana Petcu,    Beniamino Di Martino…",2013,https://link.springer.com/article/10.1186/2192-113X-2-12,https://link.springer.com/content/pdf/10.1186%2F2192-113X-2-12.pdf,,,1,42,https://doi.org/10.1186/2192-113X-2-12
Information Superiority,No author available,2007,https://link.springer.com/chapter/10.1007/978-1-4020-6456-2_1,No PDF available,,,1,No cite count available,https://doi.org/10.1007/978-1-4020-6456-2_1
Basic Methods,"Christian Müller-Schloer,    Sven Tomforde",2017,https://link.springer.com/chapter/10.1007/978-3-319-68477-2_7,No PDF available,,,1,No cite count available,https://doi.org/10.1007/978-3-319-68477-2_7
Towards Seamless Navigation,"Pekka Peltola,    Terry Moore",2017,https://link.springer.com/chapter/10.1007/978-3-319-50427-8_7,No PDF available,,,1,1,https://doi.org/10.1007/978-3-319-50427-8_7
"Genetic algorithms in wireless networking: techniques, applications, and issues","Usama Mehboob,    Junaid Qadir,    Salman Ali,    Athanasios Vasilakos",2016,https://link.springer.com/article/10.1007/s00500-016-2070-9,No PDF available,,,1,15,https://doi.org/10.1007/s00500-016-2070-9
Conceptualizing the STOF Model,"H. Bouwman,    E. Faber,    T. Haaker,    B. Kijl…",2008,https://link.springer.com/chapter/10.1007/978-3-540-79238-3_2,No PDF available,,,1,14,https://doi.org/10.1007/978-3-540-79238-3_2
"Organisations, Change, and Innovation",Axel Sommer,2012,https://link.springer.com/chapter/10.1007/978-3-642-28848-7_6,No PDF available,,,1,No cite count available,https://doi.org/10.1007/978-3-642-28848-7_6
Types for Security in a Mobile World,"Adriana B. Compagnoni,    Elsa L. Gunter",2005,https://link.springer.com/chapter/10.1007/11580850_6,No PDF available,,,1,1,https://doi.org/10.1007/11580850_6
The Technology of the 4th Industrial Revolution,"Mark Skilton,    Felix Hovsepian",2018,https://link.springer.com/chapter/10.1007/978-3-319-62479-2_2,No PDF available,,,1,No cite count available,https://doi.org/10.1007/978-3-319-62479-2_2
Intimate Multitudes: Juliana Spahr’s Ecopoetics,Meliz Ergin,2017,https://link.springer.com/chapter/10.1007/978-3-319-63263-6_4,No PDF available,,,1,No cite count available,https://doi.org/10.1007/978-3-319-63263-6_4
Theoretical framework,No author available,2008,https://link.springer.com/chapter/10.1007/978-3-7908-2054-6_2,No PDF available,,,1,No cite count available,https://doi.org/10.1007/978-3-7908-2054-6_2
Sources of Inspiration for Autonomic Computing,"Philippe Lalanda,    Julie A. McCann,    Ada Diaconescu",2013,https://link.springer.com/chapter/10.1007/978-1-4471-5007-7_3,No PDF available,,,1,No cite count available,https://doi.org/10.1007/978-1-4471-5007-7_3
Deep Middleware for the Divergent Grid,"Paul Grace,    Geoff Coulson,    Gordon S. Blair,    Barry Porter",2005,https://link.springer.com/chapter/10.1007/11587552_17,https://link.springer.com/content/pdf/10.1007%2F11587552_17.pdf,,,1,6,https://doi.org/10.1007/11587552_17
Firms' heterogeneity and sources of innovation and economic success beyond the scope of R&D,Oliver Som,2012,https://link.springer.com/chapter/10.1007/978-3-8349-3492-5_3,No PDF available,,,1,No cite count available,https://doi.org/10.1007/978-3-8349-3492-5_3
Pinpointing Tourism Information onto Mobile Maps — A Light-Weight Approach,"W. Schwinger,    C. Grün,    B. Pröll…",2006,https://link.springer.com/chapter/10.1007/3-211-32710-X_6,No PDF available,,,1,No cite count available,https://doi.org/10.1007/3-211-32710-X_6
Reinvigorating the EU-China Strategic Partnership,"Andreas Fulda,    Horst Fabian",2015,https://link.springer.com/chapter/10.1057/9781137518644_11,No PDF available,,,1,No cite count available,https://doi.org/10.1057/9781137518644_11
Towards Cooperative Semantic Computing: A Distributed Reasoning Approach for Fog-Enabled SWoT,"Nicolas Seydoux,    Khalil Drira…",2018,https://link.springer.com/chapter/10.1007/978-3-030-02610-3_23,No PDF available,,,1,No cite count available,https://doi.org/10.1007/978-3-030-02610-3_23
Survey on evolutionary computation methods for cybersecurity of mobile ad hoc networks,"Janusz Kusyk,    M. Umit Uyar,    Cem Safak Sahin",2018,https://link.springer.com/article/10.1007/s12065-018-0154-4,No PDF available,,,1,No cite count available,https://doi.org/10.1007/s12065-018-0154-4
Fog computing in internet of things: Practical applications and future directions,"Rida Zojaj Naeem,    Saman Bashir…",2019,https://link.springer.com/article/10.1007/s12083-019-00728-0,No PDF available,,,1,No cite count available,https://doi.org/10.1007/s12083-019-00728-0
ICT Tools and Systems Supporting Innovation in Product/Process Development,No author available,2009,https://link.springer.com/chapter/10.1007/978-1-84882-545-1_4,No PDF available,,,1,No cite count available,https://doi.org/10.1007/978-1-84882-545-1_4
A Decade of Technological Moderization: Negotiation and Organizational Change During the 1980s,No author available,2002,https://link.springer.com/chapter/10.1007/0-306-47187-6_3,No PDF available,,,1,No cite count available,https://doi.org/10.1007/0-306-47187-6_3
Pure Edge Computing Platform for the Future Internet,"Mirko D’Angelo,    Mauro Caporuscio",2016,https://link.springer.com/chapter/10.1007/978-3-319-50230-4_36,No PDF available,,,1,1,https://doi.org/10.1007/978-3-319-50230-4_36
