title,author,date,link,pdf_link,query,search_engine,nr_found,cite_count,doiMapping an ADL to a Component-Based Application Development Environment,"Virgínia C. C. de Paula,    Thais V. Batista",2002,https://link.springer.com/chapter/10.1007/3-540-45923-5_9,https://link.springer.com/content/pdf/10.1007%2F3-540-45923-5_9.pdf,,,1,1,https://doi.org/10.1007/3-540-45923-5_9
Architecture-Level Support for Software Component Deployment in Resource Constrained Environments,"Marija Mikic-Rakic,    Nenad Medvidovic",2002,https://link.springer.com/chapter/10.1007/3-540-45440-3_3,https://link.springer.com/content/pdf/10.1007%2F3-540-45440-3_3.pdf,,,1,12,https://doi.org/10.1007/3-540-45440-3_3
The Cordys Panel — Science Meets Business,No author available,2005,https://link.springer.com/chapter/10.1007/3-540-26694-1_5,No PDF available,,,1,No cite count available,https://doi.org/10.1007/3-540-26694-1_5
Entrenched Disbelief: Complex Hunter-Gatherers and the Case for Inclusive Cultural Evolutionary Thinking,"Jeanne E. Arnold,    Scott Sunell…",2016,https://link.springer.com/article/10.1007/s10816-015-9246-y,No PDF available,,,1,7,https://doi.org/10.1007/s10816-015-9246-y
Rethinking the ‘New’ Public Diplomacy,Brian Hocking,2005,https://link.springer.com/chapter/10.1057/9780230554931_2,No PDF available,,,1,15,https://doi.org/10.1057/9780230554931_2
Multiagent Environment Design for Pervasive Human-ICT Systems: The SAPERE Approach,"Gabriella Castelli,    Marco Mamei,    Alberto Rosi…",2013,https://link.springer.com/chapter/10.1007/978-1-4614-8806-4_44,No PDF available,,,1,No cite count available,https://doi.org/10.1007/978-1-4614-8806-4_44
Transformations and Innovations of Territorial Autonomies in the Aftermath of the Economic Crisis,Luciano Vandelli,2018,https://link.springer.com/chapter/10.1007/978-3-319-72493-5_5,No PDF available,,,1,No cite count available,https://doi.org/10.1007/978-3-319-72493-5_5
Structured Handling of Online Interface Upgrades in Integrating Dependable Systems of Systems,"Cliff Jones,    Panos Periorellis…",2003,https://link.springer.com/chapter/10.1007/3-540-36520-6_7,No PDF available,,,1,1,https://doi.org/10.1007/3-540-36520-6_7
Towards a Taxonomy of Microservices Architectures,Martin Garriga,2018,https://link.springer.com/chapter/10.1007/978-3-319-74781-1_15,No PDF available,,,1,2,https://doi.org/10.1007/978-3-319-74781-1_15
"A Transformation of the Sephardic Communities and Sarajevo Sephardic Attitudes Toward Yugoslavia, Spain and Israel",Jonna Rock,2019,https://link.springer.com/chapter/10.1007/978-3-030-14046-5_3,No PDF available,,,1,No cite count available,https://doi.org/10.1007/978-3-030-14046-5_3
Developing self-adaptive automotive systems,"Marco Wagner,    Ansgar Meroth,    Dieter Zöbel",2014,https://link.springer.com/article/10.1007/s10617-013-9124-3,https://link.springer.com/content/pdf/10.1007%2Fs10617-013-9124-3.pdf,,,1,1,https://doi.org/10.1007/s10617-013-9124-3
"Creativity, Openness, and User-Generated Cultures",Michael A. Peters,No year available,https://link.springer.com/referenceworkentry/10.1007/978-981-287-532-7_414-1,No PDF available,,,1,No cite count available,https://doi.org/10.1007/978-981-287-532-7
"Creativity, Openness and the Global Knowledge Economy","Michael A. Peters,    Tze-Chang Liu,    David J. Ondercin",2012,https://link.springer.com/chapter/10.1007/978-94-6091-967-1_2,No PDF available,,,1,No cite count available,https://doi.org/10.1007/978-94-6091-967-1_2
"Creativity, Openness, and User-Generated Cultures",Michael A. Peters,2017,https://link.springer.com/referenceworkentry/10.1007/978-981-287-588-4_414,No PDF available,,,1,No cite count available,https://doi.org/10.1007/978-981-287-588-4
From Literacy to Multiliteracies in ELT,Heather Lotherington,2007,https://link.springer.com/chapter/10.1007/978-0-387-46301-8_59,No PDF available,,,1,1,https://doi.org/10.1007/978-0-387-46301-8_59
Safe Cooperative Robot Patterns via Dynamics on Graphs,"Robert W. Ghrist,    Daniel E. Koditschek",1998,https://link.springer.com/chapter/10.1007/978-1-4471-1580-9_8,No PDF available,,,1,2,https://doi.org/10.1007/978-1-4471-1580-9_8
The Global Politics of Science and Technology: An Introduction,"Maximilian Mayer,    Mariana Carpes…",2014,https://link.springer.com/chapter/10.1007/978-3-642-55007-2_1,No PDF available,,,1,1,https://doi.org/10.1007/978-3-642-55007-2_1
The Form of the Experimental,Sönke Ahrens,2014,https://link.springer.com/chapter/10.1007/978-94-017-8709-3_3,No PDF available,,,1,No cite count available,https://doi.org/10.1007/978-94-017-8709-3_3
Future Communication Networks using Software Agents,"Alex L. G. Hayzelden,    John Bigham…",1999,https://link.springer.com/chapter/10.1007/978-3-642-58418-3_1,No PDF available,,,1,1,https://doi.org/10.1007/978-3-642-58418-3_1
Cross-Enterprise Business Process Management Architecture – Methods and Tools for Flexible Collaboration,"Sven Zang,    Anja Hofer,    Otmar Adam",2004,https://link.springer.com/chapter/10.1007/978-3-540-30470-8_62,No PDF available,,,1,No cite count available,https://doi.org/10.1007/978-3-540-30470-8_62
International Distribution,David Frederick Ross,2015,https://link.springer.com/chapter/10.1007/978-1-4899-7578-2_14,No PDF available,,,1,No cite count available,https://doi.org/10.1007/978-1-4899-7578-2_14
Introduction,No author available,2008,https://link.springer.com/chapter/10.1007/978-3-531-90999-8_1,No PDF available,,,1,No cite count available,https://doi.org/10.1007/978-3-531-90999-8_1
The Treaty of Lisbon,Justin Gibbins,2014,https://link.springer.com/chapter/10.1057/9781137376343_5,No PDF available,,,1,No cite count available,https://doi.org/10.1057/9781137376343_5
Autonomic Sensing,"Benny Lo,    Athanasia Panousopoulou,    Surapa Thiemjarus…",2014,https://link.springer.com/chapter/10.1007/978-1-4471-6374-9_10,No PDF available,,,1,No cite count available,https://doi.org/10.1007/978-1-4471-6374-9_10
Impact of Global Companies’ Real Options Implementation on Their Hungarian Subsidiaries,Andrea Szalavetz,2017,https://link.springer.com/chapter/10.1007/978-981-10-5233-0_8,No PDF available,,,1,No cite count available,https://doi.org/10.1007/978-981-10-5233-0_8
The Role of Corporate-Level Managers in Divestitures: A Process Model,Matthias Brauer,2007,https://link.springer.com/chapter/10.1007/978-3-8350-9386-7_5,No PDF available,,,1,No cite count available,https://doi.org/10.1007/978-3-8350-9386-7_5
Bibliography of Petri nets 1990,"Helmut Plünnecke,    Wolfgang Reisig",1991,https://link.springer.com/chapter/10.1007/BFb0019981,No PDF available,,,1,2,https://doi.org/10.1007/BFb0019981
"
mWater, a Case Study for Modeling Virtual Markets","Antonio Garrido,    Adriana Giret,    Vicente Botti,    Pablo Noriega",2013,https://link.springer.com/chapter/10.1007/978-94-007-5583-3_33,No PDF available,,,1,3,https://doi.org/10.1007/978-94-007-5583-3_33
Fog Networking: An Enabler for Next Generation Internet of Things,"Saad Qaisar,    Nida Riaz",2016,https://link.springer.com/chapter/10.1007/978-3-319-42108-7_27,No PDF available,,,1,No cite count available,https://doi.org/10.1007/978-3-319-42108-7_27
E-Sri Lanka as a Deliberate and Emergent Strategy Process,Nagy K. Hanna,2011,https://link.springer.com/article/10.1007/s13132-010-0028-1,No PDF available,,,1,No cite count available,https://doi.org/10.1007/s13132-010-0028-1
Soldiers and Governments in Postpraetorian Africa,Michel Louis Martin,2018,https://link.springer.com/chapter/10.1007/978-3-319-71602-2_12,No PDF available,,,1,No cite count available,https://doi.org/10.1007/978-3-319-71602-2_12
Analysis,PD Dr. Myriam Senn,2011,https://link.springer.com/chapter/10.1007/978-3-642-14974-0_5,No PDF available,,,1,No cite count available,https://doi.org/10.1007/978-3-642-14974-0_5
Urban Governance into the Future,"Chris Skelcher,    Helen Sullivan,    Stephen Jeffares",2013,https://link.springer.com/chapter/10.1057/9781137314789_7,No PDF available,,,1,No cite count available,https://doi.org/10.1057/9781137314789_7
Cultural Diversity and the School-To-Work Transition: A Relational Perspective,William G. Feighery,2013,https://link.springer.com/chapter/10.1007/978-94-007-5107-1_4,No PDF available,,,1,No cite count available,https://doi.org/10.1007/978-94-007-5107-1_4
Goudui and the State: Constructing Entrepreneurial Masculinity in Two Cosmopolitan Areas of Post-Socialist China,Everett Yuehong Zhang,2001,https://link.springer.com/chapter/10.1007/978-1-137-09944-0_9,No PDF available,,,1,13,https://doi.org/10.1007/978-1-137-09944-0_9
Semantic ambient media—an introduction,"Artur Lugmayr,    Thomas Risse,    Bjoern Stockleben…",2009,https://link.springer.com/article/10.1007/s11042-009-0282-z,No PDF available,,,1,19,https://doi.org/10.1007/s11042-009-0282-z
Self-Similarity and Criticality in Dispersed Manufacturing: A Contribution to Production Networks Control,Hermann Kühnle,2009,https://link.springer.com/chapter/10.1007/978-1-84882-468-3_4,No PDF available,,,1,1,https://doi.org/10.1007/978-1-84882-468-3_4
E-Sri Lanka as a Deliberate and Emergent Strategy Process,Nagy K. Hanna,2011,https://link.springer.com/chapter/10.1007/978-1-4614-0353-1_5,No PDF available,,,1,1,https://doi.org/10.1007/978-1-4614-0353-1_5
Conclusions and Future Research,Andrzej Jankowski,2017,https://link.springer.com/chapter/10.1007/978-3-319-57627-5_36,No PDF available,,,1,No cite count available,https://doi.org/10.1007/978-3-319-57627-5_36
"Network Topologies, Communication Protocols, and Standards","Javier Espina,    Thomas Falck,    Athanasia Panousopoulou,    Lars Schmitt…",2014,https://link.springer.com/chapter/10.1007/978-1-4471-6374-9_5,No PDF available,,,1,4,https://doi.org/10.1007/978-1-4471-6374-9_5
A Multi-agent Solution for the Deployment of Distributed Applications in Ambient Systems,"Ferdinand Piette,    Costin Caval,    Cédric Dinont…",2016,https://link.springer.com/chapter/10.1007/978-3-319-50983-9_9,No PDF available,,,1,No cite count available,https://doi.org/10.1007/978-3-319-50983-9_9
Architectural Issues,No author available,2006,https://link.springer.com/chapter/10.1007/978-0-387-35417-0_4,No PDF available,,,1,No cite count available,https://doi.org/10.1007/978-0-387-35417-0_4
Introduction,"Mario Ivan Lopez,    Jafar Suryomenggolo",2018,https://link.springer.com/chapter/10.1007/978-981-10-8881-0_1,No PDF available,,,1,No cite count available,https://doi.org/10.1007/978-981-10-8881-0_1
Conceptual Model of Business Services Availability vs. Interoperability on Collaborative IoT-enabled eBusiness Platforms,"Natalia Kryvinska,    Christine Strauss",2013,https://link.springer.com/chapter/10.1007/978-3-642-34952-2_7,No PDF available,,,1,9,https://doi.org/10.1007/978-3-642-34952-2_7
Mobile-Based DoS Attack Security Agent in Sensor Networking,"Donghyun Kim,    Sungmo Jung,    Dae-Joon Hwang,    Seoksoo Kim",2016,https://link.springer.com/article/10.1007/s11277-015-3098-3,No PDF available,,,1,2,https://doi.org/10.1007/s11277-015-3098-3
"Distributed Manufacturing: Paradigms, Concepts, Solutions and Examples",No author available,2010,https://link.springer.com/chapter/10.1007/978-1-84882-707-3_1,No PDF available,,,1,1,https://doi.org/10.1007/978-1-84882-707-3_1
Terminating distributed construction of shapes and patterns in a fair solution of automata,Othon Michail,2018,https://link.springer.com/article/10.1007/s00446-017-0309-z,https://link.springer.com/content/pdf/10.1007%2Fs00446-017-0309-z.pdf,,,1,3,https://doi.org/10.1007/s00446-017-0309-z
Eco-engineering for Water: From Soft to Hard and Back,Kelly Shannon,2013,https://link.springer.com/chapter/10.1007/978-94-007-5341-9_8,No PDF available,,,1,4,https://doi.org/10.1007/978-94-007-5341-9_8
Upgrading Shantytowns in Liaoning: The Challenge of Sustainable Housing Development,"Pengfei Ni,    Banji Oyelaran-Oyeyinka…",2015,https://link.springer.com/chapter/10.1007/978-3-662-43905-0_5,No PDF available,,,1,No cite count available,https://doi.org/10.1007/978-3-662-43905-0_5
An Informational Approach to Politics,Massimo Durante,2017,https://link.springer.com/chapter/10.1007/978-94-024-1150-8_9,No PDF available,,,1,No cite count available,https://doi.org/10.1007/978-94-024-1150-8_9
P3S: A Privacy Preserving Publish-Subscribe Middleware,"Partha Pal,    Greg Lauer,    Joud Khoury,    Nick Hoff,    Joe Loyall",2012,https://link.springer.com/chapter/10.1007/978-3-642-35170-9_24,No PDF available,,,1,7,https://doi.org/10.1007/978-3-642-35170-9_24
"Networks, terrorists and criminals: the implications for community policing",Michael Stohl,2008,https://link.springer.com/article/10.1007/s10611-008-9120-x,No PDF available,,,1,10,https://doi.org/10.1007/s10611-008-9120-x
Consistency in Distributed Systems,Kenneth P. Birman,2012,https://link.springer.com/chapter/10.1007/978-1-4471-2416-0_15,No PDF available,,,1,1,https://doi.org/10.1007/978-1-4471-2416-0_15
The Organisational Capability – Design: Designing Corporate Systems and Structures,"Paul H. Dainty,    Moreen Anderson",1996,https://link.springer.com/chapter/10.1007/978-1-349-13663-6_8,No PDF available,,,1,No cite count available,https://doi.org/10.1007/978-1-349-13663-6_8
Public Service Organizations: Social Networks and Social Capital,Ewan Ferlie,1999,https://link.springer.com/chapter/10.1007/978-1-4615-5027-3_16,No PDF available,,,1,No cite count available,https://doi.org/10.1007/978-1-4615-5027-3_16
USA: Sustainable Forest Management,Herman Hidayat,2018,https://link.springer.com/chapter/10.1007/978-981-10-7653-4_8,No PDF available,,,1,No cite count available,https://doi.org/10.1007/978-981-10-7653-4_8
Frameworks for Understanding,Xiaobai Shen,1999,https://link.springer.com/chapter/10.1057/9781403905505_2,No PDF available,,,1,No cite count available,https://doi.org/10.1057/9781403905505_2
Labour Union Strategies in the European Union Steel Sector,"Dean Stroud,    Peter Fairbrother",2009,https://link.springer.com/chapter/10.1057/9780230240889_8,No PDF available,,,1,2,https://doi.org/10.1057/9780230240889_8
Collaborative Systems in Support of Reindustrialization,Luis M. Camarinha-Matos,2013,https://link.springer.com/chapter/10.1007/978-3-642-40543-3_1,https://link.springer.com/content/pdf/10.1007%2F978-3-642-40543-3_1.pdf,,,1,No cite count available,https://doi.org/10.1007/978-3-642-40543-3_1
Institutional change and higher education,"Steven Loomis,    Jacob Rodriguez",2009,https://link.springer.com/article/10.1007/s10734-009-9206-0,No PDF available,,,1,4,https://doi.org/10.1007/s10734-009-9206-0
Introduction: A Post-Colonial Critique of Capital Accumulation Today,"Iman Kumar Mitra,    Ranabir Samaddar,    Samita Sen",2017,https://link.springer.com/chapter/10.1007/978-981-10-1037-8_1,No PDF available,,,1,1,https://doi.org/10.1007/978-981-10-1037-8_1
Agent Architecture for Dynamic Job Routing in Holonic Environment Based on the Theory of Constraints,"Leonid B. Sheremetov,    Jorge Martínez…",2003,https://link.springer.com/chapter/10.1007/978-3-540-45185-3_12,No PDF available,,,1,1,https://doi.org/10.1007/978-3-540-45185-3_12
Strategy and Innovation,Alan Moran,2015,https://link.springer.com/chapter/10.1007/978-3-319-16262-1_2,No PDF available,,,1,No cite count available,https://doi.org/10.1007/978-3-319-16262-1_2
"Addressing the Complexity of HPC in the Cloud: Emergence, Self-Organisation, Self-Management, and the Separation of Concerns",Theo Lynn,2018,https://link.springer.com/chapter/10.1007/978-3-319-76038-4_1,https://link.springer.com/content/pdf/10.1007%2F978-3-319-76038-4_1.pdf,,,1,No cite count available,https://doi.org/10.1007/978-3-319-76038-4_1
Positionality in the Digital Age: Virtual Bodies and the Effects of Virtual Experiences,Stefano Gualeni,2015,https://link.springer.com/chapter/10.1057/9781137521781_6,No PDF available,,,1,No cite count available,https://doi.org/10.1057/9781137521781_6
Grey Zones of the Market,"Julia Püschel,    Boris Vormann",2012,https://link.springer.com/chapter/10.1007/978-94-6091-817-9_2,No PDF available,,,1,No cite count available,https://doi.org/10.1007/978-94-6091-817-9_2
A Load Balancing Algorithm for Multi-agent Systems,"Iulia Ştefan,    George Moiş,    Szilárd Enyedi…",2012,https://link.springer.com/chapter/10.1007/978-3-642-27449-7_8,No PDF available,,,1,No cite count available,https://doi.org/10.1007/978-3-642-27449-7_8
“Inescapable Networks of Mutuality”: The Development of Transitional Justice in the United States,James Edward Beitler III,2013,https://link.springer.com/chapter/10.1007/978-1-4614-5295-9_6,No PDF available,,,1,No cite count available,https://doi.org/10.1007/978-1-4614-5295-9_6
Mobile Ambients in Aspect-Oriented Software Architectures,"Nour Ali,    Jennifer Pérez,    Cristóbal Costa…",2007,https://link.springer.com/chapter/10.1007/978-0-387-39388-9_4,https://link.springer.com/content/pdf/10.1007%2F978-0-387-39388-9_4.pdf,,,1,1,https://doi.org/10.1007/978-0-387-39388-9_4
The Relevance of the Early Warning of Cyber-attacks,Sergei Petrenko,2018,https://link.springer.com/chapter/10.1007/978-3-319-79036-7_1,No PDF available,,,1,No cite count available,https://doi.org/10.1007/978-3-319-79036-7_1
Documenting the Lives of Ohio Hopewell People: A Philosophical and Empirical Foundation,"Christopher Carr,    D. Troy Case",2008,https://link.springer.com/chapter/10.1007/978-0-387-77387-2_1,No PDF available,,,1,1,https://doi.org/10.1007/978-0-387-77387-2_1
Propagating Solution: Argumentative Strategies to Cement Coalitions,Philippe Zittoun,2014,https://link.springer.com/chapter/10.1057/9781137347664_4,No PDF available,,,1,No cite count available,https://doi.org/10.1057/9781137347664_4
"Trust Communities: An Open, Self-Organised Social Infrastructure of Autonomous Agents","Sarah Edenhofer,    Sven Tomforde,    Jan Kantert…",2016,https://link.springer.com/chapter/10.1007/978-3-319-29201-4_5,No PDF available,,,1,3,https://doi.org/10.1007/978-3-319-29201-4_5
On the Road to Constitutionalism: “Publius” and a Continental European Searchlight,Univ.-Prof. Mag. Dr. Anna Gamper,2009,https://link.springer.com/chapter/10.1007/978-3-211-92818-9_2,No PDF available,,,1,No cite count available,https://doi.org/10.1007/978-3-211-92818-9_2
2. Basics of Collaborative Problem Solving,No author available,2002,https://link.springer.com/chapter/10.1007/3-540-45834-4_2,No PDF available,,,1,No cite count available,https://doi.org/10.1007/3-540-45834-4_2
Analytical Sociology: A Bungean Appreciation,Poe Yu-ze Wan,2012,https://link.springer.com/article/10.1007/s11191-011-9427-3,No PDF available,,,1,5,https://doi.org/10.1007/s11191-011-9427-3
Understanding Market Competition,Rajagopal,2012,https://link.springer.com/chapter/10.1057/9781137268334_2,No PDF available,,,1,No cite count available,https://doi.org/10.1057/9781137268334_2
From Urban Reform to Parkway,Matthew Dalbey,2002,https://link.springer.com/chapter/10.1007/978-1-4615-1083-3_2,No PDF available,,,1,No cite count available,https://doi.org/10.1007/978-1-4615-1083-3_2
Dynamically Scheduling a Component-Based Framework in Clusters,"Aleksandra Kuzmanovska,    Rudolf H. Mak…",2015,https://link.springer.com/chapter/10.1007/978-3-319-15789-4_8,No PDF available,,,1,3,https://doi.org/10.1007/978-3-319-15789-4_8
The Role of Trust Management in Distributed Systems Security,"Matt Blaze,    Joan Feigenbaum,    John Ioannidis…",1999,https://link.springer.com/chapter/10.1007/3-540-48749-2_8,No PDF available,,,1,125,https://doi.org/10.1007/3-540-48749-2_8
Implementing an EMA Innovation: The Case of Carbon Accounting,Delphine Gibassier,2015,https://link.springer.com/chapter/10.1007/978-3-319-27718-9_6,No PDF available,,,1,No cite count available,https://doi.org/10.1007/978-3-319-27718-9_6
Towards a Generic Value Network for Cloud Computing,"Markus Böhm,    Galina Koleva…",2010,https://link.springer.com/chapter/10.1007/978-3-642-15681-6_10,No PDF available,,,1,16,https://doi.org/10.1007/978-3-642-15681-6_10
Automaton-on-Tag: An Approach for an RFID-Driven Production Control with Mealy Machines Stored on an RFID Tag,"Timo Busert,    Aljosha Köcher,    Robert Julius…",2017,https://link.springer.com/chapter/10.1007/978-3-319-66923-6_21,No PDF available,,,1,No cite count available,https://doi.org/10.1007/978-3-319-66923-6_21
The Clerics and the Critics: Misogyny and the Social Symbolic in Anglo-Saxon England,"Clare A. Lees,    Gillian R. Overing",2002,https://link.springer.com/chapter/10.1007/978-1-137-07997-8_2,No PDF available,,,1,No cite count available,https://doi.org/10.1007/978-1-137-07997-8_2
The Business Perspective,"Olaf Zimmermann,    Mark Tomlinson,    Stefan Peuser",2003,https://link.springer.com/chapter/10.1007/978-3-642-55514-5_1,No PDF available,,,1,No cite count available,https://doi.org/10.1007/978-3-642-55514-5_1
The Role of Semantic Technologies in Future PLM,Detlef Gerhard,2013,https://link.springer.com/chapter/10.1007/978-3-642-34471-8_13,No PDF available,,,1,1,https://doi.org/10.1007/978-3-642-34471-8_13
Introduction,Katrin Sieg,2008,https://link.springer.com/chapter/10.1057/9780230615458_1,No PDF available,,,1,No cite count available,https://doi.org/10.1057/9780230615458_1
"Superintendents in Sweden: Structures, Cultural Relations and Leadership","Olof Johansson,    Elisabet Nihlfors…",2016,https://link.springer.com/chapter/10.1007/978-3-319-25106-6_5,No PDF available,,,1,No cite count available,https://doi.org/10.1007/978-3-319-25106-6_5
The “Vernacular Only” Writing Mode,Gang Zhou,2011,https://link.springer.com/chapter/10.1057/9780230117044_5,No PDF available,,,1,No cite count available,https://doi.org/10.1057/9780230117044_5
The “Vernacular Only” Writing Mode,Gang Zhou,2011,https://link.springer.com/chapter/10.1007/978-0-230-11704-4_5,No PDF available,,,1,No cite count available,https://doi.org/10.1007/978-0-230-11704-4_5
"Regionalism, Nationalism, and the Italian Censuses","Rebecca Jean Emigh,    Dylan Riley…",2016,https://link.springer.com/chapter/10.1057/9781137485069_4,No PDF available,,,1,No cite count available,https://doi.org/10.1057/9781137485069_4
Entrepreneurial Executives,No author available,2006,https://link.springer.com/chapter/10.1007/978-3-540-34761-3_8,No PDF available,,,1,No cite count available,https://doi.org/10.1007/978-3-540-34761-3_8
Futures of Human Evolution,Elizabeth Song Lockard,2014,https://link.springer.com/chapter/10.1007/978-3-319-05930-3_6,No PDF available,,,1,No cite count available,https://doi.org/10.1007/978-3-319-05930-3_6
Representation,Christopher Lord,2004,https://link.springer.com/chapter/10.1057/9781403948168_5,No PDF available,,,1,No cite count available,https://doi.org/10.1057/9781403948168_5
Entr’acte: Sound Junctures of Global Modernity,meLê yamomo,2018,https://link.springer.com/chapter/10.1007/978-3-319-69176-3_5,No PDF available,,,1,No cite count available,https://doi.org/10.1007/978-3-319-69176-3_5
Social Entrepreneurship Business Models: Managing Innovation for Social and Economic Value Creation,"Anica Zeyen,    Prof. Dr. Markus Beckmann…",2014,https://link.springer.com/chapter/10.1007/978-3-658-02523-6_7,No PDF available,,,1,1,https://doi.org/10.1007/978-3-658-02523-6_7
"Maps, Minds, and Visions",Rana Mitter,2008,https://link.springer.com/chapter/10.1057/9780230227606_6,No PDF available,,,1,No cite count available,https://doi.org/10.1057/9780230227606_6
Colombia's cocaine syndicates,Rensselaer W. Lee III,1991,https://link.springer.com/article/10.1007/BF00389736,No PDF available,,,1,No cite count available,https://doi.org/10.1007/BF00389736
Preservation and Paradox: Choreographic Authorship in the Digital Sphere,Hetty Blades,2018,https://link.springer.com/chapter/10.1007/978-3-319-73817-8_16,No PDF available,,,1,No cite count available,https://doi.org/10.1007/978-3-319-73817-8_16
Regions and European Governance,Romain Pasquier,2015,https://link.springer.com/chapter/10.1057/9781137484468_6,No PDF available,,,1,No cite count available,https://doi.org/10.1057/9781137484468_6
Globalizing Integrated Water Resources Management: A Complicated Option in Southern Africa,Claudious Chikozho,2008,https://link.springer.com/article/10.1007/s11269-007-9223-7,No PDF available,,,1,13,https://doi.org/10.1007/s11269-007-9223-7
The EU’s Affair with Kosovo,"Rok Zupančič,    Nina Pejič",2018,https://link.springer.com/chapter/10.1007/978-3-319-77824-2_3,https://link.springer.com/content/pdf/10.1007%2F978-3-319-77824-2_3.pdf,,,1,No cite count available,https://doi.org/10.1007/978-3-319-77824-2_3
Eurasian Transport Integration Beyond Energy: Geoeconomic Transformation and Geostrategic Response,Jacopo Maria Pepe,2018,https://link.springer.com/chapter/10.1007/978-3-658-20192-0_5,No PDF available,,,1,No cite count available,https://doi.org/10.1007/978-3-658-20192-0_5
Introduction: The Emergence of Pre-Cinema,Alberto Gabriele,2016,https://link.springer.com/chapter/10.1057/978-1-137-54592-3_1,No PDF available,,,1,No cite count available,https://doi.org/10.1057/978-1-137-54592-3_1
Integrating energy and land-use planning: socio-metabolic profiles along the rural–urban continuum in Catalonia (Spain),"Pere Ariza-Montobbio,    Katharine N. Farrell…",2014,https://link.springer.com/article/10.1007/s10668-014-9533-x,No PDF available,,,1,6,https://doi.org/10.1007/s10668-014-9533-x
"Industrial policy, competence blocs and the role of science in economic development",Gunnar Eliasson,2001,https://link.springer.com/chapter/10.1007/978-3-662-11287-8_12,No PDF available,,,1,No cite count available,https://doi.org/10.1007/978-3-662-11287-8_12
S,Stewart Fist,1996,https://link.springer.com/chapter/10.1007/978-1-4615-2093-1_20,No PDF available,,,1,No cite count available,https://doi.org/10.1007/978-1-4615-2093-1_20
