title,author,date,link,pdf_link,query,search_engine,nr_found,cite_count,doiSemantic-Based Policy Engineering for Autonomic Systems,"David Lewis,    Kevin Feeney,    Kevin Carey,    Thanassis Tiropanis…",2005,https://link.springer.com/chapter/10.1007/11520184_12,https://link.springer.com/content/pdf/10.1007%2F11520184_12.pdf,,,1,2,https://doi.org/10.1007/11520184_12
Refining the ethics of computer-made decisions: a classification of moral mediation by ubiquitous machines,"Marlies Van de Voort,    Wolter Pieters,    Luca Consoli",2015,https://link.springer.com/article/10.1007/s10676-015-9360-2,https://link.springer.com/content/pdf/10.1007%2Fs10676-015-9360-2.pdf,,,1,5,https://doi.org/10.1007/s10676-015-9360-2
Fault-Resilient Pervasive Service Composition,"Hen-I Yang,    Raja Bose,    Abdelsalam (Sumi) Helal…",2009,https://link.springer.com/chapter/10.1007/978-0-387-76485-6_9,No PDF available,,,1,2,https://doi.org/10.1007/978-0-387-76485-6_9
Adaptation of Service-Based Systems,"Raman Kazhamiakin,    Salima Benbernou…",2010,https://link.springer.com/chapter/10.1007/978-3-642-17599-2_5,No PDF available,,,1,10,https://doi.org/10.1007/978-3-642-17599-2_5
"Enabling Autonomic Grid Applications: Dynamic Composition, Coordination and Interaction","Zhen Li,    Manish Parashar",2005,https://link.springer.com/chapter/10.1007/11527800_21,No PDF available,,,1,No cite count available,https://doi.org/10.1007/11527800_21
Self-configuration in MANETs: Different Perspectives,"Jing Wang,    R. Venkatesha Prasad,    Ignas Niemegeers",2007,https://link.springer.com/chapter/10.1007/978-3-540-74917-2_18,No PDF available,,,1,5,https://doi.org/10.1007/978-3-540-74917-2_18
Distributed Defeasible Speculative Reasoning in Ambient Environment,"Ho-Pun Lam,    Guido Governatori,    Ken Satoh…",2012,https://link.springer.com/chapter/10.1007/978-3-642-32897-8_5,No PDF available,,,1,3,https://doi.org/10.1007/978-3-642-32897-8_5
Towards Autonomically-Capable Processes: A Vision and Potentially Supportive Methods,"Roy Oberhauser,    Gregor Grambow",2017,https://link.springer.com/chapter/10.1007/978-3-319-52181-7_4,No PDF available,,,1,No cite count available,https://doi.org/10.1007/978-3-319-52181-7_4
Extending Semantic Web Tools for Improving Smart Spaces Interoperability and Usability,"Natalia Díaz Rodríguez,    Johan Lilius…",2013,https://link.springer.com/chapter/10.1007/978-3-319-00551-5_6,No PDF available,,,1,3,https://doi.org/10.1007/978-3-319-00551-5_6
A survey of service composition in ambient intelligence environments,"Thanos G. Stavropoulos,    Dimitris Vrakas,    Ioannis Vlahavas",2013,https://link.springer.com/article/10.1007/s10462-011-9283-1,No PDF available,,,1,17,https://doi.org/10.1007/s10462-011-9283-1
Object Tracking Using Durative Events,"Eiko Yoneki,    Jean Bacon",2005,https://link.springer.com/chapter/10.1007/11596042_68,https://link.springer.com/content/pdf/10.1007%2F11596042_68.pdf,,,1,1,https://doi.org/10.1007/11596042_68
Enabling Pervasive Collaboration with Platform Composition,"Trevor Pering,    Roy Want,    Barbara Rosario,    Shivani Sud,    Kent Lyons",2009,https://link.springer.com/chapter/10.1007/978-3-642-01516-8_14,No PDF available,,,1,11,https://doi.org/10.1007/978-3-642-01516-8_14
Computational Context to Promote Geographic Information Systems toward Human-Centric Perspectives,Luis Paulo da Silva Carvalho…,2012,https://link.springer.com/chapter/10.1007/978-3-642-31075-1_14,No PDF available,,,1,No cite count available,https://doi.org/10.1007/978-3-642-31075-1_14
"Paradigms of Distributed Software Systems: Services, Processes and Self-organization",Winfried Lamersdorf,2012,https://link.springer.com/chapter/10.1007/978-3-642-35755-8_3,No PDF available,,,1,No cite count available,https://doi.org/10.1007/978-3-642-35755-8_3
Lessons in Software Evolution Learned by Listening to Smalltalk,"Oscar Nierstrasz,    Tudor Gîrba",2010,https://link.springer.com/chapter/10.1007/978-3-642-11266-9_7,No PDF available,,,1,1,https://doi.org/10.1007/978-3-642-11266-9_7
Cloud Services Composition Support by Using Semantic Annotation and Linked Data,"Martín Serrano,    Lei Shi,    Mícheál Ó Foghlú…",2013,https://link.springer.com/chapter/10.1007/978-3-642-37186-8_18,No PDF available,,,1,3,https://doi.org/10.1007/978-3-642-37186-8_18
Non-intrusive contextual dynamic reconfiguration of ambient intelligent IoT systems,"Amira Hakim,    Abdelkrim Amirat…",2018,https://link.springer.com/article/10.1007/s12652-018-1127-2,No PDF available,,,1,No cite count available,https://doi.org/10.1007/s12652-018-1127-2
Mobile agent based framework for mobile ubiquitous application development,"Seungkeun Lee,    Kuinam Kim",2012,https://link.springer.com/article/10.1007/s11235-011-9423-6,No PDF available,,,1,No cite count available,https://doi.org/10.1007/s11235-011-9423-6
Technical Framework for Internetware: An Architecture Centric Approach,"Hong Mei,    Jian Lü",2016,https://link.springer.com/chapter/10.1007/978-981-10-2546-4_2,No PDF available,,,1,No cite count available,https://doi.org/10.1007/978-981-10-2546-4_2
A survey of security issue in multi-agent systems,"Youna Jung,    Minsoo Kim,    Amirreza Masoumzadeh…",2012,https://link.springer.com/article/10.1007/s10462-011-9228-8,No PDF available,,,1,25,https://doi.org/10.1007/s10462-011-9228-8
Technical framework for Internetware: An architecture centric approach,"FuQing Yang,    Jian Lü,    Hong Mei",2008,https://link.springer.com/article/10.1007/s11432-008-0051-z,No PDF available,,,1,28,https://doi.org/10.1007/s11432-008-0051-z
"ENACT: Development, Operation, and Quality Assurance of Trustworthy Smart IoT Systems","Nicolas Ferry,    Arnor Solberg,    Hui Song…",2019,https://link.springer.com/chapter/10.1007/978-3-030-06019-0_9,No PDF available,,,1,No cite count available,https://doi.org/10.1007/978-3-030-06019-0_9
Extending In-Home User and Context Models to Provide Ubiquitous Adaptive Support Outside the Home,"Amaia Aizpurua,    Idoia Cearreta…",2013,https://link.springer.com/chapter/10.1007/978-1-4471-4778-7_2,No PDF available,,,1,2,https://doi.org/10.1007/978-1-4471-4778-7_2
Middleware Technology for IoT Systems: Challenges and Perspectives Toward 5G,"Leonardo Albernaz Amaral,    Everton de Matos…",2016,https://link.springer.com/chapter/10.1007/978-3-319-30913-2_15,No PDF available,,,1,No cite count available,https://doi.org/10.1007/978-3-319-30913-2_15
Context provenance to enhance the dependability of ambient intelligence systems,"Daniele Riboni,    Claudio Bettini",2012,https://link.springer.com/article/10.1007/s00779-011-0448-3,No PDF available,,,1,6,https://doi.org/10.1007/s00779-011-0448-3
An Adaptive Error Detection-Recovery QOS for Intelligent Context-Awareness: AEDRQ,Eung Nam Ko,2006,https://link.springer.com/chapter/10.1007/978-3-540-37256-1_130,No PDF available,,,1,No cite count available,https://doi.org/10.1007/978-3-540-37256-1_130
Service optimal selection and composition in cloud manufacturing: a comprehensive survey,"Hamed Bouzary,    F. Frank Chen",2018,https://link.springer.com/article/10.1007/s00170-018-1910-4,No PDF available,,,1,4,https://doi.org/10.1007/s00170-018-1910-4
Middleware for internet of things: an evaluation in a small-scale IoT environment,"Andrei Palade,    Christian Cabrera,    Fan Li…",2018,https://link.springer.com/article/10.1007/s40860-018-0055-4,No PDF available,,,1,No cite count available,https://doi.org/10.1007/s40860-018-0055-4
Some Engineering Applications of the OTS/CafeOBJ Method,"Petros Stefaneas,    Iakovos Ouranos…",2014,https://link.springer.com/chapter/10.1007/978-3-642-54624-2_27,No PDF available,,,1,No cite count available,https://doi.org/10.1007/978-3-642-54624-2_27
Agent-Based Task Decomposing Technique for Web Service Composition,"Wenjuan Lian,    Hua Duan,    Jingjing Yan…",2012,https://link.springer.com/chapter/10.1007/978-3-642-31576-3_78,No PDF available,,,1,No cite count available,https://doi.org/10.1007/978-3-642-31576-3_78
Abstracts,No author available,2015,https://link.springer.com/article/10.1007/s12160-015-9688-1,No PDF available,,,1,No cite count available,https://doi.org/10.1007/s12160-015-9688-1
A Comparative Study of Aspect-Oriented and Object-Oriented Implementations: Pervasive System Use Case,"Benamar Abdelkrim,    Belkhatir Noureddine…",2011,https://link.springer.com/chapter/10.1007/978-3-642-22410-2_15,No PDF available,,,1,No cite count available,https://doi.org/10.1007/978-3-642-22410-2_15
Context-based Cooperation in Mobile Business Environments,Dipl.-Inf. Sonja Zaplata…,2009,https://link.springer.com/article/10.1007/s12599-009-0060-5,https://link.springer.com/content/pdf/10.1007%2Fs12599-009-0060-5.pdf,,,1,5,https://doi.org/10.1007/s12599-009-0060-5
Middleware Infrastructures for Self-organising Pervasive Computing Systems,"Matteo Casadei,    Marco Mamei,    Cynthia Villalba,    Mirko Viroli…",2011,https://link.springer.com/chapter/10.1007/978-3-642-17348-6_13,No PDF available,,,1,No cite count available,https://doi.org/10.1007/978-3-642-17348-6_13
Dependability Modeling and Certification of Cloud-Based Distributed Systems,Kaliappa Ravindran,2013,https://link.springer.com/chapter/10.1007/978-3-642-41428-2_27,No PDF available,,,1,No cite count available,https://doi.org/10.1007/978-3-642-41428-2_27
Smartness of Pervasive Computing Systems through Context-Awareness,Arkady Zaslavsky,2008,https://link.springer.com/chapter/10.1007/978-3-540-85500-2_25,No PDF available,,,1,No cite count available,https://doi.org/10.1007/978-3-540-85500-2_25
Controlling Process Modularity in Mobile Computing,"Takashi Kitamura,    Huimin Lin",2007,https://link.springer.com/chapter/10.1007/978-3-540-75292-9_17,No PDF available,,,1,1,https://doi.org/10.1007/978-3-540-75292-9_17
Engineering Reconfigurable Distributed Software Systems: Issues Arising for Pervasive Computing,"Apostolos Zarras,    Manel Fredj…",2006,https://link.springer.com/chapter/10.1007/11916246_19,No PDF available,,,1,5,https://doi.org/10.1007/11916246_19
Augmented Agents: Contextual Perception and Planning for BDI Architectures,"Arthur Casals,    Amal El Fallah-Seghrouchni…",2018,https://link.springer.com/chapter/10.1007/978-3-319-91899-0_3,No PDF available,,,1,No cite count available,https://doi.org/10.1007/978-3-319-91899-0_3
ScudWare: Software Infrastructure for SmartShadow,"Zhaohui Wu,    Gang Pan",2013,https://link.springer.com/chapter/10.1007/978-3-642-36382-5_5,No PDF available,,,1,No cite count available,https://doi.org/10.1007/978-3-642-36382-5_5
Collaborative learning via social computing,"Ricardo S. Alonso,    Javier Prieto…",2019,https://link.springer.com/article/10.1631/FITEE.1700840,No PDF available,,,1,No cite count available,https://doi.org/10.1631/FITEE.1700840
Bringing Quality of Context into Wearable Human Activity Recognition Systems,"Claudia Villalonga,    Daniel Roggen,    Clemens Lombriser,    Piero Zappi…",2009,https://link.springer.com/chapter/10.1007/978-3-642-04559-2_15,No PDF available,,,1,4,https://doi.org/10.1007/978-3-642-04559-2_15
"
AIOCJ: A Choreographic Framework for Safe Adaptive Distributed Applications","Mila Dalla Preda,    Saverio Giallorenzo,    Ivan Lanese…",2014,https://link.springer.com/chapter/10.1007/978-3-319-11245-9_9,No PDF available,,,1,15,https://doi.org/10.1007/978-3-319-11245-9_9
Engineering of Software-Intensive Systems: State of the Art and Research Challenges,"Matthias Hölzl,    Axel Rauschmayer…",2008,https://link.springer.com/chapter/10.1007/978-3-540-89437-7_1,No PDF available,,,1,13,https://doi.org/10.1007/978-3-540-89437-7_1
A Programmable Context Interface to Build a Context Infrastructure for Worldwide Smart Applications,"Kyung-Lang Park,    Chang-Soon Kim…",2005,https://link.springer.com/chapter/10.1007/11596356_79,No PDF available,,,1,2,https://doi.org/10.1007/11596356_79
Distributed Trust Management for Validating SLA Choreographies,"Irfan Ul Haq,    Rehab Alnemr,    Adrian Paschke…",2010,https://link.springer.com/chapter/10.1007/978-1-4419-7320-7_5,No PDF available,,,1,17,https://doi.org/10.1007/978-1-4419-7320-7_5
Is Group-Awareness Context-Awareness?,"Manuele Kirsch Pinheiro,    Carine Souveyet",2018,https://link.springer.com/chapter/10.1007/978-3-319-99504-5_16,No PDF available,,,1,No cite count available,https://doi.org/10.1007/978-3-319-99504-5_16
Towards User-Aware Service Composition,"Giacomo Cabri,    Mauro Leoncini…",2016,https://link.springer.com/chapter/10.1007/978-3-319-46909-6_2,No PDF available,,,1,No cite count available,https://doi.org/10.1007/978-3-319-46909-6_2
The CASCADAS Framework for Autonomic Communications,"Luciano Baresi,    Antonio Di Ferdinando,    Antonio Manzalini…",2009,https://link.springer.com/chapter/10.1007/978-0-387-09753-4_6,No PDF available,,,1,11,https://doi.org/10.1007/978-0-387-09753-4_6
Towards Ambient Networks Management,"Marcus Brunner,    Alex Galis,    Lawrence Cheng…",2005,https://link.springer.com/chapter/10.1007/11569510_21,No PDF available,,,1,5,https://doi.org/10.1007/11569510_21
A brief introduction to distributed systems,"Maarten van Steen,    Andrew S. Tanenbaum",2016,https://link.springer.com/article/10.1007/s00607-016-0508-7,https://link.springer.com/content/pdf/10.1007%2Fs00607-016-0508-7.pdf,,,1,5,https://doi.org/10.1007/s00607-016-0508-7
LWOAD: A Specification Language to Enable the End-User Develoment of Coordinative Functionalities,"Federico Cabitza,    Carla Simone",2009,https://link.springer.com/chapter/10.1007/978-3-642-00427-8_9,No PDF available,,,1,3,https://doi.org/10.1007/978-3-642-00427-8_9
Challenges in Modeling and Disseminating Context Information in Ambient Networks,"Dineshbalu Balakrishnan,    May El Barachi…",2005,https://link.springer.com/chapter/10.1007/11569510_4,No PDF available,,,1,3,https://doi.org/10.1007/11569510_4
Network enablers for enhanced mobility management,"R. Giaffreda,    F. de Carvalho,    T. Melia",2007,https://link.springer.com/article/10.1007/s10550-007-0032-6,No PDF available,,,1,1,https://doi.org/10.1007/s10550-007-0032-6
Programming Self-organizing Pervasive Applications with SAPERE,"Franco Zambonelli,    Gabriella Castelli,    Marco Mamei…",2014,https://link.springer.com/chapter/10.1007/978-3-319-01571-2_12,No PDF available,,,1,4,https://doi.org/10.1007/978-3-319-01571-2_12
Runtime support for type-safe and context-based behavior adaptation,"Changpeng Zhu,    Yinliang Zhao,    Bo Han,    Qinghua Zeng…",2014,https://link.springer.com/article/10.1007/s11704-013-2337-6,No PDF available,,,1,2,https://doi.org/10.1007/s11704-013-2337-6
Smart Homes for All: Collaborating Services in a for-All Architecture for Domotics,"Tiziana Catarci,    Febo Cincotti…",2009,https://link.springer.com/chapter/10.1007/978-3-642-03354-4_6,No PDF available,,,1,1,https://doi.org/10.1007/978-3-642-03354-4_6
"Adaptive, intelligent presentation of information for the museum visitor in PEACH","Oliviero Stock,    Massimo Zancanaro…",2007,https://link.springer.com/article/10.1007/s11257-007-9029-6,No PDF available,,,1,75,https://doi.org/10.1007/s11257-007-9029-6
A survey of autonomic computing methods in digital service ecosystems,"Dhaminda B. Abeywickrama,    Eila Ovaska",2017,https://link.springer.com/article/10.1007/s11761-016-0203-8,https://link.springer.com/content/pdf/10.1007%2Fs11761-016-0203-8.pdf,,,1,1,https://doi.org/10.1007/s11761-016-0203-8
Expressing and Configuring Quality of Data in Multi-purpose Wireless Sensor Networks,"Pedro Javier del Cid,    Daniel Hughes,    Sam Michiels…",2011,https://link.springer.com/chapter/10.1007/978-3-642-23583-2_7,No PDF available,,,1,No cite count available,https://doi.org/10.1007/978-3-642-23583-2_7
Autonomic communication services: a new challenge for software agents,"Raffaele Quitadamo,    Franco Zambonelli",2008,https://link.springer.com/article/10.1007/s10458-008-9054-9,No PDF available,,,1,13,https://doi.org/10.1007/s10458-008-9054-9
What is Networked Robotics?,Gerard McKee,2008,https://link.springer.com/chapter/10.1007/978-3-540-79142-3_4,No PDF available,,,1,11,https://doi.org/10.1007/978-3-540-79142-3_4
Development of a mobile web services discovery and composition model,"Cheyma Ben Njima,    Youssef Gamha,    Chirine Ghedira Guegan…",2019,https://link.springer.com/article/10.1007/s10586-018-02904-y,No PDF available,,,1,No cite count available,https://doi.org/10.1007/s10586-018-02904-y
Automating the Dynamic Interactions of Self-governed Components in Distributed Architectures,Sebastian R. Bader,2017,https://link.springer.com/chapter/10.1007/978-3-319-58451-5_12,No PDF available,,,1,No cite count available,https://doi.org/10.1007/978-3-319-58451-5_12
A Middleware-Based Application Framework for Active Space Applications,"Manuel Román,    Roy H. Campbell",2003,https://link.springer.com/chapter/10.1007/3-540-44892-6_22,https://link.springer.com/content/pdf/10.1007%2F3-540-44892-6_22.pdf,,,1,8,https://doi.org/10.1007/3-540-44892-6_22
Towards Modeling and Execution of Collective Adaptive Systems,"Vasilios Andrikopoulos,    Antonio Bucchiarone…",2014,https://link.springer.com/chapter/10.1007/978-3-319-06859-6_7,No PDF available,,,1,5,https://doi.org/10.1007/978-3-319-06859-6_7
A Context-Sensitive Middleware for Managing Embedded Pervasive Environments,"Mohamed Khedr,    Ahmed Karmouch",2004,https://link.springer.com/chapter/10.1007/978-3-540-30121-9_104,No PDF available,,,1,No cite count available,https://doi.org/10.1007/978-3-540-30121-9_104
Towards Ubiquitous Services Design and Development Approach,"Aicha Azoui,    Djilali Idoughi",2016,https://link.springer.com/chapter/10.1007/978-3-319-39862-4_1,No PDF available,,,1,No cite count available,https://doi.org/10.1007/978-3-319-39862-4_1
The Activities of Resource Discovery and Resource Estimation,"Flávia C. Delicato,    Paulo F. Pires…",2017,https://link.springer.com/chapter/10.1007/978-3-319-54247-8_4,No PDF available,,,1,No cite count available,https://doi.org/10.1007/978-3-319-54247-8_4
Watch-It-Next: A Contextual TV Recommendation System,"Michal Aharon,    Eshcar Hillel,    Amit Kagian…",2015,https://link.springer.com/chapter/10.1007/978-3-319-23461-8_12,No PDF available,,,1,2,https://doi.org/10.1007/978-3-319-23461-8_12
Framework for Dynamic Web Services Composition Guided by Live Testing,"Mounia Elqortobi,    Jamal Bentahar…",2018,https://link.springer.com/chapter/10.1007/978-3-319-67837-5_13,No PDF available,,,1,No cite count available,https://doi.org/10.1007/978-3-319-67837-5_13
An Architecture for Dynamic Service-Oriented Computing in Networked Embedded Systems,"Kirill Mechitov,    Gul Agha",2012,https://link.springer.com/chapter/10.1007/978-3-642-30835-2_10,No PDF available,,,1,1,https://doi.org/10.1007/978-3-642-30835-2_10
Semantic Web Service Coordination,Matthine Klusch,2008,https://link.springer.com/chapter/10.1007/978-3-7643-8575-0_4,No PDF available,,,1,31,https://doi.org/10.1007/978-3-7643-8575-0_4
Context-Based Event Processing Systems,"Opher Etzion,    Yonit Magid,    Ella Rabinovich…",2011,https://link.springer.com/chapter/10.1007/978-3-642-19724-6_12,No PDF available,,,1,5,https://doi.org/10.1007/978-3-642-19724-6_12
Step-Wise Development of Resilient Ambient Campus Scenarios,"Alexei Iliasov,    Budi Arief…",2009,https://link.springer.com/chapter/10.1007/978-3-642-00867-2_14,No PDF available,,,1,No cite count available,https://doi.org/10.1007/978-3-642-00867-2_14
Intelligent Provision of Semantic Web Services in Educational Systems,"Marija Zelić,    Marko Rosić,    Vlado Glavinić",2011,https://link.springer.com/chapter/10.1007/978-3-642-21657-2_72,No PDF available,,,1,No cite count available,https://doi.org/10.1007/978-3-642-21657-2_72
Exploring Interaction Design for the Social Internet of Things,Donald Degraen,2019,https://link.springer.com/chapter/10.1007/978-3-319-94659-7_5,No PDF available,,,1,No cite count available,https://doi.org/10.1007/978-3-319-94659-7_5
Service Provisioning in Cloud: A Systematic Survey,"Adrija Bhattacharya,    Sankhayan Choudhury",2017,https://link.springer.com/chapter/10.1007/978-981-10-3391-9_3,No PDF available,,,1,No cite count available,https://doi.org/10.1007/978-981-10-3391-9_3
A Self-configuring Middleware Solution for Context Management,"Tudor Cioara,    Ionut Anghel,    Ioan Salomie",2011,https://link.springer.com/chapter/10.1007/978-3-642-20077-9_24,No PDF available,,,1,No cite count available,https://doi.org/10.1007/978-3-642-20077-9_24
Multimodal Dialogue for Ambient Intelligence and Smart Environments,"Ramón López-Cózar,    Zoraida Callejas",2010,https://link.springer.com/chapter/10.1007/978-0-387-93808-0_21,No PDF available,,,1,7,https://doi.org/10.1007/978-0-387-93808-0_21
Autonomic Computing Driven by Feature Models and Architecture in FamiWare,"Nadia Gamez,    Lidia Fuentes,    Miguel A. Aragüez",2011,https://link.springer.com/chapter/10.1007/978-3-642-23798-0_16,No PDF available,,,1,7,https://doi.org/10.1007/978-3-642-23798-0_16
Reliable and efficient service composition based on smart objects’ state information,"Yuhong Feng,    Jiannong Cao,    Yan Sun…",2010,https://link.springer.com/article/10.1007/s12652-010-0017-z,No PDF available,,,1,1,https://doi.org/10.1007/s12652-010-0017-z
"Middleware for Reactive Components: An Integrated Use of Context, Roles, and Event Based Coordination","Andry Rakotonirainy,    Jaga Indulska,    Seng Wai Loke,    Arkady Zaslavsky",2001,https://link.springer.com/chapter/10.1007/3-540-45518-3_5,https://link.springer.com/content/pdf/10.1007%2F3-540-45518-3_5.pdf,,,1,3,https://doi.org/10.1007/3-540-45518-3_5
An Aspect-Oriented Approach for Developing Self-Adaptive Fractal Components,"Pierre-Charles David,    Thomas Ledoux",2006,https://link.springer.com/chapter/10.1007/11821946_6,No PDF available,,,1,29,https://doi.org/10.1007/11821946_6
Automatic Generation of Funny Cartoons Diary for Everyday Mobile Life,"Injee Song,    Myung-Chul Jung,    Sung-Bae Cho",2006,https://link.springer.com/chapter/10.1007/11941439_48,No PDF available,,,1,No cite count available,https://doi.org/10.1007/11941439_48
Towards a Reconfigurable Middleware Architecture for Pervasive Computing Systems,"Gustavo G. Pascual,    Lidia Fuentes…",2011,https://link.springer.com/chapter/10.1007/978-3-642-22056-2_35,https://link.springer.com/content/pdf/10.1007%2F978-3-642-22056-2_35.pdf,,,1,No cite count available,https://doi.org/10.1007/978-3-642-22056-2_35
Models for the Consistent Interaction of Adaptations in Self-Adaptive Systems,"Nicolás Cardozo,    Kim Mens,    Siobhán Clarke",2017,https://link.springer.com/chapter/10.1007/978-3-319-74183-3_11,No PDF available,,,1,No cite count available,https://doi.org/10.1007/978-3-319-74183-3_11
Dynamic Adaptability for Smart Environments,"Daniel Retkowitz,    Mark Stegelmann",2008,https://link.springer.com/chapter/10.1007/978-3-540-68642-2_13,https://link.springer.com/content/pdf/10.1007%2F978-3-540-68642-2_13.pdf,,,1,2,https://doi.org/10.1007/978-3-540-68642-2_13
Trust Establishment and Estimation in Cloud Services: A Systematic Literature Review,"Kanwal Mahmud,    Muhammad Usman",2019,https://link.springer.com/article/10.1007/s10922-018-9475-y,No PDF available,,,1,No cite count available,https://doi.org/10.1007/s10922-018-9475-y
Specification and Verification of Complex Location Events with Panoramic,"Evan Welbourne,    Magdalena Balazinska,    Gaetano Borriello…",2010,https://link.springer.com/chapter/10.1007/978-3-642-12654-3_4,No PDF available,,,1,3,https://doi.org/10.1007/978-3-642-12654-3_4
"Service-Oriented Programming with Jolie
","Fabrizio Montesi,    Claudio Guidi,    Gianluigi Zavattaro",2014,https://link.springer.com/chapter/10.1007/978-1-4614-7518-7_4,No PDF available,,,1,21,https://doi.org/10.1007/978-1-4614-7518-7_4
DesertFD: a finite-domain constraint based tool for design space exploration,"Brandon K. Eames,    Sandeep K. Neema…",2010,https://link.springer.com/article/10.1007/s10617-009-9049-z,No PDF available,,,1,5,https://doi.org/10.1007/s10617-009-9049-z
A Contextual Composition Algorithm Based on Ontology Semantic,"Xiaobin Zhang,    Qianqian Shen",2014,https://link.springer.com/chapter/10.1007/978-3-642-54924-3_111,No PDF available,,,1,No cite count available,https://doi.org/10.1007/978-3-642-54924-3_111
A Distributed Service Component Framework for Interoperable and Modular Service-Oriented Pervasive Computing Applications,"Daniel Pakkala,    Juho Perälä",2010,https://link.springer.com/chapter/10.1007/978-3-0346-0104-7_6,No PDF available,,,1,No cite count available,https://doi.org/10.1007/978-3-0346-0104-7_6
Image and Video Retrieval from a User-Centered Mobile Multimedia Perspective,Susanne Boll,2005,https://link.springer.com/chapter/10.1007/11526346_3,No PDF available,,,1,2,https://doi.org/10.1007/11526346_3
"Specification and Dynamic Introduction of 3rd Party, Service-Specific Adaptation Policies for Mobile Applications","Nikos Houssos,    Nancy Alonistioti,    Lazaros Merakos",2005,https://link.springer.com/article/10.1007/s11036-005-1554-0,No PDF available,,,1,No cite count available,https://doi.org/10.1007/s11036-005-1554-0
A Framework for Policy Driven Auto-adaptive Systems Using Dynamic Framed Aspects,"Phil Greenwood,    Lynne Blair",2006,https://link.springer.com/chapter/10.1007/11922827_2,No PDF available,,,1,4,https://doi.org/10.1007/11922827_2
Reasoning about Context in Uncertain Pervasive Computing Environments,"Pari Delir Haghighi,    Shonali Krishnaswamy,    Arkady Zaslavsky…",2008,https://link.springer.com/chapter/10.1007/978-3-540-88793-5_9,No PDF available,,,1,15,https://doi.org/10.1007/978-3-540-88793-5_9
