title,author,date,link,pdf_link,query,search_engine,nr_found,cite_count,doiCognitive Ontology: A Concept Structure for Dynamic Event Interpretation and Description from Visual Scene,"Yuki Wakuda,    Kosuke Sekiyama,    Toshio Fukuda",2009,https://link.springer.com/chapter/10.1007/978-3-642-00644-9_11,No PDF available,,,1,2,https://doi.org/10.1007/978-3-642-00644-9_11
A Multi-layer Framework for Virtual Organizations Creation in Breeding Environment,"Khouloud Boukadi,    Lucien Vincent…",2010,https://link.springer.com/chapter/10.1007/978-3-642-15961-9_34,https://link.springer.com/content/pdf/10.1007%2F978-3-642-15961-9_34.pdf,,,1,3,https://doi.org/10.1007/978-3-642-15961-9_34
Information and Communication Technologies Supporting the Digital Transformation of Knowledge Work,"Klaus North,    Gita Kumta",2018,https://link.springer.com/chapter/10.1007/978-3-319-59978-6_7,No PDF available,,,1,No cite count available,https://doi.org/10.1007/978-3-319-59978-6_7
TimeMachine Oulu – Dynamic Creation of Cultural-Spatio-Temporal Models as a Mobile Service,"Jaakko Peltonen,    Mark Ollila,    Timo Ojala",2003,https://link.springer.com/chapter/10.1007/978-3-540-45233-1_25,No PDF available,,,1,No cite count available,https://doi.org/10.1007/978-3-540-45233-1_25
Sensor Information Representation for the Internet of Things,"Jiehan Zhou,    Teemu Leppänen,    Meirong Liu…",2012,https://link.springer.com/chapter/10.1007/978-3-642-33618-8_68,No PDF available,,,1,1,https://doi.org/10.1007/978-3-642-33618-8_68
Pervasive Systems Architecture and the Main Related Technologies,"Francesco Colace,    Massimo De Santo…",2015,https://link.springer.com/chapter/10.1007/978-3-319-20062-0_2,No PDF available,,,1,3,https://doi.org/10.1007/978-3-319-20062-0_2
On the Combined Behavior of Autonomous Resource Management Agents,"Siri Fagernes,    Alva L. Couch",2010,https://link.springer.com/chapter/10.1007/978-3-642-13986-4_5,https://link.springer.com/content/pdf/10.1007%2F978-3-642-13986-4_5.pdf,,,1,2,https://doi.org/10.1007/978-3-642-13986-4_5
Verification of Context-Dependent Channel-Based Service Models,"Natallia Kokash,    Christian Krause…",2010,https://link.springer.com/chapter/10.1007/978-3-642-17071-3_2,No PDF available,,,1,10,https://doi.org/10.1007/978-3-642-17071-3_2
PROASIS: As-Is Business Process Model Maintenance,"Nuno Castela,    Marielba Zacarias…",2011,https://link.springer.com/chapter/10.1007/978-3-642-23388-3_3,No PDF available,,,1,1,https://doi.org/10.1007/978-3-642-23388-3_3
"ODEGSG Framework, Knowledge-Based Annotation and Design of Grid Services","Carole Goble,    Asunción Gómez-Pérez…",2005,https://link.springer.com/chapter/10.1007/11596141_26,https://link.springer.com/content/pdf/10.1007%2F11596141_26.pdf,,,1,No cite count available,https://doi.org/10.1007/11596141_26
Towards Management of OWL-S Effects by Means of a DL Action Formalism Combined with OWL Contexts,"Domenico Redavid,    Stefano Ferilli…",2014,https://link.springer.com/chapter/10.1007/978-3-319-10554-3_23,No PDF available,,,1,No cite count available,https://doi.org/10.1007/978-3-319-10554-3_23
Component-Oriented Programming,"Wolfgang Weck,    Ralf Reussner…",2007,https://link.springer.com/chapter/10.1007/978-3-540-71774-4_12,No PDF available,,,1,No cite count available,https://doi.org/10.1007/978-3-540-71774-4_12
Ontology Based Resource Allocation (OBRA) for Adaptive Intelligent Grid Environment,"Japhynth Jacob,    Elijah Blessing Rajsingh…",2012,https://link.springer.com/chapter/10.1007/978-3-642-35377-2_45,No PDF available,,,1,No cite count available,https://doi.org/10.1007/978-3-642-35377-2_45
Genetic Programming Applications in Chemical Sciences and Engineering,"Renu Vyas,    Purva Goel,    Sanjeev S. Tambe",2015,https://link.springer.com/chapter/10.1007/978-3-319-20883-1_5,No PDF available,,,1,No cite count available,https://doi.org/10.1007/978-3-319-20883-1_5
Rule-Based Spatial Awareness,Clemens Holzmann,2009,https://link.springer.com/chapter/10.1007/978-3-8348-9569-1_5,No PDF available,,,1,No cite count available,https://doi.org/10.1007/978-3-8348-9569-1_5
Designing Transparent Interaction for Ubiquitous Computing: Theory and Application,"Weining Yue,    Heng Wang,    Guoping Wang",2007,https://link.springer.com/chapter/10.1007/978-3-540-73105-4_37,No PDF available,,,1,No cite count available,https://doi.org/10.1007/978-3-540-73105-4_37
Stepping into the Digital Intelligence Era,"G. Kousalya,    P. Balakrishnan,    C. Pethuru Raj",2017,https://link.springer.com/chapter/10.1007/978-3-319-56982-6_1,No PDF available,,,1,No cite count available,https://doi.org/10.1007/978-3-319-56982-6_1
Exploring service-oriented system engineering challenges: a systematic literature review,"Qing Gu,    Patricia Lago",2009,https://link.springer.com/article/10.1007/s11761-009-0046-7,https://link.springer.com/content/pdf/10.1007%2Fs11761-009-0046-7.pdf,,,1,42,https://doi.org/10.1007/s11761-009-0046-7
Challenges of CE,"Wim J. C. Verhagen,    Josip Stjepandić…",2015,https://link.springer.com/chapter/10.1007/978-3-319-13776-6_28,No PDF available,,,1,No cite count available,https://doi.org/10.1007/978-3-319-13776-6_28
Elastic time computation in QoS-driven hypermedia presentations,"Bruno Bachelet,    Philippe Mahey,    Rogério Rodrigues…",2007,https://link.springer.com/article/10.1007/s00530-006-0067-4,No PDF available,,,1,4,https://doi.org/10.1007/s00530-006-0067-4
Towards Service Awareness and Autonomic Features in a SIP-Enabled Network,"Giuseppe Valetto,    Laurent Walter Goix,    Guillaume Delaire",2006,https://link.springer.com/chapter/10.1007/11687818_16,https://link.springer.com/content/pdf/10.1007%2F11687818_16.pdf,,,1,3,https://doi.org/10.1007/11687818_16
DRain: An Engine for Quality-of-Result Driven Process-Based Data Analytics,"Aitor Murguzur,    Johannes M. Schleicher,    Hong-Linh Truong…",2014,https://link.springer.com/chapter/10.1007/978-3-319-10172-9_22,No PDF available,,,1,1,https://doi.org/10.1007/978-3-319-10172-9_22
Context Boosting Collaborative Recommendations,"Conor Hayes,    Pádraig Cunningham",2004,https://link.springer.com/chapter/10.1007/978-1-4471-0643-2_4,No PDF available,,,1,No cite count available,https://doi.org/10.1007/978-1-4471-0643-2_4
Big Brother Knows Your Friends: On Privacy of Social Communities in Pervasive Networks,"Igor Bilogrevic,    Murtuza Jadliwala,    István Lám,    Imad Aad…",2012,https://link.springer.com/chapter/10.1007/978-3-642-31205-2_23,No PDF available,,,1,3,https://doi.org/10.1007/978-3-642-31205-2_23
"Improving Modularity, Interoperability and Extensibility in Ambient Intelligence","Marco Gomes,    Davide Carneiro,    André Pimenta…",2014,https://link.springer.com/chapter/10.1007/978-3-319-07596-9_7,No PDF available,,,1,1,https://doi.org/10.1007/978-3-319-07596-9_7
Smart Home Related Research,"Nagender Kumar Suryadevara,    Subhas Chandra Mukhopadhyay",2015,https://link.springer.com/chapter/10.1007/978-3-319-13557-1_2,No PDF available,,,1,No cite count available,https://doi.org/10.1007/978-3-319-13557-1_2
"
AML: a modeling language for designing adaptive web applications",Roberto De Virgilio,2012,https://link.springer.com/article/10.1007/s00779-011-0418-9,No PDF available,,,1,2,https://doi.org/10.1007/s00779-011-0418-9
An adaptive middleware for supporting time-critical event response,"Qian Zhu,    Gagan Agrawal",2009,https://link.springer.com/article/10.1007/s10586-008-0071-x,No PDF available,,,1,3,https://doi.org/10.1007/s10586-008-0071-x
Business Agility and Flexibility in Enterprise Service-Based Information Systems: Application to PLM Systems,"Safa Hachani,    Hervé Verjus,    Lilia Gzara",2014,https://link.springer.com/chapter/10.1007/978-3-642-38244-4_15,No PDF available,,,1,No cite count available,https://doi.org/10.1007/978-3-642-38244-4_15
Agent-Oriented Modelling: Software versus the World,Eric Yu,2002,https://link.springer.com/chapter/10.1007/3-540-70657-7_14,No PDF available,,,1,13,https://doi.org/10.1007/3-540-70657-7_14
Case Studies,"Evangelos B. Mazomenos,    Juan Mario Rodríguez…",2014,https://link.springer.com/chapter/10.1007/978-1-4614-8842-2_10,No PDF available,,,1,1,https://doi.org/10.1007/978-1-4614-8842-2_10
A Network-Centric Approach to Embedded Software for Tiny Devices,"David E. Culler,    Jason Hill,    Philip Buonadonna,    Robert Szewczyk…",2001,https://link.springer.com/chapter/10.1007/3-540-45449-7_9,No PDF available,,,1,19,https://doi.org/10.1007/3-540-45449-7_9
Feedback-Based Adaptive Resource Control in QoS-Aware SOA Systems with Soft Real-Time Requirements,"Francisco José Monaco,    Pedro Northon Nobile",2009,https://link.springer.com/chapter/10.1007/978-3-642-10625-5_51,No PDF available,,,1,No cite count available,https://doi.org/10.1007/978-3-642-10625-5_51
Community research activities in secure and trustworthy ICT infrastructures,"Bart Van Caenegem,    Thomas Skordas",2007,https://link.springer.com/article/10.1007/s11235-007-9043-3,No PDF available,,,1,3,https://doi.org/10.1007/s11235-007-9043-3
A Conceptual Framework for the Design of Geo-Collaborative Systems,"Pedro Antunes,    Paula André",2006,https://link.springer.com/article/10.1007/s10726-006-9021-2,No PDF available,,,1,10,https://doi.org/10.1007/s10726-006-9021-2
Design as Intercultural Dialogue: Coupling Human-Centered Design with Requirement Engineering Methods,"Chiara Leonardi,    Luca Sabatucci,    Angelo Susi…",2011,https://link.springer.com/chapter/10.1007/978-3-642-23765-2_34,https://link.springer.com/content/pdf/10.1007%2F978-3-642-23765-2_34.pdf,,,1,6,https://doi.org/10.1007/978-3-642-23765-2_34
Gander: Personalizing Search of the Here and Now,"Jonas Michel,    Christine Julien,    Jamie Payton…",2012,https://link.springer.com/chapter/10.1007/978-3-642-30973-1_8,No PDF available,,,1,2,https://doi.org/10.1007/978-3-642-30973-1_8
Process Optimization,Danilo Ardagna,2009,https://link.springer.com/referenceworkentry/10.1007/978-0-387-39940-9_278,No PDF available,,,1,No cite count available,https://doi.org/10.1007/978-0-387-39940-9
Process Optimization,Danilo Ardagna,No year available,https://link.springer.com/referenceworkentry/10.1007/978-1-4899-7993-3_278-2,No PDF available,,,1,No cite count available,https://doi.org/10.1007/978-1-4899-7993-3
Process Optimization,Danilo Ardagna,2018,https://link.springer.com/referenceworkentry/10.1007/978-1-4614-8265-9_278,No PDF available,,,1,No cite count available,https://doi.org/10.1007/978-1-4614-8265-9
"13th National Congress of the Italian Association of Nuclear Medicine and Molecular Imaging (AIMN), Rimini (Italy), 2–5 March 2017",No author available,2017,https://link.springer.com/article/10.1007/s40336-017-0227-x,No PDF available,,,1,No cite count available,https://doi.org/10.1007/s40336-017-0227-x
17 Towards Model-Based Engineering of Self-configuring Embedded Systems,"DeJiu Chen,    Martin Törngren,    Magnus Persson…",2010,https://link.springer.com/chapter/10.1007/978-3-642-16277-0_17,No PDF available,,,1,1,https://doi.org/10.1007/978-3-642-16277-0_17
Advanced Ubiquitous Media for Interactive Space,Taysheng Jeng,2005,https://link.springer.com/chapter/10.1007/1-4020-3698-1_32,No PDF available,,,1,1,https://doi.org/10.1007/1-4020-3698-1_32
Towards Semantic Management,No author available,2006,https://link.springer.com/chapter/10.1007/0-387-27631-9_4,No PDF available,,,1,No cite count available,https://doi.org/10.1007/0-387-27631-9_4
Service Fusion in Mobile Contexts,"Jun Miao Shen,    Michael J. O’Grady…",2010,https://link.springer.com/chapter/10.1007/978-3-642-13526-2_3,No PDF available,,,1,1,https://doi.org/10.1007/978-3-642-13526-2_3
ISReal: An Open Platform for Semantic-Based 3D Simulations in the 3D Internet,"Patrick Kapahnke,    Pascal Liedtke,    Stefan Nesbigall…",2010,https://link.springer.com/chapter/10.1007/978-3-642-17749-1_11,https://link.springer.com/content/pdf/10.1007%2F978-3-642-17749-1_11.pdf,,,1,10,https://doi.org/10.1007/978-3-642-17749-1_11
Interaction Protocols Adaptation for Negotiation in Opened Multi-agent Systems,Wassim Chtourou…,2014,https://link.springer.com/chapter/10.1007/978-3-319-07179-4_18,No PDF available,,,1,4,https://doi.org/10.1007/978-3-319-07179-4_18
An Algebraic Calculus of Database Preferences,"Bernhard Möller,    Patrick Roocks,    Markus Endres",2012,https://link.springer.com/chapter/10.1007/978-3-642-31113-0_13,No PDF available,,,1,2,https://doi.org/10.1007/978-3-642-31113-0_13
Modelling the Costs of Autonomous Logistics,"B. Scholz-Reiter,    S. Sowade,    M. Teucke",2013,https://link.springer.com/chapter/10.1007/978-3-642-24491-9_22,No PDF available,,,1,No cite count available,https://doi.org/10.1007/978-3-642-24491-9_22
"An architectural approach to the analysis, verification and validation of software intensive embedded systems","DeJiu Chen,    Lei Feng,    Tahir Naseer Qureshi,    Henrik Lönn,    Frank Hagl",2013,https://link.springer.com/article/10.1007/s00607-013-0314-4,No PDF available,,,1,13,https://doi.org/10.1007/s00607-013-0314-4
Chapter 9: Service Marts,"Alessandro Campi,    Stefano Ceri,    Georg Gottlob,    Andrea Maesani…",2010,https://link.springer.com/chapter/10.1007/978-3-642-12310-8_9,No PDF available,,,1,7,https://doi.org/10.1007/978-3-642-12310-8_9
Use of negative information in positioning and tracking algorithms,"Michele Albano,    Senka Hadzic,    Jonathan Rodriguez",2013,https://link.springer.com/article/10.1007/s11235-013-9698-x,No PDF available,,,1,2,https://doi.org/10.1007/s11235-013-9698-x
Smart Spaces: A Metacognitive Approach,"Ekaterina Gilman,    Jukka Riekki",2012,https://link.springer.com/chapter/10.1007/978-3-642-27916-4_17,No PDF available,,,1,No cite count available,https://doi.org/10.1007/978-3-642-27916-4_17
A Competitive Three-Level Pruning Technique for Information Security,"Morshed Chowdhury,    Jemal Abawajy…",2014,https://link.springer.com/chapter/10.1007/978-3-662-45670-5_3,No PDF available,,,1,No cite count available,https://doi.org/10.1007/978-3-662-45670-5_3
"Entertainment Communication Decisions, Episode 2: “Earned” Channels","Thorsten Hennig-Thurau,    Mark B. Houston",2019,https://link.springer.com/chapter/10.1007/978-3-319-89292-4_12,No PDF available,,,1,No cite count available,https://doi.org/10.1007/978-3-319-89292-4_12
"Sensoria Patterns: Augmenting Service Engineering with Formal Analysis, Transformation and Dynamicity","Martin Wirsing,    Matthias Hölzl,    Lucia Acciai…",2008,https://link.springer.com/chapter/10.1007/978-3-540-88479-8_13,No PDF available,,,1,6,https://doi.org/10.1007/978-3-540-88479-8_13
Robust evaluation of products and reviewers in social rating systems,"Mohammad Allahbakhsh,    Aleksandar Ignjatovic,    Hamid Reza Motahari-Nezhad…",2015,https://link.springer.com/article/10.1007/s11280-013-0242-4,No PDF available,,,1,7,https://doi.org/10.1007/s11280-013-0242-4
Design Principles for Safety in Human-Robot Interaction,"Manuel Giuliani,    Claus Lenz,    Thomas Müller…",2010,https://link.springer.com/article/10.1007/s12369-010-0052-0,No PDF available,,,1,16,https://doi.org/10.1007/s12369-010-0052-0
An Emotion Dimensional Model Based on Social Tags: Crossing Folksonomies and Enhancing Recommendations,"Ignacio Fernández-Tobías,    Iván Cantador,    Laura Plaza",2013,https://link.springer.com/chapter/10.1007/978-3-642-39878-0_9,No PDF available,,,1,4,https://doi.org/10.1007/978-3-642-39878-0_9
Role of Service Brokers in Cloud Computing,Dolly Kandpal,2013,https://link.springer.com/chapter/10.1007/978-1-4471-5107-4_5,No PDF available,,,1,1,https://doi.org/10.1007/978-1-4471-5107-4_5
Towards an Autonomic Service Architecture,"Ramy Farha,    Myung Sup Kim…",2005,https://link.springer.com/chapter/10.1007/11567486_7,No PDF available,,,1,5,https://doi.org/10.1007/11567486_7
Adaptation Goals for Adaptive Service-Oriented Architectures,"Luciano Baresi,    Liliana Pasquale",2011,https://link.springer.com/chapter/10.1007/978-3-642-21001-3_10,No PDF available,,,1,6,https://doi.org/10.1007/978-3-642-21001-3_10
A Formal Support for Collaborative Data Sharing,"Fabio Martinelli,    Ilaria Matteucci…",2012,https://link.springer.com/chapter/10.1007/978-3-642-32498-7_42,https://link.springer.com/content/pdf/10.1007%2F978-3-642-32498-7_42.pdf,,,1,8,https://doi.org/10.1007/978-3-642-32498-7_42
Resolving Policy Conflicts - Integrating Policies from Multiple Authors,"Kaniz Fatema,    David Chadwick",2014,https://link.springer.com/chapter/10.1007/978-3-319-07869-4_29,No PDF available,,,1,4,https://doi.org/10.1007/978-3-319-07869-4_29
"Motivation, Market and European Perspective","Emmanouela Vogiatzaki,    Artur Krukowski",2016,https://link.springer.com/chapter/10.1007/978-3-319-21293-7_1,No PDF available,,,1,No cite count available,https://doi.org/10.1007/978-3-319-21293-7_1
Expanding Human Cognition and Communication,"Jim Spohrer,    Brian M. Pierce…",2003,https://link.springer.com/chapter/10.1007/978-94-017-0359-8_3,No PDF available,,,1,No cite count available,https://doi.org/10.1007/978-94-017-0359-8_3
Adaptive Message Restructuring Using Model-Driven Engineering,"Hang Yin,    Federico Giaimo,    Hugo Andrade…",2016,https://link.springer.com/chapter/10.1007/978-3-319-32467-8_67,No PDF available,,,1,No cite count available,https://doi.org/10.1007/978-3-319-32467-8_67
A Practical Guide to Large Tiled Displays,"Paul A. Navrátil,    Brandt Westing,    Gregory P. Johnson…",2009,https://link.springer.com/chapter/10.1007/978-3-642-10520-3_93,No PDF available,,,1,5,https://doi.org/10.1007/978-3-642-10520-3_93
"Datalog for Security, Privacy and Trust",Piero A. Bonatti,2011,https://link.springer.com/chapter/10.1007/978-3-642-24206-9_2,No PDF available,,,1,3,https://doi.org/10.1007/978-3-642-24206-9_2
Prospect of the VLSI Architecture for Massive MIMO Detection,"Leibo Liu,    Guiqiang Peng,    Shaojun Wei",2019,https://link.springer.com/chapter/10.1007/978-981-13-6362-7_7,No PDF available,,,1,No cite count available,https://doi.org/10.1007/978-981-13-6362-7_7
"Optimized admission control scheme for coexisting femtocell, wireless and wireline networks","Dimitrios N. Skoutas,    Prodromos Makris,    Charalabos Skianis",2013,https://link.springer.com/article/10.1007/s11235-013-9703-4,No PDF available,,,1,7,https://doi.org/10.1007/s11235-013-9703-4
A Survey of Verifiable Computation,"Xixun Yu,    Zheng Yan,    Athanasios V. Vasilakos",2017,https://link.springer.com/article/10.1007/s11036-017-0872-3,No PDF available,,,1,4,https://doi.org/10.1007/s11036-017-0872-3
Multimodal and Agent-Based Human–Computer Interaction in Cultural Heritage Applications: an Overview,"Antonio Gentile,    Salvatore Vitabile",2010,https://link.springer.com/chapter/10.1007/978-1-4419-1636-5_11,No PDF available,,,1,No cite count available,https://doi.org/10.1007/978-1-4419-1636-5_11
Model-based testing for software safety: a systematic mapping study,"Havva Gulay Gurbuz,    Bedir Tekinerdogan",2018,https://link.springer.com/article/10.1007/s11219-017-9386-2,https://link.springer.com/content/pdf/10.1007%2Fs11219-017-9386-2.pdf,,,1,3,https://doi.org/10.1007/s11219-017-9386-2
Dynamic Service Adaptation for Runtime System Extensions,"Robert Hirschfeld,    Katsuya Kawamura,    Hendrik Berndt",2004,https://link.springer.com/chapter/10.1007/978-3-540-24614-5_17,https://link.springer.com/content/pdf/10.1007%2F978-3-540-24614-5_17.pdf,,,1,1,https://doi.org/10.1007/978-3-540-24614-5_17
Context-Dependent Task Computing in Pervasive Environment,"Hongbo Ni,    Xingshe Zhou,    Daqing Zhang,    Ngoh Lek Heng",2006,https://link.springer.com/chapter/10.1007/11890348_10,No PDF available,,,1,3,https://doi.org/10.1007/11890348_10
The First Interaction Design Pattern Library for Internet of Things User Created Applications,"Marc Godon,    Mohamed Ali Feki,    Marc Roelands…",2011,https://link.springer.com/chapter/10.1007/978-3-642-21602-2_26,No PDF available,,,1,No cite count available,https://doi.org/10.1007/978-3-642-21602-2_26
HI3 Project: Software Architecture System for Elderly Care in a Retirement Home,"A. Paz-Lopez,    G. Varela,    J. Monroy…",2009,https://link.springer.com/chapter/10.1007/978-3-540-85867-6_2,No PDF available,,,1,No cite count available,https://doi.org/10.1007/978-3-540-85867-6_2
iSemServ: Towards the Engineering of Intelligent Semantic-Based Services,"Jabu Mtsweni,    Elmarie Biermann,    Laurette Pretorius",2010,https://link.springer.com/chapter/10.1007/978-3-642-16985-4_54,https://link.springer.com/content/pdf/10.1007%2F978-3-642-16985-4_54.pdf,,,1,No cite count available,https://doi.org/10.1007/978-3-642-16985-4_54
"Event-Based Interaction Management for Composite E-Services in eFlow
","Fabio Casati,    Ming-Chien Shan",2002,https://link.springer.com/article/10.1023/A%3A1015374204227,No PDF available,,,1,23,https://doi.org/10.1023/A:1015374204227
Sound Analysis in Smart Cities,"Juan Pablo Bello,    Charlie Mydlarz…",2018,https://link.springer.com/chapter/10.1007/978-3-319-63450-0_13,No PDF available,,,1,No cite count available,https://doi.org/10.1007/978-3-319-63450-0_13
An Aspect Oriented Approach for Implementing Situational Driven Adaptation of BPMN2.0 Workflows,"Ioannis Patiniotakis,    Nikos Papageorgiou…",2013,https://link.springer.com/chapter/10.1007/978-3-642-36285-9_44,No PDF available,,,1,3,https://doi.org/10.1007/978-3-642-36285-9_44
Rule-Based Modeling and Static Analysis of Self-adaptive Systems by Graph Transformation,"Antonio Bucchiarone,    Hartmut Ehrig,    Claudia Ermel…",2015,https://link.springer.com/chapter/10.1007/978-3-319-15545-6_33,No PDF available,,,1,3,https://doi.org/10.1007/978-3-319-15545-6_33
The Role of Specification,"Prof. V. S. Alagar,    Prof. K. Periyasamy",2011,https://link.springer.com/chapter/10.1007/978-0-85729-277-3_1,No PDF available,,,1,No cite count available,https://doi.org/10.1007/978-0-85729-277-3_1
A review of information flow diagrammatic models for product–service systems,"C. Durugbo,    A. Tiwari,    J. R. Alcock",2011,https://link.springer.com/article/10.1007/s00170-010-2765-5,No PDF available,,,1,26,https://doi.org/10.1007/s00170-010-2765-5
Awareness Models for the Development of Ubiquitous Systems,"Jose Figueroa Martinez,    F. L. Gutierrez Vela…",2010,https://link.springer.com/chapter/10.1007/978-3-642-13268-1_33,No PDF available,,,1,No cite count available,https://doi.org/10.1007/978-3-642-13268-1_33
Applying semantics to Parlay-based services for telecommunication and Internet networks,"Xiuquan Qiao,    Xiaofeng Li,    Anna Fensel…",2011,https://link.springer.com/article/10.2478/s13537-011-0029-6,No PDF available,,,1,No cite count available,https://doi.org/10.2478/s13537-011-0029-6
Generic Personal Assistance Architecture for Mobile Environments,Gerald Bieber,2008,https://link.springer.com/chapter/10.1007/978-3-540-76361_17,No PDF available,,,1,No cite count available,https://doi.org/10.1007/978-3-540-76361_17
Cross-domain similarity assessment for workflow improvement to handle Big Data challenge in workflow management,"Tahereh Koohi-Var,    Morteza Zahedi",2018,https://link.springer.com/article/10.1186/s40537-018-0135-6,https://link.springer.com/content/pdf/10.1186%2Fs40537-018-0135-6.pdf,,,1,No cite count available,https://doi.org/10.1186/s40537-018-0135-6
A Workflow Checking Approach for Inherent Privacy Awareness in Network Monitoring,Maria N. Koukovini…,2012,https://link.springer.com/chapter/10.1007/978-3-642-28879-1_20,No PDF available,,,1,No cite count available,https://doi.org/10.1007/978-3-642-28879-1_20
"“Everything Personal, Not Just Business:” Improving User Experience through Rule-Based Service Customization","Richard Hull,    Bharat Kumar,    Daniel Lieuwen…",2003,https://link.springer.com/chapter/10.1007/978-3-540-24593-3_11,https://link.springer.com/content/pdf/10.1007%2F978-3-540-24593-3_11.pdf,,,1,1,https://doi.org/10.1007/978-3-540-24593-3_11
Towards A Web Service Based HCI Migration Framework,"Yao Shen,    Minjie Wang,    Minyi Guo",2011,https://link.springer.com/chapter/10.1007/978-94-007-2105-0_42,No PDF available,,,1,1,https://doi.org/10.1007/978-94-007-2105-0_42
Process-Aware Information Systems: Lessons to Be Learned from Process Mining,Wil M. P. van der Aalst,2009,https://link.springer.com/chapter/10.1007/978-3-642-00899-3_1,No PDF available,,,1,26,https://doi.org/10.1007/978-3-642-00899-3_1
Dynamic Metamodel Extension Modules to Support Adaptive Data Management,"Michael Grossniklaus,    Stefania Leone…",2010,https://link.springer.com/chapter/10.1007/978-3-642-13094-6_29,https://link.springer.com/content/pdf/10.1007%2F978-3-642-13094-6_29.pdf,,,1,4,https://doi.org/10.1007/978-3-642-13094-6_29
A Home-Automation Platform towards Ubiquitous Spaces Based on a Decentralized P2P Architecture,"Sandra S. Rodríguez,    Juan A. Holgado",2009,https://link.springer.com/chapter/10.1007/978-3-540-85863-8_36,No PDF available,,,1,1,https://doi.org/10.1007/978-3-540-85863-8_36
Verifying Resource Requirements for Ontology-Driven Rule-Based Agents,"Abdur Rakib,    Rokan Uddin Faruqui…",2012,https://link.springer.com/chapter/10.1007/978-3-642-28472-4_18,No PDF available,,,1,1,https://doi.org/10.1007/978-3-642-28472-4_18
Mobile Sensing Agents for Social Computing Environments,"Javier Bajo,    Andrew T. Campbell,    Xia Zhou",2016,https://link.springer.com/chapter/10.1007/978-3-319-40159-1_13,No PDF available,,,1,No cite count available,https://doi.org/10.1007/978-3-319-40159-1_13
Coupling Interaction Resources in Ambient Spaces: There Is More Than Meets the Eye!,"Nicolas Barralon,    Joëlle Coutaz",2008,https://link.springer.com/chapter/10.1007/978-3-540-92698-6_32,https://link.springer.com/content/pdf/10.1007%2F978-3-540-92698-6_32.pdf,,,1,No cite count available,https://doi.org/10.1007/978-3-540-92698-6_32
