title,author,date,link,pdf_link,query,search_engine,nr_found,cite_count,doiTheoretical Background,Muhamed Kudic,2015,https://link.springer.com/chapter/10.1007/978-3-319-07935-6_2,No PDF available,,,1,No cite count available,https://doi.org/10.1007/978-3-319-07935-6_2
Barriers to implementation of a redesign of information transfer and feedback in acute care: results from a multiple case study,"Janneke E van Leijen-Zeelenberg,    Arno JA van Raak…",2014,https://link.springer.com/article/10.1186/1472-6963-14-149,https://link.springer.com/content/pdf/10.1186%2F1472-6963-14-149.pdf,,,1,4,https://doi.org/10.1186/1472-6963-14-149
"Requirements for adaptive governance of groundwater ecosystem services: insights from Sandveld (South Africa), Upper Guadiana (Spain) and Spree (Germany)","Kathrin Knüppe,    Claudia Pahl-Wostl",2013,https://link.springer.com/article/10.1007/s10113-012-0312-7,No PDF available,,,1,12,https://doi.org/10.1007/s10113-012-0312-7
Gender and lexical access in Italian,"Elizabeth Bates,    Antonella Devescovi,    Luigi Pizzamiglio…",1995,https://link.springer.com/article/10.3758/BF03206800,https://link.springer.com/content/pdf/10.3758%2FBF03206800.pdf,,,1,5,https://doi.org/10.3758/BF03206800
"Abstracts from the 8th International Conference on cGMP Generators, Effectors and Therapeutic Implications","G. Todd Milne,    Peter Sandner,    Kathleen A. Lincoln…",2017,https://link.springer.com/article/10.1186/s40360-017-0170-5,https://link.springer.com/content/pdf/10.1186%2Fs40360-017-0170-5.pdf,,,1,No cite count available,https://doi.org/10.1186/s40360-017-0170-5
Genetic and functional linkage between ADAMTS superfamily proteins and fibrillin-1: a novel mechanism influencing microfibril assembly and function,"Dirk Hubmacher,    Suneel S. Apte",2011,https://link.springer.com/article/10.1007/s00018-011-0780-9,No PDF available,,,1,41,https://doi.org/10.1007/s00018-011-0780-9
Social exclusion and social capital: A comparison and critique,"Mary Daly,    Hilary Silver",2008,https://link.springer.com/article/10.1007/s11186-008-9062-4,No PDF available,,,1,63,https://doi.org/10.1007/s11186-008-9062-4
The contribution of autobiographical significance to semantic memory,"Robyn Westmacott,    Morris Moscovitch",2003,https://link.springer.com/article/10.3758/BF03196114,https://link.springer.com/content/pdf/10.3758%2FBF03196114.pdf,,,1,9,https://doi.org/10.3758/BF03196114
Human Performance Enhancement,Azad M. Madni,2018,https://link.springer.com/chapter/10.1007/978-3-319-62184-5_7,No PDF available,,,1,No cite count available,https://doi.org/10.1007/978-3-319-62184-5_7
Implications for Southern Planning Theory and Practice,"Richard de Satgé,    Vanessa Watson",2018,https://link.springer.com/chapter/10.1007/978-3-319-69496-2_7,No PDF available,,,1,No cite count available,https://doi.org/10.1007/978-3-319-69496-2_7
"Early treatment versus expectative management of patent ductus arteriosus in preterm infants: a multicentre, randomised, non-inferiority trial in Europe (BeNeDuctus trial)","Tim Hundscheid,    Wes Onland,    Bart van Overmeire,    Peter Dijk…",2018,https://link.springer.com/article/10.1186/s12887-018-1215-7,https://link.springer.com/content/pdf/10.1186%2Fs12887-018-1215-7.pdf,,,1,No cite count available,https://doi.org/10.1186/s12887-018-1215-7
Learning and Adaptation: The Role of Fisheries Comanagement in Building Resilient Social–Ecological Systems,"Daniela C. Kalikoski,    Edward H. Allison",2010,https://link.springer.com/chapter/10.1007/978-3-642-12194-4_4,No PDF available,,,1,2,https://doi.org/10.1007/978-3-642-12194-4_4
Methods and tools for identifying and leveraging additive manufacturing design potentials,"Martin Kumke,    Hagen Watschke,    Peter Hartogh…",2018,https://link.springer.com/article/10.1007/s12008-017-0399-7,No PDF available,,,1,7,https://doi.org/10.1007/s12008-017-0399-7
Analyzing the Influence of Micro-Level Factors on CCTV Camera Effect,"Eric L. Piza,    Joel M. Caplan,    Leslie W. Kennedy",2014,https://link.springer.com/article/10.1007/s10940-013-9202-5,No PDF available,,,1,22,https://doi.org/10.1007/s10940-013-9202-5
Examining Non-Tenure Track Faculty Perceptions of How Departmental Policies and Practices Shape Their Performance and Ability to Create Student Learning at Four-Year Institutions,Adrianna Kezar,2013,https://link.springer.com/article/10.1007/s11162-013-9288-5,No PDF available,,,1,14,https://doi.org/10.1007/s11162-013-9288-5
Got Information? Investor Response to Form 10-K and Form 10-Q EDGAR Filings,Paul A. Griffin,2003,https://link.springer.com/article/10.1023/A%3A1027351630866,No PDF available,,,1,64,https://doi.org/10.1023/A:1027351630866
Helping fluid teams work: A research agenda for effective team adaptation in healthcare,"Wendy L Bedwell PhD,    P Scott Ramsay BS…",2012,https://link.springer.com/article/10.1007/s13142-012-0177-9,No PDF available,,,1,13,https://doi.org/10.1007/s13142-012-0177-9
Increasing the Power of the Poor? NGO-led Social Accountability Initiatives and Political Capabilities in Rural Uganda,Sophie King,2015,https://link.springer.com/article/10.1057/ejdr.2014.74,https://link.springer.com/content/pdf/10.1057%2Fejdr.2014.74.pdf,,,1,5,https://doi.org/10.1057/ejdr.2014.74
A Flexible and Tailorable Architecture for Scripts in F2F Collaboration,"Furio Belgiorno,    Rosario De Chiara…",2008,https://link.springer.com/chapter/10.1007/978-3-540-87605-2_45,No PDF available,,,1,2,https://doi.org/10.1007/978-3-540-87605-2_45
European countries’ competitiveness and productive performance evolution: unraveling the complexity in a heterogeneity context,"Areti Gkypali,    Kostas Kounetas,    Kostas Tsekouras",2018,https://link.springer.com/article/10.1007/s00191-018-0589-x,No PDF available,,,1,No cite count available,https://doi.org/10.1007/s00191-018-0589-x
Major and minor groups in evolution,Peter Gildenhuys,2014,https://link.springer.com/article/10.1007/s10539-013-9381-3,No PDF available,,,1,No cite count available,https://doi.org/10.1007/s10539-013-9381-3
New trends: Network fibring,"Walter Carnielli,    Marcelo Coniglio,    Dov M. Gabbay…",2008,https://link.springer.com/chapter/10.1007/978-1-4020-6782-2_10,No PDF available,,,1,No cite count available,https://doi.org/10.1007/978-1-4020-6782-2_10
Herbivory of an invasive slug in a model grassland community can be affected by earthworms and mycorrhizal fungi,"Raphaël Trouvé,    Thomas Drapela,    Thomas Frank…",2014,https://link.springer.com/article/10.1007/s00374-013-0827-1,https://link.springer.com/content/pdf/10.1007%2Fs00374-013-0827-1.pdf,,,1,11,https://doi.org/10.1007/s00374-013-0827-1
Negotiation Support and E-negotiation Systems: An Overview,"Gregory E. Kersten,    Hsiangchu Lai",2007,https://link.springer.com/article/10.1007/s10726-007-9095-5,No PDF available,,,1,66,https://doi.org/10.1007/s10726-007-9095-5
Analogical Trust Reasoning,"Mozhgan Tavakolifard,    Peter Herrmann,    Pinar Öztürk",2009,https://link.springer.com/chapter/10.1007/978-3-642-02056-8_10,https://link.springer.com/content/pdf/10.1007%2F978-3-642-02056-8_10.pdf,,,1,6,https://doi.org/10.1007/978-3-642-02056-8_10
Cross-linked enzyme aggregates (CLEAs) of selected lipases: a procedure for the proper calculation of their recovered activity,"María del Pilar Guauque Torres,    María Laura Foresti,    María Luján Ferreira",2013,https://link.springer.com/article/10.1186/2191-0855-3-25,https://link.springer.com/content/pdf/10.1186%2F2191-0855-3-25.pdf,,,1,17,https://doi.org/10.1186/2191-0855-3-25
Using Dynamic Mediation to Integrate COTS Entities in a Ubiquitous Computing Environment,"Emre Kiciman,    Armando Fox",2000,https://link.springer.com/chapter/10.1007/3-540-39959-3_16,No PDF available,,,1,8,https://doi.org/10.1007/3-540-39959-3_16
Effects of Stress Factors on the Functioning of the Adult Hippocampus: Molecular-Cellular Mechanisms and the Dorsoventral Gradient,N. V. Gulyaeva,2014,https://link.springer.com/article/10.1007/s11055-014-0012-5,No PDF available,,,1,1,https://doi.org/10.1007/s11055-014-0012-5
Across Serostatus: a Study of Subjugation and Resistance in Older Gay Men’s Experiences Navigating Health Care,"Hannah Kia,    Daniel Grace,    Carol Strike…",2019,https://link.springer.com/article/10.1007/s13178-018-0344-y,No PDF available,,,1,No cite count available,https://doi.org/10.1007/s13178-018-0344-y
Managerial ties and firm performance in an emerging economy: Tests of the mediating and moderating effects,"Gang Wang,    Xu Jiang,    Chang-Hong Yuan,    Ya-Qun Yi",2013,https://link.springer.com/article/10.1007/s10490-011-9254-8,No PDF available,,,1,24,https://doi.org/10.1007/s10490-011-9254-8
Online Self-disclosure: From Users’ Regrets to Instructional Awareness,"N. E. Díaz Ferreyra,    Rene Meis,    Maritta Heisel",2017,https://link.springer.com/chapter/10.1007/978-3-319-66808-6_7,No PDF available,,,1,1,https://doi.org/10.1007/978-3-319-66808-6_7
Group I Metabotropic Glutamate Receptors (mGlu1 and mGlu5),"Julie Anne Saugstad,    Susan Lynn Ingram",2008,https://link.springer.com/chapter/10.1007/978-1-59745-055-3_10,No PDF available,,,1,2,https://doi.org/10.1007/978-1-59745-055-3_10
“A Quantifiable Indicator of a Fabricated Meaning Element”,Richard Biernacki,2012,https://link.springer.com/chapter/10.1057/9781137007285_4,No PDF available,,,1,No cite count available,https://doi.org/10.1057/9781137007285_4
Drush,Greg Anderson,2011,https://link.springer.com/chapter/10.1007/978-1-4302-3136-3_26,No PDF available,,,1,No cite count available,https://doi.org/10.1007/978-1-4302-3136-3_26
An Oil Boom’s Effect on Quality of Life (QoL): Lessons from Western North Dakota,"Felix N. Fernando,    Dennis R. Cooley",2016,https://link.springer.com/article/10.1007/s11482-015-9422-y,No PDF available,,,1,10,https://doi.org/10.1007/s11482-015-9422-y
Stewarding Sustainability Transformations in Multi-stakeholder Collaboration,Petra Kuenkel,2019,https://link.springer.com/chapter/10.1007/978-3-030-03691-1_6,No PDF available,,,1,No cite count available,https://doi.org/10.1007/978-3-030-03691-1_6
From West Africa to the Balkans: exploring women’s roles in transnational organized crime,"Jana Arsovska,    Popy Begum",2014,https://link.springer.com/article/10.1007/s12117-013-9209-1,No PDF available,,,1,8,https://doi.org/10.1007/s12117-013-9209-1
"SERVQUAL, the Kano Model and QFD","Low Sui Pheng,    Zhu Rui",2016,https://link.springer.com/chapter/10.1007/978-981-10-0956-3_3,No PDF available,,,1,No cite count available,https://doi.org/10.1007/978-981-10-0956-3_3
"Constraints and Possibilities in Small-Scale Research: A Mixed-Methods Study in West Bengal, India",Sulata Maheshwari,2016,https://link.springer.com/chapter/10.1007/978-3-319-30042-9_9,No PDF available,,,1,No cite count available,https://doi.org/10.1007/978-3-319-30042-9_9
How Do Teachers Learn Through Engaging in School-Based Teacher Learning Activities? Applying a Knowledge Conversion Perspective,Jocelyn L. N. Wong,2015,https://link.springer.com/article/10.1007/s40299-013-0157-y,No PDF available,,,1,1,https://doi.org/10.1007/s40299-013-0157-y
Biomass for Biorefineries: Availability and Costs,Niclas Scott Bentsen,2019,https://link.springer.com/chapter/10.1007/978-3-030-10961-5_2,No PDF available,,,1,No cite count available,https://doi.org/10.1007/978-3-030-10961-5_2
"Gender, Local Knowledge and Lessons Learnt in Documenting and Conserving Agrobiodiversity","Yianna Lambrou,    Regina Laub",2007,https://link.springer.com/chapter/10.1057/9780230589506_7,No PDF available,,,1,No cite count available,https://doi.org/10.1057/9780230589506_7
Peacebuilding in a Multilingual World,"Michael Kelly,    Catherine Baker",2013,https://link.springer.com/chapter/10.1057/9781137029843_8,No PDF available,,,1,No cite count available,https://doi.org/10.1057/9781137029843_8
Beyond the Nature-Culture Dualism,Yrjö Haila,2000,https://link.springer.com/article/10.1023/A%3A1006625830102,No PDF available,,,1,44,https://doi.org/10.1023/A:1006625830102
Interface Issues for Wearable and Mobile computer Users,R. S. Kalawsky,2002,https://link.springer.com/chapter/10.1007/978-1-4471-0677-7_2,No PDF available,,,1,No cite count available,https://doi.org/10.1007/978-1-4471-0677-7_2
"Cross-Cultural and Site-Based Influences on Demographic, Well-being, and Social Network Predictors of Risk Perception in Hazard and Disaster Settings in Ecuador and Mexico","Eric C. Jones,    Albert J. Faas,    Arthur D. Murphy,    Graham A. Tobin…",2013,https://link.springer.com/article/10.1007/s12110-013-9162-3,No PDF available,,,1,21,https://doi.org/10.1007/s12110-013-9162-3
Strengthening Peace-Building Through Health Promotion,"Anne W. Bunde-Birouste,    Jan E. Ritchie",2007,https://link.springer.com/chapter/10.1007/978-0-387-70974-1_15,No PDF available,,,1,No cite count available,https://doi.org/10.1007/978-0-387-70974-1_15
Tackling Poverty-migration Linkages: Evidence from Ghana and Egypt,"Rachel Sabates-Wheeler,    Ricardo Sabates,    Adriana Castaldo",2008,https://link.springer.com/article/10.1007/s11205-007-9154-y,No PDF available,,,1,9,https://doi.org/10.1007/s11205-007-9154-y
Ethics in Physiotherapy Practice – An African Perspective,"Ajediran I. Bello,    Babatunde O. A. Adegoke",2018,https://link.springer.com/chapter/10.1007/978-3-319-93230-9_10,No PDF available,,,1,No cite count available,https://doi.org/10.1007/978-3-319-93230-9_10
Towards Eco-Factories of the Future,"Denis Kurle,    Sebastian Thiede,    Christoph Herrmann",2019,https://link.springer.com/chapter/10.1007/978-3-319-93730-4_1,No PDF available,,,1,No cite count available,https://doi.org/10.1007/978-3-319-93730-4_1
Investigating the Consistency of a Pro-market Perspective Amongst Conservationists,"Libby Blanchard,    Chris G. Sandbrook…",2018,https://link.springer.com/chapter/10.1007/978-3-319-60579-1_6,No PDF available,,,1,No cite count available,https://doi.org/10.1007/978-3-319-60579-1_6
"Asset management companies, non-performing loans and systemic crisis: A developing country perspective",Onyeka Osuji,2012,https://link.springer.com/article/10.1057/jbr.2011.28,No PDF available,,,1,1,https://doi.org/10.1057/jbr.2011.28
Understanding Kid-Friendly Urban Space for a More Inclusive Smart City: The Case Study of Cagliari (Italy),"Alfonso Annunziata,    Chiara Garau",2018,https://link.springer.com/chapter/10.1007/978-3-319-95168-3_40,No PDF available,,,1,No cite count available,https://doi.org/10.1007/978-3-319-95168-3_40
Women’s Midlife Health: Why the Midlife Matters,"Siobán D. Harlow,    Carol A. Derby",2015,https://link.springer.com/article/10.1186/s40695-015-0006-7,https://link.springer.com/content/pdf/10.1186%2Fs40695-015-0006-7.pdf,,,1,5,https://doi.org/10.1186/s40695-015-0006-7
Intersectionality,Surya Monro,2015,https://link.springer.com/chapter/10.1057/9781137007315_3,No PDF available,,,1,No cite count available,https://doi.org/10.1057/9781137007315_3
“Berry Patch” As a Kind of Place—the Ethnoecology of Black Huckleberry in Northwestern Canada,"Scott Trusler,    Leslie Main Johnson",2008,https://link.springer.com/article/10.1007/s10745-008-9176-3,No PDF available,,,1,15,https://doi.org/10.1007/s10745-008-9176-3
"The feasibility of a role for community health workers in integrated mental health care for perinatal depression: a qualitative study from Surabaya, Indonesia","Endang R. Surjaningrum,    Harry Minas…",2018,https://link.springer.com/article/10.1186/s13033-018-0208-0,https://link.springer.com/content/pdf/10.1186%2Fs13033-018-0208-0.pdf,,,1,1,https://doi.org/10.1186/s13033-018-0208-0
Prolonged sexual abstinence after childbirth: gendered norms and perceived family health risks. Focus group discussions in a Tanzanian suburb,"Columba K Mbekenga,    Andrea B Pembe…",2013,https://link.springer.com/article/10.1186/1472-698X-13-4,https://link.springer.com/content/pdf/10.1186%2F1472-698X-13-4.pdf,,,1,9,https://doi.org/10.1186/1472-698X-13-4
Rural change and multidimensional analysis of farm’s vulnerability: a case study in a protected area of semi-arid northern Nicaragua,"Federica Ravera,    David Tarrasón…",2014,https://link.springer.com/article/10.1007/s10668-014-9531-z,No PDF available,,,1,1,https://doi.org/10.1007/s10668-014-9531-z
Transition Experiences and Relevant Lessons,Melani Cammett,2016,https://link.springer.com/chapter/10.1007/978-1-137-52977-0_12,No PDF available,,,1,No cite count available,https://doi.org/10.1007/978-1-137-52977-0_12
Political Disaffection,James D. Wright,1981,https://link.springer.com/chapter/10.1007/978-1-4684-3878-9_1,No PDF available,,,1,3,https://doi.org/10.1007/978-1-4684-3878-9_1
"Combined biotic stresses trigger similar transcriptomic responses but contrasting resistance against a chewing herbivore in Brassica nigra
","Christelle Bonnet,    Steve Lassueur,    Camille Ponzio,    Rieta Gols…",2017,https://link.springer.com/article/10.1186/s12870-017-1074-7,https://link.springer.com/content/pdf/10.1186%2Fs12870-017-1074-7.pdf,,,1,10,https://doi.org/10.1186/s12870-017-1074-7
Correspondence between EQ-5D health state classifications and EQ VAS scores,David K Whynes,2008,https://link.springer.com/article/10.1186/1477-7525-6-94,https://link.springer.com/content/pdf/10.1186%2F1477-7525-6-94.pdf,,,1,50,https://doi.org/10.1186/1477-7525-6-94
"Social and Proximate Determinants of the Frequency of Condom Use Among African, Caribbean, and Other Black People in a Canadian City: Results from the BLACCH Study","Shamara Baidoobonso,    Greta R. Bauer…",2016,https://link.springer.com/article/10.1007/s10903-014-9984-z,No PDF available,,,1,3,https://doi.org/10.1007/s10903-014-9984-z
Selected Distinguishing Properties of WisTech IGrC Models,Andrzej Jankowski,2017,https://link.springer.com/chapter/10.1007/978-3-319-57627-5_28,No PDF available,,,1,No cite count available,https://doi.org/10.1007/978-3-319-57627-5_28
ExPDT: Ein Policy-basierter Ansatz zur Automatisierung von Compliance,"Dr. Stefan Sackmann,    Dipl.-Inf. Martin Kähmer",2008,https://link.springer.com/article/10.1007/s11576-008-0078-1,No PDF available,,,1,23,https://doi.org/10.1007/s11576-008-0078-1
"Tabu Search and Adaptive Memory Programming — Advances, Applications and Challenges",Fred Glover,1997,https://link.springer.com/chapter/10.1007/978-1-4615-4102-8_1,No PDF available,,,1,36,https://doi.org/10.1007/978-1-4615-4102-8_1
"Dimensions of International Negotiations: Structures, Processes, and Outcomes",Daniel Druckman,1997,https://link.springer.com/article/10.1023/A%3A1008649502134,No PDF available,,,1,18,https://doi.org/10.1023/A:1008649502134
Architecture Principle Specifications,"Danny Greefhorst,    Erik Proper",2011,https://link.springer.com/chapter/10.1007/978-3-642-20279-7_4,No PDF available,,,1,No cite count available,https://doi.org/10.1007/978-3-642-20279-7_4
Theoretical background and literature review,Monika Mischke,2014,https://link.springer.com/chapter/10.1007/978-3-658-03577-8_2,No PDF available,,,1,No cite count available,https://doi.org/10.1007/978-3-658-03577-8_2
Developmental trends in adolescents' psychological and legal competence to consent to abortion,"Bruce Ambuel,    Julian Rappaport",1992,https://link.springer.com/article/10.1007/BF01044794,No PDF available,,,1,21,https://doi.org/10.1007/BF01044794
Food environment and childhood obesity: the effect of dollar stores,"Andreas C. Drichoutis,    Rodolfo M. Nayga Jr.,    Heather L. Rouse…",2015,https://link.springer.com/article/10.1186/s13561-015-0074-2,https://link.springer.com/content/pdf/10.1186%2Fs13561-015-0074-2.pdf,,,1,1,https://doi.org/10.1186/s13561-015-0074-2
Proceedings from the 9th annual conference on the science of dissemination and implementation,"David Chambers,    Lisa Simpson,    Gila Neta…",2017,https://link.springer.com/article/10.1186/s13012-017-0575-y,https://link.springer.com/content/pdf/10.1186%2Fs13012-017-0575-y.pdf,,,1,6,https://doi.org/10.1186/s13012-017-0575-y
Evaluation design for a complex intervention program targeting loneliness in non-institutionalized elderly Dutch people,"Rianne de Vlaming,    Annemien Haveman-Nies,    Pieter van't Veer…",2010,https://link.springer.com/article/10.1186/1471-2458-10-552,https://link.springer.com/content/pdf/10.1186%2F1471-2458-10-552.pdf,,,1,13,https://doi.org/10.1186/1471-2458-10-552
Predicting who fails to meet the physical activity guideline in pregnancy: a prospective study of objectively recorded physical activity in a population-based multi-ethnic cohort,"Kåre Rønn Richardsen,    Ragnhild Sørum Falk,    Anne Karen Jenum…",2016,https://link.springer.com/article/10.1186/s12884-016-0985-x,https://link.springer.com/content/pdf/10.1186%2Fs12884-016-0985-x.pdf,,,1,1,https://doi.org/10.1186/s12884-016-0985-x
SDL-Pattern based Development of a Communication Subsystem for CAN,"B. Geppert,    A. Kühlmeyer,    F. Rößler…",1998,https://link.springer.com/chapter/10.1007/978-0-387-35394-4_13,https://link.springer.com/content/pdf/10.1007%2F978-0-387-35394-4_13.pdf,,,1,3,https://doi.org/10.1007/978-0-387-35394-4_13
Understanding Victimization Frequency,Andromachi Tseloni,2014,https://link.springer.com/referenceworkentry/10.1007/978-1-4614-5690-2_127,No PDF available,,,1,No cite count available,https://doi.org/10.1007/978-1-4614-5690-2
The Importance of Foot Pressure in Diabetes,"Malindu E. Fernando,    Robert G. Crowther,    Scott Wearing",2018,https://link.springer.com/referenceworkentry/10.1007/978-3-319-14418-4_39,No PDF available,,,1,No cite count available,https://doi.org/10.1007/978-3-319-14418-4_39
The Politics and Heritage of Race and Space in San Francisco’s Chinatown,Chuo Li,2012,https://link.springer.com/chapter/10.1007/978-1-4614-1108-6_3,No PDF available,,,1,No cite count available,https://doi.org/10.1007/978-1-4614-1108-6_3
The Importance of Foot Pressure in Diabetes,"Malindu E. Fernando,    Robert G. Crowther,    Scott Wearing",No year available,https://link.springer.com/referenceworkentry/10.1007/978-3-319-30808-1_39-1,No PDF available,,,1,No cite count available,https://doi.org/10.1007/978-3-319-30808-1_39-1
The UN Guiding Principles on Business and Human Rights in (National) Action: The Dutch Agreement on Sustainable Garment and Textile,"Antoine Duval,    Enrico Partiti",2018,https://link.springer.com/chapter/10.1007/978-94-6265-243-9_12,No PDF available,,,1,No cite count available,https://doi.org/10.1007/978-94-6265-243-9_12
Methods that may stimulate creativity and their use in architectural design education,"Doris C. C. K. Kowaltowski,    Giovana Bianchi…",2010,https://link.springer.com/article/10.1007/s10798-009-9102-z,No PDF available,,,1,23,https://doi.org/10.1007/s10798-009-9102-z
"
Gender and citizenship in the restructuring of janitorial work in Los Angeles
",Cynthia Cranford Ph.D. candidate,1998,https://link.springer.com/article/10.1007/s12147-998-0009-x,No PDF available,,,1,14,https://doi.org/10.1007/s12147-998-0009-x
Pluralism in Jewish Education,Bryan Conyer,2011,https://link.springer.com/chapter/10.1007/978-94-007-0354-4_16,No PDF available,,,1,1,https://doi.org/10.1007/978-94-007-0354-4_16
Effectiveness of community based safe motherhood promoters in improving the utilization of obstetric care. The case of Mtwara Rural District in Tanzania,"Declare Mushi,    Rose Mpembeni,    Albrecht Jahn",2010,https://link.springer.com/article/10.1186/1471-2393-10-14,https://link.springer.com/content/pdf/10.1186%2F1471-2393-10-14.pdf,,,1,55,https://doi.org/10.1186/1471-2393-10-14
"Household food insecurity is associated with a higher burden of obesity and risk of dietary inadequacies among mothers in Beirut, Lebanon","Lamis Jomaa,    Farah Naja,    Ruba Cheaib,    Nahla Hwalla",2017,https://link.springer.com/article/10.1186/s12889-017-4317-5,https://link.springer.com/content/pdf/10.1186%2Fs12889-017-4317-5.pdf,,,1,1,https://doi.org/10.1186/s12889-017-4317-5
Feasibility of an implementation strategy for the integration of health promotion in routine primary care: a quantitative process evaluation,"Alvaro Sanchez,    Gonzalo Grandes,    Josep M. Cortada,    Haizea Pombo…",2017,https://link.springer.com/article/10.1186/s12875-017-0585-5,https://link.springer.com/content/pdf/10.1186%2Fs12875-017-0585-5.pdf,,,1,3,https://doi.org/10.1186/s12875-017-0585-5
"Mind, rationality, and cognition: An interdisciplinary debate","Nick Chater,    Teppo Felin,    David C. Funder,    Gerd Gigerenzer…",2018,https://link.springer.com/article/10.3758/s13423-017-1333-5,https://link.springer.com/content/pdf/10.3758%2Fs13423-017-1333-5.pdf,,,1,3,https://doi.org/10.3758/s13423-017-1333-5
Replacing monocultures with mixed-species stands: Ecosystem service implications of two production forest alternatives in Sweden,"Adam Felton,    Urban Nilsson,    Johan Sonesson,    Annika M. Felton,    Jean-Michel Roberge…",2016,https://link.springer.com/article/10.1007/s13280-015-0749-2,https://link.springer.com/content/pdf/10.1007%2Fs13280-015-0749-2.pdf,,,1,44,https://doi.org/10.1007/s13280-015-0749-2
Understanding patterns of tree adoption on farms in semi-arid and sub-humid Ethiopia,"Miyuki Iiyama,    Abayneh Derero,    Kaleb Kelemu,    Catherine Muthuri…",2017,https://link.springer.com/article/10.1007/s10457-016-9926-y,https://link.springer.com/content/pdf/10.1007%2Fs10457-016-9926-y.pdf,,,1,15,https://doi.org/10.1007/s10457-016-9926-y
Promoting a coupled human and natural systems approach to addressing conservation in complex mountainous landscapes of Central Asia,"James P. Lassoie,    Ruth E. Sherman",2010,https://link.springer.com/article/10.1007/s11707-010-0007-7,No PDF available,,,1,9,https://doi.org/10.1007/s11707-010-0007-7
