title,author,date,link,pdf_link,query,search_engine,nr_found,cite_count,doiNeo-Darwinian Theory and Hunter-Gatherers,"Robert L. Bettinger,    Raven Garvey,    Shannon Tushingham",2015,https://link.springer.com/chapter/10.1007/978-1-4899-7581-2_7,No PDF available,,,1,No cite count available,https://doi.org/10.1007/978-1-4899-7581-2_7
Managing Hybridity in a Changing Welfare Mix: Everyday Practices in an Entrepreneurial Nonprofit in Belgium,"Lesley Hustinx,    Els De Waele",2015,https://link.springer.com/article/10.1007/s11266-015-9625-8,No PDF available,,,1,9,https://doi.org/10.1007/s11266-015-9625-8
Using Fuzzy Spatial Relations to Control Movement Behavior of Mobile Objects in Spatially Explicit Ecological Models,Vincent B. Robinson,2002,https://link.springer.com/chapter/10.1007/978-3-7908-1752-2_7,No PDF available,,,1,No cite count available,https://doi.org/10.1007/978-3-7908-1752-2_7
Two shades of boldness: novel object and anti-predator behavior reflect different personality dimensions in domestic rabbits,"Anastasia Andersson,    Linda Laikre,    Ulrika A. Bergvall",2014,https://link.springer.com/article/10.1007/s10164-014-0401-9,No PDF available,,,1,2,https://doi.org/10.1007/s10164-014-0401-9
Gestural acquisition in great apes: the Social Negotiation Hypothesis,"Simone Pika,    Marlen Fröhlich",2018,https://link.springer.com/article/10.1007/s10071-017-1159-6,https://link.springer.com/content/pdf/10.1007%2Fs10071-017-1159-6.pdf,,,1,7,https://doi.org/10.1007/s10071-017-1159-6
The role of tenascin-C in tissue injury and tumorigenesis,"Kim S. Midwood,    Gertraud Orend",2009,https://link.springer.com/article/10.1007/s12079-009-0075-1,https://link.springer.com/content/pdf/10.1007%2Fs12079-009-0075-1.pdf,,,1,181,https://doi.org/10.1007/s12079-009-0075-1
Characterisation of the NRF2 transcriptional network and its response to chemical insult in primary human hepatocytes: implications for prediction of drug-induced liver injury,"Ian M. Copple,    Wouter den Hollander,    Giulia Callegaro…",2019,https://link.springer.com/article/10.1007/s00204-018-2354-1,https://link.springer.com/content/pdf/10.1007%2Fs00204-018-2354-1.pdf,,,1,No cite count available,https://doi.org/10.1007/s00204-018-2354-1
Integrating biodiversity and conservation with modern agricultural landscapes,"S. Kumaraswamy,    K. Kunte",2013,https://link.springer.com/article/10.1007/s10531-013-0562-9,No PDF available,,,1,15,https://doi.org/10.1007/s10531-013-0562-9
"The DNA Methylome: An Interface Between the Environment, Immunity, and Ageing","Lisa M. McEwen,    Sarah J. Goodman,    Michael S. Kobor…",2017,https://link.springer.com/chapter/10.1007/978-3-319-43365-3_3,No PDF available,,,1,No cite count available,https://doi.org/10.1007/978-3-319-43365-3_3
Semantic Annotation of EPC Models in Engineering Domains to Facilitate an Automated Identification of Common Modelling Practices,"Andreas Bögl,    Michael Schrefl,    Gustav Pomberger…",2009,https://link.springer.com/chapter/10.1007/978-3-642-00670-8_12,No PDF available,,,1,1,https://doi.org/10.1007/978-3-642-00670-8_12
Systemic Inquiry,Ray Ison,2017,https://link.springer.com/chapter/10.1007/978-1-4471-7351-9_10,No PDF available,,,1,No cite count available,https://doi.org/10.1007/978-1-4471-7351-9_10
Empirical research on international environmental migration: a systematic review,"Reiko Obokata,    Luisa Veronis,    Robert McLeman",2014,https://link.springer.com/article/10.1007/s11111-014-0210-7,https://link.springer.com/content/pdf/10.1007%2Fs11111-014-0210-7.pdf,,,1,30,https://doi.org/10.1007/s11111-014-0210-7
Mac OS X Development: The Tools,No author available,2008,https://link.springer.com/chapter/10.1007/978-1-4302-0255-4_25,No PDF available,,,1,No cite count available,https://doi.org/10.1007/978-1-4302-0255-4_25
The ACODEA framework: Developing segmentation and classification schemes for fully automatic analysis of online discussions,"Jin Mu,    Karsten Stegmann,    Elijah Mayfield…",2012,https://link.springer.com/article/10.1007/s11412-012-9147-y,No PDF available,,,1,27,https://doi.org/10.1007/s11412-012-9147-y
The neurotranscriptome of the Aedes aegypti mosquito,"Benjamin J. Matthews,    Carolyn S. McBride,    Matthew DeGennaro,    Orion Despo…",2016,https://link.springer.com/article/10.1186/s12864-015-2239-0,https://link.springer.com/content/pdf/10.1186%2Fs12864-015-2239-0.pdf,,,1,37,https://doi.org/10.1186/s12864-015-2239-0
Mobility Practices in Peri-Urban Areas: Understanding Processes of Urban Regionalization in Milan Urban Region,Paola Pucci,2016,https://link.springer.com/chapter/10.1007/978-3-319-22578-4_13,No PDF available,,,1,No cite count available,https://doi.org/10.1007/978-3-319-22578-4_13
Chemical communication in invertebrates,R. J. O'Connell,1986,https://link.springer.com/article/10.1007/BF01942503,No PDF available,,,1,7,https://doi.org/10.1007/BF01942503
Common Pool Resource Management at the Extensive and Intensive Margins: Experimental Evidence,"Jordan F. Suter,    Sam Collie,    Kent D. Messer…",2018,https://link.springer.com/article/10.1007/s10640-018-0283-3,No PDF available,,,1,No cite count available,https://doi.org/10.1007/s10640-018-0283-3
Introduction,No author available,2009,https://link.springer.com/chapter/10.1007/978-1-84882-254-2_1,No PDF available,,,1,No cite count available,https://doi.org/10.1007/978-1-84882-254-2_1
Alien Plant Species: Environmental Risks in Agricultural and Agro-Forest Landscapes Under Climate Change,"Joana R. Vicente,    Ana Sofia Vaz…",2019,https://link.springer.com/chapter/10.1007/978-3-319-75004-0_13,No PDF available,,,1,No cite count available,https://doi.org/10.1007/978-3-319-75004-0_13
The Neuropsychological Aspects of Musical Creativity,Ana Luísa Pinho,2018,https://link.springer.com/chapter/10.1007/978-3-319-76054-4_4,No PDF available,,,1,No cite count available,https://doi.org/10.1007/978-3-319-76054-4_4
"Using AgMIP Regional Integrated Assessment Methods to Evaluate Vulnerability, Resilience and Adaptive Capacity for Climate Smart Agricultural Systems","John M. Antle,    Sabine Homann-KeeTui,    Katrien Descheemaeker…",2018,https://link.springer.com/chapter/10.1007/978-3-319-61194-5_14,https://link.springer.com/content/pdf/10.1007%2F978-3-319-61194-5_14.pdf,,,1,No cite count available,https://doi.org/10.1007/978-3-319-61194-5_14
Conflicts between entrepreneurs and investors: the impact of perceived unethical behavior,"Veroniek Collewaert,    Yves Fassin",2013,https://link.springer.com/article/10.1007/s11187-011-9379-7,https://link.springer.com/content/pdf/10.1007%2Fs11187-011-9379-7.pdf,,,1,22,https://doi.org/10.1007/s11187-011-9379-7
Programming Incentives in Information Systems,"Ognjen Scekic,    Hong-Linh Truong…",2013,https://link.springer.com/chapter/10.1007/978-3-642-38709-8_44,https://link.springer.com/content/pdf/10.1007%2F978-3-642-38709-8_44.pdf,,,1,3,https://doi.org/10.1007/978-3-642-38709-8_44
Knowledge as Culture,Olivier Serrat,2017,https://link.springer.com/chapter/10.1007/978-981-10-0983-9_58,https://link.springer.com/content/pdf/10.1007%2F978-981-10-0983-9_58.pdf,,,1,No cite count available,https://doi.org/10.1007/978-981-10-0983-9_58
‚Participation’ in Development Thinking — Coming to Grips with a Truism and its Critiques,"Uta Berghöfer,    Augustin Berghöfer",2006,https://link.springer.com/chapter/10.1007/978-3-540-36917-2_4,No PDF available,,,1,3,https://doi.org/10.1007/978-3-540-36917-2_4
"Personal networks: a tool for gaining insight into the transmission of knowledge about food and medicinal plants among Tyrolean (Austrian) migrants in Australia, Brazil and Peru","Ruth Haselmair,    Heidemarie Pirker…",2014,https://link.springer.com/article/10.1186/1746-4269-10-1,https://link.springer.com/content/pdf/10.1186%2F1746-4269-10-1.pdf,,,1,21,https://doi.org/10.1186/1746-4269-10-1
"Semantic hierarchies for extracting, modeling, and connecting compliance requirements in information security control standards","Matthew L. Hale,    Rose F. Gamble",2017,https://link.springer.com/article/10.1007/s00766-017-0287-5,https://link.springer.com/content/pdf/10.1007%2Fs00766-017-0287-5.pdf,,,1,1,https://doi.org/10.1007/s00766-017-0287-5
"The Bermuda Triangle: The Pragmatics, Policies, and Principles for Data Sharing in the History of the Human Genome Project","Kathryn Maxson Jones,    Rachel A. Ankeny…",2018,https://link.springer.com/article/10.1007/s10739-018-9538-7,https://link.springer.com/content/pdf/10.1007%2Fs10739-018-9538-7.pdf,,,1,No cite count available,https://doi.org/10.1007/s10739-018-9538-7
Considering Users’ Emotions in Product Development Processes and the Need to Design for Attitudes,"Susan Gretchen Zöller,    Sandro Wartzack",2017,https://link.springer.com/chapter/10.1007/978-3-319-53195-3_7,No PDF available,,,1,1,https://doi.org/10.1007/978-3-319-53195-3_7
Achieving change in primary care—causes of the evidence to practice gap: systematic reviews of reviews,"Rosa Lau,    Fiona Stevenson,    Bie Nio Ong,    Krysia Dziedzic…",2016,https://link.springer.com/article/10.1186/s13012-016-0396-4,https://link.springer.com/content/pdf/10.1186%2Fs13012-016-0396-4.pdf,,,1,57,https://doi.org/10.1186/s13012-016-0396-4
Context-based Matching for Semantic Web Services,"Brahim Medjahed,    Athman Bouguettaya",2011,https://link.springer.com/chapter/10.1007/978-1-4419-8465-4_5,No PDF available,,,1,No cite count available,https://doi.org/10.1007/978-1-4419-8465-4_5
Social Context at Work: A Multilevel Analysis of Job Satisfaction,"Amy S. Wharton,    Thomas Rotolo,    Sharon R. Bird",2000,https://link.springer.com/article/10.1023/A%3A1007546120560,No PDF available,,,1,6,https://doi.org/10.1023/A:1007546120560
The Role of Media Within Young People’s Socialisation: A Theoretical Approach,"Ingrid Paus-Hasebrink,    Jasmin Kulterer…",2019,https://link.springer.com/chapter/10.1007/978-3-030-02653-0_3,https://link.springer.com/content/pdf/10.1007%2F978-3-030-02653-0_3.pdf,,,1,No cite count available,https://doi.org/10.1007/978-3-030-02653-0_3
Requirements gathering and analysis,Martin Gorrod,2004,https://link.springer.com/chapter/10.1057/9780230510296_5,No PDF available,,,1,No cite count available,https://doi.org/10.1057/9780230510296_5
An evaluative baseline for geo-semantic relatedness and similarity,"Andrea Ballatore,    Michela Bertolotto,    David C. Wilson",2014,https://link.springer.com/article/10.1007/s10707-013-0197-8,No PDF available,,,1,10,https://doi.org/10.1007/s10707-013-0197-8
Explaining Intersubsidiary Relationships,Julia Mauer,2011,https://link.springer.com/chapter/10.1007/978-3-8349-7040-4_3,No PDF available,,,1,No cite count available,https://doi.org/10.1007/978-3-8349-7040-4_3
"Technological paradigms, patterns of learning and development: An introductory roadmap","Mario Cimoli,    Giovanni Dosi",1995,https://link.springer.com/article/10.1007/BF01198306,No PDF available,,,1,56,https://doi.org/10.1007/BF01198306
Dynamics of Change,Frannie Léautier,2014,https://link.springer.com/chapter/10.1057/9781137431219_3,No PDF available,,,1,No cite count available,https://doi.org/10.1057/9781137431219_3
Design and application for a replicable foresight methodology bridging quantitative and qualitative expert data,Jan Erik Karlsen,2014,https://link.springer.com/article/10.1007/s40309-014-0040-y,https://link.springer.com/content/pdf/10.1007%2Fs40309-014-0040-y.pdf,,,1,2,https://doi.org/10.1007/s40309-014-0040-y
"Technological paradigms, patterns of learning and development: an introductory roadmap","Mario Cimoli,    Giovanni Dosi",1996,https://link.springer.com/chapter/10.1007/978-3-642-48870-2_5,No PDF available,,,1,No cite count available,https://doi.org/10.1007/978-3-642-48870-2_5
"Flower Constancy, Insect Psychology, and Plant Evolution","Lars Chittka,    James D. Thomson,    Nickolas M. Waser",1999,https://link.springer.com/article/10.1007/s001140050636,No PDF available,,,1,316,https://doi.org/10.1007/s001140050636
Modes of innovation in knowledge-intensive business services evidence from Lombardy,"Nicoletta Corrocher,    Lucia Cusmano,    Andrea Morrison",2009,https://link.springer.com/article/10.1007/s00191-008-0128-2,No PDF available,,,1,54,https://doi.org/10.1007/s00191-008-0128-2
"Tackling connections, structure, and meaning in networks: quantitative and qualitative methods in sociological network research","Jan Fuhse,    Sophie Mützel",2011,https://link.springer.com/article/10.1007/s11135-011-9492-3,No PDF available,,,1,57,https://doi.org/10.1007/s11135-011-9492-3
The Knowledge Portal “OntoWeb”,"Daniel Oberle,    Peter Spyns",2004,https://link.springer.com/chapter/10.1007/978-3-540-24750-0_25,No PDF available,,,1,2,https://doi.org/10.1007/978-3-540-24750-0_25
Evaluation and Metrics,"Sanya Carley,    Sara Lawrence",2014,https://link.springer.com/chapter/10.1007/978-1-4471-6341-1_5,No PDF available,,,1,No cite count available,https://doi.org/10.1007/978-1-4471-6341-1_5
Heterogeneity in the Frequency Distribution of Crime Victimization,"Tim Hope,    Paul A. Norris",2013,https://link.springer.com/article/10.1007/s10940-012-9190-x,No PDF available,,,1,12,https://doi.org/10.1007/s10940-012-9190-x
Requirements Engineering as a Key to Holistic Software Quality,Manfred Broy,2006,https://link.springer.com/chapter/10.1007/11902140_3,No PDF available,,,1,6,https://doi.org/10.1007/11902140_3
Data Analysis,"Patrick Lang,    Jürgen Franke",2015,https://link.springer.com/chapter/10.1007/978-3-662-48258-2_4,No PDF available,,,1,No cite count available,https://doi.org/10.1007/978-3-662-48258-2_4
Social Interaction Analysis for Team Collaboration,"Ognjen Scekic,    Mirela Riveni…",2014,https://link.springer.com/referenceworkentry/10.1007/978-1-4614-6170-8_257,No PDF available,,,1,No cite count available,https://doi.org/10.1007/978-1-4614-6170-8
Experimental effects and causal representations,Vadim Keyser,2017,https://link.springer.com/article/10.1007/s11229-017-1633-3,https://link.springer.com/content/pdf/10.1007%2Fs11229-017-1633-3.pdf,,,1,No cite count available,https://doi.org/10.1007/s11229-017-1633-3
"An investigation into mistreatment of women during labour and childbirth in maternity care facilities in Uttar Pradesh, India: a mixed methods study","Gaurav Sharma,    Loveday Penn-Kekana,    Kaveri Halder,    Véronique Filippi",2019,https://link.springer.com/article/10.1186/s12978-019-0668-y,https://link.springer.com/content/pdf/10.1186%2Fs12978-019-0668-y.pdf,,,1,No cite count available,https://doi.org/10.1186/s12978-019-0668-y
Brain transcriptome atlases: a computational perspective,"Ahmed Mahfouz,    Sjoerd M. H. Huisman…",2017,https://link.springer.com/article/10.1007/s00429-016-1338-2,https://link.springer.com/content/pdf/10.1007%2Fs00429-016-1338-2.pdf,,,1,3,https://doi.org/10.1007/s00429-016-1338-2
Vulnerability and Resilience of Human-Natural Systems of Pastoralism Worldwide,"Shikui Dong,    Shiliang Liu,    Lu Wen",2016,https://link.springer.com/chapter/10.1007/978-3-319-30732-9_2,No PDF available,,,1,No cite count available,https://doi.org/10.1007/978-3-319-30732-9_2
“Absurd and Foolish Philosophy”: Hobbes and Rochester,Richard Hillyer,2007,https://link.springer.com/chapter/10.1057/9780230604346_5,No PDF available,,,1,No cite count available,https://doi.org/10.1057/9780230604346_5
The Foster–Greer–Thorbecke (FGT) poverty measures: 25 years later,"James Foster,    Joel Greer,    Erik Thorbecke",2010,https://link.springer.com/article/10.1007/s10888-010-9136-1,No PDF available,,,1,39,https://doi.org/10.1007/s10888-010-9136-1
Between Models and Machines,Joakim Juhl,2016,https://link.springer.com/chapter/10.1007/978-94-6300-752-8_13,No PDF available,,,1,No cite count available,https://doi.org/10.1007/978-94-6300-752-8_13
What Do Panel Studies Tell Us About a Deterrent Effect of Capital Punishment? A Critique of the Literature,"Aaron Chalfin,    Amelia M. Haviland,    Steven Raphael",2013,https://link.springer.com/article/10.1007/s10940-012-9168-8,No PDF available,,,1,10,https://doi.org/10.1007/s10940-012-9168-8
Communities as “Big Small Groups”: Culture and Social Capital,"Michael Reisch,    Dana Guyet",2007,https://link.springer.com/chapter/10.1007/978-0-387-32933-8_11,No PDF available,,,1,No cite count available,https://doi.org/10.1007/978-0-387-32933-8_11
EINSTein: A Multiagent-based Model of Combat,Andrew Ilachinski,2005,https://link.springer.com/chapter/10.1007/1-84628-214-4_7,No PDF available,,,1,2,https://doi.org/10.1007/1-84628-214-4_7
Semantic ambient media: From ambient advertising to ambient-assisted living,"Bogdan Pogorelc,    Radu-Daniel Vatavu,    Artur Lugmayr…",2012,https://link.springer.com/article/10.1007/s11042-011-0917-8,No PDF available,,,1,10,https://doi.org/10.1007/s11042-011-0917-8
The complex remuneration of human resources for health in low-income settings: policy implications and a research agenda for designing effective financial incentives,"Maria Paola Bertone,    Sophie Witter",2015,https://link.springer.com/article/10.1186/s12960-015-0058-7,https://link.springer.com/content/pdf/10.1186%2Fs12960-015-0058-7.pdf,,,1,14,https://doi.org/10.1186/s12960-015-0058-7
"The Infant–Toddler Social and Emotional Assessment (ITSEA): Factor Structure, Reliability, and Validity","Alice S. Carter,    Margaret J. Briggs-Gowan…",2003,https://link.springer.com/article/10.1023/A%3A1025449031360,No PDF available,,,1,266,https://doi.org/10.1023/A:1025449031360
"National Inventory of Landscapes in Sweden (NILS)—scope, design, and experiences from establishing a multiscale biodiversity monitoring system","Göran Ståhl,    Anna Allard,    Per-Anders Esseen…",2011,https://link.springer.com/article/10.1007/s10661-010-1406-7,No PDF available,,,1,69,https://doi.org/10.1007/s10661-010-1406-7
Seaweed Lipidomics in the Era of ‘Omics’ Biology: A Contemporary Perspective,Puja Kumari,2017,https://link.springer.com/chapter/10.1007/978-3-319-62094-7_4,No PDF available,,,1,No cite count available,https://doi.org/10.1007/978-3-319-62094-7_4
Enabling the Smooth Integration of Core Assets: Defining and Packaging Architectural Rules for a Family of Embedded Products,Tim Trew,2005,https://link.springer.com/chapter/10.1007/11554844_17,No PDF available,,,1,3,https://doi.org/10.1007/11554844_17
Challenges of Testing Web Services and Security in SOA Implementations,"Abbie Barbir,    Chris Hobbs,    Elisa Bertino…",2007,https://link.springer.com/chapter/10.1007/978-3-540-72912-9_14,No PDF available,,,1,11,https://doi.org/10.1007/978-3-540-72912-9_14
The number and type of food retailers surrounding schools and their association with lunchtime eating behaviours in students,"Laura Seliske,    William Pickett,    Andrei Rosu…",2013,https://link.springer.com/article/10.1186/1479-5868-10-19,https://link.springer.com/content/pdf/10.1186%2F1479-5868-10-19.pdf,,,1,20,https://doi.org/10.1186/1479-5868-10-19
Decision Hierarchies,"Vincent C. S. Wiers,    A. (Ton) G. de Kok",2018,https://link.springer.com/chapter/10.1007/978-3-319-65055-5_3,No PDF available,,,1,No cite count available,https://doi.org/10.1007/978-3-319-65055-5_3
"Imaginative geographies: identity, difference, and English as the language of instruction in a Mexican university program",Blanca Minerva Torres-Olave,2012,https://link.springer.com/article/10.1007/s10734-011-9443-x,No PDF available,,,1,9,https://doi.org/10.1007/s10734-011-9443-x
Cropland Soil Carbon Dynamics,"Klaus Lorenz,    Rattan Lal",2012,https://link.springer.com/chapter/10.1007/978-94-007-4159-1_14,No PDF available,,,1,No cite count available,https://doi.org/10.1007/978-94-007-4159-1_14
Destigmatizing Infrastructure: Design of Community-Friendly Facilities,Hillary Brown,2014,https://link.springer.com/chapter/10.5822/978-1-61091-202-0_5,No PDF available,,,1,No cite count available,https://doi.org/10.5822/978-1-61091-202-0_5
Student Models of Instructional Design,"Susan G. Magliaro,    Neal Shambaugh",2006,https://link.springer.com/article/10.1007/s11423-006-6498-y,No PDF available,,,1,8,https://doi.org/10.1007/s11423-006-6498-y
Shall we dance? A design epistemology for organizational learning and performance,Gordon Rowland,2004,https://link.springer.com/article/10.1007/BF02504771,No PDF available,,,1,13,https://doi.org/10.1007/BF02504771
Attention Allocation,"Ben Goertzel,    Cassio Pennachin,    Nil Geisweiller",2014,https://link.springer.com/chapter/10.2991/978-94-6239-030-0_5,No PDF available,,,1,No cite count available,https://doi.org/10.2991/978-94-6239-030-0_5
Mortuary Pathways and Ritual Meanings Related to Maya Human Bone Deposits in Subterranean Contexts,"Andrea Cucina,    Vera Tiesler",2014,https://link.springer.com/chapter/10.1007/978-1-4939-0479-2_9,No PDF available,,,1,1,https://doi.org/10.1007/978-1-4939-0479-2_9
Nurturing entrepreneurial resources,Benoît Gailly,2011,https://link.springer.com/chapter/10.1057/9780230295285_4,No PDF available,,,1,No cite count available,https://doi.org/10.1057/9780230295285_4
Freud’s Ωmega and Self-Reference,Petr Bob,2015,https://link.springer.com/chapter/10.1007/978-1-4939-2700-5_5,No PDF available,,,1,No cite count available,https://doi.org/10.1007/978-1-4939-2700-5_5
Automated bug assignment: Ensemble-based machine learning in large scale industrial contexts,"Leif Jonsson,    Markus Borg,    David Broman,    Kristian Sandahl…",2016,https://link.springer.com/article/10.1007/s10664-015-9401-9,No PDF available,,,1,18,https://doi.org/10.1007/s10664-015-9401-9
Complementarity Beyond Physics,Arun Bala,2017,https://link.springer.com/chapter/10.1007/978-3-319-39784-9_1,No PDF available,,,1,No cite count available,https://doi.org/10.1007/978-3-319-39784-9_1
Introduction: Political Representation in France and Germany,"Oscar W. Gabriel,    Eric Kerrouche…",2018,https://link.springer.com/chapter/10.1007/978-3-319-72029-6_1,No PDF available,,,1,No cite count available,https://doi.org/10.1007/978-3-319-72029-6_1
The identification of Customary International Law: a process that defies prescription,Sreenivasa Rao Pemmaraju,2017,https://link.springer.com/article/10.1007/s40901-018-0082-y,No PDF available,,,1,No cite count available,https://doi.org/10.1007/s40901-018-0082-y
Ecological Functions and Adaptations of the Elasmobranch Electrosense,"Timothy C. Tricas,    Joseph A. Sisneros",2004,https://link.springer.com/chapter/10.1007/978-94-007-1060-3_14,No PDF available,,,1,8,https://doi.org/10.1007/978-94-007-1060-3_14
Autorenregister,No author available,2017,https://link.springer.com/article/10.1007/s11825-017-0126-6,No PDF available,,,1,No cite count available,https://doi.org/10.1007/s11825-017-0126-6
Abstracts of scientific papers fifth International Symposium on Computing in Anesthesia and Intensive Care,No author available,1988,https://link.springer.com/article/10.1007/BF01641815,No PDF available,,,1,No cite count available,https://doi.org/10.1007/BF01641815
Ecological Factors Driving Uptake of Anticoagulant Rodenticides in Predators,"Sofi Hindmarch,    John E. Elliott",2018,https://link.springer.com/chapter/10.1007/978-3-319-64377-9_9,No PDF available,,,1,No cite count available,https://doi.org/10.1007/978-3-319-64377-9_9
Navigation AT: Context-aware Computing,Nicholas Bradley…,2008,https://link.springer.com/chapter/10.1007/978-1-84628-867-8_7,No PDF available,,,1,6,https://doi.org/10.1007/978-1-84628-867-8_7
Crosstalk between glial and glioblastoma cells triggers the “go-or-grow” phenotype of tumor cells,"Ana Isabel Oliveira,    Sandra I. Anjo…",2017,https://link.springer.com/article/10.1186/s12964-017-0194-x,https://link.springer.com/content/pdf/10.1186%2Fs12964-017-0194-x.pdf,,,1,2,https://doi.org/10.1186/s12964-017-0194-x
Edge effects and tropical forest canopy invertebrates,"Andrew Foggo,    Claire M.P. Ozanne,    Martin R. Speight,    Clive Hambler",2001,https://link.springer.com/article/10.1023/A%3A1017594108769,No PDF available,,,1,34,https://doi.org/10.1023/A:1017594108769
Cardiovascular magnetic resonance for amyloidosis,"Marianna Fontana,    Robin Chung,    Philip N. Hawkins,    James C. Moon",2015,https://link.springer.com/article/10.1007/s10741-014-9470-7,No PDF available,,,1,44,https://doi.org/10.1007/s10741-014-9470-7
An Overview of Web Services Security,"P Kearney,    J Chapman,    N Edwards,    M Gifford,    L He",2004,https://link.springer.com/article/10.1023/B%3ABTTJ.0000015493.00504.3c,No PDF available,,,1,5,https://doi.org/10.1023/B:BTTJ.0000015493.00504.3c
"Reaching older people with PA delivered in football clubs: the reach, adoption and implementation characteristics of the Extra Time Programme","Daniel Parnell,    Andy Pringle,    Jim McKenna,    Stephen Zwolinsky…",2015,https://link.springer.com/article/10.1186/s12889-015-1560-5,https://link.springer.com/content/pdf/10.1186%2Fs12889-015-1560-5.pdf,,,1,17,https://doi.org/10.1186/s12889-015-1560-5
Drivers of private-label purchase behavior across quality tiers and product categories,"Philipp Noormann,    Sebastian Tillmanns",2017,https://link.springer.com/article/10.1007/s11573-016-0837-1,https://link.springer.com/content/pdf/10.1007%2Fs11573-016-0837-1.pdf,,,1,2,https://doi.org/10.1007/s11573-016-0837-1
Thresholds of knowledge development in complex problem solving: a multiple-case study of advanced learners’ cognitive processes,"Treavor Bogard,    Min Liu…",2013,https://link.springer.com/article/10.1007/s11423-013-9295-4,No PDF available,,,1,10,https://doi.org/10.1007/s11423-013-9295-4
The Component of Searchable Storage: Semantic-Aware Namespace,"Yu Hua,    Xue Liu",2019,https://link.springer.com/chapter/10.1007/978-981-13-2721-6_3,No PDF available,,,1,No cite count available,https://doi.org/10.1007/978-981-13-2721-6_3
