title,author,date,link,pdf_link,query,search_engine,nr_found,cite_count,doiEmpirical Evidence of Behavioral Interdependencies Across Life Choices,"Yubing Xiong,    Junyi Zhang",2017,https://link.springer.com/chapter/10.1007/978-4-431-56472-0_2,No PDF available,,,1,No cite count available,https://doi.org/10.1007/978-4-431-56472-0_2
Towards an Intelligent Environment for Programming Multi-core Computing Systems,"Sabri Pllana,    Siegfried Benkner…",2009,https://link.springer.com/chapter/10.1007/978-3-642-00955-6_19,No PDF available,,,1,7,https://doi.org/10.1007/978-3-642-00955-6_19
Emergent Semantics Systems,"Karl Aberer,    Tiziana Catarci…",2004,https://link.springer.com/chapter/10.1007/978-3-540-30145-5_2,https://link.springer.com/content/pdf/10.1007%2F978-3-540-30145-5_2.pdf,,,1,2,https://doi.org/10.1007/978-3-540-30145-5_2
Introduction,Tom D. Dillehay,2014,https://link.springer.com/chapter/10.1007/978-3-319-03128-6_1,No PDF available,,,1,1,https://doi.org/10.1007/978-3-319-03128-6_1
Social Sounds: Vocal Learning and Development of Mammal and Bird Calls,"Janette Wenrick Boughman,    Cynthia F. Moss",2003,https://link.springer.com/chapter/10.1007/0-387-22762-8_4,No PDF available,,,1,21,https://doi.org/10.1007/0-387-22762-8_4
Meeting abstracts from the 11th European Cytogenetics Conference,No author available,2017,https://link.springer.com/article/10.1186/s13039-017-0319-3,https://link.springer.com/content/pdf/10.1186%2Fs13039-017-0319-3.pdf,,,1,2,https://doi.org/10.1186/s13039-017-0319-3
Unmasking Environmental Health Zorros: The Need for Involvement of Real Risk Communication Experts for Two-Way and Problem-Solving Communication Approaches,"Hans Keune,    Peter Van Den Hazel…",2016,https://link.springer.com/chapter/10.1007/978-3-319-43142-0_10,No PDF available,,,1,No cite count available,https://doi.org/10.1007/978-3-319-43142-0_10
Nutrition during pregnancy and early development (NuPED) in urban South Africa: a study protocol for a prospective cohort,"Elizabeth A. Symington,    Jeannine Baumgartner,    Linda Malan…",2018,https://link.springer.com/article/10.1186/s12884-018-1943-6,https://link.springer.com/content/pdf/10.1186%2Fs12884-018-1943-6.pdf,,,1,No cite count available,https://doi.org/10.1186/s12884-018-1943-6
Sustainable food systems—a health perspective,"Elisabet Lindgren,    Francesca Harris,    Alan D. Dangour…",2018,https://link.springer.com/article/10.1007/s11625-018-0586-x,https://link.springer.com/content/pdf/10.1007%2Fs11625-018-0586-x.pdf,,,1,1,https://doi.org/10.1007/s11625-018-0586-x
Reasoning about Software Architectures with Contractually Specified Components,"Ralf H. Reussner,    Iman H. Poernomo,    Heinz W. Schmidt",2003,https://link.springer.com/chapter/10.1007/978-3-540-45064-1_14,No PDF available,,,1,8,https://doi.org/10.1007/978-3-540-45064-1_14
Theory for Modeling Articular Cartilage,"David W. Smith,    Bruce S. Gardiner,    Lihai Zhang…",2019,https://link.springer.com/chapter/10.1007/978-981-13-1474-2_7,No PDF available,,,1,No cite count available,https://doi.org/10.1007/978-981-13-1474-2_7
Cultural Communication Patterns: A Way How Management and Engineering Can Improve Their Mutual Understanding,"Senana Brugger,    Oliver Mack",2017,https://link.springer.com/chapter/10.1007/978-3-319-44468-0_3,No PDF available,,,1,No cite count available,https://doi.org/10.1007/978-3-319-44468-0_3
Introduction: Trust as a Matter of Equity and Excellence in Education,"Dimitri Van Maele,    Mieke Van Houtte,    Patrick B. Forsyth",2014,https://link.springer.com/chapter/10.1007/978-94-017-8014-8_1,No PDF available,,,1,4,https://doi.org/10.1007/978-94-017-8014-8_1
Reviewing and Discovering the Concepts,Héctor O. Rocha,2013,https://link.springer.com/chapter/10.1057/9781137298263_2,No PDF available,,,1,No cite count available,https://doi.org/10.1057/9781137298263_2
Supply Chain Development Under Conflict Conditions: Case of Nepal,Raj Kumar Bhattarai,2015,https://link.springer.com/chapter/10.1007/978-3-319-05765-1_11,No PDF available,,,1,No cite count available,https://doi.org/10.1007/978-3-319-05765-1_11
Knowledge Systems Engineering: A Complex System View,"Zhongtuo Wang,    Jiangning Wu",2016,https://link.springer.com/chapter/10.1007/978-4-431-55218-5_7,No PDF available,,,1,No cite count available,https://doi.org/10.1007/978-4-431-55218-5_7
Precision (and Accuracy) in Academic Written and Spoken English. An Exercise in Awareness-Raising,Andrzej Łyda,2016,https://link.springer.com/chapter/10.1007/978-3-319-31954-4_14,No PDF available,,,1,No cite count available,https://doi.org/10.1007/978-3-319-31954-4_14
Proteomics of Lactic Acid Bacteria,"Rina Wu,    Jing Lu",2014,https://link.springer.com/chapter/10.1007/978-94-017-8841-0_4,No PDF available,,,1,No cite count available,https://doi.org/10.1007/978-94-017-8841-0_4
Intertemporal deprivation in rural china: income and nutrition,"Jing You,    Sangui Wang,    Laurence Roope",2018,https://link.springer.com/article/10.1007/s10888-017-9352-z,https://link.springer.com/content/pdf/10.1007%2Fs10888-017-9352-z.pdf,,,1,2,https://doi.org/10.1007/s10888-017-9352-z
Addressing Autonomy And Interoperability In Breeding Environments,"Toni Ruokolainen,    Lea Kutvonen",2006,https://link.springer.com/chapter/10.1007/978-0-387-38269-2_50,https://link.springer.com/content/pdf/10.1007%2F978-0-387-38269-2_50.pdf,,,1,No cite count available,https://doi.org/10.1007/978-0-387-38269-2_50
"Perceptions of health stakeholders on task shifting and motivation of community health workers in different socio demographic contexts in Kenya (nomadic, peri-urban and rural agrarian)","Beverly Marion Ochieng,    Edith Akunja,    Nancy Edwards…",2014,https://link.springer.com/article/10.1186/1472-6963-14-S1-S4,https://link.springer.com/content/pdf/10.1186%2F1472-6963-14-S1-S4.pdf,,,1,10,https://doi.org/10.1186/1472-6963-14-S1-S4
Evolutionary models and the normative significance of stability,Arnon Levy,2018,https://link.springer.com/article/10.1007/s10539-018-9643-1,No PDF available,,,1,No cite count available,https://doi.org/10.1007/s10539-018-9643-1
Elements of Context Awareness,"Punnarumol Temdee,    Ramjee Prasad",2018,https://link.springer.com/chapter/10.1007/978-3-319-59035-6_3,No PDF available,,,1,No cite count available,https://doi.org/10.1007/978-3-319-59035-6_3
Timing in Speech: A Multi-Level Process,Nick Campbell,2000,https://link.springer.com/chapter/10.1007/978-94-015-9413-4_11,No PDF available,,,1,4,https://doi.org/10.1007/978-94-015-9413-4_11
Elements of Industrial Organization,P. K. Rao,2003,https://link.springer.com/chapter/10.1057/9780230597686_2,No PDF available,,,1,No cite count available,https://doi.org/10.1057/9780230597686_2
Understanding Gender and Culture in Agriculture: The Role of Qualitative and Quantitative Approaches,"Julia A. Behrman,    Ruth Meinzen-Dick,    Agnes R. Quisumbing",2014,https://link.springer.com/chapter/10.1007/978-94-017-8616-4_2,No PDF available,,,1,3,https://doi.org/10.1007/978-94-017-8616-4_2
Sexually distinct foraging strategies in an omnivorous seabird,"Kees C. J. Camphuysen,    Judy Shamoun-Baranes,    E. Emiel van Loon…",2015,https://link.springer.com/article/10.1007/s00227-015-2678-9,No PDF available,,,1,26,https://doi.org/10.1007/s00227-015-2678-9
On object-oriented design and verification,"C. Lewerentz,    Th. Lindner,    A. Rüping…",1995,https://link.springer.com/chapter/10.1007/BFb0015457,No PDF available,,,1,No cite count available,https://doi.org/10.1007/BFb0015457
Forest habitats in a mixed urban-agriculture mosaic landscape: patterns of mammal occupancy,"Yvette C. Ehlers Smith,    David A. Ehlers Smith,    T. Ramesh…",2018,https://link.springer.com/article/10.1007/s10980-017-0580-1,No PDF available,,,1,6,https://doi.org/10.1007/s10980-017-0580-1
"Effects of Range, Habitat and Roosting Ecology in Patterns of Group Association in Bats",Maria Sagot,2016,https://link.springer.com/chapter/10.1007/978-3-319-38953-0_12,No PDF available,,,1,No cite count available,https://doi.org/10.1007/978-3-319-38953-0_12
Digital co-construction of relational values: understanding the role of social media for sustainability,"Fulvia Calcagni,    Ana Terra Amorim Maia…",2019,https://link.springer.com/article/10.1007/s11625-019-00672-1,No PDF available,,,1,No cite count available,https://doi.org/10.1007/s11625-019-00672-1
Conceptions of Professional Competence,Martin Mulder Ph.D.,2014,https://link.springer.com/chapter/10.1007/978-94-017-8902-8_5,No PDF available,,,1,24,https://doi.org/10.1007/978-94-017-8902-8_5
"A quasi-experimental cross-disciplinary evaluation of the impacts of education outside the classroom on pupils’ physical activity, well-being and learning: the TEACHOUT study protocol","Glen Nielsen,    Erik Mygind,    Mads Bølling,    Camilla Roed Otte…",2016,https://link.springer.com/article/10.1186/s12889-016-3780-8,https://link.springer.com/content/pdf/10.1186%2Fs12889-016-3780-8.pdf,,,1,13,https://doi.org/10.1186/s12889-016-3780-8
Market-resource Links and Fish Vendor Livelihoods in the Upper Zambezi River Floodplains,"James G. Abbott,    Lisa M. Campbell,    Clinton J. Hay,    Tor F. Næsje…",2007,https://link.springer.com/article/10.1007/s10745-006-9102-5,No PDF available,,,1,7,https://doi.org/10.1007/s10745-006-9102-5
Exploiting Execution Context for the Detection of Anomalous System Calls,"Darren Mutz,    William Robertson,    Giovanni Vigna…",2007,https://link.springer.com/chapter/10.1007/978-3-540-74320-0_1,No PDF available,,,1,13,https://doi.org/10.1007/978-3-540-74320-0_1
Liquidity Risk Management in Banks: Economic and Regulatory Issues,"Roberto Ruozi,    Pierpaolo Ferrari",2013,https://link.springer.com/chapter/10.1007/978-3-642-29581-2_1,No PDF available,,,1,No cite count available,https://doi.org/10.1007/978-3-642-29581-2_1
Nutrition Evidence in Context,"Saskia de Pee,    Rebecca F. Grais",2017,https://link.springer.com/chapter/10.1007/978-3-319-43739-2_3,No PDF available,,,1,1,https://doi.org/10.1007/978-3-319-43739-2_3
"Identity, Citizenship and Identification",Pontus Odmalm,2005,https://link.springer.com/chapter/10.1057/9780230512382_4,No PDF available,,,1,No cite count available,https://doi.org/10.1057/9780230512382_4
"Identity, Citizenship and Identification",Pontus Odmalm,2005,https://link.springer.com/chapter/10.1007/978-0-230-51238-2_4,No PDF available,,,1,No cite count available,https://doi.org/10.1007/978-0-230-51238-2_4
Architectural Issues,No author available,2006,https://link.springer.com/chapter/10.1007/978-0-387-35417-0_4,No PDF available,,,1,No cite count available,https://doi.org/10.1007/978-0-387-35417-0_4
Effect of within-species plant genotype mixing on habitat preference of a polyphagous insect predator,"Velemir Ninkovic,    Sate Al Abassi,    Elham Ahmed,    Robert Glinwood,    Jan Pettersson",2011,https://link.springer.com/article/10.1007/s00442-010-1839-2,https://link.springer.com/content/pdf/10.1007%2Fs00442-010-1839-2.pdf,,,1,21,https://doi.org/10.1007/s00442-010-1839-2
AI Business: Framework and Maturity Model,Peter Gentsch,2019,https://link.springer.com/chapter/10.1007/978-3-319-89957-2_3,No PDF available,,,1,No cite count available,https://doi.org/10.1007/978-3-319-89957-2_3
Context-Awareness in User Modelling: Requirements Analysis for a Case-Based Reasoning Application,Andreas Zimmermann,2003,https://link.springer.com/chapter/10.1007/3-540-45006-8_54,No PDF available,,,1,10,https://doi.org/10.1007/3-540-45006-8_54
Innovative models of pension fund governance in the context of the global financial crisis,"Gordon L Clark,    Roger Urwin",2010,https://link.springer.com/article/10.1057/pm.2009.25,https://link.springer.com/content/pdf/10.1057%2Fpm.2009.25.pdf,,,1,17,https://doi.org/10.1057/pm.2009.25
Building script-based tacit knowledge in call centre trainees,"Robert J McQueen,    Jihong Chen",2010,https://link.springer.com/article/10.1057/kmrp.2010.18,No PDF available,,,1,3,https://doi.org/10.1057/kmrp.2010.18
High-throughput validation of ceRNA regulatory networks,"Hua-Sheng Chiu,    María Rodríguez Martínez,    Mukesh Bansal…",2017,https://link.springer.com/article/10.1186/s12864-017-3790-7,https://link.springer.com/content/pdf/10.1186%2Fs12864-017-3790-7.pdf,,,1,12,https://doi.org/10.1186/s12864-017-3790-7
Systems Engineering for Organic Computing: The Challenge of Shared Design and Control between OC Systems and their Human Engineers,"Kirstie L. Bellman,    Christopher Landauer,    Phyllis R. Nelson",2008,https://link.springer.com/chapter/10.1007/978-3-540-77657-4_3,No PDF available,,,1,No cite count available,https://doi.org/10.1007/978-3-540-77657-4_3
Different Techniques and Different Aspects on Declarative Knowledge,John G. Gammack,1987,https://link.springer.com/chapter/10.1007/978-1-4613-1823-1_7,No PDF available,,,1,9,https://doi.org/10.1007/978-1-4613-1823-1_7
"Quality and Equality in American Education: Systemic Problems, Systemic Solutions","Jennifer A. O’Day,    Marshall S. Smith",2016,https://link.springer.com/chapter/10.1007/978-3-319-25991-8_9,https://link.springer.com/content/pdf/10.1007%2F978-3-319-25991-8_9.pdf,,,1,7,https://doi.org/10.1007/978-3-319-25991-8_9
Interface-Based Protocol Specification of Open Systems using PSL,"Doug Lea,    Jos Marlowe",1995,https://link.springer.com/chapter/10.1007/3-540-49538-X_18,No PDF available,,,1,2,https://doi.org/10.1007/3-540-49538-X_18
SmartComposition: A Component-Based Approach for Creating Multi-screen Mashups,"Michael Krug,    Fabian Wiedemann,    Martin Gaedke",2014,https://link.springer.com/chapter/10.1007/978-3-319-08245-5_14,No PDF available,,,1,7,https://doi.org/10.1007/978-3-319-08245-5_14
Imaging Cognitive Deficits in Drug Abuse,Thomas Lundqvist,2010,https://link.springer.com/chapter/10.1007/7854_2009_26,No PDF available,,,1,29,https://doi.org/10.1007/7854_2009_26
D,"Shigeo Okabe,    Peggy Mason,    Geert Keil,    Maria Fitzgerald…",2009,https://link.springer.com/referenceworkentry/10.1007/978-3-540-29678-2_4,No PDF available,,,1,No cite count available,https://doi.org/10.1007/978-3-540-29678-2
Delivering Services in Active Museums via Group Communication,"P. Busetta,    P. Bresciani,    L. Penserini…",2007,https://link.springer.com/chapter/10.1007/3-540-68755-6_5,No PDF available,,,1,No cite count available,https://doi.org/10.1007/3-540-68755-6_5
A Framework for Goal-Based Semantic Compensation in Agent Systems,"Amy Unruh,    James Bailey…",2009,https://link.springer.com/chapter/10.1007/978-3-642-04879-1_10,No PDF available,,,1,2,https://doi.org/10.1007/978-3-642-04879-1_10
Embedding Internet-of-Things in Large-Scale Socio-technical Systems: A Community-Oriented Design in Future Smart Grids,"Yilin Huang,    Giacomo Poderi…",2019,https://link.springer.com/chapter/10.1007/978-3-319-96550-5_6,No PDF available,,,1,No cite count available,https://doi.org/10.1007/978-3-319-96550-5_6
Threads of local continuity between centralized and decentralized causality: Transitional explanations for the behavior of a complex system,Lauren Barth-Cohen,2018,https://link.springer.com/article/10.1007/s11251-018-9454-4,No PDF available,,,1,No cite count available,https://doi.org/10.1007/s11251-018-9454-4
"Signature whistle variations in a bottlenosed dolphin, Tursiops truncatus
","Vincent M. Janik,    Dietmar Todt,    G. Dehnhardt",1994,https://link.springer.com/article/10.1007/BF00170704,No PDF available,,,1,67,https://doi.org/10.1007/BF00170704
Limited geographic variation in the acoustic structure of and responses to adult male alarm barks of African green monkeys,"Tabitha Price,    Oumar Ndiaye,    Kurt Hammerschmidt…",2014,https://link.springer.com/article/10.1007/s00265-014-1694-y,https://link.springer.com/content/pdf/10.1007%2Fs00265-014-1694-y.pdf,,,1,13,https://doi.org/10.1007/s00265-014-1694-y
Discussion,Matthias Mitterlechner,2019,https://link.springer.com/chapter/10.1007/978-3-319-97979-3_8,No PDF available,,,1,No cite count available,https://doi.org/10.1007/978-3-319-97979-3_8
"From R&D Management to Management of Innovation. Research on the Organizational Factor, Trends, Mainstream and Hidden Treasures",Marius T. H. Meeus,2006,https://link.springer.com/chapter/10.1057/9780230378841_3,No PDF available,,,1,No cite count available,https://doi.org/10.1057/9780230378841_3
In Search of Relevant Management Frameworks and Tools,Linda O’Riordan,2017,https://link.springer.com/chapter/10.1007/978-3-319-50240-3_5,No PDF available,,,1,No cite count available,https://doi.org/10.1007/978-3-319-50240-3_5
Understanding diversity: a Dutch case study on teachers’ attitudes towards their diverse student population,"Daniel van Middelkoop,    Hafid Ballafkih…",2017,https://link.springer.com/article/10.1186/s40461-016-0045-9,https://link.springer.com/content/pdf/10.1186%2Fs40461-016-0045-9.pdf,,,1,3,https://doi.org/10.1186/s40461-016-0045-9
Techniques for Supporting Dynamic and Adaptive Workflow,"Peter J. Kammer,    Gregory Alan Bolcer…",2000,https://link.springer.com/article/10.1023/A%3A1008747109146,No PDF available,,,1,94,https://doi.org/10.1023/A:1008747109146
Mobilization of Neural Precursors in the Adult Central Nervous System,"Theo D. Palmer,    Fred H. Gage",2006,https://link.springer.com/chapter/10.1385/1-59259-914-1%3A343,No PDF available,,,1,1,https://doi.org/10.1385/1-59259-914-1:343
Context effects and decompositional choice modeling,"Harmen Oppewal,    Harry Timmermans",1991,https://link.springer.com/article/10.1007/BF01434324,No PDF available,,,1,2,https://doi.org/10.1007/BF01434324
Basic Concepts of Systems Biology as Seen Through Systems Biologists’ Eyes: Metaphorical Imagination and Epistemic Presuppositions,"Martin Döring,    Regine Kollek,    Anne Brüninghaus…",2015,https://link.springer.com/chapter/10.1007/978-3-319-17106-7_2,No PDF available,,,1,No cite count available,https://doi.org/10.1007/978-3-319-17106-7_2
Papers read at the 26th Annual Meeting of the Psychonomic Society,No author available,1985,https://link.springer.com/article/10.3758/BF03329844,https://link.springer.com/content/pdf/10.3758%2FBF03329844.pdf,,,1,No cite count available,https://doi.org/10.3758/BF03329844
"Time Use, Time Pressure and Gendered Behavior in Early and Late Adolescence","Margo Hilbrecht,    Jiri Zuzanek,    Roger C. Mannell",2008,https://link.springer.com/article/10.1007/s11199-007-9347-5,No PDF available,,,1,21,https://doi.org/10.1007/s11199-007-9347-5
Towards Bottom-Up Decision Making and Collaborative Knowledge Generation in Urban Infrastructure Projects Through Online Social Media,"Mazdak Nik-Bakht,    Tamer E. El-Diraby",2015,https://link.springer.com/chapter/10.1007/978-3-319-18552-1_8,No PDF available,,,1,No cite count available,https://doi.org/10.1007/978-3-319-18552-1_8
The Neuroethology of Perception and Action,J. Dean,1990,https://link.springer.com/chapter/10.1007/978-3-642-75348-0_5,No PDF available,,,1,No cite count available,https://doi.org/10.1007/978-3-642-75348-0_5
Reproductive Trade-Offs and Direct Costs for Males in Arthropods,"Inon Scharf,    Franziska Peter,    Oliver Y. Martin",2013,https://link.springer.com/article/10.1007/s11692-012-9213-4,No PDF available,,,1,55,https://doi.org/10.1007/s11692-012-9213-4
Naturalistic decision making: navigating uncertainty in complex sociotechnical work,"Julie Gore,    Paul Ward,    Gareth E. Conway,    Thomas C. Ormerod…",2018,https://link.springer.com/article/10.1007/s10111-018-0531-x,https://link.springer.com/content/pdf/10.1007%2Fs10111-018-0531-x.pdf,,,1,No cite count available,https://doi.org/10.1007/s10111-018-0531-x
Adhesion on Protein (and Other Rough Biomolecular) Surfaces,Anirban Banerji,2013,https://link.springer.com/chapter/10.1007/978-3-0348-0654-1_3,No PDF available,,,1,No cite count available,https://doi.org/10.1007/978-3-0348-0654-1_3
Abstracts,No author available,2008,https://link.springer.com/article/10.1007/s00406-008-4002-x,No PDF available,,,1,No cite count available,https://doi.org/10.1007/s00406-008-4002-x
Reworking the appraisal framework in ESL research: refining attitude resources,"Thu Ngo,    Len Unsworth",2015,https://link.springer.com/article/10.1186/s40554-015-0013-x,https://link.springer.com/content/pdf/10.1186%2Fs40554-015-0013-x.pdf,,,1,8,https://doi.org/10.1186/s40554-015-0013-x
A Framework for the Design of Alliance Governance Systems,Sascha Albers,2005,https://link.springer.com/chapter/10.1007/978-3-658-24711-9_4,No PDF available,,,1,No cite count available,https://doi.org/10.1007/978-3-658-24711-9_4
Capital Structures and Related Financing Issues,Michael Z. Brooke MA PhD FIEx.,1990,https://link.springer.com/chapter/10.1007/978-1-349-11795-6_2,No PDF available,,,1,No cite count available,https://doi.org/10.1007/978-1-349-11795-6_2
Bioacoustics and the Lateral Line System of Fishes,"Jacqueline F. Webb,    John C. Montgomery,    Joachim Mogdans",2008,https://link.springer.com/chapter/10.1007/978-0-387-73029-5_5,No PDF available,,,1,9,https://doi.org/10.1007/978-0-387-73029-5_5
Effects of injustice in primary schools on students’ behavior and joy of learning,"Natalie Ehrhardt-Madapathi,    Johanna Pretsch…",2018,https://link.springer.com/article/10.1007/s11218-017-9416-8,No PDF available,,,1,1,https://doi.org/10.1007/s11218-017-9416-8
SCALING TERRESTRIAL BIOGEOCHEMICAL PROCESSES CONTRASTING INTACT AND MODEL EXPERIMENTAL SYSTEMS,"Mark A. Bradford,    James F. Reynolds",2006,https://link.springer.com/chapter/10.1007/1-4020-4663-4_6,No PDF available,,,1,No cite count available,https://doi.org/10.1007/1-4020-4663-4_6
Vocal Ontogeny in Macaques and Marmosets: Convergent and Divergent Lines of Development,John D. Newman,1995,https://link.springer.com/chapter/10.1007/978-1-4757-9930-9_4,No PDF available,,,1,8,https://doi.org/10.1007/978-1-4757-9930-9_4
Ups and downs of art commerce: narratives of “crisis” in the contemporary art markets of Russia and India,Nataliya Komarova,2017,https://link.springer.com/article/10.1007/s11186-017-9295-1,https://link.springer.com/content/pdf/10.1007%2Fs11186-017-9295-1.pdf,,,1,3,https://doi.org/10.1007/s11186-017-9295-1
Political Competition and the Impact of Local Governance on Pro-Poor Programs,"Pranab Bardhan,    Dilip Mookherjee",2010,https://link.springer.com/chapter/10.1057/9780230295018_11,No PDF available,,,1,No cite count available,https://doi.org/10.1057/9780230295018_11
Knowledge Management Selection Model for Project Management,Meliha Handzic,2017,https://link.springer.com/chapter/10.1007/978-3-319-51067-5_7,No PDF available,,,1,No cite count available,https://doi.org/10.1007/978-3-319-51067-5_7
Practical Guide: Genomic Techniques and How to Apply Them to Marine Questions,"Virginie Mittard-Runte,    Thomas Bekel,    Jochen Blom…",2010,https://link.springer.com/chapter/10.1007/978-90-481-8639-6_9,No PDF available,,,1,No cite count available,https://doi.org/10.1007/978-90-481-8639-6_9
"Method, Process And Presentation",Elena Nardi,2008,https://link.springer.com/chapter/10.1007/978-0-387-37143-6_2,No PDF available,,,1,No cite count available,https://doi.org/10.1007/978-0-387-37143-6_2
Mining system logs to learn error predictors: a case study of a telemetry system,"Barbara Russo,    Giancarlo Succi,    Witold Pedrycz",2015,https://link.springer.com/article/10.1007/s10664-014-9303-2,No PDF available,,,1,3,https://doi.org/10.1007/s10664-014-9303-2
Conceptual Model of Internet-Based Customer Value Management,Tymoteusz Doligalski,2015,https://link.springer.com/chapter/10.1007/978-3-319-09855-5_3,No PDF available,,,1,No cite count available,https://doi.org/10.1007/978-3-319-09855-5_3
The Demography of Race and Ethnicity of Mexico,María Isabel Ayala Ph.D.,2015,https://link.springer.com/chapter/10.1007/978-90-481-8891-8_4,No PDF available,,,1,No cite count available,https://doi.org/10.1007/978-90-481-8891-8_4
Real-time spatio-temporal analysis of dynamic scenes,"Tobias Warden,    Ubbo Visser",2012,https://link.springer.com/article/10.1007/s10115-011-0422-4,No PDF available,,,1,1,https://doi.org/10.1007/s10115-011-0422-4
A Pilot Study Examining the Effects of Educational Setting and Stress on Multitasking Among Medical Students,"Jason Adam Wasserman,    Anastasia Kononova,    Tudor Moldovan…",2019,https://link.springer.com/article/10.1007/s40670-018-00648-3,No PDF available,,,1,No cite count available,https://doi.org/10.1007/s40670-018-00648-3
Abstractions of non-interference security: probabilistic versus possibilistic,"T. S. Hoang,    A. K. McIver,    L. Meinicke,    C. C. Morgan…",2014,https://link.springer.com/article/10.1007/s00165-012-0237-4,No PDF available,,,1,No cite count available,https://doi.org/10.1007/s00165-012-0237-4
Creating Territorial Intelligence Through a Digital Knowledge Ecosystem: A Way to Actualize Farmer Empowerment,"Monica Sebillo,    Giuliana Vitiello…",2017,https://link.springer.com/chapter/10.1007/978-3-319-62395-5_8,No PDF available,,,1,No cite count available,https://doi.org/10.1007/978-3-319-62395-5_8
Designing computer systems to support peer learning,Claire O’Malley,1992,https://link.springer.com/article/10.1007/BF03172898,No PDF available,,,1,6,https://doi.org/10.1007/BF03172898
"Food purchase patterns indicative of household food access insecurity, children’s dietary diversity and intake, and nutritional status using a newly developed and validated tool in the Peruvian Amazon","Ramya Ambikapathi,    Jessica D. Rothstein,    Pablo Peñataro Yori…",2018,https://link.springer.com/article/10.1007/s12571-018-0815-2,https://link.springer.com/content/pdf/10.1007%2Fs12571-018-0815-2.pdf,,,1,1,https://doi.org/10.1007/s12571-018-0815-2
