title,author,date,link,pdf_link,query,search_engine,nr_found,cite_count,doi"Techno-Organizational Diversity, Network Topologies and the Manageability of Banks",Alexandros-Andreas Kyrtsis,2010,https://link.springer.com/chapter/10.1057/9780230283176_8,No PDF available,,,1,No cite count available,https://doi.org/10.1057/9780230283176_8
Toward an execution system for self-healing workflows in cyber-physical systems,"Ronny Seiger,    Steffen Huber,    Thomas Schlegel",2018,https://link.springer.com/article/10.1007/s10270-016-0551-z,No PDF available,,,1,13,https://doi.org/10.1007/s10270-016-0551-z
Network,"Karen Savage,    Dominic Symonds",2018,https://link.springer.com/chapter/10.1007/978-3-319-95210-9_5,No PDF available,,,1,No cite count available,https://doi.org/10.1007/978-3-319-95210-9_5
Formal Models and Analysis for Self-adaptive Cyber-physical Systems,Holger Giese,2017,https://link.springer.com/chapter/10.1007/978-3-319-57666-4_1,No PDF available,,,1,No cite count available,https://doi.org/10.1007/978-3-319-57666-4_1
Autonomic Sensing,"Benny Lo,    Athanasia Panousopoulou,    Surapa Thiemjarus…",2014,https://link.springer.com/chapter/10.1007/978-1-4471-6374-9_10,No PDF available,,,1,No cite count available,https://doi.org/10.1007/978-1-4471-6374-9_10
Models@run.time: a guided tour of the state of the art and research challenges,"Nelly Bencomo,    Sebastian Götz,    Hui Song",2019,https://link.springer.com/article/10.1007/s10270-018-00712-x,No PDF available,,,1,No cite count available,https://doi.org/10.1007/s10270-018-00712-x
Support Context-Adaptation in the Constrained Application Protocol (CoAP),"Yuji Dong,    Kaiyu Wan,    Yong Yue,    Xin Huang",2019,https://link.springer.com/chapter/10.1007/978-3-030-17642-6_25,No PDF available,,,1,No cite count available,https://doi.org/10.1007/978-3-030-17642-6_25
A Multi-agent Solution for the Deployment of Distributed Applications in Ambient Systems,"Ferdinand Piette,    Costin Caval,    Cédric Dinont…",2016,https://link.springer.com/chapter/10.1007/978-3-319-50983-9_9,No PDF available,,,1,No cite count available,https://doi.org/10.1007/978-3-319-50983-9_9
"Distributed Manufacturing: Paradigms, Concepts, Solutions and Examples",No author available,2010,https://link.springer.com/chapter/10.1007/978-1-84882-707-3_1,No PDF available,,,1,1,https://doi.org/10.1007/978-1-84882-707-3_1
