title,author,date,link,pdf_link,query,search_engine,nr_found,cite_count,doiPC-RE: a method for personal and contextual requirements engineering with some experience,"Alistair Sutcliffe,    Stephen Fickas,    McKay Moore Sohlberg",2006,https://link.springer.com/article/10.1007/s00766-006-0030-0,No PDF available,,,1,43,https://doi.org/10.1007/s00766-006-0030-0
Computational Coordination Mechanisms: A tale of a struggle for flexibility,"Federico Cabitza,    Carla Simone",2013,https://link.springer.com/article/10.1007/s10606-013-9187-5,No PDF available,,,1,17,https://doi.org/10.1007/s10606-013-9187-5
Classifying 3D Human Motions by Mixing Fuzzy Gaussian Inference with Genetic Programming,"Mehdi Khoury,    Honghai Liu",2009,https://link.springer.com/chapter/10.1007/978-3-642-10817-4_6,No PDF available,,,1,No cite count available,https://doi.org/10.1007/978-3-642-10817-4_6
The PERSONA Service Platform for AAL Spaces,"Mohammad-Reza Tazari,    Francesco Furfari…",2010,https://link.springer.com/chapter/10.1007/978-0-387-93808-0_43,No PDF available,,,1,16,https://doi.org/10.1007/978-0-387-93808-0_43
Bringing Complex Event Processing into Multitree Modelling of Sensors,"Alexandre Garnier,    Jean-Marc Menaud…",2016,https://link.springer.com/chapter/10.1007/978-3-319-39577-7_16,No PDF available,,,1,No cite count available,https://doi.org/10.1007/978-3-319-39577-7_16
Service-Oriented Autonomic Pervasive Context,"Colin Aygalinc,    Eva Gerbert-Gaillard,    German Vega…",2016,https://link.springer.com/chapter/10.1007/978-3-319-46295-0_56,No PDF available,,,1,2,https://doi.org/10.1007/978-3-319-46295-0_56
Generic context adaptation for mobile cloud computing environments,"Gabriel Orsini,    Dirk Bade…",2018,https://link.springer.com/article/10.1007/s12652-017-0526-0,No PDF available,,,1,3,https://doi.org/10.1007/s12652-017-0526-0
INTERNET-SCALE CHEMICAL SENSING: IS IT MORE THAN A VISION?,Dermot Diamond,2006,https://link.springer.com/chapter/10.1007/1-4020-4295-7_06,No PDF available,,,1,2,https://doi.org/10.1007/1-4020-4295-7_06
Construction and Execution of Adaptable Applications Using an Aspect-Oriented and Model Driven Approach,"Sten A. Lundesgaard,    Arnor Solberg…",2007,https://link.springer.com/chapter/10.1007/978-3-540-72883-2_6,https://link.springer.com/content/pdf/10.1007%2F978-3-540-72883-2_6.pdf,,,1,13,https://doi.org/10.1007/978-3-540-72883-2_6
Functional Stream Derivatives of Context-Awareness on P2P Networks,"Phan Cong Vinh,    Nguyen Thanh Tung…",2013,https://link.springer.com/chapter/10.1007/978-3-642-36642-0_16,No PDF available,,,1,1,https://doi.org/10.1007/978-3-642-36642-0_16
Synthesizing Service Composition Models on the Basis of Temporal Business Rules,"Jian Yu,    Yan-Bo Han,    Jun Han,    Yan Jin…",2008,https://link.springer.com/article/10.1007/s11390-008-9196-x,No PDF available,,,1,18,https://doi.org/10.1007/s11390-008-9196-x
A dynamic service description for mobile environments,"Rohit Verma,    Abhishek Srivastava",2018,https://link.springer.com/article/10.1007/s00607-018-0611-z,No PDF available,,,1,No cite count available,https://doi.org/10.1007/s00607-018-0611-z
Bigraph-Ensured Interoperability for System(-of-Systems) Emergence,"Dominik Wachholder,    Chris Stary",2014,https://link.springer.com/chapter/10.1007/978-3-662-45550-0_25,No PDF available,,,1,1,https://doi.org/10.1007/978-3-662-45550-0_25
From Interaction to Participation: Configuring Space Through Embodied Interaction,"Amanda Williams,    Eric Kabisch,    Paul Dourish",2005,https://link.springer.com/chapter/10.1007/11551201_17,No PDF available,,,1,13,https://doi.org/10.1007/11551201_17
A Higher-Order Agent Model with Contextual Planning Management for Ambient Systems,Ahmed-Chawki Chaouche…,2014,https://link.springer.com/chapter/10.1007/978-3-662-44871-7_6,No PDF available,,,1,3,https://doi.org/10.1007/978-3-662-44871-7_6
A Self-organizing Architecture for Pervasive Ecosystems,"Cynthia Villalba,    Marco Mamei,    Franco Zambonelli",2010,https://link.springer.com/chapter/10.1007/978-3-642-14412-7_13,No PDF available,,,1,4,https://doi.org/10.1007/978-3-642-14412-7_13
Orchestrating SOA Using Requirement Specifications and Domain Ontologies,"Manoj Bhat,    Chunyang Ye,    Hans-Arno Jacobsen",2014,https://link.springer.com/chapter/10.1007/978-3-662-45391-9_30,No PDF available,,,1,2,https://doi.org/10.1007/978-3-662-45391-9_30
Architecting Resilient Computing Systems: Overall Approach and Open Issues,"Miruna Stoicescu,    Jean-Charles Fabre…",2011,https://link.springer.com/chapter/10.1007/978-3-642-24124-6_5,No PDF available,,,1,4,https://doi.org/10.1007/978-3-642-24124-6_5
Adopting Service Oriented Architectures Made Simple,"L. Bastida,    A. Berreteaga,    I. Cañadas",2008,https://link.springer.com/chapter/10.1007/978-1-84800-221-0_18,No PDF available,,,1,No cite count available,https://doi.org/10.1007/978-1-84800-221-0_18
Test-Enabled Architecture for IoT Service Creation and Provisioning,"Suparna De,    Francois Carrez,    Eike Reetz,    Ralf Tönjes,    Wei Wang",2013,https://link.springer.com/chapter/10.1007/978-3-642-38082-2_20,https://link.springer.com/content/pdf/10.1007%2F978-3-642-38082-2_20.pdf,,,1,3,https://doi.org/10.1007/978-3-642-38082-2_20
A Privacy-Considerate Framework for Identity Management in Mobile Services,"José M. del Álamo,    Antonio M. Fernández,    Rubén Trapero…",2011,https://link.springer.com/article/10.1007/s11036-011-0325-3,No PDF available,,,1,6,https://doi.org/10.1007/s11036-011-0325-3
Mobile Web and Cloud Services,Satish Narayana Srirama,2014,https://link.springer.com/chapter/10.1007/978-1-4614-7535-4_21,No PDF available,,,1,2,https://doi.org/10.1007/978-1-4614-7535-4_21
Web Service Computing: Overview and Directions,"Boualem Benatallah,    Olivier Perrin…",2006,https://link.springer.com/chapter/10.1007/0-387-27705-6_17,No PDF available,,,1,2,https://doi.org/10.1007/0-387-27705-6_17
Internet-of-Things: A New Vision for STEM and CS Education,"Vytautas Štuikys,    Renata Burbaitė",2018,https://link.springer.com/chapter/10.1007/978-3-319-78485-4_14,No PDF available,,,1,No cite count available,https://doi.org/10.1007/978-3-319-78485-4_14
A Common-Sense Planning Strategy for Ambient Intelligence,"María J. Santofimia,    Scott E. Fahlman…",2010,https://link.springer.com/chapter/10.1007/978-3-642-15390-7_20,No PDF available,,,1,3,https://doi.org/10.1007/978-3-642-15390-7_20
Spatial Security Policies for Mobile Agents in a Sentient Computing Environment,"David Scott,    Alastair Beresford…",2003,https://link.springer.com/chapter/10.1007/3-540-36578-8_8,https://link.springer.com/content/pdf/10.1007%2F3-540-36578-8_8.pdf,,,1,8,https://doi.org/10.1007/3-540-36578-8_8
Adaptive Component Allocation in ScudWare Middleware for Ubiquitous Computing,"Qing Wu,    Zhaohui Wu",2005,https://link.springer.com/chapter/10.1007/11596356_114,No PDF available,,,1,3,https://doi.org/10.1007/11596356_114
Tiles for Reo ,"Farhad Arbab,    Roberto Bruni,    Dave Clarke…",2009,https://link.springer.com/chapter/10.1007/978-3-642-03429-9_4,No PDF available,,,1,13,https://doi.org/10.1007/978-3-642-03429-9_4
A Novel Event Based Autonomic Design Pattern for Management of Webservices,"Vishnuvardhan Mannava,    T. Ramesh",2011,https://link.springer.com/chapter/10.1007/978-3-642-22555-0_16,No PDF available,,,1,1,https://doi.org/10.1007/978-3-642-22555-0_16
Interval scripts: a programming paradigm for interactive environments and agents,"Claudio S. Pinhanez,    Aaron F. Bobick",2003,https://link.springer.com/article/10.1007/s00779-002-0209-4,No PDF available,,,1,5,https://doi.org/10.1007/s00779-002-0209-4
From Embedded to Cyber-Physical Systems: Challenges and Future Directions,"John Fitzgerald,    Peter Gorm Larsen…",2014,https://link.springer.com/chapter/10.1007/978-3-642-54118-6_14,No PDF available,,,1,6,https://doi.org/10.1007/978-3-642-54118-6_14
Conjoint PERSONA – SOPRANO Workshop,"Elena Avatangelou,    Rochi Febo Dommarco,    Michael Klein…",2008,https://link.springer.com/chapter/10.1007/978-3-540-85379-4_51,No PDF available,,,1,3,https://doi.org/10.1007/978-3-540-85379-4_51
Mobility-aware Management of Internet Connectivity in Always Best Served Wireless Scenarios,"Paolo Bellavista,    Antonio Corradi,    Carlo Giannelli",2008,https://link.springer.com/article/10.1007/s11036-008-0106-9,No PDF available,,,1,10,https://doi.org/10.1007/s11036-008-0106-9
Information Modelling and Integration Using Ontology Engineering,J. Martín Serrano Orozco,2012,https://link.springer.com/chapter/10.1007/978-1-4614-2236-5_4,No PDF available,,,1,No cite count available,https://doi.org/10.1007/978-1-4614-2236-5_4
Evaluating Emerging ICTs: A Critical Capability Approach of Technology,"Yingqin Zheng,    Bernd Carsten Stahl",2012,https://link.springer.com/chapter/10.1007/978-94-007-3879-9_4,No PDF available,,,1,4,https://doi.org/10.1007/978-94-007-3879-9_4
Statelets: Coordination of Social Collaboration Processes,"Vitaliy Liptchinsky,    Roman Khazankin,    Hong-Linh Truong…",2012,https://link.springer.com/chapter/10.1007/978-3-642-30829-1_1,https://link.springer.com/content/pdf/10.1007%2F978-3-642-30829-1_1.pdf,,,1,2,https://doi.org/10.1007/978-3-642-30829-1_1
Aspects of General Security & Trust,"David Brossard,    Theo Dimitrakos…",2010,https://link.springer.com/chapter/10.1007/978-3-642-04086-3_4,No PDF available,,,1,1,https://doi.org/10.1007/978-3-642-04086-3_4
A Fixpoint-Based Calculus for Graph-Shaped Computational Fields,"Alberto Lluch Lafuente,    Michele Loreti,    Ugo Montanari",2015,https://link.springer.com/chapter/10.1007/978-3-319-19282-6_7,No PDF available,,,1,1,https://doi.org/10.1007/978-3-319-19282-6_7
LISTEN: a user-adaptive audio-augmented museum guide,"Andreas Zimmermann,    Andreas Lorenz",2008,https://link.springer.com/article/10.1007/s11257-008-9049-x,No PDF available,,,1,29,https://doi.org/10.1007/s11257-008-9049-x
A Context Driven Architecture for Cognitive Radio Nodes,"P. Balamuralidhar,    Ramjee Prasad",2008,https://link.springer.com/article/10.1007/s11277-008-9480-7,No PDF available,,,1,16,https://doi.org/10.1007/s11277-008-9480-7
Self-Adaptive Systems: A Middleware Managed Approach,"Eli Gjørven,    Frank Eliassen,    Ketil Lund…",2006,https://link.springer.com/chapter/10.1007/11767886_2,No PDF available,,,1,9,https://doi.org/10.1007/11767886_2
A Goal-Oriented Approach for Modelling Self-organising MAS,"Mirko Morandini,    Frédéric Migeon…",2009,https://link.springer.com/chapter/10.1007/978-3-642-10203-5_4,No PDF available,,,1,8,https://doi.org/10.1007/978-3-642-10203-5_4
Active Coordination Artifacts in Collaborative Ubiquitous-Computing Environments,"Marco P. Locatelli,    Marco Loregian",2007,https://link.springer.com/chapter/10.1007/978-3-540-76652-0_11,No PDF available,,,1,1,https://doi.org/10.1007/978-3-540-76652-0_11
A software architecture centric engineering approach for Internetware,"Hong Mei,    Gang Huang,    Haiyan Zhao…",2006,https://link.springer.com/article/10.1007/s11432-006-2027-1,No PDF available,,,1,21,https://doi.org/10.1007/s11432-006-2027-1
Environment Support to the Management of Context Awareness Information,Marco P. Locatelli…,2008,https://link.springer.com/chapter/10.1007/978-3-540-85029-8_14,No PDF available,,,1,No cite count available,https://doi.org/10.1007/978-3-540-85029-8_14
Recommendation Systems: Bridging Technical Aspects with Marketing Implications,"Vafopoulos Michalis,    Oikonomou Michael",2013,https://link.springer.com/chapter/10.1007/978-3-642-28977-4_5,No PDF available,,,1,No cite count available,https://doi.org/10.1007/978-3-642-28977-4_5
Smart e-commerce systems: current status and research challenges,"Zhiting Song,    Yanming Sun,    Jiafu Wan,    Lingli Huang,    Jianhua Zhu",2017,https://link.springer.com/article/10.1007/s12525-017-0272-3,No PDF available,,,1,No cite count available,https://doi.org/10.1007/s12525-017-0272-3
Supporting software intelligence in ubiquitous environment exploits mobile agent,"Yue-Shan Chang,    Chih-Tien Fan…",2012,https://link.springer.com/article/10.1007/s12652-011-0080-0,No PDF available,,,1,3,https://doi.org/10.1007/s12652-011-0080-0
Semantic Web Enabled VHE for 3rd Generation Telecommunications,"Songtao Lin,    Junliang Chen",2005,https://link.springer.com/chapter/10.1007/11534310_14,No PDF available,,,1,1,https://doi.org/10.1007/11534310_14
Ambient Assisted Living Tools for a Sustanaible Aging Society,"Andrés L. Bleda,    Rafael Maestre…",2014,https://link.springer.com/chapter/10.1007/978-3-319-06704-9_9,No PDF available,,,1,1,https://doi.org/10.1007/978-3-319-06704-9_9
The “FAME” Interactive Space,"F. Metze,    P. Gieselmann,    H. Holzapfel…",2006,https://link.springer.com/chapter/10.1007/11677482_11,No PDF available,,,1,2,https://doi.org/10.1007/11677482_11
Existing Middleware Solutions for Wireless Sensor Networks,"José Cecílio,    Pedro Furtado",2014,https://link.springer.com/chapter/10.1007/978-3-319-09280-5_4,No PDF available,,,1,2,https://doi.org/10.1007/978-3-319-09280-5_4
On enabling integrated process compliance with semantic constraints in process management systems,"Linh Thao Ly,    Stefanie Rinderle-Ma,    Kevin Göser…",2012,https://link.springer.com/article/10.1007/s10796-009-9185-9,No PDF available,,,1,31,https://doi.org/10.1007/s10796-009-9185-9
A Survey on Business Context,"Danijel Novakovic,    Christian Huemer",2014,https://link.springer.com/chapter/10.1007/978-81-322-1665-0_19,No PDF available,,,1,5,https://doi.org/10.1007/978-81-322-1665-0_19
Realizing Networks of Proactive Smart Products,"Mathieu d’Aquin,    Enrico Motta…",2012,https://link.springer.com/chapter/10.1007/978-3-642-33876-2_30,No PDF available,,,1,1,https://doi.org/10.1007/978-3-642-33876-2_30
INDISS: Interoperable Discovery System for Networked Services,"Yérom-David Bromberg,    Valérie Issarny",2005,https://link.springer.com/chapter/10.1007/11587552_9,https://link.springer.com/content/pdf/10.1007%2F11587552_9.pdf,,,1,24,https://doi.org/10.1007/11587552_9
Reflective Architectures for Adaptive Information Systems,"Andrea Maurino,    Stefano Modafferi…",2003,https://link.springer.com/chapter/10.1007/978-3-540-24593-3_9,https://link.springer.com/content/pdf/10.1007%2F978-3-540-24593-3_9.pdf,,,1,2,https://doi.org/10.1007/978-3-540-24593-3_9
Towards Dynamic and Cooperative Multi-device Personal Computing,"Spyros Lalis,    Anthony Savidis,    Alexandros Karypidis…",2007,https://link.springer.com/chapter/10.1007/978-3-540-72727-9_9,No PDF available,,,1,No cite count available,https://doi.org/10.1007/978-3-540-72727-9_9
Near-Miss Detection in Nursing: Rules and Semantics,"Mikhail Simonov,    Flavia Mazzitelli",2010,https://link.springer.com/chapter/10.1007/978-1-4419-5908-9_7,No PDF available,,,1,1,https://doi.org/10.1007/978-1-4419-5908-9_7
Social Context Enabled Description Model for Web Services,"Xiao Zheng,    Qingyong Wu,    Dongliang Ke,    Haixia Li…",2012,https://link.springer.com/chapter/10.1007/978-3-642-34038-3_2,No PDF available,,,1,No cite count available,https://doi.org/10.1007/978-3-642-34038-3_2
Developing Pervasive Agent-Based Applications: A Comparison of Two Coordination Approaches,"Inmaculada Ayala,    Mercedes Amor,    Lidia Fuentes…",2013,https://link.springer.com/chapter/10.1007/978-3-642-39866-7_5,No PDF available,,,1,1,https://doi.org/10.1007/978-3-642-39866-7_5
Adaptive E-Services Selection in P2P-Based Workflow with Multiple Property Specifications,"Jun Shen,    Shuai Yuan",2009,https://link.springer.com/chapter/10.1007/978-3-540-88081-3_9,No PDF available,,,1,No cite count available,https://doi.org/10.1007/978-3-540-88081-3_9
Adaptive Service Binding with Lightweight Semantic Web Services,"Carlos Pedrinaci,    Dave Lambert,    Maria Maleshkova,    Dong Liu…",2011,https://link.springer.com/chapter/10.1007/978-3-7091-0415-6_9,No PDF available,,,1,1,https://doi.org/10.1007/978-3-7091-0415-6_9
A Cognitive Future Internet Architecture,"Marco Castrucci,    Francesco Delli Priscoli,    Antonio Pietrabissa…",2011,https://link.springer.com/chapter/10.1007/978-3-642-20898-0_7,https://link.springer.com/content/pdf/10.1007%2F978-3-642-20898-0_7.pdf,,,1,16,https://doi.org/10.1007/978-3-642-20898-0_7
"DIY-CDR: an ontology-based, Do-It-Yourself component discoverer and recommender","Yan Tang,    Robert Meersman",2012,https://link.springer.com/article/10.1007/s00779-011-0416-y,No PDF available,,,1,3,https://doi.org/10.1007/s00779-011-0416-y
Mobile Learning Systems and Ontology,"Sergey Rodzin,    Lada Rodzina",2015,https://link.springer.com/chapter/10.1007/978-3-319-18473-9_5,No PDF available,,,1,3,https://doi.org/10.1007/978-3-319-18473-9_5
Social Sensing,"Charu C. Aggarwal,    Tarek Abdelzaher",2013,https://link.springer.com/chapter/10.1007/978-1-4614-6309-2_9,No PDF available,,,1,47,https://doi.org/10.1007/978-1-4614-6309-2_9
Recommender Systems in Industry: A Netflix Case Study,"Xavier Amatriain,    Justin Basilico",2015,https://link.springer.com/chapter/10.1007/978-1-4899-7637-6_11,No PDF available,,,1,6,https://doi.org/10.1007/978-1-4899-7637-6_11
On the sustainability of smart and smarter cities in the era of big data: an interdisciplinary and transdisciplinary literature review,Simon Elias Bibri,2019,https://link.springer.com/article/10.1186/s40537-019-0182-7,https://link.springer.com/content/pdf/10.1186%2Fs40537-019-0182-7.pdf,,,1,No cite count available,https://doi.org/10.1186/s40537-019-0182-7
Policy-based Management for Body-Sensor Networks,"Sye Loong Keoh,    Kevin Twidle…",2007,https://link.springer.com/chapter/10.1007/978-3-540-70994-7_16,No PDF available,,,1,11,https://doi.org/10.1007/978-3-540-70994-7_16
RA-Ubi: A Reference Architecture for Ubiquitous Computing,"Carlos Alberto Machado,    Eduardo Silva,    Thais Batista,    Jair Leite…",2014,https://link.springer.com/chapter/10.1007/978-3-319-09970-5_10,No PDF available,,,1,No cite count available,https://doi.org/10.1007/978-3-319-09970-5_10
A Remote Mutual Situation-Aware Model by Detecting Entrance and Exit Behaviors in Smart Home,"Mengqiao Zhang,    Junbo Wang,    Zixue Cheng,    Lei Jing…",2012,https://link.springer.com/chapter/10.1007/978-3-642-28744-2_23,No PDF available,,,1,1,https://doi.org/10.1007/978-3-642-28744-2_23
"
CoopFlow: A Framework for Inter-organizational Workflow Cooperation","Issam Chebbi,    Samir Tata",2005,https://link.springer.com/chapter/10.1007/11575771_10,No PDF available,,,1,4,https://doi.org/10.1007/11575771_10
A Notation and Logic for Mobile Computing,"Gruia-Catalin Roman,    Peter J. McCann",2002,https://link.springer.com/article/10.1023/A%3A1012908529306,No PDF available,,,1,13,https://doi.org/10.1023/A:1012908529306
Ontological Engineering and the Semantic Web,"José Manuel Gómez-Pérez,    Carlos Ruiz",2010,https://link.springer.com/chapter/10.1007/978-3-642-14461-5_8,No PDF available,,,1,3,https://doi.org/10.1007/978-3-642-14461-5_8
Introducing IYOUIT,"Sebastian Boehm,    Johan Koolwaaij,    Marko Luther…",2008,https://link.springer.com/chapter/10.1007/978-3-540-88564-1_52,https://link.springer.com/content/pdf/10.1007%2F978-3-540-88564-1_52.pdf,,,1,11,https://doi.org/10.1007/978-3-540-88564-1_52
Self-organising Pervasive Ecosystems: A Crowd Evacuation Example,"Sara Montagna,    Mirko Viroli,    Matteo Risoldi…",2011,https://link.springer.com/chapter/10.1007/978-3-642-24124-6_12,No PDF available,,,1,3,https://doi.org/10.1007/978-3-642-24124-6_12
Use of Negative Information in Positioning Algorithms,"Michele Albano,    Senka Hadzic,    Jonathan Rodriguez",2012,https://link.springer.com/chapter/10.1007/978-3-642-35155-6_17,No PDF available,,,1,No cite count available,https://doi.org/10.1007/978-3-642-35155-6_17
Continuous Management of Professional Virtual Community Inheritance Based on the Adaptation of Social Protocols,Willy Picard,2007,https://link.springer.com/chapter/10.1007/978-0-387-73798-0_40,https://link.springer.com/content/pdf/10.1007%2F978-0-387-73798-0_40.pdf,,,1,No cite count available,https://doi.org/10.1007/978-0-387-73798-0_40
A human-centric runtime framework for mixed service-oriented systems,Daniel Schall,2011,https://link.springer.com/article/10.1007/s10619-011-7081-z,No PDF available,,,1,5,https://doi.org/10.1007/s10619-011-7081-z
Contextualization: dynamic configuration of virtual machines,"Django Armstrong,    Daniel Espling,    Johan Tordsson…",2015,https://link.springer.com/article/10.1186/s13677-015-0042-8,https://link.springer.com/content/pdf/10.1186%2Fs13677-015-0042-8.pdf,,,1,4,https://doi.org/10.1186/s13677-015-0042-8
The PLASTIC Framework and Tools for Testing Service-Oriented Applications,"Antonia Bertolino,    Guglielmo De Angelis,    Lars Frantzen…",2009,https://link.springer.com/chapter/10.1007/978-3-540-95888-8_5,No PDF available,,,1,8,https://doi.org/10.1007/978-3-540-95888-8_5
Semantic and Implicit HCI: A Step Forward AmI Delivery at Home for Patient Experience,Ana Isabel Calvo-Alcalde…,2010,https://link.springer.com/chapter/10.1007/978-3-642-13268-1_17,No PDF available,,,1,No cite count available,https://doi.org/10.1007/978-3-642-13268-1_17
Being aware: where we think the action is,Martin E. Müller,2007,https://link.springer.com/article/10.1007/s10111-006-0047-7,No PDF available,,,1,3,https://doi.org/10.1007/s10111-006-0047-7
Thoth – A publish/subscribe architecture for peer-to-peer tool integration,Klaus Marius Hansen,2004,https://link.springer.com/article/10.1007/s10009-004-0156-7,No PDF available,,,1,No cite count available,https://doi.org/10.1007/s10009-004-0156-7
SmartWeb Handheld — Multimodal Interaction with Ontological Knowledge Bases and Semantic Web Services,"Daniel Sonntag,    Ralf Engel,    Gerd Herzog…",2007,https://link.springer.com/chapter/10.1007/978-3-540-72348-6_14,No PDF available,,,1,10,https://doi.org/10.1007/978-3-540-72348-6_14
Appropriation Infrastructure: Supporting the Design of Usages,"Gunnar Stevens,    Volkmar Pipek,    Volker Wulf",2009,https://link.springer.com/chapter/10.1007/978-3-642-00427-8_4,No PDF available,,,1,10,https://doi.org/10.1007/978-3-642-00427-8_4
"An Empirical Study of Use Contexts in the Mobile Internet, Focusing on the Usability of Information Architecture","Hoyoung Kim,    Jinwoo Kim,    Yeonsoo Lee",2005,https://link.springer.com/article/10.1007/s10796-005-1486-z,No PDF available,,,1,25,https://doi.org/10.1007/s10796-005-1486-z
On Requirements Model Driven Adaption and Evolution of Internetware,"Hong Mei,    Jian Lü",2016,https://link.springer.com/chapter/10.1007/978-981-10-2546-4_5,No PDF available,,,1,No cite count available,https://doi.org/10.1007/978-981-10-2546-4_5
Exception Handling in Web Service Processes,"Dietmar Jannach,    Alexander Gut",2011,https://link.springer.com/chapter/10.1007/978-3-642-17505-3_11,No PDF available,,,1,2,https://doi.org/10.1007/978-3-642-17505-3_11
An Adaptive Mobile System Using Mobile Grid Computing in Wireless Network,"Jehwan Oh,    Seunghwa Lee,    Eunseok Lee",2006,https://link.springer.com/chapter/10.1007/11751649_6,No PDF available,,,1,2,https://doi.org/10.1007/11751649_6
"Multimodality for Plastic User Interfaces: Models, Methods, and Principles","Jean Vanderdonckt,    Gaëlle Calvary,    Joëlle Coutaz…",2008,https://link.springer.com/chapter/10.1007/978-3-540-78345-9_4,No PDF available,,,1,5,https://doi.org/10.1007/978-3-540-78345-9_4
Measure Method and Metrics for Network Characteristics in Service Systems,"Haihong E,    Xiaojia Jin,    Junjie Tong…",2013,https://link.springer.com/chapter/10.1007/978-3-642-37015-1_15,No PDF available,,,1,No cite count available,https://doi.org/10.1007/978-3-642-37015-1_15
Safety Assurance of Open Adaptive Systems – A Survey,"Mario Trapp,    Daniel Schneider",2014,https://link.springer.com/chapter/10.1007/978-3-319-08915-7_11,No PDF available,,,1,6,https://doi.org/10.1007/978-3-319-08915-7_11
Supporting Mobile Activities in a Shared Semantic Ambient,"Fabio Pittarello,    Augusto Celentano",2006,https://link.springer.com/chapter/10.1007/11915034_116,No PDF available,,,1,No cite count available,https://doi.org/10.1007/11915034_116
A Domain-Specific Model for Data Quality Constraints in Service Process Adaptations,"Claus Pahl,    Neel Mani,    Ming-Xue Wang",2013,https://link.springer.com/chapter/10.1007/978-3-642-45364-9_25,No PDF available,,,1,2,https://doi.org/10.1007/978-3-642-45364-9_25
A Product Line Architecture for Evolving Intelligent Component Services in Tourism Information Systems,"J. O Daramola,    M. O Adigun,    O. O. Olugbara",2008,https://link.springer.com/chapter/10.1007/978-3-211-77280-5_11,No PDF available,,,1,No cite count available,https://doi.org/10.1007/978-3-211-77280-5_11
Runtime Adaptability of Ambient Intelligence Systems Based on Component-Oriented Approach,"Muhammed Cagri Kaya,    Alperen Eroglu…",2019,https://link.springer.com/chapter/10.1007/978-3-030-04173-1_4,No PDF available,,,1,No cite count available,https://doi.org/10.1007/978-3-030-04173-1_4
A survey on service-oriented middleware for wireless sensor networks,"Nader Mohamed,    Jameela Al-Jaroodi",2011,https://link.springer.com/article/10.1007/s11761-011-0083-x,No PDF available,,,1,47,https://doi.org/10.1007/s11761-011-0083-x
A self-adaptation scheme for workflow management in multi-agent systems,"Fu-Shiung Hsieh,    Jim-Bon Lin",2016,https://link.springer.com/article/10.1007/s10845-013-0818-y,No PDF available,,,1,13,https://doi.org/10.1007/s10845-013-0818-y
Ontology-Based User Modeling,Liana Razmerita,2007,https://link.springer.com/chapter/10.1007/978-0-387-37022-4_23,No PDF available,,,1,3,https://doi.org/10.1007/978-0-387-37022-4_23
