title,author,date,link,pdf_link,query,search_engine,nr_found,cite_count,doi
Decentralized Governance and Climate Change Adaptation: Working Locally to Address Community Resilience Priorities,"Erin Martin,    Christopher Perine,    Veronique Lee…",2018,https://link.springer.com/chapter/10.1007/978-3-319-72874-2_1,No PDF available,,,1,No cite count available,https://doi.org/10.1007/978-3-319-72874-2_1
Extending trust management with cooperation incentives: a fully decentralized framework for user-centric network environments,"Carlos Ballester Lafuente,    Jean-Marc Seigneur",2015,https://link.springer.com/article/10.1186/s40493-015-0018-0,https://link.springer.com/content/pdf/10.1186%2Fs40493-015-0018-0.pdf,,,1,No cite count available,https://doi.org/10.1186/s40493-015-0018-0
Threads of local continuity between centralized and decentralized causality: Transitional explanations for the behavior of a complex system,Lauren Barth-Cohen,2018,https://link.springer.com/article/10.1007/s11251-018-9454-4,No PDF available,,,1,No cite count available,https://doi.org/10.1007/s11251-018-9454-4
A formal context specific trust model (FTM) for multimedia and ubiquitous computing environment,"Sheikh I. Ahamed,    Munirul M. Haque,    Nilothpal Talukder",2010,https://link.springer.com/article/10.1007/s11235-009-9261-y,No PDF available,,,1,2,https://doi.org/10.1007/s11235-009-9261-y
Constructing Cross-Context Scholarly Conversations,David A. Whetten,2002,https://link.springer.com/chapter/10.1007/978-1-4615-1095-6_2,No PDF available,,,1,No cite count available,https://doi.org/10.1007/978-1-4615-1095-6_2
Cloud Logistics Systems: Reference Architecture Design,Falco Jaekel,2019,https://link.springer.com/chapter/10.1007/978-3-658-22837-8_6,No PDF available,,,1,No cite count available,https://doi.org/10.1007/978-3-658-22837-8_6
Meeting Future Energy Needs in the Hindu Kush Himalaya,"Shobhakar Dhakal,    Leena Srivastava,    Bikash Sharma…",2019,https://link.springer.com/chapter/10.1007/978-3-319-92288-1_6,https://link.springer.com/content/pdf/10.1007%2F978-3-319-92288-1_6.pdf,,,1,No cite count available,https://doi.org/10.1007/978-3-319-92288-1_6
S,Peter Newman,1998,https://link.springer.com/chapter/10.1007/978-1-349-14286-6_4,No PDF available,,,1,No cite count available,https://doi.org/10.1007/978-1-349-14286-6_4
Dynamic Policy Adaptation for Collaborative Groups,"Madhumita Chatterjee,    G. Sivakumar",2010,https://link.springer.com/chapter/10.1007/978-3-642-14478-3_38,No PDF available,,,1,No cite count available,https://doi.org/10.1007/978-3-642-14478-3_38
Modelling Business Relationships in a Non-Centralised Systems Environment,"I. G. Macdonald,    R. A. Veryard",1995,https://link.springer.com/chapter/10.1007/978-0-387-34871-1_9,https://link.springer.com/content/pdf/10.1007%2F978-0-387-34871-1_9.pdf,,,1,No cite count available,https://doi.org/10.1007/978-0-387-34871-1_9
Knowledge Services,"Ronald Maier,    Thomas Hädrich,    René Peinl",2009,https://link.springer.com/chapter/10.1007/978-3-540-89768-2_4,No PDF available,,,1,No cite count available,https://doi.org/10.1007/978-3-540-89768-2_4
Structured decision-making for sustainable water infrastructure planning and four future scenarios,"Judit Lienert,    Lisa Scholten,    Christoph Egger…",2015,https://link.springer.com/article/10.1007/s40070-014-0030-0,No PDF available,,,1,26,https://doi.org/10.1007/s40070-014-0030-0
Evolution of Economic Systems: The Case of Japan,"Tetsuji Okazaki,    Masahiro Okuno-Fujiwara…",1998,https://link.springer.com/chapter/10.1007/978-1-349-26928-0_15,No PDF available,,,1,1,https://doi.org/10.1007/978-1-349-26928-0_15
Abstracting Context in Event-Based Software,"Adrian Holzer,    Lukasz Ziarek,    K. R. Jayaram…",2012,https://link.springer.com/chapter/10.1007/978-3-642-35551-6_4,No PDF available,,,1,1,https://doi.org/10.1007/978-3-642-35551-6_4
The ILO and compliance,Lars Thomann,2012,https://link.springer.com/chapter/10.1007/978-3-531-93124-1_4,No PDF available,,,1,No cite count available,https://doi.org/10.1007/978-3-531-93124-1_4
Areas of TVET Research,"Felix Rauner,    Rupert Maclean",2008,https://link.springer.com/chapter/10.1007/978-1-4020-8347-1_4,No PDF available,,,1,No cite count available,https://doi.org/10.1007/978-1-4020-8347-1_4
Situative governance and energy transitions in a spatial context: case studies from Germany,"Gerhard Fuchs,    Nele Hinderer",2014,https://link.springer.com/article/10.1186/s13705-014-0016-6,https://link.springer.com/content/pdf/10.1186%2Fs13705-014-0016-6.pdf,,,1,18,https://doi.org/10.1186/s13705-014-0016-6
Pervasive Context Sharing in Magpie: Adaptive Trust-Based Privacy Protection,"Chenguang Liu,    Christine Julien",2015,https://link.springer.com/chapter/10.1007/978-3-319-29003-4_8,No PDF available,,,1,No cite count available,https://doi.org/10.1007/978-3-319-29003-4_8
Abstracts of the 85th Annual Meeting of the German Society for Experimental and Clinical Pharmacology and Toxicology (DGPT) and the 21th Annual Meeting of the Association of the Clinical Pharmacology Germany (VKliPha) With contribution of the Arbeitsgemeinschaft für Angewandte Humanpharmakologie e. V. (AGAH),No author available,2019,https://link.springer.com/article/10.1007/s00210-019-01621-6,No PDF available,,,1,No cite count available,https://doi.org/10.1007/s00210-019-01621-6
"Politics, Territory, and Nationalism: A Conceptual Framework",Dejan Stjepanović,2018,https://link.springer.com/chapter/10.1057/978-1-137-58585-1_2,No PDF available,,,1,No cite count available,https://doi.org/10.1057/978-1-137-58585-1_2
"Juggling Administrative Institutions: Local State Actors and the Management of Urban Space in Kumasi, Ghana","Matthew Sabbi,    Collins Adjei Mensah",2016,https://link.springer.com/article/10.1007/s12132-015-9262-8,No PDF available,,,1,2,https://doi.org/10.1007/s12132-015-9262-8
"The Review of Sustainable Development Goals (SDGs): People, Perspective and Planning","Ali Cheshmehzangi,    Ayotunde Dawodu",2019,https://link.springer.com/chapter/10.1007/978-981-13-1388-2_4,No PDF available,,,1,No cite count available,https://doi.org/10.1007/978-981-13-1388-2_4
Posters,No author available,2009,https://link.springer.com/article/10.1007/s12603-009-0095-9,No PDF available,,,1,2,https://doi.org/10.1007/s12603-009-0095-9
A Framework for the Design of Alliance Governance Systems,Sascha Albers,2005,https://link.springer.com/chapter/10.1007/978-3-658-24711-9_4,No PDF available,,,1,No cite count available,https://doi.org/10.1007/978-3-658-24711-9_4
P,Peter Newman,1998,https://link.springer.com/chapter/10.1007/978-1-349-14286-6_1,No PDF available,,,1,No cite count available,https://doi.org/10.1007/978-1-349-14286-6_1
Towards Eco-Factories of the Future,"Denis Kurle,    Sebastian Thiede,    Christoph Herrmann",2019,https://link.springer.com/chapter/10.1007/978-3-319-93730-4_1,No PDF available,,,1,No cite count available,https://doi.org/10.1007/978-3-319-93730-4_1
Trust as a facilitator in cloud computing: a survey,"Sheikh Mahbub Habib,    Sascha Hauke…",2012,https://link.springer.com/article/10.1186/2192-113X-1-19,https://link.springer.com/content/pdf/10.1186%2F2192-113X-1-19.pdf,,,1,35,https://doi.org/10.1186/2192-113X-1-19
Assessing the Structural Fluidity of Virtual Organizations and Its Effects,"Sean P. Goggins,    Giuseppe Valetto",2014,https://link.springer.com/chapter/10.1007/978-3-319-09378-9_8,No PDF available,,,1,No cite count available,https://doi.org/10.1007/978-3-319-09378-9_8
Scientific Evaluations in the DRD: A Case of Asymmetries and Uncertainties,Mihalis Kritikos,2018,https://link.springer.com/chapter/10.1057/978-1-137-31446-8_6,No PDF available,,,1,No cite count available,https://doi.org/10.1057/978-1-137-31446-8_6
Explaining Intersubsidiary Relationships,Julia Mauer,2011,https://link.springer.com/chapter/10.1007/978-3-8349-7040-4_3,No PDF available,,,1,No cite count available,https://doi.org/10.1007/978-3-8349-7040-4_3
Improving the implementation of health workforce policies through governance: a review of case studies,"Marjolein Dieleman,    Daniel MP Shaw,    Prisca Zwanikken",2011,https://link.springer.com/article/10.1186/1478-4491-9-10,https://link.springer.com/content/pdf/10.1186%2F1478-4491-9-10.pdf,,,1,34,https://doi.org/10.1186/1478-4491-9-10
The Roadmap of Trust and Trust Evaluation in Web Applications and Web Services,"Lei Li,    Yan Wang",2014,https://link.springer.com/chapter/10.1007/978-1-4614-7535-4_4,No PDF available,,,1,1,https://doi.org/10.1007/978-1-4614-7535-4_4
The Recruitment and Selection of School Leaders – First Findings of an International Comparison,"Stephan Gerhard Huber,    Maren Hiltmann",2010,https://link.springer.com/chapter/10.1007/978-90-481-3501-1_16,No PDF available,,,1,5,https://doi.org/10.1007/978-90-481-3501-1_16
Dynamic Adaptive Service Architecture – Towards Coordinated Service Composition,Claus Pahl,2010,https://link.springer.com/chapter/10.1007/978-3-642-15114-9_43,No PDF available,,,1,3,https://doi.org/10.1007/978-3-642-15114-9_43
Secure interoperability with O2O contracts,"Céline Coma,    Nora Cuppens-Boulahia…",2010,https://link.springer.com/chapter/10.2991/978-94-91216-32-9_11,No PDF available,,,1,No cite count available,https://doi.org/10.2991/978-94-91216-32-9_11
"A Two-Level Analysis of Classroom Climate in Relation to Social Context, Group Composition, and Organization of Special Support",Mara Westling Allodi,2002,https://link.springer.com/article/10.1023/A%3A1021972206111,No PDF available,,,1,23,https://doi.org/10.1023/A:1021972206111
Achieving Self-adaptation through Dynamic Group Management,"Luciano Baresi,    Sam Guinea,    Panteha Saeedi",2013,https://link.springer.com/chapter/10.1007/978-3-642-36249-1_8,No PDF available,,,1,3,https://doi.org/10.1007/978-3-642-36249-1_8
Emergent Semantics Systems,"Karl Aberer,    Tiziana Catarci…",2004,https://link.springer.com/chapter/10.1007/978-3-540-30145-5_2,https://link.springer.com/content/pdf/10.1007%2F978-3-540-30145-5_2.pdf,,,1,2,https://doi.org/10.1007/978-3-540-30145-5_2
Scaling up of Policy Experiments and Pilots: A Qualitative Comparative Analysis and Lessons for the Water Sector,"Sreeja Nair,    Michael Howlett",2015,https://link.springer.com/article/10.1007/s11269-015-1081-0,No PDF available,,,1,6,https://doi.org/10.1007/s11269-015-1081-0
"Non-timber forest products certification and management: a socioeconomic study among the Kadars in Kerala, India","Jyotsna Krishnakumar,    John F. Yanagida…",2015,https://link.springer.com/article/10.1007/s10668-014-9578-x,No PDF available,,,1,4,https://doi.org/10.1007/s10668-014-9578-x
Virtual Persons and Identities,David-Olivier Jaquet-Chiffelle…,2009,https://link.springer.com/chapter/10.1007/978-3-642-01820-6_3,No PDF available,,,1,3,https://doi.org/10.1007/978-3-642-01820-6_3
Identification and coding of single studies of success factors in innovation management,Markus Sattler,2011,https://link.springer.com/chapter/10.1007/978-3-8349-6158-7_4,No PDF available,,,1,No cite count available,https://doi.org/10.1007/978-3-8349-6158-7_4
Characterisation of Recent Energy System Analyses,"Bert Droste-Franke,    Martin Carrier,    Matthias Kaiser…",2015,https://link.springer.com/chapter/10.1007/978-3-319-11346-3_4,No PDF available,,,1,No cite count available,https://doi.org/10.1007/978-3-319-11346-3_4
Ontology-Based Composition and Matching for Dynamic Service Coordination,"Claus Pahl,    Veronica Gacitua-Decar…",2011,https://link.springer.com/chapter/10.1007/978-3-642-22056-2_49,https://link.springer.com/content/pdf/10.1007%2F978-3-642-22056-2_49.pdf,,,1,1,https://doi.org/10.1007/978-3-642-22056-2_49
Rapid Sustainability Appraisal of Collapsed Jatropha Projects in Ghana Using Local Community Perceptions: Methodological Implications for Sustainability Science,"Abubakari Ahmed,    Alexandros Gasparatos",2016,https://link.springer.com/chapter/10.1007/978-3-319-32930-7_10,No PDF available,,,1,1,https://doi.org/10.1007/978-3-319-32930-7_10
"How does decentralisation affect health sector planning and financial management? a case study of early effects of devolution in Kilifi County, Kenya","Benjamin Tsofa,    Sassy Molyneux,    Lucy Gilson…",2017,https://link.springer.com/article/10.1186/s12939-017-0649-0,https://link.springer.com/content/pdf/10.1186%2Fs12939-017-0649-0.pdf,,,1,10,https://doi.org/10.1186/s12939-017-0649-0
The Risks Involved upon the Use of Biometric Data and Biometric Systems,Els J. Kindt,2013,https://link.springer.com/chapter/10.1007/978-94-007-7522-0_4,No PDF available,,,1,No cite count available,https://doi.org/10.1007/978-94-007-7522-0_4
Systems,No author available,2007,https://link.springer.com/chapter/10.1007/978-3-540-71408-8_7,No PDF available,,,1,No cite count available,https://doi.org/10.1007/978-3-540-71408-8_7
Cooperative Multi-Agent Reinforcement Learning for Multi-Component Robotic Systems: guidelines for future research,"Manuel Graña,    Borja Fernandez-Gauna,    Jose Manuel Lopez-Guede",2011,https://link.springer.com/article/10.2478/s13230-011-0017-5,No PDF available,,,1,No cite count available,https://doi.org/10.2478/s13230-011-0017-5
MNEs’ R&D and the Technological Transition in CEE,"Julia Manea,    Robert Pearce",2004,https://link.springer.com/chapter/10.1057/9780230511811_6,No PDF available,,,1,No cite count available,https://doi.org/10.1057/9780230511811_6
Pluralist Economics: A Multi-paradigmatic Look,Kavous Ardalan,2018,https://link.springer.com/chapter/10.1007/978-3-319-72071-5_12,No PDF available,,,1,No cite count available,https://doi.org/10.1007/978-3-319-72071-5_12
Globalization and Poverty in Asia: Can Shared Growth Be Sustained?,"Machiko Nissanke,    Erik Thorbecke",2008,https://link.springer.com/chapter/10.1057/9780230594005_1,No PDF available,,,1,No cite count available,https://doi.org/10.1057/9780230594005_1
Techniques for Robust Planning in Degradable Multiagent Systems,Ping Xuan,2006,https://link.springer.com/chapter/10.1007/0-387-27972-5_15,No PDF available,,,1,No cite count available,https://doi.org/10.1007/0-387-27972-5_15
Achieving Coordination through Dynamic Construction of Open Workflows,"Louis Thomas,    Justin Wilson,    Gruia-Catalin Roman,    Christopher Gill",2009,https://link.springer.com/chapter/10.1007/978-3-642-10445-9_14,https://link.springer.com/content/pdf/10.1007%2F978-3-642-10445-9_14.pdf,,,1,No cite count available,https://doi.org/10.1007/978-3-642-10445-9_14
Local Electricity Regulation in Germany,Gerhard Fuchs,2017,https://link.springer.com/chapter/10.1057/978-1-137-58828-9_12,No PDF available,,,1,No cite count available,https://doi.org/10.1057/978-1-137-58828-9_12
Organization,No author available,2007,https://link.springer.com/chapter/10.1007/978-3-540-71408-8_6,No PDF available,,,1,No cite count available,https://doi.org/10.1007/978-3-540-71408-8_6
Adaptive Management for Novel Ecosystems,Nicholas A.J. Graham…,2015,https://link.springer.com/chapter/10.1007/978-94-017-9682-8_8,No PDF available,,,1,No cite count available,https://doi.org/10.1007/978-94-017-9682-8_8
Rethinking Democracy and Autonomy Through the Case of Kurdish Movement,Dilan Okçuoğlu,2018,https://link.springer.com/chapter/10.1007/978-3-030-01108-6_10,No PDF available,,,1,No cite count available,https://doi.org/10.1007/978-3-030-01108-6_10
"Implementation and diffusion of innovative water infrastructures: obstacles, stakeholder networks and strategic opportunities for utilities","Jan Hendrik Trapp,    Heide Kerber,    Engelbert Schramm",2017,https://link.springer.com/article/10.1007/s12665-017-6461-8,No PDF available,,,1,2,https://doi.org/10.1007/s12665-017-6461-8
How to Form and Shape an Organization and Its Subconscious Mind,Werner Leodolter,2017,https://link.springer.com/chapter/10.1007/978-3-319-53618-7_5,No PDF available,,,1,No cite count available,https://doi.org/10.1007/978-3-319-53618-7_5
An Introduction to the Eclectic Paradigm as a Meta-Framework for the Cross-Disciplinary Analysis of International Business,John Cantwell,2015,https://link.springer.com/chapter/10.1007/978-1-137-54471-1_1,No PDF available,,,1,2,https://doi.org/10.1007/978-1-137-54471-1_1
Perceptions of Legitimacy in Nordic Regional Development Networks,"Jenni Airaksinen,    Helena Härkönen,    Arto Haveri",2014,https://link.springer.com/article/10.1007/s11115-013-0238-7,No PDF available,,,1,3,https://doi.org/10.1007/s11115-013-0238-7
"Urban Resilience Assessment: Multiple Dimensions, Criteria, and Indicators","Ayyoob Sharifi,    Yoshiki Yamagata",2016,https://link.springer.com/chapter/10.1007/978-3-319-39812-9_13,No PDF available,,,1,1,https://doi.org/10.1007/978-3-319-39812-9_13
ICT Tools and Systems Supporting Innovation in Product/Process Development,No author available,2009,https://link.springer.com/chapter/10.1007/978-1-84882-545-1_4,No PDF available,,,1,No cite count available,https://doi.org/10.1007/978-1-84882-545-1_4
Multilevel Governance of Immigration in Multinational States: ‘Who Governs?’ Reconsidered,"Ricard Zapata-Barrero,    Fiona Barker",2014,https://link.springer.com/chapter/10.1057/9781137358530_2,No PDF available,,,1,No cite count available,https://doi.org/10.1057/9781137358530_2
A Framework for the Analysis of Governance Structures Applying to Groundwater Resources and the Requirements for the Sustainable Management of Associated Ecosystem Services,"Kathrin Knüppe,    Claudia Pahl-Wostl",2011,https://link.springer.com/article/10.1007/s11269-011-9861-7,No PDF available,,,1,27,https://doi.org/10.1007/s11269-011-9861-7
Governance as multiplicity: the Assemblage Thinking perspective,Helen Briassoulis,2019,https://link.springer.com/article/10.1007/s11077-018-09345-9,No PDF available,,,1,No cite count available,https://doi.org/10.1007/s11077-018-09345-9
"Beyond Boom and Bust: External Rents, Durable Authoritarianism, and Institutional Adaptation in the Hashemite Kingdom of Jordan","Anne Mariel Peters,    Pete W. Moore",2009,https://link.springer.com/article/10.1007/s12116-009-9053-0,No PDF available,,,1,21,https://doi.org/10.1007/s12116-009-9053-0
Applying Cross-Industry Networks in the Early Innovation Phase,"Ellen Enkel,    Sebastian Heil",2014,https://link.springer.com/chapter/10.1007/978-3-319-01056-4_9,No PDF available,,,1,No cite count available,https://doi.org/10.1007/978-3-319-01056-4_9
Swiss Immigration Federalism,Anita Manatschal,2014,https://link.springer.com/chapter/10.1007/978-94-017-8604-1_9,No PDF available,,,1,No cite count available,https://doi.org/10.1007/978-94-017-8604-1_9
Understanding and Tackling Poverty and Vulnerability in Mountain Livelihoods in the Hindu Kush Himalaya,"Giovanna Gioli,    Ganesh Thapa,    Fawad Khan…",2019,https://link.springer.com/chapter/10.1007/978-3-319-92288-1_12,https://link.springer.com/content/pdf/10.1007%2F978-3-319-92288-1_12.pdf,,,1,No cite count available,https://doi.org/10.1007/978-3-319-92288-1_12
The Chicago Fire of 1871: a bottom-up approach to disaster relief,Emily C. Skarbek,2014,https://link.springer.com/article/10.1007/s11127-014-0175-1,No PDF available,,,1,5,https://doi.org/10.1007/s11127-014-0175-1
Geospatial Visualization of Automotive Sensor Data: A Conceptual and Implementational Framework for Environment and Traffic-Related Applications,"Patrick Voland,    Hartmut Asche",2017,https://link.springer.com/chapter/10.1007/978-3-319-62401-3_45,No PDF available,,,1,No cite count available,https://doi.org/10.1007/978-3-319-62401-3_45
"Advanced Concepts for Architecture Support
 in Process-Driven Applications",Volker Stiehl,2014,https://link.springer.com/chapter/10.1007/978-3-319-07218-0_5,No PDF available,,,1,No cite count available,https://doi.org/10.1007/978-3-319-07218-0_5
Concretizing Loosely Specified Processes,Manfred Reichert…,2012,https://link.springer.com/chapter/10.1007/978-3-642-30409-5_11,No PDF available,,,1,No cite count available,https://doi.org/10.1007/978-3-642-30409-5_11
From National to Local Economic Development (LED): The South African Case,P. S. Reddy,2016,https://link.springer.com/chapter/10.1057/9781137558367_6,No PDF available,,,1,No cite count available,https://doi.org/10.1057/9781137558367_6
"Retail Trade in Agriculture, Environment, and Fair-Trade Practices: Review of Experiences and Future Pathways",Amita Shah,2016,https://link.springer.com/chapter/10.1007/978-81-322-2476-1_4,No PDF available,,,1,No cite count available,https://doi.org/10.1007/978-81-322-2476-1_4
Run-Time and Atomic Weaving of Distributed Aspects,"Eddy Truyen,    Wouter Joosen",2006,https://link.springer.com/chapter/10.1007/11922827_6,No PDF available,,,1,No cite count available,https://doi.org/10.1007/11922827_6
On intellectual capital management as an evaluation criterion for university managers: a case study,"Stefania Veltri,    Pina Puntillo",2019,https://link.springer.com/article/10.1007/s10997-019-09461-5,No PDF available,,,1,No cite count available,https://doi.org/10.1007/s10997-019-09461-5
Economic Implications of Transforming Hospital Governance,Przemyslaw Marcin Sowa,2016,https://link.springer.com/chapter/10.1007/978-981-287-766-6_4,No PDF available,,,1,No cite count available,https://doi.org/10.1007/978-981-287-766-6_4
Anatomy of WFP Emergency Operations,D. John Shaw,2011,https://link.springer.com/chapter/10.1057/9780230316713_4,No PDF available,,,1,No cite count available,https://doi.org/10.1057/9780230316713_4
EINSTein: A Multiagent-based Model of Combat,Andrew Ilachinski,2005,https://link.springer.com/chapter/10.1007/1-84628-214-4_7,No PDF available,,,1,No cite count available,https://doi.org/10.1007/1-84628-214-4_7
Focusing on Older Residents Views,"Belinda Yuen,    Sue Wei Cheong",2019,https://link.springer.com/chapter/10.1007/978-3-319-92444-1_2,No PDF available,,,1,No cite count available,https://doi.org/10.1007/978-3-319-92444-1_2
Reusability for Trust and Reputation Systems,"Johannes Sänger,    Günther Pernul",2014,https://link.springer.com/chapter/10.1007/978-3-662-43813-8_3,https://link.springer.com/content/pdf/10.1007%2F978-3-662-43813-8_3.pdf,,,1,1,https://doi.org/10.1007/978-3-662-43813-8_3
"Trajectories, Institutions and Stakeholders in Public Management Reform","David Farnham,    Annie Hondeghem…",2005,https://link.springer.com/chapter/10.1057/9780230378612_2,No PDF available,,,1,1,https://doi.org/10.1057/9780230378612_2
Abstracts from the ICBM 2012 Meeting,No author available,2012,https://link.springer.com/article/10.1007/s12529-012-9247-0,No PDF available,,,1,No cite count available,https://doi.org/10.1007/s12529-012-9247-0
"Healthy Living: The European Congress of Epidemiology, 2015","Esther Bols,    Luc Smits,    Matty Weijenberg",2015,https://link.springer.com/article/10.1007/s10654-015-0072-z,No PDF available,,,1,3,https://doi.org/10.1007/s10654-015-0072-z
Towards a Global Civil Culture,Michael Galchinsky,2016,https://link.springer.com/chapter/10.1007/978-3-319-31851-6_4,No PDF available,,,1,No cite count available,https://doi.org/10.1007/978-3-319-31851-6_4
Towards a framework for the development of adaptable service-based applications,"Stephen Lane,    Qing Gu,    Patricia Lago…",2014,https://link.springer.com/article/10.1007/s11761-013-0136-4,No PDF available,,,1,5,https://doi.org/10.1007/s11761-013-0136-4
Governing fisheries through the critical decade: the role and utility of polycentric systems,"C. Cvitanovic,    A. J. Hobday,    J. McDonald…",2018,https://link.springer.com/article/10.1007/s11160-017-9495-9,No PDF available,,,1,No cite count available,https://doi.org/10.1007/s11160-017-9495-9
Deducing a state-of-the-art presentation of the Eclectic Paradigm from four decades of development: a systematic literature review,Chris Wagner,2019,https://link.springer.com/article/10.1007/s11301-019-00160-x,No PDF available,,,1,No cite count available,https://doi.org/10.1007/s11301-019-00160-x
Automatically composing reusable software components for mobile devices,"Jules White,    Douglas C. Schmidt,    Egon Wuchner…",2008,https://link.springer.com/article/10.1007/BF03192550,https://link.springer.com/content/pdf/10.1007%2FBF03192550.pdf,,,1,8,https://doi.org/10.1007/BF03192550
Health—exploring complexity: an interdisciplinary systems approach HEC2016,"Eva Grill,    Martin Müller,    Ulrich Mansmann",2016,https://link.springer.com/article/10.1007/s10654-016-0183-1,No PDF available,,,1,1,https://doi.org/10.1007/s10654-016-0183-1
Ensuring Sustainability of Bioenergy in Practice,Dr. Francesca Farioli,2013,https://link.springer.com/referenceworkentry/10.1007/978-1-4020-8939-8_122,No PDF available,,,1,No cite count available,https://doi.org/10.1007/978-1-4020-8939-8_122
Contextually Aware Adaptive Systems for Enterprise Transformation,"Gabrielle Peko,    Ching-Shen Dong,    David Sundaram",2013,https://link.springer.com/chapter/10.1007/978-3-642-36642-0_6,No PDF available,,,1,No cite count available,https://doi.org/10.1007/978-3-642-36642-0_6
Knowledge as Culture,Olivier Serrat,2017,https://link.springer.com/chapter/10.1007/978-981-10-0983-9_58,https://link.springer.com/content/pdf/10.1007%2F978-981-10-0983-9_58.pdf,,,1,No cite count available,https://doi.org/10.1007/978-981-10-0983-9_58
Social Governance,"Sridipta Misra,    Muthucumaru Maheswaran…",2017,https://link.springer.com/chapter/10.1007/978-3-319-44230-3_5,No PDF available,,,1,No cite count available,https://doi.org/10.1007/978-3-319-44230-3_5
Countering Service Information Challenges in the Internet of Services,"Dr. Daniel Oberle,    Dipl.-Ing. Nadeem Bhatti…",2009,https://link.springer.com/article/10.1007/s12599-009-0069-9,https://link.springer.com/content/pdf/10.1007%2Fs12599-009-0069-9.pdf,,,1,16,https://doi.org/10.1007/s12599-009-0069-9
