title,author,date,link,pdf_link,query,search_engine,nr_found,cite_count,doiInnovative Daylighting Systems,"Kyle Konis,    Stephen Selkowitz",2017,https://link.springer.com/chapter/10.1007/978-3-319-39463-3_3,No PDF available,,,1,No cite count available,https://doi.org/10.1007/978-3-319-39463-3_3
"Futuring, Experimentation, and Transformative Urban Politics","Mark Swilling,    Edgar Pieterse,    Maarten Hajer",No year available,https://link.springer.com/referenceworkentry/10.1007/978-3-319-31737-3_24-1,No PDF available,,,1,No cite count available,https://doi.org/10.1007/978-3-319-31737-3_24-1
Managing Semantic Compensation in a Multi-agent System,"Amy Unruh,    James Bailey…",2004,https://link.springer.com/chapter/10.1007/978-3-540-30468-5_17,No PDF available,,,1,No cite count available,https://doi.org/10.1007/978-3-540-30468-5_17
State budget transfers to Health Insurance to expand coverage to people outside formal sector work in Latin America,"Inke Mathauer,    Thorsten Behrendt",2017,https://link.springer.com/article/10.1186/s12913-017-2004-y,https://link.springer.com/content/pdf/10.1186%2Fs12913-017-2004-y.pdf,,,1,2,https://doi.org/10.1186/s12913-017-2004-y
On the Integration of Configuration and Meta-level Programming Approaches,"Orlando Loques,    Alexandre Sztajnberg,    Julius Leite…",2000,https://link.springer.com/chapter/10.1007/3-540-45046-7_11,No PDF available,,,1,No cite count available,https://doi.org/10.1007/3-540-45046-7_11
Conclusion: Methodological and Conceptual Contributions,"Philippe Bonnal,    Jean-Michel Sourisseau…",2018,https://link.springer.com/chapter/10.1007/978-94-024-1617-6_26,No PDF available,,,1,No cite count available,https://doi.org/10.1007/978-94-024-1617-6_26
The impact of wind uncertainty on the strategic valuation of distributed electricity storage,"Pedro Crespo Del Granado,    Stein W. Wallace,    Zhan Pang",2016,https://link.springer.com/article/10.1007/s10287-015-0235-0,No PDF available,,,1,No cite count available,No DOI available
Super-Flexible Organizations: Orgitechting Geo-Distributed Federations,Professor Homa Bahrami…,2010,https://link.springer.com/chapter/10.1007/978-3-642-02447-4_7,No PDF available,,,1,No cite count available,https://doi.org/10.1007/978-3-642-02447-4_7
Critical Advocacy Perspectives on Organization in Higher Education,"Penny A. Pasque Ph.D.,    Rozana Carducci Ph.D.",2015,https://link.springer.com/chapter/10.1007/978-3-319-12835-1_7,No PDF available,,,1,No cite count available,https://doi.org/10.1007/978-3-319-12835-1_7
Conceptualizing Context for Pervasive Advertising,"Christine Bauer,    Sarah Spiekermann",2011,https://link.springer.com/chapter/10.1007/978-0-85729-352-7_8,No PDF available,,,1,12,https://doi.org/10.1007/978-0-85729-352-7_8
Increasing the Power of the Poor? NGO-led Social Accountability Initiatives and Political Capabilities in Rural Uganda,Sophie King,2015,https://link.springer.com/article/10.1057/ejdr.2014.74,https://link.springer.com/content/pdf/10.1057%2Fejdr.2014.74.pdf,,,1,5,https://doi.org/10.1057/ejdr.2014.74
Seeking Simplicity: A Practical Application of Complexity to Evaluation,Emery Brusset,2016,https://link.springer.com/chapter/10.1057/978-1-137-60111-7_9,No PDF available,,,1,No cite count available,https://doi.org/10.1057/978-1-137-60111-7_9
Techniques for Supporting Dynamic and Adaptive Workflow,"Peter J. Kammer,    Gregory Alan Bolcer…",2000,https://link.springer.com/article/10.1023/A%3A1008747109146,No PDF available,,,1,94,https://doi.org/10.1023/A:1008747109146
Architectural Issues,No author available,2006,https://link.springer.com/chapter/10.1007/978-0-387-35417-0_4,No PDF available,,,1,No cite count available,https://doi.org/10.1007/978-0-387-35417-0_4
Systems research methods and approaches at CIAT—current and planned involvement,"F. Torres,    G. Gallopin",1994,https://link.springer.com/chapter/10.1007/978-94-011-0764-8_17,No PDF available,,,1,No cite count available,https://doi.org/10.1007/978-94-011-0764-8_17
Capturing communication and context in the software project lifecycle,"Vera Zaychik,    William C. Regli",2003,https://link.springer.com/article/10.1007/s00163-002-0027-8,No PDF available,,,1,7,https://doi.org/10.1007/s00163-002-0027-8
"Social Class, Tertiary Education, and Field Theory",Robert Craig Strathdee,2008,https://link.springer.com/chapter/10.1057/9780230614529_2,No PDF available,,,1,No cite count available,https://doi.org/10.1057/9780230614529_2
The Power of ICT Towards Effective Decision Making on Public Resources Allocation: Case of Rural Areas of Uganda,"Charles Karemera,    Johnstone Baguma…",2016,https://link.springer.com/chapter/10.1007/978-3-319-49700-6_26,No PDF available,,,1,No cite count available,https://doi.org/10.1007/978-3-319-49700-6_26
Marketized state ownership and foreign expansion of emerging market multinationals: Leveraging institutional competitive advantages,"Ming Hua Li,    Lin Cui,    Jiangyong Lu",2017,https://link.springer.com/article/10.1007/s10490-015-9436-x,No PDF available,,,1,9,https://doi.org/10.1007/s10490-015-9436-x
"NGOs, IGOs, and Global Public Policies",Anna Ohanyan,2008,https://link.springer.com/chapter/10.1057/9780230616103_2,No PDF available,,,1,No cite count available,https://doi.org/10.1057/9780230616103_2
From Modern to Postmodern Politics? The ‘Autonomous Turn’,Simon Susen,2015,https://link.springer.com/chapter/10.1057/9781137318237_6,No PDF available,,,1,No cite count available,https://doi.org/10.1057/9781137318237_6
Between Control and Cooperation: Multi-Stakeholder Service Provision and the Legitimacy of State Institutions in Ethiopia’s Amhara National Regional State,"Nora Stel,    Fenta Mandefro Abate",2014,https://link.springer.com/article/10.1057/ejdr.2013.60,No PDF available,,,1,1,https://doi.org/10.1057/ejdr.2013.60
The militarization of cattle raiding in South Sudan: how a traditional practice became a tool for political violence,"Hannah Wild,    Jok Madut Jok,    Ronak Patel",2018,https://link.springer.com/article/10.1186/s41018-018-0030-y,https://link.springer.com/content/pdf/10.1186%2Fs41018-018-0030-y.pdf,,,1,1,https://doi.org/10.1186/s41018-018-0030-y
Social exclusion and social capital: A comparison and critique,"Mary Daly,    Hilary Silver",2008,https://link.springer.com/article/10.1007/s11186-008-9062-4,No PDF available,,,1,63,https://doi.org/10.1007/s11186-008-9062-4
Big Data and Analytics for Competitive Advantage,Vincenzo Morabito,2015,https://link.springer.com/chapter/10.1007/978-3-319-10665-6_1,No PDF available,,,1,No cite count available,https://doi.org/10.1007/978-3-319-10665-6_1
From Modern to Postmodern Sociology? The ‘Cultural Turn’,Simon Susen,2015,https://link.springer.com/chapter/10.1057/9781137318237_4,No PDF available,,,1,No cite count available,https://doi.org/10.1057/9781137318237_4
An overview of the opportunities and challenges of promoting climate change adaptation at the local level: a case study from a community adaptation planning in Nepal,"Bimal Raj Regmi,    Cassandra Star,    Walter Leal Filho",2016,https://link.springer.com/article/10.1007/s10584-016-1765-3,No PDF available,,,1,5,https://doi.org/10.1007/s10584-016-1765-3
Issues in Agent Communication: An Introduction,"Frank Dignum,    Mark Greaves",2000,https://link.springer.com/chapter/10.1007/10722777_1,No PDF available,,,1,1,https://doi.org/10.1007/10722777_1
"Coping with Reform: The Intermix of Teacher Morale, Teacher Burnout, and Teacher Accountability",Anthony Gary Dworkin,1997,https://link.springer.com/chapter/10.1007/978-94-011-4942-6_13,No PDF available,,,1,10,https://doi.org/10.1007/978-94-011-4942-6_13
Generative sectors and the new historical materialism: Economic ascent and the cumulatively sequential restructuring of the world economy,"Stephen G. Bunker,    Paul S. Ciccantell",2003,https://link.springer.com/article/10.1007/BF02686270,No PDF available,,,1,13,https://doi.org/10.1007/BF02686270
Social Sensing,"Charu C. Aggarwal,    Tarek Abdelzaher",2013,https://link.springer.com/chapter/10.1007/978-1-4614-6309-2_9,No PDF available,,,1,47,https://doi.org/10.1007/978-1-4614-6309-2_9
Media Management and Social Media Business: New Forms of Value Creation in the Context of Increasingly Interconnected Media Applications,"Reinhard Kunz,    Stefan Werning",2013,https://link.springer.com/chapter/10.1007/978-3-642-28897-5_15,No PDF available,,,1,5,https://doi.org/10.1007/978-3-642-28897-5_15
NGOs and philanthropy in Latin America: The Brazilian case,Leilah Landim,1997,https://link.springer.com/article/10.1007/BF02354208,No PDF available,,,1,3,https://doi.org/10.1007/BF02354208
Contributing to a Transition to Sustainability of Agri-Food Systems: Potentials and Pitfalls for Organic Farming,Ika Darnhofer,2014,https://link.springer.com/chapter/10.1007/978-94-007-7927-3_24,No PDF available,,,1,4,https://doi.org/10.1007/978-94-007-7927-3_24
Cost-Benefit Analysis for Adaptive Web Service Substitution with Compensation,"Ying Yin,    Xizhe Zhang,    Bin Zhang",2011,https://link.springer.com/chapter/10.1007/978-3-642-25255-6_64,No PDF available,,,1,1,https://doi.org/10.1007/978-3-642-25255-6_64
"The Bermuda Triangle: The Pragmatics, Policies, and Principles for Data Sharing in the History of the Human Genome Project","Kathryn Maxson Jones,    Rachel A. Ankeny…",2018,https://link.springer.com/article/10.1007/s10739-018-9538-7,https://link.springer.com/content/pdf/10.1007%2Fs10739-018-9538-7.pdf,,,1,No cite count available,https://doi.org/10.1007/s10739-018-9538-7
The UN Guiding Principles on Business and Human Rights in (National) Action: The Dutch Agreement on Sustainable Garment and Textile,"Antoine Duval,    Enrico Partiti",2018,https://link.springer.com/chapter/10.1007/978-94-6265-243-9_12,No PDF available,,,1,No cite count available,https://doi.org/10.1007/978-94-6265-243-9_12
Basic Concepts of Systems Biology as Seen Through Systems Biologists’ Eyes: Metaphorical Imagination and Epistemic Presuppositions,"Martin Döring,    Regine Kollek,    Anne Brüninghaus…",2015,https://link.springer.com/chapter/10.1007/978-3-319-17106-7_2,No PDF available,,,1,No cite count available,https://doi.org/10.1007/978-3-319-17106-7_2
"VET Research in Relation to VET Policy, Planning and Practice",Anneke Westerhuis,2008,https://link.springer.com/chapter/10.1007/978-1-4020-8347-1_3,No PDF available,,,1,No cite count available,https://doi.org/10.1007/978-1-4020-8347-1_3
Chaotic Brain/Mind Dynamics,No author available,2007,https://link.springer.com/chapter/10.1007/978-3-540-71561-0_2,No PDF available,,,1,No cite count available,https://doi.org/10.1007/978-3-540-71561-0_2
Glocalization Effects of Immigrants’ Activities on the Host Society,Ewa Morawska,2014,https://link.springer.com/chapter/10.1057/9780230390805_6,No PDF available,,,1,No cite count available,https://doi.org/10.1057/9780230390805_6
Digital libraries at a crossroads,Yannis Ioannidis,2005,https://link.springer.com/article/10.1007/s00799-004-0098-4,No PDF available,,,1,21,https://doi.org/10.1007/s00799-004-0098-4
Hiding Relations: The Irony of ‘Effective Aid’,Rosalind Eyben,2010,https://link.springer.com/article/10.1057/ejdr.2010.10,No PDF available,,,1,28,https://doi.org/10.1057/ejdr.2010.10
The Role of Knowledge Bases in Complex Product Systems: Some Empirical Evidence from the Aero Engine Industry,"Massimo Paoli,    Andrea Prencipe",1999,https://link.springer.com/article/10.1023/A%3A1009999823012,No PDF available,,,1,15,https://doi.org/10.1023/A:1009999823012
Beyond 1.5 °C: vulnerabilities and adaptation strategies for Caribbean Small Island Developing States,Michelle A. Mycoo,2018,https://link.springer.com/article/10.1007/s10113-017-1248-8,https://link.springer.com/content/pdf/10.1007%2Fs10113-017-1248-8.pdf,,,1,2,https://doi.org/10.1007/s10113-017-1248-8
The Global Crisis and the World: The Cases of Emerging and Developed Economies,"Marin A. Marinov,    Svetla T. Marinova",2013,https://link.springer.com/chapter/10.1057/9781137277473_1,No PDF available,,,1,No cite count available,https://doi.org/10.1057/9781137277473_1
Resilience to climate change: from theory to practice through co-production of knowledge in Chile,"Roxana Borquez,    Paulina Aldunce,    Carolina Adler",2017,https://link.springer.com/article/10.1007/s11625-016-0400-6,https://link.springer.com/content/pdf/10.1007%2Fs11625-016-0400-6.pdf,,,1,6,https://doi.org/10.1007/s11625-016-0400-6
Conceptual Framework and Some Background Issues,Isiaka A. Badmus,2015,https://link.springer.com/chapter/10.1057/9781137426611_2,No PDF available,,,1,No cite count available,https://doi.org/10.1057/9781137426611_2
Community Responses to Government Defunding of Watershed Projects: A Comparative Study in India and the USA,"Tomas M. Koontz,    Sucharita Sen",2013,https://link.springer.com/article/10.1007/s00267-012-0008-2,No PDF available,,,1,6,https://doi.org/10.1007/s00267-012-0008-2
The Campaign for Food Sovereignty 20 Years On,Alana Mann,2014,https://link.springer.com/chapter/10.1057/9781137341402_7,No PDF available,,,1,No cite count available,https://doi.org/10.1057/9781137341402_7
Economic Development Patterns and the Evolution of Violence in Latin America,"William Ascher,    Natalia Mirovitskaya",2012,https://link.springer.com/chapter/10.1057/9781137272690_1,No PDF available,,,1,No cite count available,https://doi.org/10.1057/9781137272690_1
"Requirements for adaptive governance of groundwater ecosystem services: insights from Sandveld (South Africa), Upper Guadiana (Spain) and Spree (Germany)","Kathrin Knüppe,    Claudia Pahl-Wostl",2013,https://link.springer.com/article/10.1007/s10113-012-0312-7,No PDF available,,,1,12,https://doi.org/10.1007/s10113-012-0312-7
The Practice Turn: Performance and the British Academy,Heike Roms,2010,https://link.springer.com/chapter/10.1057/9780230279421_4,No PDF available,,,1,No cite count available,https://doi.org/10.1057/9780230279421_4
