title,author,date,link,pdf_link,query,search_engine,nr_found,cite_count,doi"Aspect-oriented Programming for Dynamic Web Service Selection, Integration and Management","María Agustina Cibrán,    Bart Verheecke,    Wim Vanderperren,    Davy Suvée…",2007,https://link.springer.com/article/10.1007/s11280-006-0017-2,No PDF available,,,1,12,https://doi.org/10.1007/s11280-006-0017-2
Trust and Reputation,"Sarah N. Lim Choi Keung,    Nathan Griffiths",2010,https://link.springer.com/chapter/10.1007/978-1-84996-041-0_8,No PDF available,,,1,3,https://doi.org/10.1007/978-1-84996-041-0_8
Judicial Independence – The Normativity of an Evolving Transnational Principle,Anja Seibert-Fohr,2012,https://link.springer.com/chapter/10.1007/978-3-642-28299-7_29,No PDF available,,,1,1,https://doi.org/10.1007/978-3-642-28299-7_29
Conclusions,Mihalis Kritikos,2018,https://link.springer.com/chapter/10.1057/978-1-137-31446-8_7,No PDF available,,,1,No cite count available,https://doi.org/10.1057/978-1-137-31446-8_7
EINSTein,Andrew Ilachinski,2009,https://link.springer.com/chapter/10.1007/978-1-84882-285-6_9,No PDF available,,,1,2,https://doi.org/10.1007/978-1-84882-285-6_9
A ‘Knowledge Ecologies’ Analysis of Co-designing Water and Sanitation Services in Alaska,"Dena Fam,    Zoë Sofoulis",2017,https://link.springer.com/article/10.1007/s11948-016-9830-x,No PDF available,,,1,No cite count available,https://doi.org/10.1007/s11948-016-9830-x
Abstracts 2016,No author available,2016,https://link.springer.com/article/10.1007/s12529-016-9586-3,No PDF available,,,1,3,https://doi.org/10.1007/s12529-016-9586-3
"Corporate Diversification, Internationalization and Location of Technological Activities by MNCs in Europe","John Cantwell,    Lucia Piscitello",2002,https://link.springer.com/chapter/10.1057/9781403937674_9,No PDF available,,,1,No cite count available,https://doi.org/10.1057/9781403937674_9
Violence against Women and Southern African Advocacy on the SADC Gender Protocol,"Anouka van Eerdewijk,    Joni van de Sand",2014,https://link.springer.com/chapter/10.1057/9781137301451_9,No PDF available,,,1,No cite count available,https://doi.org/10.1057/9781137301451_9
Gendered and Gendering Parties,Fiona Macaulay,2006,https://link.springer.com/chapter/10.1057/9780230595699_2,No PDF available,,,1,No cite count available,https://doi.org/10.1057/9780230595699_2
The Value of Knowledge for Extended Enterprises,Shung Yar Lim,2007,https://link.springer.com/chapter/10.1007/978-1-4020-6071-7_10,No PDF available,,,1,No cite count available,https://doi.org/10.1007/978-1-4020-6071-7_10
"The feasibility of a role for community health workers in integrated mental health care for perinatal depression: a qualitative study from Surabaya, Indonesia","Endang R. Surjaningrum,    Harry Minas…",2018,https://link.springer.com/article/10.1186/s13033-018-0208-0,https://link.springer.com/content/pdf/10.1186%2Fs13033-018-0208-0.pdf,,,1,1,https://doi.org/10.1186/s13033-018-0208-0
What is evolutionary about ‘regional systems of innovation’? Implications for regional policy,Elvira Uyarra,2009,https://link.springer.com/article/10.1007/s00191-009-0135-y,No PDF available,,,1,99,https://doi.org/10.1007/s00191-009-0135-y
Adaptive governance to promote ecosystem services in urban green spaces,"Olivia Odom Green,    Ahjond S. Garmestani,    Sandra Albro,    Natalie C. Ban…",2016,https://link.springer.com/article/10.1007/s11252-015-0476-2,No PDF available,,,1,25,https://doi.org/10.1007/s11252-015-0476-2
Applications of Multi-Agent Systems,Mihaela Oprea,2004,https://link.springer.com/chapter/10.1007/1-4020-8159-6_9,https://link.springer.com/content/pdf/10.1007%2F1-4020-8159-6_9.pdf,,,1,No cite count available,https://doi.org/10.1007/1-4020-8159-6_9
"Accounting for Social, Spatial, and Textual Interconnections",Dr. Ephraim Nissan,2012,https://link.springer.com/chapter/10.1007/978-90-481-8990-8_6,No PDF available,,,1,No cite count available,https://doi.org/10.1007/978-90-481-8990-8_6
Climate change adaptation and the Least Developed Countries Fund (LDCF): Qualitative insights from policy implementation in the Asia-Pacific,"Benjamin K. Sovacool,    Björn-Ola Linnér,    Richard J. T. Klein",2017,https://link.springer.com/article/10.1007/s10584-016-1839-2,https://link.springer.com/content/pdf/10.1007%2Fs10584-016-1839-2.pdf,,,1,11,https://doi.org/10.1007/s10584-016-1839-2
Elements of Industrial Organization,P. K. Rao,2003,https://link.springer.com/chapter/10.1057/9780230597686_2,No PDF available,,,1,No cite count available,https://doi.org/10.1057/9780230597686_2
Environmental Economics and Environmental Policy Instruments: Introduction and Overview,"Kerry Turner,    Hans Opschoor",1994,https://link.springer.com/chapter/10.1007/978-94-011-0856-0_1,No PDF available,,,1,No cite count available,https://doi.org/10.1007/978-94-011-0856-0_1
From Angry Youth to Anxious Parents: The Mediated Politics of Everyday Life,Bingchun Meng,2018,https://link.springer.com/chapter/10.1057/978-1-137-46214-5_5,No PDF available,,,1,No cite count available,https://doi.org/10.1057/978-1-137-46214-5_5
“A manager in the minds of doctors:” a comparison of new modes of control in European hospitals,"Ellen Kuhlmann,    Viola Burau,    Tiago Correia…",2013,https://link.springer.com/article/10.1186/1472-6963-13-246,https://link.springer.com/content/pdf/10.1186%2F1472-6963-13-246.pdf,,,1,26,https://doi.org/10.1186/1472-6963-13-246
The Regime Evolves,"Ronald D. Brunner,    Amanda H. Lynch",2010,https://link.springer.com/chapter/10.1007/978-1-935704-01-0_2,No PDF available,,,1,No cite count available,https://doi.org/10.1007/978-1-935704-01-0_2
A framework for conducting a services marketing audit,"Leonard L. Berry,    Jeffrey S. Conant…",1991,https://link.springer.com/article/10.1007/BF02726500,No PDF available,,,1,54,https://doi.org/10.1007/BF02726500
Irish Women: Late Developers?,Linda Connolly,2002,https://link.springer.com/chapter/10.1057/9780230509122_1,No PDF available,,,1,No cite count available,https://doi.org/10.1057/9780230509122_1
"Gender, Local Knowledge and Lessons Learnt in Documenting and Conserving Agrobiodiversity","Yianna Lambrou,    Regina Laub",2007,https://link.springer.com/chapter/10.1057/9780230589506_7,No PDF available,,,1,No cite count available,https://doi.org/10.1057/9780230589506_7
An Ecological Approach to Understanding Adult Obesity Prevalence in the United States: A County-level Analysis using Geographically Weighted Regression,Nyesha C. Black,2014,https://link.springer.com/article/10.1007/s12061-014-9108-0,No PDF available,,,1,12,https://doi.org/10.1007/s12061-014-9108-0
Making Infrastructure Climate Resilient: Bridging the Transformation Gap with “Living Labs”?,"Ernst Schäfer,    Ulrich Scheele",2017,https://link.springer.com/chapter/10.1007/978-3-658-16759-2_10,No PDF available,,,1,1,https://doi.org/10.1007/978-3-658-16759-2_10
Negotiation Support and E-negotiation Systems: An Overview,"Gregory E. Kersten,    Hsiangchu Lai",2007,https://link.springer.com/article/10.1007/s10726-007-9095-5,No PDF available,,,1,66,https://doi.org/10.1007/s10726-007-9095-5
Communication and competition in environmental studies,Matthew R. Auer,2010,https://link.springer.com/article/10.1007/s11077-010-9109-z,No PDF available,,,1,5,https://doi.org/10.1007/s11077-010-9109-z
A design theory for digital platforms supporting online communities: a multiple case study,"Paolo Spagnoletti,    Andrea Resca,    Gwanhoo Lee",2015,https://link.springer.com/article/10.1057/jit.2014.37,https://link.springer.com/content/pdf/10.1057%2Fjit.2014.37.pdf,,,1,18,https://doi.org/10.1057/jit.2014.37
A Coordination Space Architecture for Service Collaboration and Cooperation,"Claus Pahl,    Veronica Gacitua-Decar…",2011,https://link.springer.com/chapter/10.1007/978-3-642-22056-2_39,https://link.springer.com/content/pdf/10.1007%2F978-3-642-22056-2_39.pdf,,,1,2,https://doi.org/10.1007/978-3-642-22056-2_39
Human resource management in post-conflict health systems: review of research and knowledge gaps,"Edward Roome,    Joanna Raven,    Tim Martineau",2014,https://link.springer.com/article/10.1186/1752-1505-8-18,https://link.springer.com/content/pdf/10.1186%2F1752-1505-8-18.pdf,,,1,16,https://doi.org/10.1186/1752-1505-8-18
Guiding Emergence,Brad Kershner,2015,https://link.springer.com/chapter/10.1007/978-94-6209-914-2_3,No PDF available,,,1,No cite count available,https://doi.org/10.1007/978-94-6209-914-2_3
Challenges to multiteam system leadership: an analysis of leadership during the management of railway disruptions,Danny Schipper,2017,https://link.springer.com/article/10.1007/s10111-017-0415-5,https://link.springer.com/content/pdf/10.1007%2Fs10111-017-0415-5.pdf,,,1,3,https://doi.org/10.1007/s10111-017-0415-5
Agent Patterns for Ambient Intelligence,"Paolo Bresciani,    Loris Penserini,    Paolo Busetta…",2004,https://link.springer.com/chapter/10.1007/978-3-540-30464-7_51,No PDF available,,,1,No cite count available,https://doi.org/10.1007/978-3-540-30464-7_51
Management implications,No author available,2006,https://link.springer.com/chapter/10.1007/978-3-8350-9355-3_7,No PDF available,,,1,No cite count available,https://doi.org/10.1007/978-3-8350-9355-3_7
"A Comparison with the African Development Bank, the Asian Development Bank and the European Union",Marie von Engelhardt,2018,https://link.springer.com/chapter/10.1007/978-3-319-62695-6_6,No PDF available,,,1,No cite count available,https://doi.org/10.1007/978-3-319-62695-6_6
Embracing the Complexity: Surfacing Problem Situations with Multiple Actors of the Pineapple Value Chain in Uganda,"Katharine Tröger,    Margareta Amy Lelea…",2018,https://link.springer.com/article/10.1007/s11213-018-9443-1,No PDF available,,,1,No cite count available,https://doi.org/10.1007/s11213-018-9443-1
State of Research,Georg Stampfl,2016,https://link.springer.com/chapter/10.1007/978-3-658-11266-0_2,No PDF available,,,1,No cite count available,https://doi.org/10.1007/978-3-658-11266-0_2
"Management Regimes, Property Rights, and Forest Biodiversity in Nepal and India","Harini Nagendra,    Yogesh Gokhale",2008,https://link.springer.com/article/10.1007/s00267-008-9073-y,No PDF available,,,1,20,https://doi.org/10.1007/s00267-008-9073-y
An overview of the opportunities and challenges of promoting climate change adaptation at the local level: a case study from a community adaptation planning in Nepal,"Bimal Raj Regmi,    Cassandra Star,    Walter Leal Filho",2016,https://link.springer.com/article/10.1007/s10584-016-1765-3,No PDF available,,,1,5,https://doi.org/10.1007/s10584-016-1765-3
Postmodern Dynamics of Innovation and Knowledge in the Context of Sustainable Energy Development,Harald E. Otto,2017,https://link.springer.com/chapter/10.1007/978-981-10-0471-1_54,No PDF available,,,1,No cite count available,https://doi.org/10.1007/978-981-10-0471-1_54
From Old Pay to New Pay,Jonathan Trevor,2010,https://link.springer.com/chapter/10.1057/9780230298958_2,No PDF available,,,1,No cite count available,https://doi.org/10.1057/9780230298958_2
Strategies of Interactivity,Dieter Daniels,2008,https://link.springer.com/chapter/10.1007/978-3-540-79870-5_3,No PDF available,,,1,1,https://doi.org/10.1007/978-3-540-79870-5_3
Massive Views,No author available,2001,https://link.springer.com/chapter/10.1007/3-540-45162-5_5,No PDF available,,,1,No cite count available,https://doi.org/10.1007/3-540-45162-5_5
Public Private Partnerships and Corporate Social Responsibility: Needs for and Impacts on Education in India and Indonesia,Clara Morgan,2017,https://link.springer.com/chapter/10.1007/978-1-4939-6915-9_9,No PDF available,,,1,No cite count available,https://doi.org/10.1007/978-1-4939-6915-9_9
Dynamic Problem Solving in the Semantic Grid,No author available,2008,https://link.springer.com/chapter/10.1007/978-3-540-79454-7_3,No PDF available,,,1,No cite count available,https://doi.org/10.1007/978-3-540-79454-7_3
System Model for the Internet of Things,"Sridipta Misra,    Muthucumaru Maheswaran…",2017,https://link.springer.com/chapter/10.1007/978-3-319-44230-3_2,No PDF available,,,1,1,https://doi.org/10.1007/978-3-319-44230-3_2
Comparable Approaches to IVE,"Nikolay Mehandjiev,    Hamideh Afsarmanesh…",2010,https://link.springer.com/chapter/10.1007/978-1-84882-691-5_12,No PDF available,,,1,No cite count available,https://doi.org/10.1007/978-1-84882-691-5_12
Nutritional Consequences of Wealth Differentials in East African Pastoralists: The Case of the Datoga of Northern Tanzania,Daniel W. Sellen,2003,https://link.springer.com/article/10.1023/B%3AHUEC.0000005513.78183.34,No PDF available,,,1,23,https://doi.org/10.1023/B:HUEC.0000005513.78183.34
Techniques for Supporting Dynamic and Adaptive Workflow,"Peter J. Kammer,    Gregory Alan Bolcer…",2000,https://link.springer.com/article/10.1023/A%3A1008747109146,No PDF available,,,1,94,https://doi.org/10.1023/A:1008747109146
Measuring the Intangible Aspects of the Manufacturing Strategy – A Case Study from the Automotive Industry,"Bjørnar Henriksen,    Lars E. Onsøyen",2010,https://link.springer.com/chapter/10.1007/978-3-642-16358-6_48,https://link.springer.com/content/pdf/10.1007%2F978-3-642-16358-6_48.pdf,,,1,No cite count available,https://doi.org/10.1007/978-3-642-16358-6_48
Query optimization in information integration,"Dongfeng Chen,    Rada Chirkova,    Fereidoon Sadri,    Tiia J. Salo",2013,https://link.springer.com/article/10.1007/s00236-013-0179-1,No PDF available,,,1,1,https://doi.org/10.1007/s00236-013-0179-1
Do Teacher-Student Relationships Deteriorate Over Time?,"Ridwan Maulana,    Marie-Christine Opdenakker",2014,https://link.springer.com/chapter/10.1007/978-94-6209-701-8_9,No PDF available,,,1,No cite count available,https://doi.org/10.1007/978-94-6209-701-8_9
Scientific Proceedings (Abstracts) 25th German Cancer Congress,No author available,2002,https://link.springer.com/article/10.1007/BF01480868,No PDF available,,,1,No cite count available,https://doi.org/10.1007/BF01480868
Humanitarian Emergencies,"Reinhard Kaiser,    Paul B. Spiegel",2008,https://link.springer.com/chapter/10.1007/978-1-59745-464-3_24,No PDF available,,,1,No cite count available,https://doi.org/10.1007/978-1-59745-464-3_24
Conceptualizing Context for Pervasive Advertising,"Christine Bauer,    Sarah Spiekermann",2011,https://link.springer.com/chapter/10.1007/978-0-85729-352-7_8,No PDF available,,,1,12,https://doi.org/10.1007/978-0-85729-352-7_8
Managing Green Business Model Transformations – A Framework for Management Practice,Axel Sommer,2012,https://link.springer.com/chapter/10.1007/978-3-642-28848-7_9,No PDF available,,,1,No cite count available,https://doi.org/10.1007/978-3-642-28848-7_9
Other Important Issues Relevant for Control of Population,Bedprakas SyamRoy,2017,https://link.springer.com/chapter/10.1007/978-3-319-47494-6_3,No PDF available,,,1,No cite count available,https://doi.org/10.1007/978-3-319-47494-6_3
The Role of Institutions in Shaping the Opportunities and Constraints on Actors’ Behaviour,Pontus Odmalm,2005,https://link.springer.com/chapter/10.1057/9780230512382_3,No PDF available,,,1,No cite count available,https://doi.org/10.1057/9780230512382_3
The Role of Institutions in Shaping the Opportunities and Constraints on Actors’ Behaviour,Pontus Odmalm,2005,https://link.springer.com/chapter/10.1007/978-0-230-51238-2_3,No PDF available,,,1,No cite count available,https://doi.org/10.1007/978-0-230-51238-2_3
Participatory scenario development for integrated sustainability assessment,"Lisa Bohunovsky,    Jill Jäger,    Ines Omann",2011,https://link.springer.com/article/10.1007/s10113-010-0143-3,No PDF available,,,1,21,https://doi.org/10.1007/s10113-010-0143-3
Understanding patterns of tree adoption on farms in semi-arid and sub-humid Ethiopia,"Miyuki Iiyama,    Abayneh Derero,    Kaleb Kelemu,    Catherine Muthuri…",2017,https://link.springer.com/article/10.1007/s10457-016-9926-y,https://link.springer.com/content/pdf/10.1007%2Fs10457-016-9926-y.pdf,,,1,15,https://doi.org/10.1007/s10457-016-9926-y
"The Ecological: Whose Nature?
",Phillip Kalantzis-Cope,2018,https://link.springer.com/chapter/10.1007/978-3-319-64650-3_5,No PDF available,,,1,No cite count available,https://doi.org/10.1007/978-3-319-64650-3_5
Towards an International Regulatory Framework?,Susan Brown-Shafii,2011,https://link.springer.com/chapter/10.1057/9780230309111_5,No PDF available,,,1,No cite count available,https://doi.org/10.1057/9780230309111_5
Key Components of Demand Driven Supply Chain,Paulo Mendes Jr.,2011,https://link.springer.com/chapter/10.1007/978-3-642-19992-9_4,No PDF available,,,1,No cite count available,https://doi.org/10.1007/978-3-642-19992-9_4
Biological Perspectives on Prerational Intelligence,"Jeffrey Dean,    Ralf Beckers,    Holk Cruse",2000,https://link.springer.com/chapter/10.1007/978-94-010-0870-9_79,No PDF available,,,1,No cite count available,https://doi.org/10.1007/978-94-010-0870-9_79
On the Integration of Configuration and Meta-level Programming Approaches,"Orlando Loques,    Alexandre Sztajnberg,    Julius Leite…",2000,https://link.springer.com/chapter/10.1007/3-540-45046-7_11,No PDF available,,,1,No cite count available,https://doi.org/10.1007/3-540-45046-7_11
Terminology Entries (Alphabetical Presentation),Rita C. Richey,2013,https://link.springer.com/chapter/10.1007/978-1-4614-6573-7_1,No PDF available,,,1,No cite count available,https://doi.org/10.1007/978-1-4614-6573-7_1
Inter-Municipal Cooperation: A Widespread Phenomenon,"Rudie Hulst,    André van Montfort",2007,https://link.springer.com/chapter/10.1007/1-4020-5379-7_1,No PDF available,,,1,17,https://doi.org/10.1007/1-4020-5379-7_1
"Social multi-criteria evaluation to identify appropriate disaster risk reduction measures: application to landslides in the Rwenzori Mountains, Uganda","Jan Maes,    Kewan Mertens,    Liesbet Jacobs,    Bosco Bwambale,    Liesbet Vranken…",2018,https://link.springer.com/article/10.1007/s10346-018-1030-0,No PDF available,,,1,1,https://doi.org/10.1007/s10346-018-1030-0
Integrative Governance of Environmental Water in Australia’s Murray–Darling Basin: Evolving Challenges and Emerging Pathways,"Zachary Bischoff-Mattson,    Amanda H. Lynch",2017,https://link.springer.com/article/10.1007/s00267-017-0864-x,No PDF available,,,1,1,https://doi.org/10.1007/s00267-017-0864-x
Knowledge Systems Engineering: A Complex System View,"Zhongtuo Wang,    Jiangning Wu",2016,https://link.springer.com/chapter/10.1007/978-4-431-55218-5_7,No PDF available,,,1,No cite count available,https://doi.org/10.1007/978-4-431-55218-5_7
Medical termination of pregnancy service delivery in the context of decentralization: social and structural influences,"Alana Hulme-Chambers,    Samantha Clune…",2018,https://link.springer.com/article/10.1186/s12939-018-0888-8,https://link.springer.com/content/pdf/10.1186%2Fs12939-018-0888-8.pdf,,,1,No cite count available,https://doi.org/10.1186/s12939-018-0888-8
"Migration in the Hindu Kush Himalaya: Drivers, Consequences, and Governance","Tasneem Siddiqui,    Ram B. Bhagat,    Soumyadeep Banerjee…",2019,https://link.springer.com/chapter/10.1007/978-3-319-92288-1_15,https://link.springer.com/content/pdf/10.1007%2F978-3-319-92288-1_15.pdf,,,1,No cite count available,https://doi.org/10.1007/978-3-319-92288-1_15
English Learners and Their Transition to Postsecondary Education,"Anne-Marie Núñez,    Cecilia Rios-Aguilar…",2016,https://link.springer.com/chapter/10.1007/978-3-319-26829-3_2,No PDF available,,,1,4,https://doi.org/10.1007/978-3-319-26829-3_2
"Futuring, Experimentation, and Transformative Urban Politics","Mark Swilling,    Edgar Pieterse,    Maarten Hajer",No year available,https://link.springer.com/referenceworkentry/10.1007/978-3-319-31737-3_24-1,No PDF available,,,1,No cite count available,https://doi.org/10.1007/978-3-319-31737-3_24-1
Trust Management,Adam Wierzbicki,2010,https://link.springer.com/chapter/10.1007/978-3-642-13451-7_3,No PDF available,,,1,1,https://doi.org/10.1007/978-3-642-13451-7_3
Evaluation of Engineering Approaches in the Secure Software Development Life Cycle,"Marianne Busch,    Nora Koch,    Martin Wirsing",2014,https://link.springer.com/chapter/10.1007/978-3-319-07452-8_10,No PDF available,,,1,2,https://doi.org/10.1007/978-3-319-07452-8_10
Theoretical Research Framework,Cilli Sobiech,2013,https://link.springer.com/chapter/10.1007/978-3-642-32365-2_3,No PDF available,,,1,No cite count available,https://doi.org/10.1007/978-3-642-32365-2_3
Western European Civil Service Systems: A Comparative Analysis,"Frits M. Van der Meer,    Trui Steen,    Anchrit Wille",2007,https://link.springer.com/chapter/10.1057/9780230593084_3,No PDF available,,,1,No cite count available,https://doi.org/10.1057/9780230593084_3
Understanding and influencing the policy process,"Christopher M. Weible,    Tanya Heikkila,    Peter deLeon,    Paul A. Sabatier",2012,https://link.springer.com/article/10.1007/s11077-011-9143-5,No PDF available,,,1,73,https://doi.org/10.1007/s11077-011-9143-5
Architectural Issues,No author available,2006,https://link.springer.com/chapter/10.1007/978-0-387-35417-0_4,No PDF available,,,1,No cite count available,https://doi.org/10.1007/978-0-387-35417-0_4
Conclusion: Methodological and Conceptual Contributions,"Philippe Bonnal,    Jean-Michel Sourisseau…",2018,https://link.springer.com/chapter/10.1007/978-94-024-1617-6_26,No PDF available,,,1,No cite count available,https://doi.org/10.1007/978-94-024-1617-6_26
Corporate Social Responsibility and Equal Opportunities for Men and Women as Organizational Values,"Urmi Nanda Biswas,    Karin Allard…",2017,https://link.springer.com/chapter/10.1007/978-981-10-6133-2_3,No PDF available,,,1,No cite count available,https://doi.org/10.1007/978-981-10-6133-2_3
The Role of Institutional Legacies from Yugoslav Decentralization,Alexander Kleibrink,2015,https://link.springer.com/chapter/10.1057/9781137495723_3,No PDF available,,,1,No cite count available,https://doi.org/10.1057/9781137495723_3
"Closing the loop: integrative systems management of waste in food, energy, and water systems","Sarah C. Davis,    Derek Kauneckis…",2016,https://link.springer.com/article/10.1007/s13412-016-0370-0,https://link.springer.com/content/pdf/10.1007%2Fs13412-016-0370-0.pdf,,,1,11,https://doi.org/10.1007/s13412-016-0370-0
"Cross-Cultural and Site-Based Influences on Demographic, Well-being, and Social Network Predictors of Risk Perception in Hazard and Disaster Settings in Ecuador and Mexico","Eric C. Jones,    Albert J. Faas,    Arthur D. Murphy,    Graham A. Tobin…",2013,https://link.springer.com/article/10.1007/s12110-013-9162-3,No PDF available,,,1,21,https://doi.org/10.1007/s12110-013-9162-3
Toward a Methodological Knowledge for Service-Oriented Development Based on OPEN Meta-Model,"Mahdi Fahmideh,    Fereidoon Shams…",2011,https://link.springer.com/chapter/10.1007/978-3-642-22203-0_54,No PDF available,,,1,No cite count available,https://doi.org/10.1007/978-3-642-22203-0_54
Can We (Still) Think About the European Union and Canada as “Cosmopolitan Vanguards”?,John Erik Fossum,2018,https://link.springer.com/chapter/10.1057/978-1-137-58987-3_6,No PDF available,,,1,No cite count available,https://doi.org/10.1057/978-1-137-58987-3_6
Introduction: Political Representation in France and Germany,"Oscar W. Gabriel,    Eric Kerrouche…",2018,https://link.springer.com/chapter/10.1007/978-3-319-72029-6_1,No PDF available,,,1,No cite count available,https://doi.org/10.1007/978-3-319-72029-6_1
Beyond 1.5 °C: vulnerabilities and adaptation strategies for Caribbean Small Island Developing States,Michelle A. Mycoo,2018,https://link.springer.com/article/10.1007/s10113-017-1248-8,https://link.springer.com/content/pdf/10.1007%2Fs10113-017-1248-8.pdf,,,1,2,https://doi.org/10.1007/s10113-017-1248-8
Liquidity Risk Management in Banks: Economic and Regulatory Issues,"Roberto Ruozi,    Pierpaolo Ferrari",2013,https://link.springer.com/chapter/10.1007/978-3-642-29581-2_1,No PDF available,,,1,No cite count available,https://doi.org/10.1007/978-3-642-29581-2_1
Capital Structures and Related Financing Issues,Michael Z. Brooke MA PhD FIEx.,1990,https://link.springer.com/chapter/10.1007/978-1-349-11795-6_2,No PDF available,,,1,No cite count available,https://doi.org/10.1007/978-1-349-11795-6_2
Research Methods,"Felix Rauner,    Rupert Maclean",2008,https://link.springer.com/chapter/10.1007/978-1-4020-8347-1_6,No PDF available,,,1,No cite count available,https://doi.org/10.1007/978-1-4020-8347-1_6
From complex systems analysis to transformational change: a comparative appraisal of sustainability science projects,"Arnim Wiek,    Barry Ness,    Petra Schweizer-Ries,    Fridolin S. Brand…",2012,https://link.springer.com/article/10.1007/s11625-011-0148-y,No PDF available,,,1,152,https://doi.org/10.1007/s11625-011-0148-y
Co-learning,Jim Armstrong,2013,https://link.springer.com/chapter/10.1057/9781137310118_7,No PDF available,,,1,No cite count available,https://doi.org/10.1057/9781137310118_7
Public Service Organizations: Social Networks and Social Capital,Ewan Ferlie,1999,https://link.springer.com/chapter/10.1007/978-1-4615-5027-3_16,No PDF available,,,1,No cite count available,https://doi.org/10.1007/978-1-4615-5027-3_16
A Universal Socio-Technical Computing Machine,"Markus Luczak-Roesch,    Ramine Tinati,    Saud Aljaloud,    Wendy Hall…",2016,https://link.springer.com/chapter/10.1007/978-3-319-38791-8_48,No PDF available,,,1,No cite count available,https://doi.org/10.1007/978-3-319-38791-8_48
