title,author,date,link,pdf_link
Service Provision in Ad Hoc Networks,"Radu Handorean,    Gruia-Catalin Roman",2002,https://link.springer.com/chapter/10.1007/3-540-46000-4_21,No PDF available
Detection and Mitigation of Attacks by Colluding Misbehaving Nodes in MANET,"Poonam,    K. Garg,    M. Misra",2010,https://link.springer.com/chapter/10.1007/978-3-642-14478-3_19,No PDF available
Analysis of a Session-Layer Protocol in mCRL2,"Marko van Eekelen,    Stefan ten Hoedt…",2008,https://link.springer.com/chapter/10.1007/978-3-540-79707-4_14,No PDF available
Connection Cost Based Handover Decision for Offloading Macrocells by Femtocells,"Michal Vondra,    Zdenek Becvar",2012,https://link.springer.com/chapter/10.1007/978-3-642-30630-3_18,No PDF available
Streaming Content Wars: Download and Play Strikes Back,"Charalampos Patrikakis,    Nikos Papaoulakis,    Chryssanthi Stefanoudaki…",2010,https://link.springer.com/chapter/10.1007/978-3-642-12630-7_26,No PDF available
A Fully Digital Smart LED Luminaire with Remote Management and Embedded Power Quality Analysis System,"Guilherme M. Soares,    Pedro S. Almeida…",2017,https://link.springer.com/article/10.1007/s40313-017-0335-x,https://link.springer.com/content/pdf/10.1007%2Fs40313-017-0335-x.pdf
An Agent Based Service Discovery Architecture for Mobile Environments,"Zhou Wang,    Jochen Seitz",2002,https://link.springer.com/chapter/10.1007/3-540-36087-5_41,No PDF available
Social Media in Disaster Risk Reduction and Crisis Management,David E. Alexander,2014,https://link.springer.com/article/10.1007/s11948-013-9502-z,https://link.springer.com/content/pdf/10.1007%2Fs11948-013-9502-z.pdf
Location of Mobile Devices Using Networked Surfaces,"Frank Hoffmann,    James Scott",2002,https://link.springer.com/chapter/10.1007/3-540-45809-3_22,No PDF available
A Message Service for Opportunistic Computing in Disconnected MANETs,"Abdulkader Benchi,    Frédéric Guidec…",2012,https://link.springer.com/chapter/10.1007/978-3-642-30823-9_10,https://link.springer.com/content/pdf/10.1007%2F978-3-642-30823-9_10.pdf
Central Processing Unit for an Autopilot: Description and Hardware-In-the-Loop Simulation,"Adriano Bittar,    Neusa M. F. de Oliveira",2013,https://link.springer.com/article/10.1007/s10846-012-9745-y,https://link.springer.com/content/pdf/10.1007%2Fs10846-012-9745-y.pdf
Using ubiquitous computing in interactive mobile marketing,"Stan Kurkovsky,    Karthik Harihar",2006,https://link.springer.com/article/10.1007/s00779-005-0044-5,https://link.springer.com/content/pdf/10.1007%2Fs00779-005-0044-5.pdf
Workflow Support for Mobile Data Collection,"Peter Wakholi,    Weiqin Chen,    Jørn Klungsøyr",2011,https://link.springer.com/chapter/10.1007/978-3-642-21759-3_22,No PDF available
A System of Systems Framework for Microgrids,"Magdi S. Mahmoud,    Fouad M. AL-Sunni",2015,https://link.springer.com/chapter/10.1007/978-3-319-16910-1_5,https://link.springer.com/content/pdf/10.1007%2F978-3-319-16910-1_5.pdf
Music Studio Technology,Robert Mores,2018,https://link.springer.com/chapter/10.1007/978-3-662-55004-5_12,https://link.springer.com/content/pdf/10.1007%2F978-3-662-55004-5_12.pdf
Performance Analysis for the Improved Topology Updating Mechanism for ZigBee Networks in 5G,"Saichao Li,    Jiasong Mu",2018,https://link.springer.com/chapter/10.1007/978-981-10-3229-5_32,https://link.springer.com/content/pdf/10.1007%2F978-981-10-3229-5_32.pdf
Design and Implementation of Remote Monitoring System for Working Conditions of Cremation Equipment,"Fengguang Huang,    Lin Tian,    Yu Bai,    Wei Wang",2019,https://link.springer.com/chapter/10.1007/978-981-13-2288-4_27,No PDF available
A Novel Distributed Protocol for Path Selection in Dynamic Wavelength-Routed WDM Networks,"P.-H. Ho,    H. T. Mouftah",2003,https://link.springer.com/article/10.1023/A%3A1021097611848,https://link.springer.com/content/pdf/10.1023%2FA%3A1021097611848.pdf
Achieving Adaptivity Through Strategies in a Distributed Software Architecture,"Claudia Raibulet,    Luigi Ubezio…",2009,https://link.springer.com/chapter/10.1007/978-3-642-01112-2_11,No PDF available
MELON: A Persistent Message-Based Communication Paradigm for MANETs,"Justin Collins,    Rajive Bagrodia",2014,https://link.springer.com/chapter/10.1007/978-3-319-11569-6_59,No PDF available
Geo-Mobile Queries: Sketch-Based Queries in Mobile GIS-Environments,"David Caduff,    Max J. Egenhofer",2005,https://link.springer.com/chapter/10.1007/11599289_13,https://link.springer.com/content/pdf/10.1007%2F11599289_13.pdf
Software Performance Models from System Scenarios in Use Case Maps,"Dorin C. Petriu,    Murray Woodside",2002,https://link.springer.com/chapter/10.1007/3-540-46029-2_9,No PDF available
ASSR Fair Load Distribution Using Efficiency Division Factor with Greedy Booster Approach for MANET,"Ahmad Anzaar,    Husain Shahnawaz,    Chand Mukesh…",2010,https://link.springer.com/chapter/10.1007/978-3-642-15766-0_112,No PDF available
A Chord-Based Novel Mobile Peer-to-Peer File Sharing Protocol,"Min Li,    Enhong Chen,    Phillip C-y Sheu",2006,https://link.springer.com/chapter/10.1007/11610113_77,No PDF available
Economic Slowdown and the American Model,No author available,2005,https://link.springer.com/chapter/10.1007/1-4020-2934-9_6,No PDF available
A Dual-Token-Based Fault Tolerant Mutual Exclusion Algorithm for MANETs,"Weigang Wu,    Jiannong Cao,    Michel Raynal",2007,https://link.springer.com/chapter/10.1007/978-3-540-77024-4_52,No PDF available
An Optimized Architecture for Supporting Data Streaming in Interactive Grids,"L. Caviglione,    C. Cervellera,    R. Marcialis",2011,https://link.springer.com/chapter/10.1007/978-1-4419-5574-6_4,No PDF available
Freeing Cooperation from Servers Tyranny,"Davide Balzarotti,    Carlo Ghezzi,    Mattia Monga",2002,https://link.springer.com/chapter/10.1007/3-540-45745-3_21,No PDF available
Consensus Algorithm with Censored Data for Distributed Detection with Corrupted Measurements: A Game-Theoretic Approach,"Kassem Kallas,    Benedetta Tondi…",2016,https://link.springer.com/chapter/10.1007/978-3-319-47413-7_26,https://link.springer.com/content/pdf/10.1007%2F978-3-319-47413-7_26.pdf
Security controls in an integrated Biobank to protect privacy in data sharing: rationale and study design,"Takako Takai-Igarashi,    Kengo Kinoshita…",2017,https://link.springer.com/article/10.1186/s12911-017-0494-5,https://link.springer.com/content/pdf/10.1186%2Fs12911-017-0494-5.pdf
Mobile Computing,No author available,2005,https://link.springer.com/chapter/10.1007/0-387-23840-9_13,No PDF available
MobiLim: An Agent Based License Management for Cloud Computing,"Pankaj B. Thorat,    Anil K. Sarje",2011,https://link.springer.com/chapter/10.1007/978-3-642-22606-9_35,No PDF available
Group-Based Self-organization Grid Architecture,"Jaime Lloret,    Miguel Garcia,    Fernando Boronat…",2007,https://link.springer.com/chapter/10.1007/978-3-540-72360-8_50,No PDF available
Replication in Intermittently Connected Mobile Ad Hoc Networks,Ke Shi,2007,https://link.springer.com/chapter/10.1007/978-3-540-73549-6_32,No PDF available
SeSaMe: Towards a Semantic Self Adaptive Middleware for Smart Spaces,"Luciano Baresi,    Sam Guinea,    Adnan Shahzada",2013,https://link.springer.com/chapter/10.1007/978-3-642-45343-4_1,No PDF available
Fractionated Software for Networked Cyber-Physical Systems: Research Directions and Long-Term Vision,"Mark-Oliver Stehr,    Carolyn Talcott…",2011,https://link.springer.com/chapter/10.1007/978-3-642-24933-4_7,No PDF available
Real-time automated risk assessment in protected core networking,"Konrad Wrona,    Geir Hallingstad",2010,https://link.springer.com/article/10.1007/s11235-009-9242-1,https://link.springer.com/content/pdf/10.1007%2Fs11235-009-9242-1.pdf
Opportunistic Information Dissemination in Mobile Ad-Hoc Networks: Adaptiveness vs. Obliviousness and Randomization vs. Determinism,"Martín Farach-Colton,    Antonio Fernández Anta…",2012,https://link.springer.com/chapter/10.1007/978-3-642-29344-3_26,No PDF available
Practical Guidelines for Design of Human-in-the-Loop Systems: Lessons Learned,Vasily Moshnyaga,2018,https://link.springer.com/chapter/10.1007/978-3-319-78437-3_7,https://link.springer.com/content/pdf/10.1007%2F978-3-319-78437-3_7.pdf
"e-Science, the Way Leading to Modernization of Sciences and Technologies: e-Science Practice and Thought in Chinese Academy of Sciences","Baoping Yan,    Wenzhuang Gui,    Ze Luo,    Gang Qin,    Jian Li,    Kai Nan…",2011,https://link.springer.com/chapter/10.1007/978-0-85729-439-5_18,No PDF available
Virtualization of Health Care: The Role of Capacity Building,Ai Keow Lim,2017,https://link.springer.com/chapter/10.1007/978-3-319-47617-9_7,https://link.springer.com/content/pdf/10.1007%2F978-3-319-47617-9_7.pdf
Combining User Profiles and Situation Contexts for Spontaneous Service Provision in Smart Assistive Environments,"Weijun Qin,    Daqing Zhang,    Yuanchun Shi,    Kejun Du",2008,https://link.springer.com/chapter/10.1007/978-3-540-69293-5_16,No PDF available
Data Organization Issues for Location-Dependent Queries in Mobile Computing,"Sanjay Kumar Madria,    Bharat Bhargava…",2000,https://link.springer.com/chapter/10.1007/3-540-44472-6_12,No PDF available
Mobile Grid System Based on Mobile Agent,"JongHyuk Lee,    SungJin Choi,    JongBeom Lim…",2010,https://link.springer.com/chapter/10.1007/978-3-642-17625-8_12,No PDF available
Spot the Hotspot: Wi-Fi Hotspot Classification from Internet Traffic,"Andrey Finkelshtein,    Rami Puzis,    Asaf Shabtai…",2016,https://link.springer.com/chapter/10.1007/978-3-319-39931-7_23,https://link.springer.com/content/pdf/10.1007%2F978-3-319-39931-7_23.pdf
GeoDTN+Nav: Geographic DTN Routing with Navigator Prediction for Urban Vehicular Environments,"Pei-Chun Cheng,    Kevin C. Lee,    Mario Gerla,    Jérôme Härri",2010,https://link.springer.com/article/10.1007/s11036-009-0181-6,https://link.springer.com/content/pdf/10.1007%2Fs11036-009-0181-6.pdf
An Architectural Blueprint for a Real-World Internet,"Alex Gluhak,    Manfred Hauswirth,    Srdjan Krco,    Nenad Stojanovic…",2011,https://link.springer.com/chapter/10.1007/978-3-642-20898-0_5,https://link.springer.com/content/pdf/10.1007%2F978-3-642-20898-0_5.pdf
Analysis of the Migration Process in the ERTMS System from GSM Technology to LTE on the Polish Railway,"Andrzej Kochan,    Łukasz Gruba",2018,https://link.springer.com/chapter/10.1007/978-3-319-97955-7_17,https://link.springer.com/content/pdf/10.1007%2F978-3-319-97955-7_17.pdf
Related Work,"Jun Li,    Peter Reiher,    Gerald J. Popek",2003,https://link.springer.com/chapter/10.1007/978-1-4615-1021-5_7,No PDF available
Processing k Nearest Neighbor Queries for Location-Dependent Data in MANETs,"Yuka Komai,    Yuya Sasaki,    Takahiro Hara…",2013,https://link.springer.com/chapter/10.1007/978-3-642-40173-2_19,No PDF available
Exploring an Adaptive Architecture for Service Discovery over MANETs,"Beihong Jin,    Fusang Zhang,    Haibin Weng",2011,https://link.springer.com/chapter/10.1007/978-3-642-23641-9_21,No PDF available
A Dynamic Mobile Grid System for 4G Networks,"Manel Abdelkader,    Mohamed Hamdi Noureddine Boudriga",2009,https://link.springer.com/chapter/10.1007/978-3-642-10549-4_17,No PDF available
A novel weight based clustering algorithm for routing in MANET,"Sunil Pathak,    Dr. Sonal Jain",2016,https://link.springer.com/article/10.1007/s11276-015-1124-8,https://link.springer.com/content/pdf/10.1007%2Fs11276-015-1124-8.pdf
Distributed phase-shift beamforming power balancing in ad-hoc and sensor networks,"Alexandru Mihnea Moucha,    Viktor Cerny,    Jan Kubr,    Jan Janecek",2014,https://link.springer.com/article/10.1007/s11235-013-9839-2,https://link.springer.com/content/pdf/10.1007%2Fs11235-013-9839-2.pdf
A Notation and Logic for Mobile Computing,"Gruia-Catalin Roman,    Peter J. McCann",2002,https://link.springer.com/article/10.1023/A%3A1012908529306,https://link.springer.com/content/pdf/10.1023%2FA%3A1012908529306.pdf
Summary and Conclusions,Samia Mohamed Nour,2015,https://link.springer.com/chapter/10.1007/978-3-319-13999-9_9,No PDF available
Effect of Node Density and Node Movement Model on Performance of a VDTN,"Kevin Bylykbashi,    Evjola Spaho…",2017,https://link.springer.com/chapter/10.1007/978-3-319-49106-6_14,https://link.springer.com/content/pdf/10.1007%2F978-3-319-49106-6_14.pdf
Ambient Clouds: Reactive Asynchronous Collections for Mobile Ad Hoc Network Applications,"Kevin Pinte,    Andoni Lombide Carreton…",2013,https://link.springer.com/chapter/10.1007/978-3-642-38541-4_7,https://link.springer.com/content/pdf/10.1007%2F978-3-642-38541-4_7.pdf
Collection and Object Synchronization Based on Context Information,"Sasu Tarkoma,    Tancred Lindholm…",2005,https://link.springer.com/chapter/10.1007/11569510_23,https://link.springer.com/content/pdf/10.1007%2F11569510_23.pdf
A web-based pervasive recommendation system for mobile tourist guides,"Damianos Gavalas,    Michael Kenteris",2011,https://link.springer.com/article/10.1007/s00779-011-0389-x,https://link.springer.com/content/pdf/10.1007%2Fs00779-011-0389-x.pdf
Cyber-Physical Systems for Agricultural and Construction Machinery—Current Applications and Future Potential,"Georg Jacobs,    Felix Schlüter,    Jan Schröter…",2017,https://link.springer.com/chapter/10.1007/978-3-319-42559-7_26,https://link.springer.com/content/pdf/10.1007%2F978-3-319-42559-7_26.pdf
A Connectivity-Based Multi-Lane Routing Optimization Algorithm in Vehicular Communication,"Hai-tao Zhao,    Huimin Wang,    Hongbo Zhu,    Dapeng Li",2018,https://link.springer.com/article/10.1007/s11277-018-5642-4,https://link.springer.com/content/pdf/10.1007%2Fs11277-018-5642-4.pdf
An Incentive-Based Scheme for Mitigating Node Selfishness in Smart Opportunistic Mobile Networks,"C. C. Sobin,    Vaskar Raychoudhury,    Snehanshu Saha",2017,https://link.springer.com/article/10.1007/s11277-017-4139-x,https://link.springer.com/content/pdf/10.1007%2Fs11277-017-4139-x.pdf
Replication for High Availability,Bettina Kemme,2009,https://link.springer.com/referenceworkentry/10.1007/978-0-387-39940-9_313,https://link.springer.com/content/pdf/10.1007%2F978-0-387-39940-9_313.pdf
Autonomic Application-Level Message Delivery Using Virtual Magnetic Fields,"Luiz A. P. Lima Jr.,    Alcides Calsavara",2010,https://link.springer.com/article/10.1007/s10922-009-9145-1,https://link.springer.com/content/pdf/10.1007%2Fs10922-009-9145-1.pdf
An efficient technique for mitigating stealthy attacks using MNDA in MANET,"D. Muruganandam,    J. Martin Leo Manickam",2018,https://link.springer.com/article/10.1007/s00521-018-3634-7,https://link.springer.com/content/pdf/10.1007%2Fs00521-018-3634-7.pdf
Increasing the Resilience of Critical SCADA Systems Using Peer-to-Peer Overlays,"Daniel Germanus,    Abdelmajid Khelil,    Neeraj Suri",2010,https://link.springer.com/chapter/10.1007/978-3-642-13556-9_10,No PDF available
Appendix C: Problems,Kenneth P. Birman,2012,https://link.springer.com/chapter/10.1007/978-1-4471-2416-0_24,No PDF available
Enhancement in Connectivity by Distributed Beamforming in WSN,"Vandana Raj,    Kulvinder Singh",2017,https://link.springer.com/chapter/10.1007/978-981-10-1678-3_58,https://link.springer.com/content/pdf/10.1007%2F978-981-10-1678-3_58.pdf
Hierarchical replication and multiversion concurrency control model for mobile database systems (MDS),"M. Mohana,    C. Jaykumar",2017,https://link.springer.com/article/10.1007/s11276-015-1190-y,https://link.springer.com/content/pdf/10.1007%2Fs11276-015-1190-y.pdf
A Novel Data Centric Information Retrieval Protocol for Queries in Delay Tolerant Networks,"Zhenxin Feng,    Kwan-Wu Chin",2015,https://link.springer.com/article/10.1007/s10922-014-9326-4,https://link.springer.com/content/pdf/10.1007%2Fs10922-014-9326-4.pdf
Methodology for Detection and Restraint of P2P Applications in the Network,"Rodrigo M. P. Silva,    Ronaldo M. Salles",2012,https://link.springer.com/chapter/10.1007/978-3-642-31128-4_24,No PDF available
Survey of Environmental Effects in Railway Communications,"Nerea Fernandez,    Saioa Arrizabalaga…",2018,https://link.springer.com/chapter/10.1007/978-3-319-90371-2_7,https://link.springer.com/content/pdf/10.1007%2F978-3-319-90371-2_7.pdf
GeoSUZ: A Geocast Routing Protocol in Sub-ZORs for VANETs,"Salim Allal,    Saadi Boudjit",2013,https://link.springer.com/chapter/10.1007/978-3-642-38227-7_34,No PDF available
CIMPL: A Public Safety Tool Based on Opportunistic Communication,"Waldir Moreira,    Antonio Oliveira-Jr.…",2016,https://link.springer.com/chapter/10.1007/978-3-319-40509-4_12,https://link.springer.com/content/pdf/10.1007%2F978-3-319-40509-4_12.pdf
Reconciling Cloud and Mobile Computing Using Activity-Based Predictive Caching,"Dawud Gordon,    Sven Frauen,    Michael Beigl",2014,https://link.springer.com/chapter/10.1007/978-3-319-05452-0_11,No PDF available
A Testing Architecture for Designing High-Reliable MANET Protocols,"Teruo Higashino,    Hirozumi Yamaguchi",2005,https://link.springer.com/chapter/10.1007/11562436_3,https://link.springer.com/content/pdf/10.1007%2F11562436_3.pdf
A Map-Based Hoarding Mechanism for Location-Dependent Information,"Uwe Kubach,    Kurt Rothermel",2001,https://link.springer.com/chapter/10.1007/3-540-44498-X_12,No PDF available
Supporting autonomous work and reintegration in collaborative systems,"Michael Berger,    Alexander Schill…",1998,https://link.springer.com/chapter/10.1007/BFb0027106,No PDF available
Keep Your Eyes on the Road and Your Finger on the Trigger – Designing for Mixed Focus of Attention in a Mobile Game for Brief Encounters,"Liselott Brunnberg,    Oskar Juhlin",2006,https://link.springer.com/chapter/10.1007/11748625_11,No PDF available
Updated data dissemination methods for updating old replicas in ad hoc networks,"Hideki Hayashi,    Takahiro Hara,    Shojiro Nishio",2005,https://link.springer.com/article/10.1007/s00779-004-0331-6,https://link.springer.com/content/pdf/10.1007%2Fs00779-004-0331-6.pdf
Approximate Queries with Adaptive Processing,"Barbara Catania,    Giovanna Guerrini",2013,https://link.springer.com/chapter/10.1007/978-3-642-28323-9_10,No PDF available
Communication Channel Reconstruction Technology of Wide-Area Protection Under Extreme Catastrophe,"Zhenxing Li,    Xianggen Yin,    Zhe Zhang…",2012,https://link.springer.com/chapter/10.1007/978-1-4471-2467-2_198,No PDF available
Communities: Concept-Based Querying for Mobile Services,"Chara Skouteli,    Christoforos Panayiotou,    George Samaras…",2005,https://link.springer.com/chapter/10.1007/978-3-540-31794-4_4,https://link.springer.com/content/pdf/10.1007%2F978-3-540-31794-4_4.pdf
A Two-Phase Energy-Aware Scheduling Approach for CPU-Intensive Jobs in Mobile Grids,"Matías Hirsch,    Juan Manuel Rodríguez,    Cristian Mateos…",2017,https://link.springer.com/article/10.1007/s10723-016-9387-6,https://link.springer.com/content/pdf/10.1007%2Fs10723-016-9387-6.pdf
Applications and Services,"Rodolfo I. Meneguette,    Robson E. De Grande…",2018,https://link.springer.com/chapter/10.1007/978-3-319-93332-0_7,https://link.springer.com/content/pdf/10.1007%2F978-3-319-93332-0_7.pdf
Integrating Synchronous and Asynchronous Interactions in Groupware Applications,"Nuno Preguiça,    J. Legatheaux Martins…",2005,https://link.springer.com/chapter/10.1007/11560296_7,https://link.springer.com/content/pdf/10.1007%2F11560296_7.pdf
PicoDBMS: Scaling down database techniques for the smartcard,"Philippe Pucheral,    Luc Bouganim,    Patrick Valduriez,    Christophe Bobineau",2001,https://link.springer.com/article/10.1007/s007780100047,https://link.springer.com/content/pdf/10.1007%2Fs007780100047.pdf
Gesture-Based Interface for Connection and Control of Multi-device in a Tabletop Display Environment,"Hyunglae Lee,    Heeseok Jeong,    Joongho Lee…",2009,https://link.springer.com/chapter/10.1007/978-3-642-02577-8_24,No PDF available
Analysis and Countermeasure on Vulnerability of WPA Key Exchange Mechanism,"You Sung Kang,    KyungHee Oh,    ByungHo Chung…",2004,https://link.springer.com/chapter/10.1007/978-3-540-25978-7_92,No PDF available
"Metering, Intelligent Enough for Smart Grids?",Geert Deconinck,2010,https://link.springer.com/chapter/10.1007/978-90-481-3594-3_8,No PDF available
A Semantic-Based Fully Visual Application for Context-Aware Matchmaking and Request Refinement in Ubiquitous Computing,"Michele Ruta,    Tommaso Di Noia…",2008,https://link.springer.com/chapter/10.1007/978-3-540-69848-7_22,No PDF available
An Effective Job Replication Technique Based on Reliability and Performance in Mobile Grids,"Daeyong Jung,    SungHo Chin,    KwangSik Chung…",2010,https://link.springer.com/chapter/10.1007/978-3-642-13067-0_9,No PDF available
EMUNE: Architecture for Mobile Data Transfer Scheduling with Network Availability Predictions,"Upendra Rathnayake,    Henrik Petander,    Maximilian Ott…",2012,https://link.springer.com/article/10.1007/s11036-011-0332-4,https://link.springer.com/content/pdf/10.1007%2Fs11036-011-0332-4.pdf
Spatial Hoarding: A Hoarding Strategy for Location-Dependent Systems,"Karim Zerioh,    Omar El Beqqali,    Robert Laurini",2005,https://link.springer.com/chapter/10.1007/3-540-26772-7_17,No PDF available
Autonomic Computing to Manage Green Core Networks with Quality of Service,"Remi Sharrock,    Thierry Monteil…",2013,https://link.springer.com/chapter/10.1007/978-3-642-40517-4_20,No PDF available
Timed Use Case Maps,"Jameleddine Hassine,    Juergen Rilling…",2006,https://link.springer.com/chapter/10.1007/11951148_7,No PDF available
Innovating Regional Co-operation between the Local and the National,"Henrik Dons Finsrud,    Jan-Evert Nilsson,    Åke Uhlin",2011,https://link.springer.com/chapter/10.1057/9780230304154_12,No PDF available
Unix for Nomads: Making Unix Support Mobile Computing,"Michael Bender,    Alexander Davidson,    Clark Dong,    Steven Drach…",1996,https://link.springer.com/chapter/10.1007/978-0-585-29603-6_16,No PDF available
Ubiquitous recommender systems,"Christos Mettouris,    George A. Papadopoulos",2014,https://link.springer.com/article/10.1007/s00607-013-0351-z,https://link.springer.com/content/pdf/10.1007%2Fs00607-013-0351-z.pdf
Service Discovery Protocol Interoperability in the Mobile Environment,"Yérom-David Bromberg,    Valérie Issarny",2005,https://link.springer.com/chapter/10.1007/11407386_6,https://link.springer.com/content/pdf/10.1007%2F11407386_6.pdf
Energy-efficient data centers,"Junaid Shuja,    Sajjad A. Madani,    Kashif Bilal,    Khizar Hayat,    Samee U. Khan…",2012,https://link.springer.com/article/10.1007/s00607-012-0211-2,https://link.springer.com/content/pdf/10.1007%2Fs00607-012-0211-2.pdf
Views: Middleware Abstractions for Context-Aware Applications in MANETs,"Kurt Schelfthout,    Tom Holvoet…",2006,https://link.springer.com/chapter/10.1007/11738817_2,No PDF available
An Efficient Handover Mechanism by Adopting Direction Prediction and Adaptive Time-to-Trigger in LTE Networks,"Fu-Min Chang,    Hsiu-Lang Wang,    Szu-Ying Hu…",2013,https://link.springer.com/chapter/10.1007/978-3-642-39640-3_20,No PDF available
8th International conference on management and rehabilitation of chronic respiratory failure: the long summaries – Part 3,"Nicolino Ambrosino,    Richard Casaburi…",2015,https://link.springer.com/article/10.1186/s40248-015-0028-x,https://link.springer.com/content/pdf/10.1186%2Fs40248-015-0028-x.pdf
Performance Analysis of Object Store Systems in a Fog and Edge Computing Infrastructure,"Bastien Confais,    Adrien Lebre…",2017,https://link.springer.com/chapter/10.1007/978-3-662-55696-2_2,https://link.springer.com/content/pdf/10.1007%2F978-3-662-55696-2_2.pdf
"Data Collection, Reliable Real-Time","Vana Kalogeraki,    Amir Soheili",No year available,https://link.springer.com/referenceworkentry/10.1007/978-3-319-23519-6_238-2,No PDF available
Collaborative Network Coding in Opportunistic Mobile Social Network,"Tzu-Chieh Tsai,    Chien-Chun Han,    Shou-Yu Yen",2016,https://link.springer.com/chapter/10.1007/978-3-319-48021-3_13,https://link.springer.com/content/pdf/10.1007%2F978-3-319-48021-3_13.pdf
The Strasbourg Period: Radio-Engineering,Alexander Pechenkin,2014,https://link.springer.com/chapter/10.1007/978-3-319-00572-0_3,No PDF available
Survey of Pervasive Games and Technologies,Kim J. L. Nevelsteen,2015,https://link.springer.com/chapter/10.1007/978-3-319-17632-1_2,https://link.springer.com/content/pdf/10.1007%2F978-3-319-17632-1_2.pdf
Introduction,"Magdi S. Mahmoud,    Fouad M. AL-Sunni",2015,https://link.springer.com/chapter/10.1007/978-3-319-16910-1_1,https://link.springer.com/content/pdf/10.1007%2F978-3-319-16910-1_1.pdf
Supporting parents for in-home capture of problem behaviors of children with developmental disabilities,"N. Nazneen,    Agata Rozga,    Mario Romero…",2012,https://link.springer.com/article/10.1007/s00779-011-0385-1,https://link.springer.com/content/pdf/10.1007%2Fs00779-011-0385-1.pdf
A Mixed Data Dissemination Strategy for Mobile Computing Systems,"Guohong Cao,    Yiqiong Wu,    Bo Li",2001,https://link.springer.com/chapter/10.1007/3-540-47714-4_37,No PDF available
Change of geographic information service model in mobile context,"Ren Fu Ph.D. candidate,    Du Qingyun",2005,https://link.springer.com/article/10.1007/BF02838661,No PDF available
Performance evaluation of various MANET routing protocols for adaptability in VANET environment,Kamlesh Chandra Purohit…,2017,https://link.springer.com/article/10.1007/s13198-016-0507-2,https://link.springer.com/content/pdf/10.1007%2Fs13198-016-0507-2.pdf
Distributed Dynamic Self-adaptation of Data Management in Telemedicine Applications,"Françoise André,    Maria-Teresa Segarra…",2009,https://link.springer.com/chapter/10.1007/978-3-642-02868-7_47,No PDF available
