title,author,date,link,pdf_link
A New Cross-Layer Unstructured P2P File Sharing Protocol over Mobile Ad Hoc Network,"Nadir Shah,    Depie Qian",2010,https://link.springer.com/chapter/10.1007/978-3-642-13577-4_22,No PDF available
Advances in vehicular ad-hoc networks (VANETs): Challenges and road-map for future development,"Elias C. Eze,    Si-Jing Zhang,    En-Jie Liu…",2016,https://link.springer.com/article/10.1007/s11633-015-0913-y,https://link.springer.com/content/pdf/10.1007%2Fs11633-015-0913-y.pdf
A trust aware routing protocol for energy constrained wireless sensor network,"Adnan Ahmed,    Kamalrulnizam Abu Bakar,    Muhammad Ibrahim Channa…",2016,https://link.springer.com/article/10.1007/s11235-015-0068-8,https://link.springer.com/content/pdf/10.1007%2Fs11235-015-0068-8.pdf
F,André Heck,2004,https://link.springer.com/chapter/10.1007/978-0-306-48603-6_6,No PDF available
Robotic Ubiquitous Cognitive Ecology for Smart Homes,"G. Amato,    D. Bacciu,    M. Broxvall,    S. Chessa…",2015,https://link.springer.com/article/10.1007/s10846-015-0178-2,https://link.springer.com/content/pdf/10.1007%2Fs10846-015-0178-2.pdf
Personal Communications and Mobile Computing,Dimitris N. Chorafas,1997,https://link.springer.com/chapter/10.1007/978-1-349-14175-3_5,No PDF available
Policy-Driven Binding to Information Resources in Mobility-Enabled Scenarios,"Paolo Bellavista,    Antonio Corradi,    Rebecca Montanari…",2003,https://link.springer.com/chapter/10.1007/3-540-36389-0_15,No PDF available
Compliance of Wireless Application Protocols,Ousmane Koné,2002,https://link.springer.com/chapter/10.1007/978-0-387-35497-2_9,https://link.springer.com/content/pdf/10.1007%2F978-0-387-35497-2_9.pdf
Integrated Services over ATM/MAN-Based Personal Communication Networks,"Henry C.B. Chan,    Victor C.M. Leung",2000,https://link.springer.com/article/10.1023/A%3A1008955502946,https://link.springer.com/content/pdf/10.1023%2FA%3A1008955502946.pdf
Internet connectivity for mobile ad hoc network: a survey based study,"Radwa Attia,    Rawya Rizk,    Hesham Arafat Ali",2015,https://link.springer.com/article/10.1007/s11276-015-0922-3,https://link.springer.com/content/pdf/10.1007%2Fs11276-015-0922-3.pdf
Smart Grid,"Dawood Al Abri,    Arif S. Malik…",2017,https://link.springer.com/referenceworkentry/10.1007/978-3-319-14409-2_78,https://link.springer.com/content/pdf/10.1007%2F978-3-319-14409-2_78.pdf
A Model ATM Network and APIs for Service Management  on an ATM Network,"Jit Biswas,    R. Radhakrishna Pillai",1997,https://link.springer.com/article/10.1023/A%3A1018791315895,https://link.springer.com/content/pdf/10.1023%2FA%3A1018791315895.pdf
Centaurus: An Infrastructure for Service Management in Ubiquitous Computing Environments,"Lalana Kagal,    Vladimir Korolev,    Sasikanth Avancha,    Anupam Joshi…",2002,https://link.springer.com/article/10.1023/A%3A1020385804671,https://link.springer.com/content/pdf/10.1023%2FA%3A1020385804671.pdf
Smart Grid,"Dawood Al Abri,    Arif Malik,    Mohammed Albadi…",No year available,https://link.springer.com/referenceworkentry/10.1007/978-1-4614-6431-0_78-1,No PDF available
Standardisation advancements in the area of routing for mobile ad-hoc networks,"Tipu Arvind Ramrekha,    Emmanouil Panaousis…",2013,https://link.springer.com/article/10.1007/s11227-011-0705-2,https://link.springer.com/content/pdf/10.1007%2Fs11227-011-0705-2.pdf
On the Monitoring Period for Fault-Tolerant Sensor Networks,"Filipe Araújo,    Luís Rodrigues",2005,https://link.springer.com/chapter/10.1007/11572329_15,https://link.springer.com/content/pdf/10.1007%2F11572329_15.pdf
Container Terminal Operation: Current Trends and Future Challenges,"Kap Hwan Kim,    Hoon Lee",2015,https://link.springer.com/chapter/10.1007/978-3-319-11891-8_2,No PDF available
Device Interfaces,Melvin I. Reynolds,2009,https://link.springer.com/chapter/10.1007/978-0-387-76418-4_7,No PDF available
Maximizing Lifetime of Connected-Dominating-Set in Cognitive Radio Networks,"Zhiyong Lin,    Hai Liu,    Xiaowen Chu,    Yiu-Wing Leung,    Ivan Stojmenovic",2012,https://link.springer.com/chapter/10.1007/978-3-642-30054-7_25,https://link.springer.com/content/pdf/10.1007%2F978-3-642-30054-7_25.pdf
Fault Diagnosis Algorithm for Wireless Sensor-Based on Fault Tolerant Topology,"Weijing Liu,    Yanfang Liu",2018,https://link.springer.com/chapter/10.1007/978-3-319-60744-3_53,https://link.springer.com/content/pdf/10.1007%2F978-3-319-60744-3_53.pdf
The multi-copy diversity for routing in sparse vehicular ad hoc networks,"Joon Yoo,    Sunwoong Choi,    Chong-kwon Kim",2012,https://link.springer.com/article/10.1007/s11235-010-9405-0,https://link.springer.com/content/pdf/10.1007%2Fs11235-010-9405-0.pdf
Network Swapping,"Emanuele Lattanzi,    Andrea Acquaviva…",2005,https://link.springer.com/chapter/10.1007/11419822_7,https://link.springer.com/content/pdf/10.1007%2F11419822_7.pdf
Incremental View Maintenance for Mobile Databases,"Ken C. K. Lee,    Hong Va Leong,    Antonio Si",2000,https://link.springer.com/article/10.1007/PL00011650,https://link.springer.com/content/pdf/10.1007%2FPL00011650.pdf
Modelling user preferences and configuring services in B3G devices,"Konstantinos P. Demestichas,    Artemis A. Koutsorodi…",2008,https://link.springer.com/article/10.1007/s11276-007-0044-7,https://link.springer.com/content/pdf/10.1007%2Fs11276-007-0044-7.pdf
Localized Movement Control for Fault Tolerance of Mobile Robot Networks,"Shantanu Das,    Hai Liu,    Ajith Kamath,    Amiya Nayak…",2007,https://link.springer.com/chapter/10.1007/978-0-387-74899-3_1,https://link.springer.com/content/pdf/10.1007%2F978-0-387-74899-3_1.pdf
Beyond Automation: The Cognitive IoT. Artificial Intelligence Brings Sense to the Internet of Things,"Pijush Kanti Dutta Pramanik,    Saurabh Pal…",2018,https://link.springer.com/chapter/10.1007/978-3-319-70688-7_1,https://link.springer.com/content/pdf/10.1007%2F978-3-319-70688-7_1.pdf
Replic8: Location-Aware Data Replication for High Availability in Ubiquitous Environments,"Evangelos Kotsovinos,    Douglas McIlwraith",2005,https://link.springer.com/chapter/10.1007/11424505_4,https://link.springer.com/content/pdf/10.1007%2F11424505_4.pdf
ANTARCTICA: A Multiagent System for Internet Data Services in a Wireless Computing Framework,"A. Goñi,    A. Illarramendi,    E. Mena…",2002,https://link.springer.com/chapter/10.1007/3-540-36257-6_11,No PDF available
Improving TCP Performance in Mobile Ad hoc Networks,"Rajendra V. Boppana,    Thomas D. Dyer",2004,https://link.springer.com/chapter/10.1007/978-1-4613-0223-0_2,No PDF available
QoS Provision Using Dual RF Modules in Wireless LAN,"Sang-Hee Park,    Hye-Soo Kim,    Chun-Su Park,    Kyunghun Jang…",2004,https://link.springer.com/chapter/10.1007/978-3-540-30473-9_4,No PDF available
Towards More Adaptive Voice Applications,Jörg Ott,2010,https://link.springer.com/chapter/10.1007/978-3-642-16558-0_30,No PDF available
WiGriMMA: A Wireless Grid Monitoring Model Using Agents,"Mahantesh N. Birje,    Sunilkumar S. Manvi",2011,https://link.springer.com/article/10.1007/s10723-011-9181-4,https://link.springer.com/content/pdf/10.1007%2Fs10723-011-9181-4.pdf
Experimental Performance Evaluation of Sensor-Based Networking for Energy Efficiency in Smart Buildings,"Constantinos Marios Angelopoulos,    Sotiris Nikoletseas",2013,https://link.springer.com/chapter/10.1007/978-3-642-41296-7_3,No PDF available
Security Challenges in Smart Grid Implementation,"Sanjay Goel,    Yuan Hong",2015,https://link.springer.com/chapter/10.1007/978-1-4471-6663-4_1,https://link.springer.com/content/pdf/10.1007%2F978-1-4471-6663-4_1.pdf
A stochastic model to study the impact of the transmission frequency of hello messages on the connectivity of ad hoc networks,"Karima Adel-Aissanou,    Djamil Aïssani,    Nathalia Djellab…",2014,https://link.springer.com/article/10.1007/s11235-013-9841-8,https://link.springer.com/content/pdf/10.1007%2Fs11235-013-9841-8.pdf
"Integration of renewable energy sources, energy storage systems, and electrical vehicles with smart power distribution networks","A. R. Di Fazio,    T. Erseghe,    E. Ghiani…",2013,https://link.springer.com/article/10.1007/s12652-013-0182-y,https://link.springer.com/content/pdf/10.1007%2Fs12652-013-0182-y.pdf
Research on Design of LTE-Based High-Speed Railway Networks in Korea: Current and Emerging Issues,"Jin-Kyu Choi,    Hanbyeog Cho,    Hyun-Seo Oh…",2016,https://link.springer.com/chapter/10.1007/978-3-662-47895-0_19,https://link.springer.com/content/pdf/10.1007%2F978-3-662-47895-0_19.pdf
A stable virtual backbone for wireless MANETS,Javad Akbari Torkestani,2014,https://link.springer.com/article/10.1007/s11235-013-9760-8,https://link.springer.com/content/pdf/10.1007%2Fs11235-013-9760-8.pdf
Wireless Monitoring System for Hybrid Power Generation System,"Jin-Seok Oh,    Soo-Young Bae,    Ji-Young Lee…",2010,https://link.springer.com/chapter/10.1007/978-3-642-13624-5_10,No PDF available
A Comparative Analysis of Virtual Versus Physical Process-Migration Strategies for Distributed Modeling and Simulation of Mobile Computing Networks,"K. Han,    S. Ghosh",1996,https://link.springer.com/chapter/10.1007/978-0-387-34947-3_6,https://link.springer.com/content/pdf/10.1007%2F978-0-387-34947-3_6.pdf
Technological and Legal Aspects of CIS,Peter Stavroulakis,2010,https://link.springer.com/chapter/10.1007/978-3-642-04117-4_38,No PDF available
Middleware Services for Pervasive Grids,"Mario Ciampi,    Antonio Coronato…",2006,https://link.springer.com/chapter/10.1007/11946441_47,No PDF available
Mobile-to-Grid Middleware: An Approach for Breaching the Divide Between Mobile and Grid Environments,"Umar Kalim,    Hassan Jameel,    Ali Sajjad,    Sungyoung Lee",2005,https://link.springer.com/chapter/10.1007/978-3-540-31956-6_1,https://link.springer.com/content/pdf/10.1007%2F978-3-540-31956-6_1.pdf
Opportunistic media access control and routing for delay-tolerant mobile ad hoc networks,Liang Dong,2012,https://link.springer.com/article/10.1007/s11276-012-0444-1,https://link.springer.com/content/pdf/10.1007%2Fs11276-012-0444-1.pdf
Saving Energy on WiFi with Required IPsec,"Youngsang Shin,    Steven Myers…",2010,https://link.springer.com/chapter/10.1007/978-3-642-16161-2_9,No PDF available
Enabling Personalized Composition and Adaptive Provisioning of Web Services,"Quan Z. Sheng,    Boualem Benatallah…",2004,https://link.springer.com/chapter/10.1007/978-3-540-25975-6_24,https://link.springer.com/content/pdf/10.1007%2F978-3-540-25975-6_24.pdf
Computer Supported Cooperative Work (CSCW),No author available,2002,https://link.springer.com/chapter/10.1007/0-306-46972-3_3,No PDF available
Framework of an Application-Aware Adaptation Scheme for Disconnected Operations,"Umar Kalim,    Hassan Jameel,    Ali Sajjad,    Sang Man Han…",2009,https://link.springer.com/chapter/10.1007/978-3-642-00972-3_21,https://link.springer.com/content/pdf/10.1007%2F978-3-642-00972-3_21.pdf
Localization of Integrity Constraints in Mobile Databases and Specification in PRO-MOTION,"Subhasish Mazumdar,    Panos K. Chrysanthis",2004,https://link.springer.com/article/10.1023/B%3AMONE.0000034702.89538.a7,https://link.springer.com/content/pdf/10.1023%2FB%3AMONE.0000034702.89538.a7.pdf
Relay Ability Estimation and Topology Control Using Multidimensional Context Parameters for Mobile P2P Multicast,"Hiroyuki Kubo,    Ryoichi Shinkuma…",2010,https://link.springer.com/article/10.1155/2011/389058,https://link.springer.com/content/pdf/10.1155%2F2011%2F389058.pdf
Location and Tracking Services for a Meta-UbiComp Environment,"Antonio Coronato,    Giuseppe De Pietro",2005,https://link.springer.com/chapter/10.1007/11518358_14,https://link.springer.com/content/pdf/10.1007%2F11518358_14.pdf
Process Monitoring and Control of Gas Pipeline Networks,"G. Lappus,    G. Schmidt",1990,https://link.springer.com/chapter/10.1007/978-94-009-0609-9_12,No PDF available
A Mobile Agents Based Architecture for the Distributed Processing of Continuous Location Queries in a Wireless Environment: Performance Evaluation,"Sergio Ilarri,    Eduardo Mena…",2005,https://link.springer.com/chapter/10.1007/978-3-540-30192-9_35,https://link.springer.com/content/pdf/10.1007%2F978-3-540-30192-9_35.pdf
Collaborative joins in a pervasive computing environment,"Filip Perich,    Anupam Joshi,    Yelena Yesha,    Tim Finin",2005,https://link.springer.com/article/10.1007/s00778-004-0127-3,https://link.springer.com/content/pdf/10.1007%2Fs00778-004-0127-3.pdf
Caching and Data Replication in Mobile Environment,R. K. Ghosh,2017,https://link.springer.com/chapter/10.1007/978-981-10-3941-6_14,https://link.springer.com/content/pdf/10.1007%2F978-981-10-3941-6_14.pdf
"Self-Configuring, Self-Organizing, and Self-Healing Schemes in Mobile Ad Hoc Networks",Doina Bein,2009,https://link.springer.com/chapter/10.1007/978-1-84800-328-6_2,No PDF available
Protecting the End User Device in 4G Heterogeneous Networks,"Hani Alquhayz,    Ali Al-Bayatti,    Amelia Platt",2013,https://link.springer.com/chapter/10.1007/978-94-007-6190-2_26,No PDF available
An Analytical Study of Broadcast Based Cache Invalidation in Mobile Computing Networks,"Kwong Yuen Lai,    Zahir Tari,    Peter Bertok",2003,https://link.springer.com/chapter/10.1007/978-3-540-39964-3_34,No PDF available
A Study of Reducing Resource Waste for Mobile Grid with Software Defined Network,"Jun Kwon Jung,    Ji Hoon Hong…",2014,https://link.springer.com/chapter/10.1007/978-3-319-09147-1_55,No PDF available
Building a Laboratory Surveillance System via a Wireless Sensor Network,"Chi-Un Lei,    J. K. Seon,    Zhun Shen,    Ka LokMan,    Danny Hughes…",2013,https://link.springer.com/chapter/10.1007/978-3-642-38027-3_77,No PDF available
Animation within Mobile Multimedia On-line Services,"C. Belz,    M. Bergold,    H. Häckelmann,    R. Strack",1996,https://link.springer.com/chapter/10.1007/978-0-387-34980-0_11,https://link.springer.com/content/pdf/10.1007%2F978-0-387-34980-0_11.pdf
Concepts for Wide Area Workflow Management (WAWM),"Gerold Riempp Dipl. Wirtschaftsingenieur, PhD",1998,https://link.springer.com/chapter/10.1007/978-1-4471-1578-6_5,No PDF available
A Service Oriented Reflective Wireless Middleware,"Bora Yurday,    Halûk Gümüşkaya",2006,https://link.springer.com/chapter/10.1007/11948148_53,No PDF available
Opportunistic Channels: Mobility-Aware Event Delivery,"Yuan Chen,    Karsten Schwan,    Dong Zhou",2003,https://link.springer.com/chapter/10.1007/3-540-44892-6_10,https://link.springer.com/content/pdf/10.1007%2F3-540-44892-6_10.pdf
A Lightweight Management System for a Military Ad Hoc Network,"Jorma Jormakka,    Henryka Jormakka,    Janne Väre",2008,https://link.springer.com/chapter/10.1007/978-3-540-89524-4_53,No PDF available
Protocols in the OSI Lower Layers,No author available,2008,https://link.springer.com/chapter/10.1007/978-3-540-77541-6_9,No PDF available
D,André Heck,2001,https://link.springer.com/chapter/10.1007/978-94-011-4351-6_4,No PDF available
A Novel Mobility-Aware Data Transfer Service (MADTS) Based on DDS Standards,"Basem Al-Madani,    Ayaz ul Hassan Khan…",2014,https://link.springer.com/article/10.1007/s13369-014-0944-7,https://link.springer.com/content/pdf/10.1007%2Fs13369-014-0944-7.pdf
The mobile Internet,No author available,2002,https://link.springer.com/chapter/10.1007/0-306-47795-5_15,No PDF available
Volume II Entries M — Z,George L. Maddox PhD,2001,https://link.springer.com/chapter/10.1007/978-3-662-38338-4_2,No PDF available
Bandwidth-Conserving Cache Validation Schemes in a Mobile Database System,"Hyunchul Kang,    Sangmin Lim",2001,https://link.springer.com/chapter/10.1007/3-540-44498-X_10,No PDF available
Fuzzy searching and routing in unstructured mobile peer-to-peer networks,"Babar Shah,    Farkhund Iqbal,    Omar Alfandi,    Yoonsoo Kim,    SeokYoon Kang…",2017,https://link.springer.com/article/10.1007/s10586-017-0857-9,https://link.springer.com/content/pdf/10.1007%2Fs10586-017-0857-9.pdf
On the Use of Link Quality Estimation for Improving Higher Layer Protocols and Mechanisms,"Nouha Baccour,    Daniele Puccinelli…",2013,https://link.springer.com/chapter/10.1007/978-3-319-00774-8_5,No PDF available
IP Flow Mobility in PMIPv6 Based Networks: Solution Design and Experimental Evaluation,"Telemaco Melia,    Carlos J. Bernardos…",2011,https://link.springer.com/article/10.1007/s11277-011-0423-3,https://link.springer.com/content/pdf/10.1007%2Fs11277-011-0423-3.pdf
Cluster based emergency message broadcasting technique for vehicular ad hoc network,"B. Ramakrishnan,    R. Bhagavath Nishanth,    M. Milton Joe,    M. Selvi",2017,https://link.springer.com/article/10.1007/s11276-015-1134-6,https://link.springer.com/content/pdf/10.1007%2Fs11276-015-1134-6.pdf
MARE: Resource Discovery and Configuration in Ad Hoc Networks,"Matt Storey,    Gordon Blair,    Adrian Friday",2002,https://link.springer.com/article/10.1023/A%3A1016543700801,https://link.springer.com/content/pdf/10.1023%2FA%3A1016543700801.pdf
Bandwidth-satisfied multicast trees in large-scale ad-hoc networks,Chia-Cheng Hu,2010,https://link.springer.com/article/10.1007/s11276-009-0171-4,https://link.springer.com/content/pdf/10.1007%2Fs11276-009-0171-4.pdf
Integrating mobile agents into the mobile middleware,"Ernö Kovacs,    Klaus Röhrle,    Matthias Reich",1998,https://link.springer.com/article/10.1007/BF01324936,https://link.springer.com/content/pdf/10.1007%2FBF01324936.pdf
Abstract,No author available,2006,https://link.springer.com/article/10.1007/s10336-006-0093-1,https://link.springer.com/content/pdf/10.1007%2Fs10336-006-0093-1.pdf
Pervasive Systems in Health Care,"Achilles Kameas,    Ioannis Calemis",2010,https://link.springer.com/chapter/10.1007/978-0-387-93808-0_12,No PDF available
Mesh Design: Lower Layer Issues,"Parth H. Pathak,    Rudra Dutta",2013,https://link.springer.com/chapter/10.1007/978-1-4614-4627-9_3,No PDF available
"DMAP-FR: Dynamic Mobility Anchor Points for Mobility, Service and Failure Recovery Management in Mobile IPv6 Systems","Weiping He,    Ing-Ray Chen,    Ding-Chau Wang",2012,https://link.springer.com/article/10.1007/s11277-010-0065-x,https://link.springer.com/content/pdf/10.1007%2Fs11277-010-0065-x.pdf
Toward a higher yield: a wireless sensor network-based temperature monitoring and fan-circulating system for precision cultivation in plant factories,"Joe-Air Jiang,    Min-Sheng Liao,    Tzu-Shiang Lin,    Chen-Kang Huang…",2018,https://link.springer.com/article/10.1007/s11119-018-9565-6,https://link.springer.com/content/pdf/10.1007%2Fs11119-018-9565-6.pdf
Freeze TCPv2: An Enhancement of Freeze TCP for Efficient Handoff in Heterogeneous Networks,"Minu Park,    Jaehyung Lee,    Jahwan Koo…",2009,https://link.springer.com/chapter/10.1007/978-3-642-02559-4_49,No PDF available
A Caching Model for Real-Time Databases in Mobile Ad-Hoc Networks,"Yanhong Li,    Le Gruenwald",2005,https://link.springer.com/chapter/10.1007/11546924_19,https://link.springer.com/content/pdf/10.1007%2F11546924_19.pdf
Design and Performance Analysis of a Message Scheduling Scheme for WLAN-Based Cluster Computing,"Junghoon Lee,    Mikyung Kang,    Euiyoung Kang…",2006,https://link.springer.com/chapter/10.1007/11751632_61,No PDF available
Multimedia service utilizing hierarchical fog computing for vehicular networks,"Jeevan Kharel,    Soo Young Shin",2018,https://link.springer.com/article/10.1007/s11042-018-6530-3,https://link.springer.com/content/pdf/10.1007%2Fs11042-018-6530-3.pdf
Publish/Subscribe Systems on Node and Link Error Prone Mobile Environments,"Sangyoon Oh,    Sangmi Lee Pallickara,    Sunghoon Ko…",2005,https://link.springer.com/chapter/10.1007/11428848_75,https://link.springer.com/content/pdf/10.1007%2F11428848_75.pdf
Adaptive caching and refreshing in mobile databases,"Antonio Si,    Hong Va Leong",1997,https://link.springer.com/article/10.1007/BF01299650,https://link.springer.com/content/pdf/10.1007%2FBF01299650.pdf
"
         A lightweight framework for mobile web services
        ","Yeon-Seok Kim,    Kyong-Ho Lee",2009,https://link.springer.com/article/10.1007/s00450-009-0091-7,https://link.springer.com/content/pdf/10.1007%2Fs00450-009-0091-7.pdf
Distributed Event Localization and Tracking with Wireless Sensors,"Markus Wälchli,    Piotr Skoczylas,    Michael Meer…",2007,https://link.springer.com/chapter/10.1007/978-3-540-72697-5_21,No PDF available
Seamless Handover for Multi-user Sessions with QoS and Connectivity Support,"Eduardo Cerqueira,    Luis Veloso,    Paulo Mendes…",2007,https://link.springer.com/chapter/10.1007/978-3-540-72697-5_7,No PDF available
Wireless Sensors (Languages/Programming/Developments Tools/Examples),"Jérémie Albert,    Lionel Barrère…",2014,https://link.springer.com/chapter/10.1007/978-1-4614-7915-4_24,No PDF available
Genesis and Advanced Traveler Information Systems,"Shashi Shekhar,    Duen-Ren Liu",1996,https://link.springer.com/chapter/10.1007/978-0-585-29603-6_26,No PDF available
Secure In-Vehicle Communication,"Marko Wolf,    André Weimerskirch,    Christof Paar",2006,https://link.springer.com/chapter/10.1007/3-540-28428-1_6,No PDF available
ICBM-Based Smart Farm Environment Management System,"Meonghun Lee,    Haengkon Kim,    Hyun Yoe",2019,https://link.springer.com/chapter/10.1007/978-3-319-98367-7_4,No PDF available
Protocols for Updating Highly Accurate Location Information,"Alexander Leonhardi,    Kurt Rothermel",2002,https://link.springer.com/chapter/10.1007/0-306-47573-1_5,No PDF available
Hand-around on Seamless Services and Mobility in Home Networking,"Pei-Yuan Qiu,    Min-Shu Hung,    Jen-yi Pan,    Kuo-Pao Fan,    Jui-Wen Chen",2008,https://link.springer.com/chapter/10.1007/978-0-387-77216-5_21,https://link.springer.com/content/pdf/10.1007%2F978-0-387-77216-5_21.pdf
Cross-layer based congestion detection and routing protocol using fuzzy logic for MANET,"M. Anuradha,    G. S. Anandha Mala",2017,https://link.springer.com/article/10.1007/s11276-016-1211-5,https://link.springer.com/content/pdf/10.1007%2Fs11276-016-1211-5.pdf
An Agent Based Prototype for Optimizing Power Plant Operation,"Christina Athanasopoulou,    Vasilis Chatziathanasiou",2010,https://link.springer.com/chapter/10.2991/978-94-91216-31-2_9,No PDF available
Incentive Mechanisms for Cooperation in Peer-to-Peer Networks,"Daniel A. G. Manzato,    Nelson L. S. da Fonseca",2010,https://link.springer.com/chapter/10.1007/978-0-387-09751-0_22,No PDF available
Demographic and Geographic Overview of India,Chris Devonshire-Ellis,2012,https://link.springer.com/chapter/10.1007/978-3-642-27618-7_6,No PDF available
The On The Move Project: Description of Mobile Middleware and Experimental Results,"T. Wierlemann,    T. Kassing,    Julie Harmer",2002,https://link.springer.com/chapter/10.1007/0-306-47041-1_2,No PDF available
Cooperative load-balancing strategy based on N-hops routing algorithm of ad hoc network in heterogeneous overlapping networks,"Xuebing Pei,    Guangxi Zhu,    Qingping Wang…",2008,https://link.springer.com/article/10.1007/s12243-008-0062-1,https://link.springer.com/content/pdf/10.1007%2Fs12243-008-0062-1.pdf
Mobile Distributed Real-time Database Systems,"Kam-Yiu Lam,    Tei-Wei Kuo",2002,https://link.springer.com/chapter/10.1007/0-306-46988-X_18,No PDF available
Assigning Hierarchy to Collaborative Mobile Charging in Sensor Networks,"Adelina Madhja,    Sotiris Nikoletseas…",2016,https://link.springer.com/chapter/10.1007/978-3-319-46810-5_20,https://link.springer.com/content/pdf/10.1007%2F978-3-319-46810-5_20.pdf
"Mobile Query Processing-Taxonomy, Issues and Challenges","Diya Thomas,    Sabu M. Thampi",2011,https://link.springer.com/chapter/10.1007/978-3-642-22709-7_7,No PDF available
Channel Assignment and Multiple Access in Trunking Radio Systems [1],"Peter Stavroulakis,    Kostas Ioannou…",2007,https://link.springer.com/chapter/10.1007/3-540-71192-9_4,No PDF available
Publish/Subscribe in a Mobile Environment,"Yongqiang Huang,    Hector Garcia-Molina",2004,https://link.springer.com/article/10.1023/B%3AWINE.0000044025.64654.65,https://link.springer.com/content/pdf/10.1023%2FB%3AWINE.0000044025.64654.65.pdf
Cross-Layer Optimization,No author available,2006,https://link.springer.com/chapter/10.1007/978-1-4020-5066-4_4,No PDF available
Data Sampling Control and Compression in Sensor Networks,"Jinbao Li,    Jianzhong Li",2005,https://link.springer.com/chapter/10.1007/11599463_5,https://link.springer.com/content/pdf/10.1007%2F11599463_5.pdf
Ad Hoc Networks: Optimization Problems and Solution Methods,"Carlos A. S. Oliveira,    Panos M. Pardalos",2006,https://link.springer.com/chapter/10.1007/0-387-29026-5_6,No PDF available
Adaptive Backbone Based Cooperative Caching in Mobile Ad hoc Networks,"Preetha Theresa Joy,    K. Poulose Jacob",2014,https://link.springer.com/article/10.1007/s10776-014-0252-x,https://link.springer.com/content/pdf/10.1007%2Fs10776-014-0252-x.pdf
An approach for an adaptive visualization in a mobile environment,"Luc Neumann,    Alberto B. Raposo",1997,https://link.springer.com/chapter/10.1007/BFb0000359,No PDF available
Multi-Robot Exploration in Wireless Environments,"Anshika Pal,    Ritu Tiwari,    Anupam Shukla",2012,https://link.springer.com/article/10.1007/s12559-012-9142-7,https://link.springer.com/content/pdf/10.1007%2Fs12559-012-9142-7.pdf
Timestamps to Detect R-W Conflicts in Mobile Computing,Sanjay Kumar Madria,1999,https://link.springer.com/chapter/10.1007/978-3-540-49121-7_21,No PDF available
Efficient Distributed Skyline Queries for Mobile Applications,"Ying-Yuan Xiao,    Yue-Guo Chen",2010,https://link.springer.com/article/10.1007/s11390-010-9342-0,https://link.springer.com/content/pdf/10.1007%2Fs11390-010-9342-0.pdf
