title,author,date,link,pdf_link
A Ubiquitous Control Architecture for Low Power Systems,"James “Wez” Weatherall,    Duncan Grisby",2002,https://link.springer.com/chapter/10.1007/3-540-45997-9_6,No PDF available
An Efficient Election Protocol in a Mobile Computing Environment,Sung-Hoon Park,2003,https://link.springer.com/chapter/10.1007/3-540-44860-8_40,https://link.springer.com/content/pdf/10.1007%2F3-540-44860-8_40.pdf
Cognitive Radio Networks,D. Carrillo,2017,https://link.springer.com/chapter/10.1007/978-3-319-53753-5_8,https://link.springer.com/content/pdf/10.1007%2F978-3-319-53753-5_8.pdf
A Mobile Agent Framework for Digital Nomads,André P. Meyer,2003,https://link.springer.com/chapter/10.1007/978-1-4419-9200-0_7,No PDF available
Effect of Storage Size on IoT Device Selection in Opportunistic Networks: A Comparison Study of Two Fuzzy-Based Systems,"Miralda Cuka,    Donald Elmazi,    Tetsuya Oda…",2018,https://link.springer.com/chapter/10.1007/978-3-319-69811-3_9,https://link.springer.com/content/pdf/10.1007%2F978-3-319-69811-3_9.pdf
A data dissemination mechanism for motorway environment in VANETs,"Yang Yang,    Qian Liu,    Zhipeng Gao…",2015,https://link.springer.com/article/10.1186/s13638-015-0310-9,https://link.springer.com/content/pdf/10.1186%2Fs13638-015-0310-9.pdf
An Energy Efficient Message Scheduling Algorithm Considering Node Failure in IoT Environment,"Saima Abdullah,    Kun Yang",2014,https://link.springer.com/article/10.1007/s11277-014-1960-3,https://link.springer.com/content/pdf/10.1007%2Fs11277-014-1960-3.pdf
Ensuring Serializability for Mobile Data Mining on Multimedia Objects,"Shin Parker,    Zhengxin Chen,    Eugene Sheng",2005,https://link.springer.com/chapter/10.1007/978-3-540-30537-8_10,https://link.springer.com/content/pdf/10.1007%2F978-3-540-30537-8_10.pdf
"An IT Perspective on Standards, Service Architectures and Platforms",John O’Connell,2013,https://link.springer.com/chapter/10.1007/978-3-642-41569-2_7,No PDF available
SMS-Based Automatic Billing System of Household Power Consumption Based on Active Experts Messaging,"Mark Dominic Cabioc,    Bobby D. Gerardo,    Yung-Cheol Byun",2011,https://link.springer.com/chapter/10.1007/978-3-642-27201-1_26,No PDF available
A Norm-Governed Systems Perspective of Ad Hoc Networks,"Alexander Artikis,    Lloyd Kamara,    Jeremy Pitt",2007,https://link.springer.com/chapter/10.1007/978-3-540-75524-1_8,No PDF available
"
ubiREST: A RESTful Service-Oriented Middleware for Ubiquitous Networking","Mauro Caporuscio,    Marco Funaro,    Carlo Ghezzi,    Valérie Issarny",2014,https://link.springer.com/chapter/10.1007/978-1-4614-7535-4_20,No PDF available
Collaborative Solutions in the Single European Electronic Market (SEEM),Isidro Laso Ballesteros,2004,https://link.springer.com/chapter/10.1007/0-306-48696-2_3,No PDF available
Data Management,"C. Bolchini,    F. A. Schreiber,    L. Tanca",2006,https://link.springer.com/chapter/10.1007/3-540-31008-8_6,No PDF available
Fault-tolerant data management in the gaston peer-to-peer file system,"Dipl.-Ing. Vladimír Dynda,    Dipl.-Ing. Pavel Rydlo",2003,https://link.springer.com/article/10.1007/BF03254945,https://link.springer.com/content/pdf/10.1007%2FBF03254945.pdf
Support for real-time decision making in mobile financial applications,"Frada Burstein,    Julie Cowie…",2008,https://link.springer.com/article/10.1007/s10257-008-0090-4,https://link.springer.com/content/pdf/10.1007%2Fs10257-008-0090-4.pdf
Editorial for Special Issue on Pervasive Computing,No author available,2002,https://link.springer.com/article/10.1023/A%3A1017495926517,https://link.springer.com/content/pdf/10.1023%2FA%3A1017495926517.pdf
Cyber Vulnerability in Power Systems Operation and Control,"Ettore Bompard,    Paolo Cuccia,    Marcelo Masera…",2012,https://link.springer.com/chapter/10.1007/978-3-642-28920-0_10,No PDF available
Resource Discovery Using Spatio-temporal Information in Mobile Ad-Hoc Networks,"Ouri Wolfson,    Bo Xu,    Huabei Yin…",2005,https://link.springer.com/chapter/10.1007/11599289_12,https://link.springer.com/content/pdf/10.1007%2F11599289_12.pdf
Discourses on the Mesh Network,"Deji Chen,    Mark Nixon,    Aloysius Mok",2010,https://link.springer.com/chapter/10.1007/978-1-4419-6047-4_9,No PDF available
Transmission of 3D Video Content,"Emil Dumic,    Anamaria Bjelopera…",2019,https://link.springer.com/chapter/10.1007/978-3-319-77842-6_8,https://link.springer.com/content/pdf/10.1007%2F978-3-319-77842-6_8.pdf
EAU: Efficient Address Updating for Seamless Handover in Multi-homed Mobile Environments,"Yuansong Qiao,    Shuaijun Zhang,    Adrian Matthews,    Gregory Hayes…",2010,https://link.springer.com/chapter/10.1007/978-3-642-12963-6_18,https://link.springer.com/content/pdf/10.1007%2F978-3-642-12963-6_18.pdf
LIDAR: a protocol for stable and energy-efficient clustering of ad-hoc multihop networks,"Damianos Gavalas,    Grammati Pantziou…",2007,https://link.springer.com/article/10.1007/s11235-007-9053-1,https://link.springer.com/content/pdf/10.1007%2Fs11235-007-9053-1.pdf
Industrial Internet of Things Solution for Real-Time Monitoring of the Additive Manufacturing Process,"Mahmoud Salama,    Ahmed Elkaseer…",2019,https://link.springer.com/chapter/10.1007/978-3-319-99981-4_33,No PDF available
Chapar: A Cross-Layer Overlay Event System for MANETs,"Amir R. Khakpour,    Isabelle Demeure",2009,https://link.springer.com/chapter/10.1007/978-3-642-01802-2_24,No PDF available
NarrowCast: A New Link-Layer Primitive for Gossip-Based Sensornet Protocols,"Tomasz Pazurkiewicz,    Michal Gregorczyk,    Konrad Iwanicki",2014,https://link.springer.com/chapter/10.1007/978-3-319-04651-8_1,No PDF available
Dynamic service deployment in a distributed heterogeneous cluster based router (DHCR),"Wajdi Louati,    Ines Houidi,    Manel Kharrat,    Djamal Zeghlache…",2008,https://link.springer.com/article/10.1007/s10586-008-0056-9,https://link.springer.com/content/pdf/10.1007%2Fs10586-008-0056-9.pdf
A novel queue management policy for delay-tolerant networks,Saeid Iranmanesh,2016,https://link.springer.com/article/10.1186/s13638-016-0576-6,https://link.springer.com/content/pdf/10.1186%2Fs13638-016-0576-6.pdf
A Framework to Evaluate 5G Networks for Smart and Fail-Safe Communications in ERTMS/ETCS,"Roberto Canonico,    Stefano Marrone…",2017,https://link.springer.com/chapter/10.1007/978-3-319-68499-4_3,https://link.springer.com/content/pdf/10.1007%2F978-3-319-68499-4_3.pdf
Dual paths node-disjoint routing for data salvation in mobile ad hoc,"Fuu-Cheng Jiang,    Chu-Hsing Lin,    Der-Chen Huang…",2012,https://link.springer.com/article/10.1007/s11227-010-0437-8,https://link.springer.com/content/pdf/10.1007%2Fs11227-010-0437-8.pdf
Handover procedure and decision strategy in LTE-based femtocell network,"Ardian Ulvan,    Robert Bestak,    Melvi Ulvan",2013,https://link.springer.com/article/10.1007/s11235-011-9599-9,https://link.springer.com/content/pdf/10.1007%2Fs11235-011-9599-9.pdf
Multipath routing in mobile ad hoc network with probabilistic splitting of traffic,"Indrani Das,    Daya K. Lobiyal,    C. P. Katti",2016,https://link.springer.com/article/10.1007/s11276-015-1093-y,https://link.springer.com/content/pdf/10.1007%2Fs11276-015-1093-y.pdf
Mobile Database Cache Replacement Policies: LRU and PPRRP,"Hariram Chavan,    Suneeta Sane",2011,https://link.springer.com/chapter/10.1007/978-3-642-17857-3_51,No PDF available
Di-GAFR: Directed Greedy Adaptive Face-Based Routing,"Tao Yang,    Ye Huang,    Jianxin Chen,    Geng Yang…",2008,https://link.springer.com/chapter/10.1007/978-3-540-69295-9_44,No PDF available
Query-Based Model Checking of Ad Hoc Network Protocols,"Anu Singh,    C. R. Ramakrishnan,    Scott A. Smolka",2009,https://link.springer.com/chapter/10.1007/978-3-642-04081-8_40,No PDF available
Transmission Range Effects on AODV Multicast Communication,"Elizabeth M. Belding-Royer,    Charles E. Perkins",2002,https://link.springer.com/article/10.1023/A%3A1020708701096,https://link.springer.com/content/pdf/10.1023%2FA%3A1020708701096.pdf
"
GateScript: A Scripting Language for Generic Active Gateways","Hoa-Binh Nguyen,    Andrzej Duda",2007,https://link.springer.com/chapter/10.1007/978-3-540-71500-9_1,https://link.springer.com/content/pdf/10.1007%2F978-3-540-71500-9_1.pdf
Socially-Aware Multimedia Dissemination in Personal Mobile Networks,"Lucas Guardalben,    Tomé Gomes,    Paulo Salvador…",2017,https://link.springer.com/article/10.1007/s11277-017-4609-1,https://link.springer.com/content/pdf/10.1007%2Fs11277-017-4609-1.pdf
When Will You Be at the Office? Predicting Future Locations and Times,"Ingrid Burbey,    Thomas L. Martin",2012,https://link.springer.com/chapter/10.1007/978-3-642-29336-8_9,No PDF available
Security Issues in M—Commerce: A Usage—Based Taxonomy,"Suresh Chari,    Parviz Kermani,    Sean Smith,    Leandros Tassiulas",2001,https://link.springer.com/chapter/10.1007/3-540-45370-9_16,No PDF available
Movement-Based Checkpointing and Message Logging for Recovery in MANETs,"Parmeet Kaur Jaggi,    Awadhesh Kumar Singh",2015,https://link.springer.com/article/10.1007/s11277-015-2498-8,https://link.springer.com/content/pdf/10.1007%2Fs11277-015-2498-8.pdf
Service-Oriented Smart Clients,No author available,2005,https://link.springer.com/chapter/10.1007/978-1-4302-0058-1_10,No PDF available
Performance of Voice Traffic over Mobile Ad Hoc Network,"Jisoo Kim,    Daein Choi,    Jungjin Park…",2004,https://link.springer.com/chapter/10.1007/978-3-540-25978-7_25,No PDF available
Web Service Computing: Overview and Directions,"Boualem Benatallah,    Olivier Perrin…",2006,https://link.springer.com/chapter/10.1007/0-387-27705-6_17,No PDF available
Pervasive Games,"Leif Oppermann,    Michaela Slussareff",2016,https://link.springer.com/chapter/10.1007/978-3-319-46152-6_18,https://link.springer.com/content/pdf/10.1007%2F978-3-319-46152-6_18.pdf
BIIR: A Beacon Information Independent VANET Routing Algorithm with Low Broadcast Overhead,"Neeraj Kumar,    Mayank Dave",2016,https://link.springer.com/article/10.1007/s11277-015-2620-y,https://link.springer.com/content/pdf/10.1007%2Fs11277-015-2620-y.pdf
Limbo: A tuple space based platform for adaptive mobile applications,"N. Davies,    S. P. Wade,    A. Friday…",1997,https://link.springer.com/chapter/10.1007/978-0-387-35188-9_22,No PDF available
Fast Asynchronous Streaming Handoff,"Jinsong Lin,    Glenn Glazer,    Richard Guy…",2002,https://link.springer.com/chapter/10.1007/3-540-36166-9_24,No PDF available
Preventing Cyber-Attacks,Luis Ayala,2016,https://link.springer.com/chapter/10.1007/978-1-4842-2155-6_7,https://link.springer.com/content/pdf/10.1007%2F978-1-4842-2155-6_7.pdf
Robust and Cost-Efficient Communication Based on SNMP in Mobile Networks,"Sang-Hoon Ryu,    Doo-Kwon Baik",2007,https://link.springer.com/chapter/10.1007/978-3-540-77600-0_17,No PDF available
Achieving Coordination through Dynamic Construction of Open Workflows,"Louis Thomas,    Justin Wilson,    Gruia-Catalin Roman,    Christopher Gill",2009,https://link.springer.com/chapter/10.1007/978-3-642-10445-9_14,https://link.springer.com/content/pdf/10.1007%2F978-3-642-10445-9_14.pdf
Toward Advanced Mobile Cloud Computing for the Internet of Things: Current Issues and Future Direction,"Taeshik Shon,    Jaeik Cho,    Kyusunk Han,    Hyohyun Choi",2014,https://link.springer.com/article/10.1007/s11036-014-0509-8,https://link.springer.com/content/pdf/10.1007%2Fs11036-014-0509-8.pdf
A World of Ambient Intelligence,Luiz Costa,2016,https://link.springer.com/chapter/10.1007/978-3-319-39198-4_2,No PDF available
FPGA based distributed self healing architecture for reusable systems,"Ali Akoglu,    Adarsha Sreeramareddy,    Jeff G. Josiah",2009,https://link.springer.com/article/10.1007/s10586-009-0082-2,https://link.springer.com/content/pdf/10.1007%2Fs10586-009-0082-2.pdf
Levering Mobile Cloud Computing for Mobile Big Data Analytics,"Yongxin Liu,    Houbing Song",2018,https://link.springer.com/chapter/10.1007/978-3-319-67925-9_2,https://link.springer.com/content/pdf/10.1007%2F978-3-319-67925-9_2.pdf
RAMSES: A Mobile Computing System for Field Archaeology,"Massimo Ancona,    Gabriella Dodero,    Vittoria Gianuzzi",1999,https://link.springer.com/chapter/10.1007/3-540-48157-5_21,No PDF available
Fault tolerance and QoS scheduling using CAN in mobile social cloud computing,"SookKyong Choi,    KwangSik Chung,    Heonchang Yu",2014,https://link.springer.com/article/10.1007/s10586-013-0286-3,https://link.springer.com/content/pdf/10.1007%2Fs10586-013-0286-3.pdf
"Editorial: Peer-to-Peer networking and applications, Volume 3, Issue 4","Xuemin (Sherman) Shen,    Heather Yu",2010,https://link.springer.com/article/10.1007/s12083-010-0091-1,https://link.springer.com/content/pdf/10.1007%2Fs12083-010-0091-1.pdf
Distributed Energy Efficient Data Gathering without Aggregation via Spanning Tree Optimization,"Lenka Carr-Motyčková,    David Dryml",2013,https://link.springer.com/chapter/10.1007/978-3-642-39247-4_8,No PDF available
Surveillance Data Secure Transmissions,Wei Qi Yan,2017,https://link.springer.com/chapter/10.1007/978-3-319-60228-8_3,https://link.springer.com/content/pdf/10.1007%2F978-3-319-60228-8_3.pdf
PKIX Certificate Status in Hybrid MANETs,"Jose L. Muñoz,    Oscar Esparza,    Carlos Gañán…",2009,https://link.springer.com/chapter/10.1007/978-3-642-03944-7_12,https://link.springer.com/content/pdf/10.1007%2F978-3-642-03944-7_12.pdf
Quality Assurances of Probabilistic Queries,"Reynold Cheng,    Edward Chan,    Kam-Yiu Lam",2007,https://link.springer.com/chapter/10.1007/3-540-37366-7_9,No PDF available
Evaluation of Structural and Temporal Properties of Ego Networks for Data Availability in DOSNs,"Andrea De Salve,    Barbara Guidi,    Laura Ricci",2018,https://link.springer.com/article/10.1007/s11036-017-0830-0,https://link.springer.com/content/pdf/10.1007%2Fs11036-017-0830-0.pdf
Contrail: Enabling Decentralized Social Networks on Smartphones,"Patrick Stuedi,    Iqbal Mohomed,    Mahesh Balakrishnan,    Z. Morley Mao…",2011,https://link.springer.com/chapter/10.1007/978-3-642-25821-3_3,https://link.springer.com/content/pdf/10.1007%2F978-3-642-25821-3_3.pdf
Comparative Analysis of Ad-Hoc Networks Oriented to Collaborative Activities,"Sebastián Echeverría,    Raúl Santelices…",2006,https://link.springer.com/chapter/10.1007/11682127_33,No PDF available
Emulation-Based Performance Evaluation of Routing Protocols for Uaanets,"Jean-Aimé Maxa,    Gilles Roudiere,    Nicolas Larrieu",2015,https://link.springer.com/chapter/10.1007/978-3-319-17765-6_20,https://link.springer.com/content/pdf/10.1007%2F978-3-319-17765-6_20.pdf
Performance Analysis of Secure Multipath Routing Protocols for Mobile Ad Hoc Networks,"Rosa Mavropodi,    Panayiotis Kotzanikolaou…",2005,https://link.springer.com/chapter/10.1007/11424505_26,https://link.springer.com/content/pdf/10.1007%2F11424505_26.pdf
Single Lock Manager Approach for Achieving Concurrency Control in Mobile Environments,"Salman Abdul Moiz,    Lakshmi Rajamani",2007,https://link.springer.com/chapter/10.1007/978-3-540-77220-0_58,No PDF available
DVB Solutions for Interactive Services,Professor Dr.-Ing. Ulrich Reimers,2004,https://link.springer.com/chapter/10.1007/978-3-662-11577-0_13,No PDF available
Network Engineering: Towards Data-Driven Framework for Network Configuration,"Khac Hoai Nam Bui,    Sungrae Cho,    Jason J. Jung…",2018,https://link.springer.com/chapter/10.1007/978-3-319-98752-1_7,https://link.springer.com/content/pdf/10.1007%2F978-3-319-98752-1_7.pdf
Supporting Mobile Virtual Team’s Coordination with SOA-Based Active Entities,"Ruben Dario Franco,    Andrés Neyem…",2007,https://link.springer.com/chapter/10.1007/978-0-387-73798-0_60,https://link.springer.com/content/pdf/10.1007%2F978-0-387-73798-0_60.pdf
A dynamic and fast event matching algorithm for a content-based publish/subscribe information dissemination system in Sensor-Grid,"Mohammad Mehedi Hassan,    Biao Song,    Eui-Nam Huh",2010,https://link.springer.com/article/10.1007/s11227-009-0327-0,https://link.springer.com/content/pdf/10.1007%2Fs11227-009-0327-0.pdf
Design and Implementation of Location-Based Handoff Scheme for Multimedia Data,"Dong Hyun Kim,    Jong Deok Kim",2013,https://link.springer.com/chapter/10.1007/978-3-642-35966-8_31,No PDF available
Adaptive Admission Control for Mobile Ad Hoc Networks based on a Cross-layer Design,"María Canales,    José Ramón Gállego…",2007,https://link.springer.com/chapter/10.1007/978-0-387-74159-8_1,https://link.springer.com/content/pdf/10.1007%2F978-0-387-74159-8_1.pdf
Edison: Database-Supported Synchronization for PDAs,"Matthew Denny,    Michael J. Franklin",2004,https://link.springer.com/article/10.1023/B%3ADAPD.0000013067.55166.a2,https://link.springer.com/content/pdf/10.1023%2FB%3ADAPD.0000013067.55166.a2.pdf
Towards a Standards-Based Autonomic Context Management System,"Jadwiga Indulska,    Karen Henricksen,    Peizhao Hu",2006,https://link.springer.com/chapter/10.1007/11839569_3,No PDF available
Peer-to-Peer Data Lookup for Multi-agent Systems,"Michael Thomas,    William Regli",2005,https://link.springer.com/chapter/10.1007/11574781_19,https://link.springer.com/content/pdf/10.1007%2F11574781_19.pdf
Ranking Sector Oriented Sense with Geographic Protocol,"Rajalakshmi Dheenadayalan,    Sanoj Subramanian",2013,https://link.springer.com/chapter/10.1007/978-81-322-1000-9_39,No PDF available
A game theoretical approach to model the channel selection dynamics in non-coordinated IEEE 802.11 networks,"Sérgio L. D. L. Gramacho,    Gustavo B. Figueiredo,    Lasaro Camargos",2018,https://link.springer.com/article/10.1007/s11276-018-1751-y,https://link.springer.com/content/pdf/10.1007%2Fs11276-018-1751-y.pdf
Using a History-Based Approach to Predict Topology Control Information in Mobile Ad Hoc Networks,"Pere Millán,    Carlos Molina,    Roc Meseguer…",2014,https://link.springer.com/chapter/10.1007/978-3-319-11692-1_21,No PDF available
Performance Evaluation of a Fuzzy-Based Cluster-Management System for VANETs,"Kosuke Ozera,    Kevin Bylykbashi,    Yi Liu…",2019,https://link.springer.com/chapter/10.1007/978-3-030-02613-4_56,https://link.springer.com/content/pdf/10.1007%2F978-3-030-02613-4_56.pdf
Application Development and Cost Analysis for Content Based Publish Subscribe Model in Mobile Environment,"Medha A. Shah,    P. J. Kulkarni",2012,https://link.springer.com/chapter/10.1007/978-3-642-30111-7_55,No PDF available
Passive Network-Awareness for Dynamic Resource-Constrained Networks,"Agoston Petz,    Taesoo Jun,    Nirmalya Roy…",2011,https://link.springer.com/chapter/10.1007/978-3-642-21387-8_9,No PDF available
Vehicular Wi-Fi Offloading in Heterogeneous Vehicular Networks: Techniques and Challenges,"Mahmoud Alawi,    Raed Alsaqour,    Mahamod Ismail…",2018,https://link.springer.com/article/10.1007/s11036-017-0916-8,https://link.springer.com/content/pdf/10.1007%2Fs11036-017-0916-8.pdf
Scalable Invalidation-Based Processing of Queries in Broadcast Push Delivery,Evaggelia Pitoura,1999,https://link.springer.com/chapter/10.1007/978-3-540-49121-7_20,No PDF available
Delay-Aware Mobile Transactions,"Brahim Ayari,    Abdelmajid Khelil,    Neeraj Suri",2008,https://link.springer.com/chapter/10.1007/978-3-540-87785-1_25,https://link.springer.com/content/pdf/10.1007%2F978-3-540-87785-1_25.pdf
Performance Analysis of Virtual Time Optimistic Transaction Processing,"Cong Liu,    Wei Huang,    Zhiguo Zhang",2004,https://link.springer.com/chapter/10.1007/978-3-540-30483-8_13,No PDF available
Design and Evaluation of a Publish/Subscribe Framework for Ubiquitous Systems,"Zigor Salvador,    Alberto Lafuente…",2013,https://link.springer.com/chapter/10.1007/978-3-642-40238-8_5,No PDF available
"Swarm Dispersion via Potential Fields, Leader Election, and Counting Hops","Anuraag Pakanati,    Maria Gini",2010,https://link.springer.com/chapter/10.1007/978-3-642-17319-6_44,No PDF available
Introduction to Telecommunication Systems,No author available,2002,https://link.springer.com/chapter/10.1007/0-306-47312-7_1,No PDF available
AP load balance strategy in face of high user density,"Wei Zhang,    Ze Yu He,    Li Min Ma,    Rami Salem…",2018,https://link.springer.com/article/10.1007/s12652-018-0690-x,https://link.springer.com/content/pdf/10.1007%2Fs12652-018-0690-x.pdf
A Location Aware Mobility based Routing Protocol for the Bluetooth Scatternet,"Sheng-Wen Chang,    Prasan Kumar Sahoo,    Chih-Yung Chang",2008,https://link.springer.com/article/10.1007/s11277-008-9498-x,https://link.springer.com/content/pdf/10.1007%2Fs11277-008-9498-x.pdf
Network design methods for mitigation of intentional attacks in scale-free networks,"Walid K. Ghamry,    Khaled M. F. Elsayed",2012,https://link.springer.com/article/10.1007/s11235-010-9375-2,https://link.springer.com/content/pdf/10.1007%2Fs11235-010-9375-2.pdf
Intelligent System Architecture for Context-Awareness in Ubiquitous Computing,"Jae-Woo Chang,    Seung-Tae Hong",2008,https://link.springer.com/chapter/10.1007/978-3-540-69293-5_53,No PDF available
Game strategies for distributed denial of service defense in the Cloud of Things,"Yichuan Wang,    Yefei Zhang,    Xinhong Hei…",2016,https://link.springer.com/article/10.1007/BF03391587,https://link.springer.com/content/pdf/10.1007%2FBF03391587.pdf
A Protocol for Resource Sharing in Norm-Governed Ad Hoc Networks,"Alexander Artikis,    Lloyd Kamara,    Jeremy Pitt…",2005,https://link.springer.com/chapter/10.1007/11493402_13,https://link.springer.com/content/pdf/10.1007%2F11493402_13.pdf
Adaptive Mobility and Range Based Clustering Dependent MAC Protocol for Vehicular Ad Hoc Networks,"Raghavendra Pal,    Nishu Gupta,    Arun Prakash…",2018,https://link.springer.com/article/10.1007/s11277-017-4913-9,https://link.springer.com/content/pdf/10.1007%2Fs11277-017-4913-9.pdf
PERA: Priority-Based Energy-Efficient Routing Algorithm for WBANs,"Gulnaz Ahmed,    Zou Jianhua,    Mian Muhammad Sadiq Fareed",2017,https://link.springer.com/article/10.1007/s11277-017-4415-9,https://link.springer.com/content/pdf/10.1007%2Fs11277-017-4415-9.pdf
Cache Invalidation for Updated Data in Ad Hoc Networks,"Hideki Hayashi,    Takahiro Hara…",2003,https://link.springer.com/chapter/10.1007/978-3-540-39964-3_32,No PDF available
Facilitating Agent Messaging on PDAs,"Sasu Tarkoma,    Mikko Laukkanen",2002,https://link.springer.com/chapter/10.1007/3-540-36086-7_24,No PDF available
A NAT traversal mechanism for cloud video surveillance applications using WebSocket,"Gianni D’Angelo,    Salvatore Rampone",2018,https://link.springer.com/article/10.1007/s11042-018-5821-z,https://link.springer.com/content/pdf/10.1007%2Fs11042-018-5821-z.pdf
Introduction,"Xiaofeng Meng,    Zhiming Ding,    Jiajie Xu",2014,https://link.springer.com/chapter/10.1007/978-3-642-38276-5_1,No PDF available
A Handover Scheme Based on HMIPv6 for B3G Networks,"Eunjoo Jeong,    Sangjoon Park,    Hyewon K. Lee…",2005,https://link.springer.com/chapter/10.1007/11424758_13,https://link.springer.com/content/pdf/10.1007%2F11424758_13.pdf
Performance comparison of Bluetooth scatternet formation protocols for multi-hop networks,"Zhifang Wang,    Robert J. Thomas,    Zygmunt J. Haas",2009,https://link.springer.com/article/10.1007/s11276-007-0036-7,https://link.springer.com/content/pdf/10.1007%2Fs11276-007-0036-7.pdf
An Address Configuration and Confirmation Scheme for Seamless Mobility Support in IPv6 Network,"Seung-Hee Hwang,    Youn-Hee Han,    Sung-Gi Min…",2004,https://link.springer.com/chapter/10.1007/978-3-540-24643-5_7,No PDF available
Optimal performance of heterogeneous networks based on the bit rate,"Déthié Dione,    Salimata Gueye Diagne,    Bakary Koné,    Youssou Gningue",2016,https://link.springer.com/article/10.1007/s40096-015-0171-8,https://link.springer.com/content/pdf/10.1007%2Fs40096-015-0171-8.pdf
Concepts for Reliable Communication in a Software-Defined Network Architecture,Ferdinand von Tüllenburg…,2017,https://link.springer.com/chapter/10.1007/978-3-319-66284-8_15,https://link.springer.com/content/pdf/10.1007%2F978-3-319-66284-8_15.pdf
Introduction,"Xiaofeng Meng,    Jidong Chen",2010,https://link.springer.com/chapter/10.1007/978-3-642-13199-8_1,No PDF available
Efficient Cache Management Protocol Based on Data Locality in Mobile DBMSs,"IlYoung Chung,    JeHyok Ryu,    Chong -Sun Hwang",2000,https://link.springer.com/chapter/10.1007/3-540-44472-6_5,No PDF available
A Chaos Based Secure Communication Scheme for Hybrid Message Logging and Asynchronous Checkpointing for Mobile Computing,"Santo Banerjee,    S. Mukhopadhyay",2011,https://link.springer.com/chapter/10.1007/978-3-642-21922-1_10,No PDF available
Internet of Things: information security challenges and solutions,"Natalia Miloslavskaya,    Alexander Tolstoy",2018,https://link.springer.com/article/10.1007/s10586-018-2823-6,https://link.springer.com/content/pdf/10.1007%2Fs10586-018-2823-6.pdf
A brief review of the state of the art in Operational Research in Telecommunications,"Pablo Cortés,    Jesús Muñuzuri",2008,https://link.springer.com/article/10.1057/ori.2008.59,No PDF available
Maximum Lifetime Broadcast in Mobile Sensor Networks,"Bruno Nunes,    Frederico Barboza,    Flávio Assis",2013,https://link.springer.com/chapter/10.1007/978-3-642-39247-4_3,No PDF available
Synapse: A Scalable Protocol for Interconnecting Heterogeneous Overlay Networks,"Luigi Liquori,    Cédric Tedeschi,    Laurent Vanni,    Francesco Bongiovanni…",2010,https://link.springer.com/chapter/10.1007/978-3-642-12963-6_6,https://link.springer.com/content/pdf/10.1007%2F978-3-642-12963-6_6.pdf
Relay selection for secure 5G green communications,"Nikolaos Nomikos,    Ana Nieto,    Prodromos Makris…",2015,https://link.springer.com/article/10.1007/s11235-014-9890-7,https://link.springer.com/content/pdf/10.1007%2Fs11235-014-9890-7.pdf
